recordid,songid_DBNL,jaar_eind,jaar_begin,bronid,rijmaccent,rijmgeslacht,rijmschema,strofeschema,strofeschema_plus,trefw_genre,aantal_strofe,verstal,text,melodienorm,plaats,filepath_DBNL
117779,_apo008apol01_0063,1741,1741.0,1001391,22334433,mmmvmmvv,AAAbCCbb,2A 2A 3A 3b 4C 4C 3b 3b,2A +  2A   .3A    3b   .4C   .4C   .3b=  .3b=,,15,7,"Maakje klaar, maakje klaar,
De Kalfs-kop die is gaar,
Ey hoor hem eens koken,
Myn Maagje danst op dat geluyd
De kop die wil de Ketel uyt
Ik heb hem al geroken.
Ik heb hem al geroken.

Dats 'er een, dats 'er een,
Ter Wereld schoonder geen,
Dat yder moet belyen,
Ontgin hem maar eens heen en weer,
En denk dat uyt een anders Leer,
Goed riemen is te snyen. 
Goed riemen is te snyen. 

Was 'er maar, was 'er maar,
Een Fret of Avegaar,
Om de Oogen uyt te boren,
Maar deze Lepel is ook goed:
Houd op u Tafelbord of Hoed,
Kan u 't Gezigt bekoren. 
Kan u 't Gezigt bekoren. 

Dit 's zyn Tong, dit 's zyn Tong,
Daar hy 't Muziek me zong,
Terwyl zyn Makkers dansten,
Wat dunkje van dat Kakebeen,
Daar zit de beste Knap om heen,
Die wy ons leven schransten. 
Die wy ons leven schransten. 

Wie zou niet, wie zou niet,
Als hy 't Verhemelt ziet,
Een stukje daar van wenssen,
Wat zyn de Herssens hagel-wit,
Zie of 'er ook een Ky in zit,
Als in de meeste Menschen. 
Als in de meeste Menschen. 

Blank en mals, blank en mals,
Is hy gelyk een Hals,
En Prammen van een Meysje,
Men roept vry op de Klieren schrik,
En aard de schoonste Zwezerik,
Ik bidje Proef een rysje. 
Ik bidje Proef een rysje. 

Eêle Kost, eêle Kost,
Uyt Spanje is gelost
Geen Koppen kan op wegen,
Indien Spekjan de lugt maar rook,
Hy zou gewis zyn Lap en Pook,
Aan deze Kop vervegen. 
Aan deze Kop vervegen. 

d' Indiaan, d' Indiaan,
Liet al zyn Kruyden staan,
Indien hy meê mogt eeten,
Hy schonk aan ons zyn Gogeltas
Zyne Piessan en de Annas,
Zou hy wel haast vergeten. 
Zou hy wel haast vergeten. 

Gans en Kip, Gans en Kip,
Kapoen en Watersnip,
Wie zou niet na je talen,
Geen Pluym-gediert, Wild of Tam,
Geen Osse-tong, geen Hane-kam,
Mag by de Koppen halen. 
Mag by de Koppen halen. 

Hy is op, hy is op,
Die schoonder Kalfs-kop,
En in ons Lyf begraven,
Kom laat ons met de Koele-wyn,
Zyn Uytvaard nu gedagtig zyn,
En onze Keeltjes laven. 
En onze Keeltjes laven. 

Beste-maat, Beste-maat,
Ey hoor eens hoe hy Blaat,
Om Muskadelle-droppen,
Al ben ik aan myn twede Fles,
Kom doenwe nog een teug vyf zes,
Ter eeren van de Koppen. 
Ter eeren van de Koppen. 

ô Hoe zoet! ô hoe zoet!
Verheugd de Wyn het Bloed,
Der vriendelyke Snaken,
Maar hoe, wat hoor ik voor gewoel?
Of druypt 'er ymand door de Stoel?
My dunkt de Sporten kraken. 
My dunkt de Sporten kraken. 

't Is geen nood, 't Is geen nood,
De Man is nog niet dood,
Hy staat weer op zyn Benen:
Maar zagt, wie is 'er buyten aam,
En spreekt 'er woorden van een Vaam,
Ik hoor zo byster stenen. 
Ik hoor zo byster stenen. 

Laat ons gaan, laat ons gaan,
Het Heerschop is voldaan,
En 't Maantje schynd nog helder,
Wy hebben altemaal de Vragt:
Nu vrienden, 'k wensje goeden Nagt,
Maar val niet in de Kelder. 
Maar val niet in de Kelder. 

Is dit Feest, is dit Feest,
Vol van Snakery geweest,
Tot geen Verwyt kan 't strekken,
Want na de Taal van Diogeen,
Zo is d' Wereld maar alleen,
Een grote Kooy vol Gekken.
Een grote Kooy vol Gekken.",Op een tijd op een tijd,Leiden,../../data/dbnl/_apo008apol01_01.xml
129551,_thi001thir06_0019,1708,1708.0,1016156,44244,vmmvm,aBBaB,4a 4B 2B 4a 4B,4a    4B   2B 4a 4B,"liefdeslied
verhalend lied, wereldlijk",14,5,"Vrijers, wel, wat hebje klugjes
Met de meysjes in den Haag,
Alle daag,
Want sy betoone met haer sugjes
Dat sy zijn tot trouwen graag.

De bloote Borsjes siet men speelen
Onder ‘t dunne Floers   of Cantyn,
Suyver fijn.
Dat is te seggen: komt myn streelen,
Want ik soeck gestreelt te zijn.

Dese Haagze Herderinne
Hebbe met haar soete reen
Aangebeen
Venus, d’ Moeder van het minne,
Om haar jongste Zoontje kleen.

Venus nam het Cupidootje,
Liet hem uyt den Hemel hoog,
Maar het vloog,
Naar dese rey, maar ‘t kleyne Gootje
Kreeg sijn boel haast in het oog.

Sy maakte   daar de vreugt met dansse
En spronge lustig in d' wind
Met het kint;
Sy kroonde hem met Minne kransse:
‘t Boefje was daar seer bemint.

Men ging het op de schoot doudynen
Met kussen, met een soet gestreel
En gequeel.
Men songer daar: ‘O Jonge Borsje   kleyne,
Heer, wat is uw vleesje eel.’

Sy eerden hem gelijk een Engeltje,
En tegen   met hem op d' Jagt,
Maar ‘t lagt,
Want dit verbruyd’   olicke bengeltje
Toont haar sijn boefjes kragt:

Tien vergulde schoone schigtjes
Trok hy uyt sijn koker root
En hy schoot
Onder d’hoop van dese soete Nigjes
Dat een ider laggend' vloot.

d’ Een die lonckte met sijn minnetje,
Door der   liefde zoete brant
Diese vant,
Pronkte haar op als een Godinnetje,
Geestig met een Haags verstant.

d’ Ander ging haar ouders vlieden,
Na d’ een of ander plaats vry
En seer bly
Ging daar haar alderliefste Lief ontbieden
Om d' soete snakery.

Een die doolde langes de stranden,
Schreef daar met haer   eigen bloet
- Ag, so soet -
Dat haar de min het herte souw of branden,
Soo hy   niet haar lusjes boet.

Veel die kreege schoone bloosjes
Op haar kaakjes, net
Geblancket:
Maar dese kleur als roode roosjes,
Vloogen haar wel haast op ‘t bed.

Dus soo komt dat meenig meysjen
Door het speelen met het kint
Wert verblint,
Bieden haar blank en poesel vleysje
Aan die geen die haar niet mind.

Jongmans, wilje gaan uyt vryen,
Houd uw uyt de kap van de Sot
Van Marot,
Want gy en souter niet bedyen
En dan waarje iders spot.",Meisje moet ik bij u slapen,Amsterdam,../../data/dbnl/_thi001thir06_01.xml
175971,revi001clps01_0018,1640,1640.0,1015987,555555,vvmmvv,aaBBcc,5a 5a 5B 5B 5c 5c,.5a   .5a   .5B   .5B   .5c   .5c   .5D   .5D,psalm,13,8,"2 Aldus benaut heb ick den Heer gebeden,
Tot mijnen God riep ick van hier beneden,
Mijn schreyen tot hem in den hemel quam,
En mijne stem tot sijne ooren clam.
Van stonden aen men sach de aerde trillen,
De bergen hooch en waren niet te stillen,
Haer diepsten gront die daverd' op en neer,
Want sonder maet vertorent was de Heer.

3 Wt sijnen neus' een damp hem spreyd' int ronde,
Een lichte vlam ontbrand' in synen monde,
Syn grimmicheyt was so geweldich groot
Datmen om-heen niet sach als colen root.
Hy booch de lucht, en daelde tot de volcken,
Syn voetpat was 't geswier van swerte wolcken,
Den Cherub snel hem voerde heel geswind'
Hy sweefde op de vleugels van de wint.

4 Een groote drift van wolcken hem bedecte,
En tot een tent de duysterheyt hem strecte,
Een blixemstrael die voor hem henen vloot
Het bruyne swerc doordringende ontsloot.
Den hagel grof met weerlicht hem verspreyde,
Den donder fel sich door de locht uytbreyde,
De hoochste God syn stemme van hem gaf,
En colen viers wierp hy van boven af.

5 De Heere, met syn uytgeschoten pijlen
Heeft tot de vlucht syn vyanden doen ylen,
Den swaren storm en vreesselijcken wint
Haer heeft verschrict en t'eenemael ontsint.
Men sach alsdoen de donck're watergoten
Der colcken diep haer aderen ontblooten,
Hy reycte my van boven syne hant,
En holp my uyt den afgront weer te land'.

6 Hy vrijde my van de vermeten scharen
Der vyanden die my te machtich waren,
Sy brachten my in eenen droeven staet,
Maer onse God was doe mijn toeverlaet.
Hy voerde my op 't ruym uyt alle vreese,
Dat hy aen my syn goedicheyt bewese.
Dies heeft hy na mijn vroomheyt my geloont.
En my na mijn gerechticheyt verschoont.

7 Want ick behielt altijdt des Heeren wegen,
Geen goddeloosheyt heb ick willen plegen,
Syn goede wet heb ick steets na-gespoort
En heb daer van verworpen niet een woort.
Ick eerde hem uyt mijnes herten gronde.
In al mijn doen bewaerd' ick my voor sonde,
Dies heeft hy na mijn vroomheyt my gedaen,
En na mijn recht heeft hy 't my laten gaen.

8 Den vromen sydy vroom, en reyn den reynen,
Oprecht met die 't oprechtelijcken meynen,
Een trouwe Heer aen den getrouwen knecht,
Verkeert, met die haer keeren van het recht.
't Ellendich volc behoudet ghy seer goedich,
En drucket neer die stout zijn en hoochmoedich,
Mijn donck're lamp hebdy, o Heer, verlicht,
In duysterheyt gaeft ghy my claer gesicht.

9  Met u verwin en doe ic groote dingen,
Met u wil ick de muyren overspringen,
Des Heeren wech is heylich ende goet,
Des Heeren woort doorloutert inde gloet.
Hij is een schilt in 't uyterste benouwen
Voor alle die op syne gunste bouwen.
Waer is een God behalven onse Heer?
Of sonder hem een vaste steenrots meer?

10 Die my omgort, en maket my cloeckmoedich,
Die mijnen wech maect effen en voorspoedich,
Geeft voeten als de voeten van het ree,
En doet my vast staen op een hooge stee.
Die tot den crijch my lust geeft en vermogen,
Dat mijne vuyst kan breken stale bogen,
De schilt uws heyls o Heer beschuttet my,
V rechterhant is my gestadich by.

11 V goetheyt die my nimmer heeft begeven
Heeft my nu meer dan oyt te voor verheven.
Ghy maect den pat ruym onder mijnen voet,
Dat ick niet uyt en glijde onverhoedt.
Mijn vyanden ick wackerlijc can jagen,
En keer niet om eer datse zijn geslagen,
Ick sla-se datse niet weer op en staen,
Maer mijn gewelt gants werden onderdaen.

12 Ghy gordet my met sterckheyt om te strijden,
Ghy vellet die my haten en benijden,
Ghy hebbet neer-gebogen hare macht,
Sy zijn te niet door mijne hant gebracht.
Sy riepen wel, maer 't was voor dove ooren,
Tot God, vergeefs, want hy en wou niet hooren,
Sy zijn als stof gedreven van den wint,
Als slijck het welck men op de straten vint.

13 Ghy reddet my van 't volck vol muyterije,
Ghy maeckt my groot door nieuwe heerschappije,
Het Heydensch volc dat ic noyt had gekent
Heeft willich hem tot mijnen dienst gewent.
De vremde door 't gerucht mijns naems gedreven
Geveynsdelijck aen my haer overgeven,
Sy hebben in haer sloten vast gebeeft
Als van mijn cracht men haer gesproken heeft.

14 De Heere leeft, mijn steenrots wil ick loven,
Gesegent sy de heerscher van hier boven.
Hy isset die my van mijn haters wreeckt,
En die de macht der groote volcken breect.
Hy maeckt dat my mijn vyant niet en lettet,
Die boven haer int conincrijck my settet,
Hy ist alleen die my in vrydom stelt
Van hem die drijft een openbaer gewelt.",Psalm 018 Datheen,Deventer,../../data/dbnl/revi001clps01_01.xml
191547,lixb001kers01_0052,1736,1736.0,1010250,4444224224,vmvmmmmmmm,aBaBCCDEED,4a 4B 4a 4B 2C 2C 4D 2E 2E 4D,.4a   .4B   .4a   .4B   .2C + .2C   .4D   .2E + .2E   .4D,,14,8,"1. O Jesu, die uyt wonderbaer goetheyt
Waerachtigh mensch geworden zijt
En door den invloedt van uwe soetheyt,
Die vruchtbaer maeght seer hebt verblijd
Weest willekom // O Bruydegom,
Schoon boven alle Sonne-schijn:
O Godt en mensch // 'tIs onsen wensch
Met u inwendigh een te zijn.

2. Gy waert noch in u Moeder besloten,
Als zy besocht haer oude Nicht;
Daer hebt gy uwen dooper begoten
Met blijschap en Prophetisch licht!
O wonder kind // dat uwen vriend
Noch ongeboren hebt verheught:
Verlicht ons Heer // Oock met u Leer
En geeft ons oock u volle vreught.

3. Gy zijt seer schoon ter werelt gekomen
Gelijck een strael door een gelas:
De Maeght en hebdy geensints benomen
Haer suyverheyt daer zy in was;
O soete vrucht // die met genucht,
En alle reynigheyt zijt gebaert!
O schoon Fonteyn // Hout ons oock reyn
Want gy zijt die ons hert bewaert.

4 Men heeft u in den Tempel gedragen
Tot Offerhand' van lof en danck;
Daer Simeon met wonder behagen
Gesongen heeft den Swanen sanck:
Al zijnen lust // Is toe geblust,
Al zijnen wensch is toe voldaen,
Vult ons gesicht // Oock met u licht,
En laet ons oock in vrede gaen.

5. Maer soeten Jesu, wilt ons verklaren
Hoe kost dat met u liefde staen,
Dat gy in uwe bloemige jaeren
U lieve Moeder zijt ontgaen?
Zy soeckt, zy vraeght; Zy weent, zy klaeght;
Zy vindt u naer den derden dagh:
Geeft dat ick u, soo soecke nu,
Dat ick u eeuwigh vinden magh.

6. O Jesu, die in't lijdens beginne
Soo harden strijdt hebt uytgestaen,
Dat u van vrees en krachtiger minne
Het bloedigh sweet is af-gegaen,
O lieven Godt // Laet u gebodt
Altoos bestieren mijnen wil:
Doet heel te niet, Soo my noch jet
Met u doet leven in verschil.

7. De straf der helle waeren wy schuldigh
Den hemel hadden wy verbeurt:
Maer Jesu, gy zijt wonder verduldigh,
Door ons gegeesselt en verscheurt:
Saghtmoedigh Lam // En wordt niet
gram // Al is't dat ick in sonden val:
Al is mijn schult // Eylaes vervult!
Betaeltse met u Wonden al.

8. O Sone Godts, o Heere der Heeren,
Met dorens heeft men u gekroont;
Soo heeft den mensch u willen vereeren
Soo heeft hy uwen dienst geloont!
O grooten Godt, Gy zijt bespot,
Om ons te brengen tot uw eer:
O Vaders schijn // Ootmoedigh zijn
Dat is uw alderhooghste leer.

9. Onnoosel bloedt, all' onse misdaden
Hebt gy gedragen op u Cruys:
Soo zijt gy met ons lasten beladen,
Ter doodt geleyt van dat gespuys!
O goeden Heer // en laet met meer
Ons hert beswijcken in den druck,
Maeckt van u pijn, Ons medecijn,
Maeckt van u lijden ons geluck.

10. O Godt, gy hebt den hemel ontsloten,
Als gy aen't Cruys gestorven zijt:
u leste Bloedt, uyt liefde vergoten
Heeft noch voleyndight desen strijdt,
O Jesu soet // en laet dat Bloedt
Aen my toch niet verloren gaen:
Geeft dat ick magh // ten jongsten dagh
Oock onder d'uytverkoren staen.

11. O Jesu, gy zijt krachtigh verresen,
En't eeuwigh leven in-gegaen,
Om ons te geven 't Goddelijck wesen,
En van den val doen op te staen,
O Vaders kracht // Gelijck van macht,
O alderhooghsten Medecijn,
O doodt der doodt // Aensiet den noodt,
Daer wy met lijf en ziel in zijn.

13. Als gy nu waert ten hoogste verheven
Tot aen uws Vaders rechterhandt,
Soo hebt gy u beminde gegeven
De gaef des Geests tot eenen pandt,
Die heeft terstont // Uyt haeren mondt
Doen vloeyen alderhande tael,
Stort ons oock in // die soete min,
Want zy vernieuwt altemael.

14. Maer, Jesu wie sal konnen verhaelen,
Met wat een honinck soet gelaet,
Gy hebt u Moeder komen onthaelen,
Als nu vervult was haere maet:
Gy zijt met haer, Seer schoon en klaer
Den hoogen hemel in-gegaen:
doet onsen geest // Oock aldermeest
Op't hemels goet zijn oogen slaen.

15. Gy hebt haer boven d'Engelsche scharen
Verheven als een Coningin,
Verkooren om u, Schepper te baeren,
Vervult met uwe soete min:
Gy zijt de kroon // Gy zijt den loon
Van haere groote deught:
O goeden Heer, Tot haerder eer,
Laet ons oock komen tot u vreught.",Sarabande Pinel,Antwerpen,../../data/dbnl/lixb001kers01_01.xml
