recordid,songid_DBNL,jaar_eind,jaar_begin,bronid,rijmaccent,rijmgeslacht,rijmschema,strofeschema,strofeschema_plus,trefw_genre,aantal_strofe,verstal,text,melodienorm,plaats,filepath_DBNL
9068,lode002uyt_01_0029,1676,1676.0,1000814,555423223,mmmvvmvvm,ABBcdEddE,5A 5B 5B 4c 2d 3E 2d 2d 3E,.5A   .5B   .5B   .4c   .2d=+ .3E/  .2d=  .2d=+ .3E/,geestelijk lied,14,7,"GRootmoedig Hert!  Dat alles over-schrijdt,
Dat vander aarden in den Hemel stapt,
Dat vander aarden in den Hemel stapt,
En trapt op bergen en spitsen als vlackten:
Regt-schape Reusen, sonder Hemel-twist.
Regt-schape Reusen,
Regt-schape Reusen, sonder Hemel-twist.

Des Hemels Ligt  Leert u des Hemels glansch
En wat daar is van binnen door te sien: //
En wat daar is van binnen door te sien: //
Te sien 't geen wijsen verstandigen als blind;
In al haar letter diep verborgen blijft. //
In al haar letter 
In al haar letter diep verborgen blijft. //

De Wijsheyd self  Dat Grondelose diep,
De Goedheyd sonder paal beminnelijck, //
De Goedheyd sonder paal beminnelijck, //
Dien Ocean van 't eyndloos Genoegsaam
Sig aan U toonen sonder Masker voor. //
Sig aan U toonen 
Sig aan U toonen sonder Masker voor. //

Een aardsch Monarch  Te dienen is te cleyn
Des Hemels Heer, en Schepper lust u maar //
Des Hemels Heer, en Schepper lust u maar //
Met 's Hemels salige Geesten te dienen:
Dat is uw Glory; Glorieuse Ziel! //
Dat is uw Glory; 
Dat is uw Glory; Glorieuse Ziel! //

Een Aardsch Monarch  Te sijn van gansch de werld,
Het costelijckste dat de Ganges schenckt; //
Het costelijckste dat de Ganges schenckt; //
Lusten, die lage sielen verleyden
Sijn wel wat schijnsel, maar voor u te cleyn. //
Sijn wel wat schijnsel, 
Sijn wel wat schijnsel, maar voor u te cleyn. //

Het Wesentlijck,   self de Wesenaar
Daar al dat Heerlijck maar een beeck van is, //
Daar al dat Heerlijck maar een beeck van is, //
(Een beeck? liever, een schijnsel, een schaduw)
Dat Wesentlijke daar, is self uw Deel. ,,
Dat Wesentlijke daar, 
Dat Wesentlijke daar, is self uw Deel. ,,

Gy kent geen dienst  Nog lage slaverny:
Geen lust u ringelt in haar vuyl gebied; //
Geen lust u ringelt in haar vuyl gebied; //
Geen mensche gunste, geen eere, geen smaatheyd,
Geen werldsche wijse: want gy staat te hoog. //
Geen werldsche wijse: 
Geen werldsche wijse: want gy staat te hoog. //

Der Reusen daad  Was rotsen van 't gebergt
Te scheuren, en te tjorsen op een hoop; //
Te scheuren, en te tjorsen op een hoop; //
Althoos den Hemel (hoe hoog) te bestormen
Van Babels hoogte. Nutteloos gewoel! //
Van Babels hoogte. 
Van Babels hoogte. Nutteloos gewoel! //

Maar gy gebiedt  Wis Bergen u ter hulp,
Die op 't gelovig woord u staan ten dienst, //
Die op 't gelovig woord u staan ten dienst, //
Om den Magtigsten vyand U selven
U t'onderwerpen tot uw eeuwig Heyl. //
U t'onderwerpen 
U t'onderwerpen tot uw eeuwig Heyl. //

Thans sal uw Wil  U noyd ontrusten meer,
Gevyseld tot de hoogte, van haar woel //
Gevyseld tot de hoogte, van haar woel //
In 't onverwricklijck besluyt te verliesen.
O salig sterven, daar sy eeuwig leeft! //
O salig sterven, 
O salig sterven, daar sy eeuwig leeft! //

Wat is'er voor  Uw hoog gemoed te steyl!
Die niet door u , maar door den Hemel werckt. //
Die niet door u , maar door den Hemel werckt. //
Gy laat lage gemoederen kreunen,
En grijpt het steylste sonder kommer aan. //
En grijpt het steylste 
En grijpt het steylste sonder kommer aan. //

David den Reus,  En Simson sloeg den Leeuw:
Beyd beelden van uw ongekreuckt gemoed. //
Beyd beelden van uw ongekreuckt gemoed. //
Daar sijn geen deugden soo hooge, soo swaare,
Die 't cloeck Gelove niet ter hand en grijpt.
Die 't cloeck Gelove 
Die 't cloeck Gelove niet ter hand en grijpt.

O! salig Niet! O! Edel-moedig Niet!
Die in uwe oogen, niet met al en sijt,
Die in uwe oogen, niet met al en sijt,
Gelijck gy waarlijck niet met al en sijt.
Wis die waarheyd, die waarheyd, die waarheyd
Maackt u veel Hooger,
Maackt u veel Hooger, dan die hooge staan. //

Groot-hertig Niet! Dat sig veragten can.
Ick bid' den Hemel om geen hooger gaav: //
Ick bid' den Hemel om geen hooger gaav: //
Want dat ick Niet, en Hy Alles alleen is,
Dat 's mijn Genoegen, en ick wensch niet meer.
Dat 's mijn Genoegen, 
Dat 's mijn Genoegen, en ick wensch niet meer. //",Repicaban,Utrecht,../../data/dbnl/lode002uyt_01_01.xml
14236,_suu001suur02_0021,1508,1508.0,1000039,443,mmv,AAb,4A 4A 3b,.4A   .4A   .3b,"kerstlied
loflied, geestelijk",14,3,"21.1.
IN vruechden is alle de werelt wijt
die enghelen brenghen ons groot iolijt
met vruechden hier beneden.

21.2.
¶ Want aen maghet ghebenedijt
so is volcomen nv tet ter tijt
onser salicheden

21.3.
¶ Natuer is bouen den loop ghegaen
een suuer maecht die heeft ontfaen
een kint in aertrijcke

21.4.
¶ Seer cortelic ist al voldaen.
dat ysayas dede verstaen
dwelc was seer wonderlike

21.5.
¶ Dat licht der sonnen is ons geboren.
die moeder is maecht ende was te voren
ende bleef in reynicheden.

21.6.
Inder scriftueren so machmen horen.
hoe dat bi adam was verloren
tgeslacht der menschelicheden

21.7.
¶ Kinder nv laet ons blide sijn.
ende louen dat soete kindekijn
gheboren menschelijke

21.8.
¶ Want hi is comen als ic beuroede
pm te verlossen met sinen bloede.
ons allen ghemeenlijke

21.9.
¶ Ihesus so is die name sijn.
hi weende als ander kindekijn
na sijnder menschelicheden

21.10.
¶ Twee stomme beesten bekenden wel.
al haren scepper en niemant el
bi sijnder godlijcheden.

21.11.
¶ Een cribbeken stont daer ghemaect
daer wert hi in gheleyt al naect.
die heere van hemelrijcke.

21.12.
¶ Drie coningen quamen wt verre lande
ende si brochten daer offerhande
seer blide ende oetmoedelijke

21.13.
¶ Nv laet ons bidden dat kindekijn
met maria die maghet fijn
dat si ons wil ontfermen

21.14.
¶ Als wi hier niet langer en mogen zijn
dat si ons dan van die eewighe pijn.
wil behoeden ende beschermen",Klaas Molenaar,Antwerpen,../../data/dbnl/_suu001suur02_01.xml
24569,_han028hand01_0070,1500,1476.0,1006807,6644242,mmmmvmv,AABBcDc,6A 6A 4B 4B 2c 4D 2c,.6A   .6A   .4B   .4B   .2c   .4D   .2c,kerstlied,14,7,"1   Wyldy hoeren syngen
enen sueten sanck
van Jhesus die ic geerne sage
al wordet lanck
ende hoe hi inder jerster nacht
in eenre crybben wart gelecht
al onverborgen
die een reyne hertken heeft
die en ders niet sorgen

2   Ende doe heer Jhesus gebaren wart
doe wasset colt
in tween olden hasen
geuonden waert
daer stont een esel ende een ront
die hueden maria oer lieue kynt
ende onsen heren
die hem soe wal gedienen kan
hi lones hem sere

3   Jhesus wart besneden
nader older ewe
woldes v niet verdrieten
ic songes v meer
dat worden die hilige drie Conynge ontwaer
sy brachten oren offer daer
ende oren gauen
sy baden dat weerde kyndekyn
om syne genade

4   Josep doe den esel nam
al by den toem
wat vant hi anden wege staen
een dattelen boem
och eselken du moetste stylle staen
wi willen die dattelen plucken gaen
wi syn seer moede
die dattelen boem ter eerden nech
in marien stote

5   Maria las die dattelen
in oren schoet
Josep was een olt man
dats hem verdroet
Maria laet die dattelen staen
wy hebben noch viertich mylen te gaen
het wort seer spade
wy bidden dat weerde kyndekyn
doer syne genade

6   Josep nam dat eselkyn
al byder hant
sy quamen by schoenre sonnen
in dat eyepten lant
eyepten is een seer guede stat
daer Josep oec die herberge bat
seer ellendich
maria die span voel guedes gaerns
mit oren handen

7   Maria die conde spynnen
dat vrouwelyn
Josep die conde tymmeren
sy geneerden sich
doe Josep niet meer tymmeren en kan
doe was hi alsoe olden man
hy haspelde geerne
Jhesus droech dat gaernken te huys
den ryken ende den armen

8   Den hiligen geest den hadden wi geern
al beyden wy lanck
wy willen noch van heer Jhesus syngen
enen nyen sanck
hoe lieue dat synre moeder was
doe hy in oren armen lach
al onverborgen
soe wie heer Jhesus mynne draget
die en derf niet sorgen

9   Doe Jhesus inder crybben lach
dat hilige kynt
drie hilige Conyngen tot hem quamen
wt oryenten
sy offerden daer drie gauen stolt
merre wieroec ende golt
sy waren reyne
dat kynt dat is der engelen heer
der werlt gemeyne

10   Doe herodes dat vernam
die felle tyran
dat dat kynt gebaeren was
hi waert seer gram
hi synen knechten doe geboet
dat sy brachten die kynder ter doet
soe wredelike
daerom soe syn sy nv gecroent
int hemelryke

11 	Die engel inder mydder nacht
tot Josep quam
Josep vrent staet op gereet
scaffet v vandan
herodes heeft der kynder voel
gedodet het gaet der nv al wt den spoel
om Jhesus wille
Josep voer toe eyepten wert
in eenre styllen

12   Doe Jhesus anden cruce clam
die hilige man
ende maria syn lieue lieue moeder
tot hem quam
hoer herte dat was in groter noet
hi leet voer ons den bitteren doet
soe mynnentlike
dat sullen wy in ons hertken dragen
stedelicken

13    Jhesus is die beste weert dat weet ic wal
daer hi aender tafelen syt
daer vaertmen wal
hi is die weert ende hi salt oec syn
hi quyt die cost hi betaelt den wyn
dat doet hi geerne
ic waer soe geerne nae deser tyt
in syne tauerne

14   Soe wille wy dan heer Jhesus bidden
om ene bede
dat hi ons geue nae deser tyt
synen ewigen vrede
ende daer toe oec syn suete aenschyn
ende mitten engelen blyde te syn
eweliken
wie Jhesus in sinen herten draget
den maket hi ryke
Amen",Ik had zo gaarne de Heilige Geest,"IJsselstreek (Deventer, later Zutphen)",../../data/dbnl/_han028hand01_01.xml
35401,ruyt001aeng01_0035,1733,1710.0,1011337,666222,mmmmmm,AAAAAA,6A 6A 6A 2A 2A 2A,6A 6A 6A 2A 2A 2A,"dialooglied, wereldlijk
liefdeslied",14,6,"LIefste Rosalinde, waerom weende gy?
Seght my wat is d' oorsaeck van u droef gheschrey
Ick sal u misschien haest komen maeken bly
Waerom sucht ghy,
waerom ducht ghy
Segghet my?

2. Ah! Leander mijnen nood is al te groot
Ick beween mijn Vader en mijn moeders doot
Ick sit hier alleen, ick ween, ick sucht, ick krijt
Vader, Moeder,
Suster, Broeder,
'k Bent al quyt.

3. Soete Rosalinde, 't doet my selve pijn,
'k Wenschte dat in droefheyt wesen kost de mijn
Oft dat uw gesucht wiert onder ons gemeen,
Ick soud' helpen,
ende stelpen
Uw' gheween.

4. Daer en sal noyt van mijn weenen zijn com-af
Voor dat ick sal rusten neffens hun in 't graf,
Ach! mijn lieve moeder waer ick toch by u
'k Ben mijn leven,
dat ick leve
Nu al mu.

5. Sus, sus, Rosalinde, sus en krijt niet meer,
Troost u met den wille van den grooten Heer,
Peyst dat yder mensch die Godt het leven gaf
Eens moet sterven,
en bederven
In het graf.

6. 'k Danck u seer Leander dat gy in mijn smert
Soekt te zijn den trooster van mijn droevig hert:
Gy troost my met woorden, maer 'k en krijgh daerom
Mijn beminde,
doode vrienden
Niet wed'rom.

7. Is 't dat mijnen trouwen dienst aen u behaeght
Ick sal uwen Vader wesen soete maeght,
Den man daer men d' ouders om verlaete moet
Is u naerder,
als u Vader,
En uw' Bloedt.

8. Soetjens wat Leander meynt gy dat een maeght
Soo terstont tot yeder weder-liefde draeght,
Van de goede jaghers wort het wildt verfoeyt,
Dat sigh vanghen,
laet, en langhen
Sonder moeyt.

9. Gy weet Rosalinde dat mijn hert u mindt,
Meer als eenen Vader mint sijn eygen kint,
Ick heb' u verkoren voor mijn weerde vrouw,
Rosalinde,
mijn beminde
Gheeft m' uw Trouw.

10. Gy kont sterck bewegen mijn jongh hert en sin
Ick voel my genegen tot u weder-min
Uw' bevalligh spreken is mijn Hertjens-dief
'k Kies Leander,
en geen ander
Voor mijn Lief.

11. Liefste als gy my uw' Trouw zijt gevende
Soo vergeet de doode om de levende
Bidt Godt voor hun ziel; maer en weent niet meer
Als ghy meught nu;
soo verheught u
In den Heer.

12. Meer als eenigh kint sijn Ouders minnen kan
Sal ick u beminnen mijnen lieven Man,
Wy zijn Bruydt en Bruygom; wy zijn man en wijf;
Wy-lie krielen
met twee zielen,
In een lijf.

13. Eer de thiende maendt sal sien de Sonne-schijn
Sult gy hoop ick moeder en ick vader zijn,
En soo zult gy weder krijgen van den Heer,
Vader, Moeder,
Suster, Broeder,
Wenscht ghy meer.

14. Door de lieffelijcke woorden soo vol geest
Keert mijn droevig sterf-huys in een bruyloffeest
Door den soeten troost die gy mijn hert aendoet
Keert mijn Lijden,
in verblijden
't Seur in't 't soet.",La marine,Brugge,../../data/dbnl/ruyt001aeng01_01.xml
36954,minn002eere02_0051,1677,1677.0,1001870,666222,mmmmmm,AAAAAA,6A 6A 6A 2A 2A 2A,6A 6A 6A 2A 2A 2A,"dialooglied, wereldlijk
liefdeslied",14,6,"LIefste Rosalinde waerom weende ghy,
Segt my wat is d'oorsaeck van u droef gheschrey,
Ick sal u misschien haest konnen maken bly,
Waerom sucht ghy’
Waerom ducht ghy
Segghet my?

2. Ah! Leander mynen noodt is al te groot,
Ick beween myn Vaders en myn Moeders doodt,
Ick sit hier alleen, ick ween, ick sucht, ick kryt,
Vader, Moeder’
 Suster, Broeder,
'k Ben 't al quyt.

3. Soete Rosalinde 't doet my selver pyn,
'k Wenschste dat u droef heyt wesen kost de myn,
Oft dat uw ghesucht wirdt onder ons ghemeen,
Ick soud' helpen’
Ende stelpen
Uw gheween.

4. Daer en sal noyt van myn weenen zyn com-af,
Voor dat ick sal rusten neffens hun in 't graf,
Ah! myn lieve Moeder waer ick togh by u,
'k Ben myn leven’
Dat ick leve
Nu al mu.

5. Sus, sus Rosalinde, sus en kryt niet meer,
Troost u met den wille van den Grooten Heer,
Peyst dat ieder Mensch die Godt het leven gaf,
Eens moet sterven,
En bederven
In het Graf.

6 'k Danck u seer Leander dat ghy in myn smert'
Soeckt te zyn den Trooster van myn droevigh hert,
Gy troost my met woorden, maer 'k en krygh daerom
Myn Beminde’
Doode Vrienden
Niet wed'rom.

7. Is 't dat mynen trouwen dienst aen u behaeght,
Ick sal uwen Vader wesen soete Maeght,
Den Man daer-men d'Ouders om verlaten moet
Is u nader’
Als uw Vader,
En uw bloedt.

8. Soetjens wat Leander meyndt ghy dat een Maeght
Soo terstondt tot ieder weder-liefde draeght,
Van de goede Jaghers wordt het Wilt verfoeyt
Dat figh vanghen’
Laet, en langhen
Sonder moeyt.

9. Ghy weet Rosalinde dat myn hert u mindt
Meer als eenen Vader mindt syn eyghen Kindt,
Ick hebb u verkoren voor myn weerde Vrouw,
Rosalinde’
Myn Beminde
Gheeft m'uw' Trouw.

10. Ghy kont sterck bewegen myn jong hert en sin,
Ick voel my gheneghen tot uw' weder-min,
Uw bevalligh spreken is myn Hertjens-dief,
'k Kies Leander’
En gheen ander
Voor myn Lief.

11. Liefste als ghy my uw Trouw zyt ghevende,
Soo vergheet de Doode om de Levende,
Bidt Godt voor hun Zielen, maer en weent niet meer,
Als ghy meught nu’
Soo verheught u
In den Heer.

12. Meer als eenigh Kindt syn' Ouders minnen kan,
Sal ick u beminnen mynen lieven Man,
Wy zyn Bruyt en Bruygom, wy zyn Man, en Wyf,
Wy-lie crielen’
Met twee Zielen
In een Lyf.

13. Eer de thiende Maendt sal sien den Sonne-schyn,
Sult ghy hop' ick moeder, en ick Vader zyn,
En soo sult ghy weder-kryghen van den Heer,
Vader, Moeder’
Suster, Broeder,
Wenscht ghy meer?

14. Door uw' lieffelycke woorden soo vol gheest,
Keert myn droevig Sterf-huys in een Bruylost-feest,
Door den soeten troost die ghy myn hert aen-doet,
Keert myn lyden,
in 't verblyden
't Suer in 't soet.",La marine,Brussel,../../data/dbnl/minn002eere02_01.xml
51886,woor003nieu01_0001,1836,1836.0,1003360,4444444444,vmvmmvmvmm,aBaBBcDcDD,4a 4B 4a 4B 4B 4c 4D 4c 4D 4D,.4a   .4B   .4a   .4B=  .4B=  .4c   .4D   .4c   .4D/  .4D/,,14,10,"Al die tot iets wonders zyn genegen,
Die komt hier by en hoord dit lied,
Wat door den Hemelheer zyn zegen,
In het koude Rusland is geschied, 
In het koude Rusland is geschied,
Hoe dat een knaap van wynig Jaren,
Zyn Groot Vaders levens redder was,
Die hy uit de slimst gevaren,
Kordaat ging redden op dit pas. 
Kordaat ging redden op dit pas.

In Rusland is een Dorp gelegen,
Waar van de naam is Ialtimoff,
Daar was een Beer om aas verlegen,
Die ging op Koei en Schaapen of, 
Die ging op Koei en Schaapen of,
De Landman kon dit slecht gedogen,
Zy namen met malkander raad,
Om dit dier na hun vermogen,
Te straffen voor zyn euveldaad. 
Te straffen voor zyn euveldaad.

Ziet hier deez' Boeren al te zaamen,
Komen hier by dien Oude Man,
Om met malkander een plan te beraamen,
Of men die Beer ook dooden kan, 
Of men die Beer ook dooden kan,
De Oude Boer met vuur en glorie,
Maakt zich terstond ter Jagt gereed,
Om te behalen de Victorie,
Maar dit verschaften hem groot leed. 
Maar dit verschaften hem groot leed.

Hoe ligt doet men iets onbezonnen,
En ziet de zwaarste zaak niet in,
'T was beter nooit als nu begonnen,
Dat komt te laat ons in de zin, 
Dat komt te laat ons in de zin,
Zoo ging het ook met dezen Ouden,
Die was zoo vuurig en zoo kloek,
En daar hy op zyn Geweer vertrouwden,
Zoo was zyn leven byna zoek. 
Zoo was zyn leven byna zoek.

De Boer was naauw in het Bosch gekomen,
Of hy ontmoet de woeste Beer,
Legt op hem aan vlug zonder schromen,
Maar ach hier wvgert zyn Geweer, 
Maar ach hier wvgert zyn Geweer,
Het Beest verwoed op het gebeuren,
Werpt voort den Oude Man ter aard,
En wil hem als zyn buit verscheuren,
Daar niets zyn woeden evenaard. 
Daar niets zyn woeden evenaard.

'T is waar den Mensch herdenkt zyn leven,
Maar God den Heer bestierd zyn gang,
Zoo was het hier mee ook gelegen,
Wat had dien Ouden het hier bang, 
Wat had dien Ouden het hier bang,
Had hy gedagt hier zoo te vaaren,
Vast keek hy na geen Beeren uit.
Hy was niet slimmer by Barbaaren,
En had zyn leven schier verbeurd. 
En had zyn leven schier verbeurd.

Zyn Klyn Zoon kan dit niet gedogen,
Treed voorwaards met een Byl als Held,
En hakt den Beer in kop en ogen,
Tot hy zyn heil in 't vlugten steld, 
Tot hy zyn heil in 't vlugten steld,
Wat wonder door des Hemels zeegen,
Dees knaap met moed en kragt bezield,
Heeft dus den Beer ter neer gelegen,
Groot Vader was aards wis vernield. 
Groot Vader was aards wis vernield.

Beschouw ô Mensch dit groote wonder,
Van zoo een klyn en jong perzoon,
Dat die dees wreede Beer bragt onder,
Wie vlegt hem niet een Helden Kroon, 
Wie vlegt hem niet een Helden Kroon,
Van altoos groenen Eerlauw'rieren,
Dien immers past aan ieder Held,
Daar hy den wreedste aller dieren,
Den woesten Beer heeft neergeveld. 
Den woesten Beer heeft neergeveld.

Hier legt den Beer geheel verslagen,
Den kop verbrydzeld in zyn bloed,
Den Oude Man word weg gedragen,
Waar op dit dier zoo had gewoed, 
Waar op dit dier zoo had gewoed,
Belaan met doodelyke wonden,
Geen kragt of magt meer om te staan,
Als of hy was geheel verslonden,
Maar nog is er verbetering aan. 
Maar nog is er verbetering aan.

Nu legt den Ouden Man ter neder,
Verkneld, vergruist met wond op wond,
Des Hemels gunst hersteld hem weder,
Van al zyn smert in korten stond, 
Van al zyn smert in korten stond,
De Chirurgyn zal hem verbinden,
Op dat hy spoedig word hersteld,
Zoo leefd hy weder by zyn vrinden,
Daar elk Gods wonder daad vermeld. 
Daar elk Gods wonder daad vermeld.

Triumph! hier juicht in volle zegen,
Van 't grooten Hof den Russen stoed,
Deez' jonge knaap met blydschap tegen,
Voor zyn getrouwen Helden moed, 
Voor zyn getrouwen Helden moed,
Hier werd hem een bewys geschonken,
Ter eer voor hem en 't nageslagt,
Wiens hart zou hier niet door ontvonken,
Daar hy door 't Hof wierd hooggeagt. 
Daar hy door 't Hof wierd hooggeagt.

De Keizer zegt door vreugd gedreven,
Tegens zyn Hof en Edelen stoed,
Ziet Heeren 't geen dat ik hier geven,
Is voor deez' Jongelings trouw en moed, 
Is voor deez' Jongelings trouw en moed,
'K schat hem een knaap van hooge waarden,
Neemt alle hier een Exempel aan,
Daar niemand hem ooit evenaarden,
In zyn kloekmoedig stout bestaan, 
In zyn kloekmoedig stout bestaan,

Welaan myn Zoon ontvangt dit teken,
Van mynen hand tot waren blyk,
Dat ik uw hoog schat en bereken,
Met grooten Helden steeds gelyk, 
Met grooten Helden steeds gelyk,
Den Hemel schenkt uw een lang leven,
Behouwd altoos dien moed en deugd,
Die in uw hart reeds staat geschreven,
Zoo leeft gy voor uw nut en vreugd. 
Zoo leeft gy voor uw nut en vreugd.

Aanschouw ô Mensch Gods wonder wegen
Dien ik uw voorstel in dit lied,
Deez' knaap geboren tot een zegen,
Zyns Groot Vaders leven was vast te niet
Zyns Groot Vaders leven was vast te nie
Zoo hy niet door Gods wonder werken,
Dien nordsche Beer had neergeveld,
Wie kan zyn kragt of magt beperken,
Zoo God van David maakt een Held.
Zoo God van David maakt een Held.",Contre les chagrins de la vie,Amsterdam (Anjeliersgracht 148),../../data/dbnl/woor003nieu01_01.xml
114451,_apo009apol01_0071,1745,1745.0,1001390,3333333,vvmvvmm,aaBccBB,3a 3a 3B 3c 3c 3B 3B,.3a   .3a   .3B   .3c   .3c   .3B=  .3B=,"dialooglied
liefdeslied",14,7,"WAnneer zal ik u vinde,
Myn Zielvermaek Clarinde?
Die ik zoo teer bemin,
Ach! wierd het my gegeven,
Met u in d'Eght te Leven,
'k Boog my steets naer uw zin.
'k Boog my steets naer uw zin.

'k Zou met myn gantsche Leven,
Opregte blyken geven,
Dat ik O! Ziels vriendin;
U tederlyk Beminde:
Ey kom, myn Lief Clarinde,
Gun dat ik u eens vin.
Gun dat ik u eens vin.

Ach! dat ik u ontmoeten,
'k Viel neder voor uw Voeten,
ô Haven myner Jeugt,
'k Zou my met Eerbied buigen,
Myn Liefden u betuigen,
Myn schat, myn Hoogste vreugd.
Myn schat, myn Hoogste vreugd.

Maer zagt! ik zie haer komen,
Daer langs die groene Bomen,
Ik spoed my derwaerds heen;
'k Zal haer terstont omhelzen,
In 't groen van deze Elzen,
Met smeken en gebeen.
Met smeken en gebeen.

ô Wensch van myn gedagten,
Waer op myn zinnen wagten,
Ik hiet u Wellekom:
Myn Troost, myn Uytverkoren!
Waerd gy voor my geboren:
ô Uitgelezen Blom.
ô Uitgelezen Blom.

Ik zou niets meer begeren,
De Doot zou my nauw weren,
Van u myn Hoogste Schat:
De Nyt; mag met haer Tanden,
Elk zoeken aen te randen,
Op my heeft zy geen Vat.
Op my heeft zy geen Vat.

'k Zou my gelukkig agten,
En steeds u wil betragten,
ô Zoetste Herderin!
Ik zal u Eeuwig Pryzen,
En Liefde pligt bewyzen,
Toond my slegs Wedermin.
Toond my slegs Wedermin.

Wel Hylas, uwe Klagten
Wie zou die hier verwagten?
'k Was hier na toe getreen
Om my wat te Verlusten,
En wat in 't Groen te rusten,
In stilten hier alleen.
In stilten hier alleen.

Myn Zoetste Lief Clarinde,
'k Ben bly dat ik u vinde:
Myn Wensch was maer alleen,
Dat ik u mogt ontmoeten,
Om te off'ren aen uw voeten,
Myn Smeken en gebeen.
Myn Smeken en gebeen.

Laet ik uw gunst maer Winnen,
Ik zal u Eeuwig Minnen,
En u ten dienste staen;
Ik zal uw Schaepjes weyden,
En met vernoeging leyden,
In Malsche Klaver-blaen.
In Malsche Klaver-blaen.

Ik voel myn Hart bestreden
ô Hylas! door uw beden,
Gy hebt myn Ziel doorwondt,
Uw Min kan my behagen,
'k Wil u myn gunst toedragen,
En Minnen 't aller stondt.
En Minnen 't aller stondt.

Ik wil my overgeven,
Om Steeds met u te Leven,
Als eens gezind van Aerd;
Ik Wensch dat onze dagen,
Geen droefheit mag najagen,
Maer al wat vreugde baerdt.
Maer al wat vreugde baerdt.

Myn Lieve Ziel, Clarinde!
Wyl ik mag ondervinden,
Uw gunst en uwe Trouw,
'k Wensch ons zal zyn gegeven,
Steeds eens gezind te leven,
Bevryd van naberouw.
Bevryd van naberouw.

'k Wensch ons niets zal ontbreken,
Maer dat we ons zien ontsteken,
Lang door een zuiv're Min:
En dat wy alle beyde,
In kort ons zien verblyden,
Door Vrugten naer ons zin.
Door Vrugten naer ons zin.",Ik breng u op een dronkje,'s-Gravenhage,../../data/dbnl/_apo009apol01_01.xml
