recordid,songid_DBNL,jaar_eind,jaar_begin,bronid,rijmaccent,rijmgeslacht,rijmschema,strofeschema,strofeschema_plus,trefw_genre,aantal_strofe,verstal,text,melodienorm,plaats,filepath_DBNL
2155,blas001fida01_0058,1663,1663.0,1000642,3535352221,vvvvvvvvvv,abbaacdddc,3a 5b 3b 5a 3a 5c 2d 2d 2d 1c,.3a   .5b   .3b   .5a   .3a   .5c    2d=+  2d=+  2d=  .1c,liefdeslied,10,8,"O Volmaaxte der Maagden!
O lieve Celestyn, wiens braave leeden
In kostelijkke kleeden
Aan minnaars oog spijt Venus self behaagden.
Hoe sal ik, die my vraagden,
Na eys beginnen natuurs volmaakt bedrijven
Af te beelden, af te beelden, af te beelden 
met schrijven?

Uw Geboorte te eeren
Was reukkeloos bestaan, die felf den Heemel
Met goddelijk geweemel
Rontom uw wieg aan d'Amstel quam vermeeren.
Ik sal de pen dan keeren,
En na behooren, so veel men kan beseffen
Uwe schoonheyd, uwe schoonheyd, uwe schoonheyd 
verheffen.

Wie sach schoonder als 't weesen
Van mijne Celestyn? ô gulde haaren!
Die Paphos Soon voor snaaren,
En aan sijn boog voor rekkelijke peesen
Allangh heeft uytgeleesen.
O minne-snikjes! die krullend langs de wangen
Al de minnaars, al de minnaars, al de minnaars 
bevangen.

Deftig voorhooft! daar d'oogen
So helder met haar flonkkerende lichten
Als Heemels lichten lichten.
Wiens lonkjes, groot van minnelijkvermogen
In 't hart des minnaars vloogen.
Daar nestelt Liefde, daar voel ik minne-looten,
Vol van kommer, vol van kommer, vol van kommer 
geschoten.

Schoone Kaakken! ô Kaakken
In welkkers Roosengaard op Lely gronde
Adonis onderstonde
Sijn leeven als met Venus te vermaakken.
Die Hof doet yder blaakken:
Uw roode Kaakjes, alleen of bey te saamen,
Lente-bloemtjes, lente-bloemtjes, lente-bloemtjes 
beschamen.

Purp're Boorden der Lipjes!
Waar aan in suyver nat de nektar stroomen
Met soete drifjes koomen;
Daar eb en vloed verwisselt op de tipjes
Van die kooraale klipjes.
Daar serrep-soete, en lekkre aders vloeyen
Die haer Lipjes, die haer Lipjes, die haer Lipjes 
besproeyen.

Laat die Lipjes ontsluyten
Op datmen sie die mals Robijne kassen,
Waer in de paarlen wassen
Die paarlen die de liefde sou vrybuyten,
Die Tanden die d'er spruyten
In schellepen van Koraal, en wijse reeden
Door het spreeken, door het spreeken, door het spreeken 
ontleeden.

Swane Halsje! dat Gooden
Wen gy uw orgle stem komt op te halen,
Als fiere Nagtegalen,
Op dat bankket aanlokkend schijnt te nooden,
Ik liet my willig dooden,
Mocht ik mijn armen om 't maagden halsje vlechten,
En met kusjes, en met kusjes, en met kusjes 
bevechten.

Poesle Vingren! met platen
Van Parlemoer bedekt, wiens blaawe aadren
Ter blankke hant vergadren.
Wie tracht sijn hart niet voor uw hand te laten
Soo kunstig boven maten?
't Sy die borduurt, of spoeyt met vlugge tukken
Op de Cymbels, op de Cymbels, op de Cymbels 
te drukken.

Deese gaven heeft schoone
U frisse Celestyn natuur gegeeven:
Eer wouw ik daadlijk sneeven
Eer ik niet sach mijn min met die beloone!
Geen siel mijn Rifbewoone
Of maak dien Engel, die my tot haar doet neygen,
Die Jeugde-bee, die Deugde-ree, die Vreugde-see 
my eygen.",Amarilli mia bella,Amsterdam,../../data/dbnl/blas001fida01_01.xml
2157,blas001fida01_0060,1663,1663.0,1000642,55422555,vmvvmmmm,aBaaBCCC,5a 5B 4a 2a 2B 5C 5C 5C,.5a   .5B   .4a   .2a   .2B   .5C   .5C=  .5C=,"liefdeslied
klaaglied",10,8,"IK moet mijn noodgeheym dan nu beklagen'
En storten ach! veel droeve traantjes uyt:
Hoe kan mijn Hart die swaare plaagen
Noch al verdraagen
Die 't Lot Besluyt?
Moet ik dan endeloos en overal
Staag suchten onder druk en ongeval?
Staag suchten onder druk en ongeval?

O dartel Paphos wicht! u moet ik schelden;
O Venus! die mijn boesem klaagen doet;
Ik klaagde niet dat Min my quelde
Of gy ontstelde
Mijn vry gemoed.
O neen, de Liefde was al mijn begeer,
De Liefde, die ik Minne-Moeder eer.
De Liefde, die ik Minne-Moeder eer.

Ik weet gy deerenis hebt met mijn Minne,
Ik weet, gy maakt dat my mijn Lief erbermt;
Sy trekt mijn Min te boesem inne,
Die 'k hoop te winne',
Nu 't hartje kermt.
Ik klaag niet over haar die lieve Maagd,
Die Maagd die my in eewigheyd behaagd.
Die Maagd die my in eewigheyd behaagd.

Maar Venus hoe liet gy mijn Min so wassen?
Hoe wierd mijn trou en suyvre drift so groot?
Dat ik vergoot veel Minne-plassen,
Nu 'k wil verrassen
Haar kuysche schoot.
Gy hebt mijn Minne-bee te veel verhoort,
Waar door mijn waarde Lief sich vind verstoort.
Waar door mijn waarde Lief sich vind verstoort.

'k Was niet vernoegt met haar genegentheeden,
Die sy my self so vast heeft toegeseyt,
Ik wouw noch verder buyten reeden
Dat sy met Eeden
Swoer trouwigheyd:
Ik bad van haar ook Trouw-beloften, maar
Mijn trow-versoek viel voor haar Min te swaar.
Mijn trow-versoek viel voor haar Min te swaar.

Hoe, seyse, wiltge my tot weer-min dwingen?
Daar u geen weer-min wort ontseyt, ô neen,
Maar Trou-beloften voort te bringen.
Sijn vreemde dingen
En tegens reên.
Ik sweer, gy ook wel krijgt de Trou van my,
Maar wacht, tot ik u meer genegen sy.
Maar wacht, tot ik u meer genegen sy.

Dus sprak mijn Lief met min-genegen lonkken;
Maar och! mijn graage min bleef onvernoegt.
Hoe suchte sy om mijne vonkken!
Mijn min als dronkken
Haar boesem wroegt.
Wy scheyden dan met onvernoegde sin,
Dat my groot hinder dee in mijne Min.
Dat my groot hinder dee in mijne Min.

Wat naare nacht moest ik toen overbrengen!
Wat al gedachten speelden in haar hoofd!
Wie voesde meest sijn quaal verlengen?
Wie kon gehengen
Dat Min verdoofd?
Het dondren van haar stem op Donderdag
En blix'men van haar toorn ik deerlijk sag.
En blix'men van haar toorn ik deerlijk sag.

O Alderliefste siel, ô Overschoone!
O waarde Celestyn! ô Weerelds schat!
'k Beken, ik quam uw Goedheyd hoone,
Wilt my verschoone
Dat ik soo bad.
Ik eysch vergiffenis nu 'k heb misdaan.
Vergeef my, en neem my in gunst weer aan.
Vergeef my, en neem my in gunst weer aan.

Ik weet, gy draagt de Goedheyd in uw spieren,
Vergeef my dan die faal, so sweer ik, 'k sal
U, als mijn Son, inwendig vieren,
En steets vercieren
Uw welgeval,
Heb ik tot Trouw-woord u te stark genood,
Mijn Min, die stark is, my die daad gebood.
Mijn Min, die stark is, my die daad gebood.",Son altesse royale,Amsterdam,../../data/dbnl/blas001fida01_01.xml
4605,stal001extr01_0028,1631,1631.0,1000716,3333444,mvmvmmm,AbAbCCC,3A 3b 3A 3b 4C 4C 4C,.3A   .3b   .3A   .3b   .4C   .4C=   4C=,,10,7,"T’Geen ik u, sprak den Heer
Gebie ter goeder trouwen
Dat doed noch min noch meer,
Dus past my t’onderhouwen
De zuyv’re wet, die ik u gaf,
Noch doedter toe, noch trekter af.
doedter toe, noch trekter af.

Hoord hier Papist! dus luydt
Den text van Deutronomen,
Fijn Man! wat wiljer uit
Besluiten, t’uwer vromen?
Besluiten? Dat het Pausdom alst
Besluiten? Dat het Pausdom alst
Iet nieus gebiedt, de schrift vervalst.

Wildt ghy den Text aldus verstaen,
Ey goe! zoo doed my weten:
Of ook dit schennis is begaen
Van alle de Propheten,
Schriftuiren, Psalmen, bouken die
Schriftuiren, Psalmen, bouken die
Ick nae dit woord beschreven zie?

Hoe kwamen Mardocheeus,
Zulks wy noch kunnen lezen,
En Iudas Machabeeus,
Te treden boven dezen?
Hoe kwam dat vierderley Bodvast
Hoe kwam dat vierderley Bodvast
By Zacharias wierd belast?

Hoe dorsten in ’t begin
De eerste twaalf boden
Het Christen huisgezin
Bevelen, als van node
’t Onhouden zich met nauwe wacht
’t Onhouden zich met nauwe wacht
Van ronnen bloed, en van versmacht?

’t Is waer dit was wel eer
Door Moises aenden Ioden
Maer nu noch nimmermeer
Aen ’t Heydendom geboden.
Voor dat hen deze keur gezet
Voor dat hen deze keur gezet
Werd deur d’Apostolijke Wet.

En dat deur middel, niet
Van nieuwe openbaring;
Gelijk elk een wel ziet
Uit dien, dat by vergaring
Van raed, als ordinaris beurdt,
Van raed, als ordinaris beurdt,
Dit van d’Apost’len is gekeurdt.

Wel tot een klaer bemerk
Dat zulks tot allen tijden
Goods algemein Kerk
Was magtig te verlijden.
Die hy tot ’s werelds eynde toe
Die hy tot ’s werelds eynde toe
Belast heeft mette Schepers-roe.

Midsdien werd meer als wel
Bevonden, dat van Gode
By ’t Deutronooms bevel
Niet anders werd verboden,
Dan by zijn woord te geender tijd
Dan by zijn woord te geender tijd
Te vougen datter tegenstrijd.

Wildt ghy dan, lieve knecht!
De Roomsche keur afzetten,
Zoo tooondt eerst datze vecht
Met Goods geschreve Wetten.
End’ ik zal straks nae d’eerste proof
End’ ik zal straks nae d’eerste proof
Met u aenvaerden ’t nieu geloof.",Laatstmaal ging ik ter jacht,Leuven,../../data/dbnl/stal001extr01_01.xml
9086,lode002uyt_01_0047,1676,1676.0,1000814,44443331134,vmvmmmvvvmm,aBaBCCdddCC,4a 4B 4a 4B 3C 3C 3d 1d 1d 3C 4C,4a    4B    4a    4B   .3C=  .3C=   3d   .1d= 1d 3C 4C,geestelijk lied,10,11,"HOog! om hoog! mijn siel, na boven!
Hier beneden is het niet:
't Regte leven, lieven, loven,
Is maar daarmen Iesum siet.
Al wat gy siet op aard,
Al wat gy hoort op aard,
Is uw costlijck leven, lieven, loven,
Al wat gy wenscht op aard,
Is uw costlijck hert niet waard.

Schoon en pragt is enckel schijn, en
Ydelheyd al 't costelijck,
Lusten met 't gebruyck verdwijnen,
Goud en silver is maar slijck:
Daar 't costelijcke bloed
Daar 't costelijcke bloed
Waardig all uw leven, lieven loven,
Daar 't costelijcke bloet
't Hert boven alles gelden doet.

't Leven sonder eynden Heerlijck,
Na dit leven crijgelijck,
Is, mijn siel, alleen begeerlijck,
En beweegt onsigtbaarlijck:
Sluyt maar uw vleeschlijck oog,
Sluyt maar etc.
Want dit heerlijck leven, leven, leven,
Sluyt maar uw vleeschlijck oog,
Want dit leven is om hoog.

Sonder sterven voor Godt leven,
Sonder moeyte, sonder pijn,
Sonder sieckte, sonder beven,
Sonder quel, en sonder quijn:
O! yd'le siel bedenckt, O! yd'le etc.
Sonder sterven leven, leven, leven,
O! ydle siel bedenckt,
Wat u den Hemel goedig schenckt.

Leven in volmaackte deugden,
Tot des Heeren Heerlijckheyd,
Vrolijck in des Hemels vreugden,
Heylig in sijn Heylicheyd:
Met so een glansch vereent, Met so etc.
Sonder sonden leven, leven, leven,
Met so een glansch vereent,
Siet wat den Hemel u verleent.

Hersenlosen, die de snooden
Sonden doet, en daar in leeft,
Weet gy niet, dat u de dood, en
Hel nog in den boesem cleeft?
Wilt gy ten leven gaan? Wilt gy etc.
Vangt der deugden leven, leven, leven,
Wilt gy ten leven gaan?
Vangt hier het deugdsaam leven aan.

Wenschelijck en lievens-weerdig
Is mijn Iesus, daar de min
Altijd tot wat anders veerdig
Vindt alleen genoegen in!
Mijn siel na boven dan, Mijn siel etc.
Daar ick Iesus lieven, lieven, lieven,
Mijn siel na boven dat,
Daar ick het heyl aanschouwen can.

Alderminnelijckste Schoonheyd!
Oorsaack van wat hier schoon schijnt,
Die door jaren, nog gewoonheyd
Min vermaackt, of oyt verdwijnt.
U, Schoonheyd, bid ick aan, U etc.
Wil ick oyt yets lieven, lieven, lieven,
U, Schoonheyd, bid ick aan,
Daar sal het hert eerst henen gaan.

Allerley Bevallijckheden
Diemen hier bedencken can,
Menschen-liefde, menschen seden
Sijnder maar een schaduw van.
Dit steelt mijn hert en al, Dit etc.
Lust my yet te lieven, lieven, lieven,
Dit steelt mijn hert en al,
Dit boven al ick lieven sal.

Ah! dat aller menschen tongen,
Aller Englen wackerheyd
t'Samen-spanden, t'samen songen
Iesus lof en Heerlijckheyd!
Waackt op Hert, mond, en hand
Waackt op mijn Cijter; want
Iesus is te loven, loven, loven:
Waackt all' op hier is stoff
Singt sonder eynden Iesus loff.",Un jour m'en allais seulette,Utrecht,../../data/dbnl/lode002uyt_01_01.xml
9127,lode002uyt_01_0088,1676,1676.0,1000814,5551,mmmm,AABB,5A 5A 5B 1B,.5A   .5A   .5B   .1B,geestelijk lied,10,4,"DE lage Son, mijn Vriend, ontreckt my bloem
En loof ter cransen; weygert my den roem
Van 't waardig hooft te cieren met het spruy      
-tend' cruyd:

Die Hy N.N. Die alles bouwt, en ciert,
En draagt, en 't hert in breydel houdt, en viert,
Maack 't heylig breyn van ongemene glans       
Een crans:

Een crans; daar op wel diep geschreven staan
De jaren die thans sijn voor-by gegaan,
Die on-herroep'lijck ylden en geswind;      
Als wind:

Gesneden sijn met d'onweerhoub're griff
De woorden welckers ongesielde riff
Gehoort is, en wiens keest vrugtloos, so 't scheen,      
Verdween:

Geprentet sijn de schricken van dien dag,
Wanneer den Regter met een streng gesag
Sal reeck'ning eyschen van ons doen en tijd      
Verslijt:

Gemaalt sijn, en na 't leven afgebeeldt
Die eyndelose Saliche'en, en Weeld
Die 't honck'rend hert hier soeckt met alle list,      
Maar mist:

Geschildert staat, en levendig vertoont
't Oneyndig jammer dat daar onder woont,
Daar 't grootst getal der menschen boetloos sugt,      
En dugt:

Getekent hangt dien Godt-Mensch welckes bloed,
En traan, en wond, daar schrijft en roept sijn gloed
Van Liefde; tot hem 't hert (dat aamloos hijght)      
Ontsijgt.

De telgen sy elck onverjaarde deugt;
't Verciersel yver; d' omloop ware vreugt;
Den Grond dien wijsen Raad die Gods woord heeft,      
En geeft.

Alwijse Godt! Die self de naam van Raad
Bemind en redt der Radelosen staat:
Gedugte Godt! geeft N.N. altijd Raad      
En daad.",Hartknagend onverzettelijk,Utrecht,../../data/dbnl/lode002uyt_01_01.xml
24587,_han028hand01_0088,1500,1476.0,1006807,66,mm,AA,6A 6A,.6A   .6A,devoot lied,10,2,"1   HOege   vrouden synt hierbauen al inder ewicheit
daer jhesus syn wtuercoren haer stede heeft bereyt

2   Jhesus toe behaegen dat is al myne begeerte
Alle   daege daer omme toe steruen dat is hi my wal weert

3   Wie wil behaegen die sy daer toe bereit
syn herte ledich toe maken van alre ydelheit

4   Wie myt ihesus mynne van bynnen is omme beuaen
Die mach syn lof wal synnen haer schult waert of gedaen

5   Die ihesus mynne draeget die synt wal geheten vroet
sie hebben wtuercoeren dat alre beste  guet

6   Wie suuer is van herten nae ihesus wille bereit
die moet wt mynnen daelen in dieper oetmoedicheit

7   Die hoeren eygen willen laten Ende ihesus syn   onderdaen
gheen tonge en mach wt spreken wat loen sie soelen ontfaen

8   Die ihesus mynne smaken den alre besten wyn
Altyt is hoere begeerte in synen dienste toe syn

9   Jhesus an toescouwen in synre hoeger moegentheit
Daer is myne verlangen Och   weer myne siele bereyt

10   Wat vrouden   mach my hier lusten in desen yamerliken dael
myn herte dat lopet van bynen tot ihesus altoe maele",,"IJsselstreek (Deventer, later Zutphen)",../../data/dbnl/_han028hand01_01.xml
