recordid,songid_DBNL,jaar_eind,jaar_begin,bronid,rijmaccent,rijmgeslacht,rijmschema,strofeschema,strofeschema_plus,trefw_genre,aantal_strofe,verstal,text,melodienorm,plaats,filepath_DBNL
36054,dyck014oude01_0055,1664,1664.0,1015503,432232222111124,vmmmmmmmmvvvvmm,aBCCBDEDEffggBB,4a 3B 2C 2C 3B 2D 2E 2D 2E 1f 1f 1g 1g 2B 4B,.4a   .3B   .2C   .2C   .3B    2D +  2E    2D +  2E   .1f + 1f   .1g + .1g + 2B 4B,"bruiloftslied
kluchtlied",12,10,"Hebdy niet gehoort, lieve Teunis
Van Mijntjens Bruylof-feest,
Hoe dat alle man
Met hare soete Ian,
Was vrolijck om het meest;
Heyntjen de baes, en kreupele Niel,
En schemele Klaes, en scheele Michiel,
Daer schoncken, en droncken
En songen en sprongen om het meest,
Was dat niet een Bruylof-feest?

2. Haddy eens gesien daer die wijven,
Sy hadden ‘t alsoo breedt,
Datse mans wel by kans
Beschaemden met den dans,
Was dat niet fraey bescheet?
Mijntjen de bruydt, en velle van kranck
En Bayke klap uyt, en Lysje de manck,
Daer liepen, en riepen kourante cinquante
En songen en sprongen om het meest,
Was dat niet een Bruylof-feest?

3. Kromme Stijn, en Hennen in het wambais
Spronck over stoel en banck;
Maer Cousin Severijn
die deet het wel soo fijn,
Want hy oock mede sangh.
Maegeren Loen, en kaele Matthijs,
En Ioppe de Floen, en simpele Gijs,
Daer kraeyden en draeyden alle mande pavande
En songen en sprongen om het meest,
Was dat niet een Bruylof-feest?

4. Hier wert oock gehoort malle kalle
Met Kees, en sijn malloot,
Onder al dit geschal,
sy kraeyde boven al,
Gelijck een lijsters stroot.
Scheel Jacquemijn, en Klaerke petit,
En lange Peerijn, en losse Margriet,
Daer nyghden en heyghden, en lachten en schachten
En songen en sprongen om het meest,
Was dat niet een Bruylof-feest?

5. Daniel den Yrs met sijn sargie,
En proost van doncker-vliedt
Hadt een pack met toback
Gesteken inde sack:
Maer Lijs en wistet niet.
Marten pack op, en Louwe de recht,
En holle klomp op, en sobere specht,
Die roockten, en smoockten, en sogen, en spogem
En songen en sprongen om het meest,
Was dat niet een Bruylof-feest?

6. Olymaer, en Lippen de speelman,
Die streeck ‘k ken weet niet hoe
Een nieu dans opse frans
Voor wijven en voor mans,
Men wierter niet eens moe.
Krepele Leun, en hompe de pom,
En Teeuwe sijn seun, en Claesje van klomp
Die rteden, en schreden veel dansen als fransen
En songen en sprongen om het meest,
Was dat niet een Bruylof-feest?

7. Onder al ‘t gedraet en krioolen
Was slinger been Paschier,
Die wel ras met een glas,
wou dansen cinke pas
Maer viel met ‘t glas en bier.
Djeure riep jome, en trock hem wat stijf
En scheurde sijn mouwe, en viel hem op ‘t lijf.
Daer vroeten die kloeten, en rolden en solden
En songen en sprongen om het meest,
Was dat niet een Bruylof-feest?

8. Huyven achter aen quam gekropen,
En vontse voet aen voet!
Maer Ariaen nam het spaen,
en wouder tusschen staen;
Hy meynd’ het gingh voor goets.
Lemmen en Haen die vatten de saegh,
En hielpen Ariaen, en scheurde de kraeg
Daer swoeren die boeren, gans katten! gants ratten
En songen en sprongen om het meest,
Was dat niet een Bruylof-feest?

9. Carel in de Krol nam het sout-vat
Op ‘t hooft voor een kasket;
Maer Reynier van het vyer
die spot voor een rapier
Voor schilt de bra-pan vet.
Dries Kapiteyen, en Thijs Luytenant
Alferis Gleeyen, en Balten Sergeant
Die wouden en souden dees’ sielen vernielen
En songen en sprongen om het meest,
Was dat niet een Bruylof-feest?

10. Truytjen riep om hulp hare buren,
Siet! ginter leydt Paschier.
Soose liep, soose riep,
ontwaeckte Ian de pier.
En rolden in het vyer,
Senghde sijn hoedt, en brande sijn hant,
Verschrickte de voet, en riep moort en brant.
Daer liepmen, daer riepmen
Met hoopen, gantsch knoopen
En songen en sprongen om het meest,
Was dat niet een Bruylof-feest?

11. Borgemeester Faes wiert geroepen
Met schrijver meester Loen,
Die daer aen quam gegaen,
als het spel schier was gedaen.
Wel! wat ‘s hier al te doen
Ieure de Kloet die spouwde daer bloedt
En vatte sijn hoedt, en seyde ‘t is goedt.
Dus scheyden sy beyden dees’ knechten van vechten,
En songen en sprongen om het meest,
Was dat niet een Bruylof-feest?

12. Borgemeester seyde, goeje mannen;
Dit is een ongeluck;
‘t Is gevat, beter dat,
dan in het hooft een gat;
Denckt ‘t is een Bruylof-stuck.
Geeft hier de kan aen lieve Paschier,
En d’Ieure goey man; sa Grietje, schenckt bier,
Laet vraet haet nu sincken, en quaet zaet verdrincken.
Lapt dees’ fluyt in uw huydt.
Hier mee was die Bruyloft uyt.",Heb dij niet gehoord lieve Teunis,Antwerpen [=Amsterdam],../../data/dbnl/dyck014oude01_01.xml
51264,_nie023nieu01_0001,1842,1819.0,1002981,3434333444,mmmmmmmmmm,AABBCCDDEE,3A 4A 3B 4B 3C 3C 3D 4D 4E 4E,3A    4A    3B    4B    3C   3C 3D 4D 4E 4E,"verhalend lied, wereldlijk
historielied",18,7,"Hoort een droef geval,
Van 't geen ik u zingen zal,
Hoe de lasterzucht,
Is een snode Duivels vrucht;
Daar de geile lust,
Nimmer hout haar rust
Voor zy 't grootste kwaad,
Heeft verwekt in de Echte staat
't Geen te Oostende is gebeurd,
Waardig om te zyn betreurd.

Een Colonel getrouw,
Leefde in liefde met zyn Vrouw,
Had drie Kinderen schoon,
Tot zyn heilige Huwelyks-loon;
Hy werd in korten tyd, 
Geroepen tot den stryd,
Om het Vaderland, 
Te bevryden met Gods hand,
Dus moest hy in 't kort alzoo, 
Na de slag van Waterloo.

Met een kloeke moed, 
Hy zich ras ten stryde spoed,
Neemt een teer afscheid,
Met een traan van dankbaarheid;
Van zyn Vrouw en Kroost, 
Weest; zegt hy getroost,
Treur niet; want ik keer, 
Binnen kort met glorie weêr;
Wees gerust, houd u constand,
'k Stryd voor God en 't Vaderland.

Hy keerde ook spoedig weêr;
Vond weldra tot zyn begeer,
Zyn Vrouw en Kinderen daar;
Werd hun blydschap straks gewaar;
De Meid ook; van wiens list, 
Toen nog niemand wist,
Noemt hem welkom ras,
Schoon haar hart vol boosheid was;
Het geen helaas in korte tyd,
De allergrootste smart bereid.

De Colonel zat op een tyd,
Te schryven in zyn eenzaamheid;
De Meid kwam in zyn Kamer treên;
Zagtjes daar hy was alleen;
En, zegt ach Mynheer! 
Ik beklaag u zeer,
Want u echte Vrouw, 
Handelt u geheel ontrouw;
Dit fraai Horlogie; hier op let,
Vond ik heden in het Bed.

Toen gy waard ten stryd,
Was uw Vrouw eerst regt verblyd,
Gy toonde in 't Veld uw kloek;
Maar zy telkens kreeg bezoek,
Van een dartel Heer, 
En zy schond de eer,
Van een waardig Man, 
Daar is dit Horlogie van,
Hy; verschrikt op deze reên,
Gaat woedend uit de Kamer treên.

Zyn Vrouw met 't jongste Kind,
Altoos door hem teer bemind,
Verstoot hy; snode Hoer,
Sprak hy; gaat, ontruim myn vloer;
Want uw vervloekte min, 
Stoort myn Huisgezin,
Hoe gy dan ook schreid, 
Ik acht zulks maar valsigheid;
Hier baten dus geen droef getraan,
Zy moest Landwaards zwerven gaan.

Zy kwam te Londen aan,
Zag daar aan de Haven staan;
Een Kapitein wiens eer, 
's Konings teken had vermeerd,
Dien zy haar armoed klaagt, 
Om een Aelmoes vraagt,
Ach wat diepe smart, 
Voor een braaf onschuldig hart;
Haar Geld en Goed was reeds verteerd,
Haar vreugd in jammerklagt verkeert.

Intusschen was de Meid,
Door deez' uitkomst gansch verblyd;
Zy vleide; en dacht haar Heer,
Dus te krygen tot haar begeer;
Haar geilheid bleek zeer snel, 
Tot schandelyk Overspel,
Maar wat de boosheid doet,
De Deugd verfierd doch 't rein gemoed;
De onschuld praalt doch boven al,
Zoo 't Lied u verder melden zal.

Deez' Engelsch Kapitein,
Kwam, als of het zoo moest zyn;
Te Oostende aan, 
In een Koffiehuis gegaan,
Verhaalt daar hoe hy een Vrouw, 
In diepe druk en rouw,
Wel eer van rang en staat, 
Had ontmoet heel disperaat;
Hoe hy; daar haar onschuld blonk,
Met haar lief Kind een Aelmoes schonk.

De Kolonel zyn vrind,
Dien hy juist aldaar ook vind,
Scheen als opgewekt, 
En uit 't Koffiehuis vertrekt;
Zyn hart dat in hem treurt
Spreekt; daar is iets gebeurd:
Hy vertrekt op 't ogenblik,
Maar komt te huis; ô welk een schrik,
Zyn valsche Meid had zig vermoord,
Had zig verhangen aan een koord.

Het geen hy spoedig zag,
Daar ook een Brief op Tafel lag;
Hy leest die; vindt tot rouw,
Deze woorden, uw echte Vrouw,
Droeg zig te allen tyd, 
Vol van eerbaarheid;
Deugdzaam en oprecht, 
Nimmer schond zy hare Echt,
Maar geile lust heest my verleid,
En zulk een valsche Tong verspreid.

Hy riep zyn beide Zoons,
Zegt; ach voor my wat helsche loon:
Uw lieve Moeder treurd, 
Om 't geen nimmer is gebeurd
't Geen my dringt door 't hart, 
Zy leid druk en smart;
Dus 'k vertrek met spoed, 
Of ik haar nog eens ontmoet;
Hy huurde voor hun een andere Meid,
En kuschte hun vaarwel voor korten tyd.

Hy reed te Londen aan,
Wat ongeluk moest daar ontstaan;
Zyn Paard dat schiften deed, 
Op de Brug; Straks overreed
Een lief en aardig Kind, 
Dat men speelend' vind;
Men houd hem tegen, ach!
En hy gevoelde 't droefst geklag;
Hy zag het en storte een tranenvloed,
Het was zyn Kind zyn eigen bloed.

De Moeder vol getraan,
Trof hy terstond by 't schouwspel aan;
Zy was gansch zinneloos,
Daar zy de dood welhaast verkoos,
In de diepe vloed, 
Met een benaauwd gemoed;
Maar haar Man treed toe, 
Zyt u leven doch niet moê;
Redde haar, God heeft u elend,
Wederom ten best gewend.

't Kind dat hy terstond,
Naar een Chirurgyn toe zond;
Wierd 't verband gelegd, 
Maar de wond was veel te slegt
Dus het teder Wigt, 
In het droef gezicht,
Van de Ouders 't meest, 
Helaas, spoedig gaf den geest;
Ach welk een nieuwe smart en rouw,
Voor deez' droeve Man en Vrouw.

Hy viel door droefheid teêr,
Voor zyn waarde Vrouw ter neêr;
Ach myn lieve Vrouw! 
Ik geloofde een valsche trouw;
Een snode Hoer; ô ja, 
Vertrouwde ik weldra;
Maar door wanhoop groot,
Vond ze haar loon ook in den dood;
Ach vergeef my; 'k heb misdaan,
Schenk my weêr uw hart voortaan.

Nu gingen zy te vreên, 
Weder na Oostende heen;
De brave Zoons verheugd. 
In het beste van hun jeugd;
Noemde welkom haar, 
De nieuwe Meid aldaar,
Ook haar blydschap voegd,
Zoo leefden zy steeds vergenoegt;
Ach schuw doch snode lasterzucht,
Zy baart altoos een Helsche vrugt.",,Amsterdam,../../data/dbnl/_nie023nieu01_01.xml
111638,_apo006apol01_0084,1750,1750.0,1001217,4441313,mmmmmmm,AAABCBD,4A 4A 4A 1B 3C 1B 3D,.4A=  .4A=  .4A   .1B/+ .3C   .1B/+ 3D,kinderlied,10,5,"LAast was ik in myn eenigheid,
LAast was ik in myn eenigheid,
'k dagt hoe besteed ik best myn tyd,
Alleen, Iris je vous le jure.
Alleen, Iris je vous le dire.

2. Nu dagt ik op myn eerste tyd:
2. Nu dagt ik op myn eerste tyd:
Dan weder op het onderscheyd
Van u, Iris je vous le jure.
Van u, Iris je vous le dis.

3. Tot dat my weer te binnen kwam,
3. Tot dat my weer te binnen kwam,
Hoe ik eens in myn armen nam,
Myn Lief: Iris je vous le jure.
Myn Lief: Iris je vous le dis.

4. En dat zy 't gansch niet kwalyk nam;
4. En dat zy 't gansch niet kwalyk nam;
Maar irep heel sagt myn lieve Lam
Wat 's dit? Iris je vous le jure.
Is 't ernst? Iris je vous le dis.

5. Maar Laas! wat baat my dit gedagt?
5. Maar Laas! wat baat my dit gedagt?
Myn schoone Nymph, die met my lagt
Blyft wreed: Iris je vous le jure.
Blyft wreed: Iris je vous le dis.

6. Maer weet schoon dat gy met my lagt
6. Maer weet schoon dat gy met my lagt
Krygt uw Cupido in zyn magt,
g'Ontvlied, Iris je vous le jure.
Geen Pyl; Iris je vous le dis.

7. Voldoe myn wensch schoon Engelin
7. Voldoe myn wensch schoon Engelin
En schenk my eens u Wedermin,
Maar sagt, Iris je vous le jure.
Zy lagt; Iris je vous le dis.

8. Wel Minnaar wyl ik ken uw min,
8. Wel Minnaar wyl ik ken uw min,
Verblind ik my aen uwe sin;
'k Schenk uw, Iris je vous le jure.
Myn Trouw, Iris je vous le dis.

9. Gelukkig zyn wy voor altyd
9. Gelukkig zyn wy voor altyd
En lagchen om de bitse Nyd,
Te zaam, Iris je vous le dis.
Te zaam, Iris je vous le dis.

10. Zo leven wy steeds onbenyd
10. Zo leven wy steeds onbenyd
En minnen steeds elkaar om stryd,
Te zaam, Iris je vous le jure.
Te zaam, Iris je vous le dis.",Tircis dans un bois ténébreux,Dordrecht,../../data/dbnl/_apo006apol01_01.xml
112301,_apo006apol03_0102,1750,1750.0,1001389,2433243333222233333222233,mmmmmmmmmvmmmmmmmmvmmmmmm,ABBBACCAAdEEFFGGAAdEEFFGG,2A 4B 3B 3B 2A 4C 3C 3A 3A 3d 2E 2E 2F 2F 3G 3G 3A 3A 3d 2E 2E 2F 2F 3G 3G,.2A   .4B   .3B   .3B   .2A   .4C   .3C   .3A!  .3A@  .3d#  2E$  .2E%  .2F^  .2F&  .3G*  .3G(  .3A!  .3A@  .3d#  .2E$  .2E%  .2F^  .2F&  .3G*  .3G(,"dialooglied, wereldlijk",10,25,"WEl zoete meid,
Waar wilje nu dus vroegjes heen?
En gaaje zoo alleen,
Myn ziel vermaak, Climeen?
Ik ben verblyd,
Dat ik u dus van pas ontmoet.
Wel dat is zeker zoet,
'k Ga met u, vindje't goed.
Je weet hoe langen tyd,
Dat ik u heb gevryd.
Zeg, wanneer zal 't eens lukken?
Ik klaag en zugt
Met ongenucht,
Uit al myn hart
Van Minne-smart:
Maarr jy belacht myn pyn
En hebt den bras van myn.

2 Neen Tircis, dat kan niet bestaan:
Ik raad u, datje my laat gaan
Neen Tircis dat kan niet bestaan,
Wild naar een ander gaan:
Die gy voortaan uw dienst aanbied
En u gelooven zal;
Want of je my bemint of niet,
Dat scheeld my niet met al.
Dat mal gelaat
My niet aanstaat.
Ik hou niet van de Min;
Des niet lang praat;
Maar henen gaat.
Ik heb in u geen zin.

3 Hoe! zoud gy my dus beloonen?
Voor myn lang beproefde Min
Wel dat meenje niet myn schoone;
Heugt u niet, myn Engelin,
Hoe ik in opregtigheid
U myn dienst heb toe gewyd;
En dat gy
Wedermin liet blyken.
Woud ge my
Nu weer laten kyken?
Dat is juist niet hups gezeid.

4. Zag ik u niet laast by Kloris staan,
By 't toepad van de lindelaan;
Zag, ik u niet laast by Kloris staan
By 't schynen van de Maan?
Dat gekus,, en gebrus
Heb ik netjes afgekeeken:
En, wat hadje 't druk te spreeken
Met ons Amarant daar flus.

5. Myn alderliefste Herderin
Gy zyt alleen, die ik bemin:
En buiten u is 'er geen,
Die ik zo opregtelyk meen.
Ik weet'er van Kloris nog Amarant.
Die zaken die bennen al aan een kant.
'k Min u alleen
En anders geen:
Al zogt ik door't gantsche Land.

6. Neen Herder, je kunt maer gaan;
Uw dingen zyn hier al afgedaan.
Neen Tircis, je kunt maar gaan,
't Verveeld my hier langer te staan.
Ik heb u reeds genoeg gezeid,
Hoe dat de zaak tans by my leid.
En.. En.. En dag gy
Niet op zult doen by my.
'k Zoek niet te trouwen:
Ik houw niet van den Echten staat.
't Mogt my berouwen,
Als 't was te laat.
Des al uw praaten
Zal u niet baaten:
Wil dat vry laaten.
'k Bid u dat gy gaat.

7. Benje dan zo hart van zin,
Datje niet bent te beweegen?
Zo versmoor ik in de Min.
Adieu dan, myn Engelin.
'k Zal dan al myn Levens tyd
Eenzaam door het velt gaan zweeven,
Ach! Ach! met geklag.
Ben ik myn Climene quyt?
Waar toe wil ik langer leeven.
'k Heb dog, tot in Eeuwigheid,
U myn Liefde toegewyd.

8. Wel hoe! hy gaat.
Wel! dus en had ik 't niet gemeend
Ik hield my kwaad:
Maar 't hert is niet versteent.
Ei, Tircis, nog een woord:
Gy hebt myn ziel bekoord.
Kom nader Herder wild niet vreezen,
Ik zal voortaan de uwe weezen.
Zyt wel te vreen
Omhels nu Climeen.
Zie daar is myn hand,
Tot een onderpand
Van den Echten band.

9. Climeen, is't waar of droom;
Ik nader maar met schroom.
Is't ernst? lieve Maagd,
Dat gy my Liefde draagd.
En zult gy, ô! Climeen,
Met my in d'echt gaan treen?
Zo gun, dat ik genaak
Uw malsche Rozekaak:
En met een teed'ren kus
Myn vlam een weinig blus.

Ja kus vry, myn Tircis, en weest wel te vreen
La &c.......
Ja kus vry, ô! Tircis en weest wel te vreen.
Standvastige Minnaar omhels uw Climeen
La &c.......
La &.......
Gy, Nimphjes en Herders, neem deel in ons vreugd
La &c.......
Gy, Nimphjes en Herders, neem deel in ons vreugd
Op dat gy ons voorbeeld haast volgen meugt.
La &c.......
La &c.......",De gedachten,Dordrecht,../../data/dbnl/_apo006apol03_01.xml
116045,stap007lust01_0173,1681,1681.0,1016154,44444444,vvmmvvmm,aaBBccDD,4a 4a 4B 4B 4c 4c 4D 4D,4a 4a 4B 4B 4c 4c 4D 4D,"gebedslied
avondlied, geestelijk",10,8,"1. DE naare duisternis komt dekken
De aard: doch Gy kund my verstrekken,
O God! voor een genoegzaam licht,
Gaat Gy u van my niet verveeren,
De nagt zelfs kan my 't ligt niet weeren,
Uw by-zijn is mijn ziels-gezigt.

2. Dat toch de duist're nacht der zonden
Geen muur of scheidzel zy bevonden,
Om my 't ontrooven uw gezicht;
Uw aangezicht, dat door zijn klaarheid
's Ziels neevelen verdrijft in waarheid,
En aan doet breeken 't rechte licht.

3. Gy brengt alleen de held're dag aan,
Mits duisternis moet voor uw weg-gaan:
Want Gy alleene zijt mijn zon,
De oorzaak van mijn licht en leeven,
Die al mijns herten wensch kund geeven:
Mijn heils-fontein mijn leevens-bron.

4. Dat geen vervaarelijke droomen
In 's herzens schilderye koomen,
Terwijl het lichaam leid en rust:
't En waar zoodaanig een gezigte,
Als 't hert van Izaks zoon verlichte,
En in hem bluste 's vluchts on-lust.

5. Een vlucht is my, mijn God! de Weereld,
In bitt're gal schoon uit bepeereld:
De vyand is ons sta'ig op zy,
Hy lokt door lust, maar loond met wroegen;
In 't zien'lijk is geen waar benoegen;
Mijn herts verlange, is naar Dy.

6. Terwijl de slaap kruipt door de a'eren,
Wild waaker Isr'els ons bewaaren,
Terwijl 't verstand is van de wagt,
De zinnen zig ontslaan van zorgen,
Tot op den wenschelijken morgen.
Hou ons, o Heer! in uw gedagt.

7. Slaap is een beeld van 't eeuwig slaapen;
Dat toch de Duivel zig niet waapen
Door 's vleeschs gemakkelijke rust.
En werp ons in den dood der zonden,
Daar d' eeuwig vast aan is verbonden,
Als 's leevens lamp eens is geblust.

8. Dat 't beeld des doods my sterven leere,
En als dit lijf tot stof gaat keeren,
Geef, Vaader! dat ik zoo gerust,
De laatste slaap in 't graf mag slaapen,
Wis van te zullen zijn herschaapen
Tot d' eeuwig-duurende wel-lust.

9. Dat d' slaap haar rechte eind bereike,
Vermoeidheid van de leeden wijke,
Om tot 's Geests dienst te zijn bequaam
d' Werk-tuigen van 't verstand en zinnen
Verfrischt, en als vernieuwd van binnen
In alles heil'gen uwen naam.

10. In uw bewaaring gaa ik rusten
Als 'k U maar heb wat kan my lusten
Van al wat aard en Heemel heeft?
Uw gunst mijn burgt mijn vaste schans is,
Daar Gy zijt voor geen vyand kans is;
Gy dekt die naa uw leiding leeft.",O kerstnacht schoner dan de dagen,Alkmaar,../../data/dbnl/stap007lust01_01.xml
124270,_zin006zing01_0019,1860,1860.0,1001259,44442222,vmvmvvvm,aBcBdedF,4a 4B 4c 4B 2d 2e 2d 2F,4a    4B    4c    4B    2d=+ .2e    2d=+ .2F,,11,6,"Ach! wat zou de wereld wezen,
Moest zij zonder Meisjes zijn,
En met Meisjes zonder Jongens,
Was ze ook maar een rampwoestijn.
Jongens bij Meisjes, ja, Loeris bij Loerisje,
Jongens hij Meisjes, ja zóó moet het zijn.

2. Meisjes zitten bij elkander,
Reppen rust'loos priem en naald,
Maar het ledig harte zegt haar,
Dat in hare kring iets faalt.
Jongens bij Meisjes, ja, Loeris bij Loerisje,
Jongens hij Meisjes, ja zóó moet het zijn.

3. Jongens zetten zich in 't ronde,
Rooken lucht en wolken zwart,
Maar zij missen lieve Meisjes,
En hun vreugd raakt nimmer 't hart.
Jongens bij Meisjes, ja, Loeris bij Loerisje,
Jongens hij Meisjes, ja zóó moet het zijn.

4. Meisjes bij elkaâr gezeten,
Drinken koffij slechts en thee,
En helaas! de warme dranken
Brengen niets dan onheil meê.
Jongens bij Meisjes, ja, Loeris bij Loerisje,
Jongens hij Meisjes, ja zóó moet het zijn.

5. In der Jongens ruwe kringen
Staat noch glaasje stil noch flesch,
En de rampen van het zwelgen,
Leert men bij Hippocrates.
Jongens bij Meisjes, ja, Loeris bij Loerisje,
Jongens hij Meisjes, ja zóó moet het zijn.

6. Doch als Jongens bij de Meisjes,
Meisjes bij de Jongens zijn,
Proeft men slechts maar thee en koffij,
En men drinkt een glaasje wijn.
Jongens bij Meisjes, ja, Loeris bij Loerisje,
Jongens hij Meisjes, ja zóó moet het zijn.

7. Maar men leeft gezond en vrolijk,
Bij de koffij, thee en wijn,
Als maar Jongens bij de Meisjes,
Meisjes bij de Jongens zijn.
Jongens bij Meisjes, ja, Loeris bij Loerisje,
Jongens hij Meisjes, ja zóó moet het zijn.

8. Hoort men Meisjes, afgezonderd,
Redekav'len onderling,
't Onderwerp dan van hun kouten,
Is slechts eenig zielloos ding,
Jongens bij Meisjes, ja, Loeris bij Loerisje,
Jongens hij Meisjes, ja zóó moet het zijn.

9. Jongens in hun zamenkomsten,
Voeren elk om strijd het woord,
Doch een nuttig woord van stichting,
Wordt ook zelden daar gehoord.
Jongens bij Meisjes, ja, Loeris bij Loerisje,
Jongens hij Meisjes, ja zóó moet het zijn.

10. Maar een woord van vuur en leven,
Dat en hart en zinnen streelt,
Hoort men dan, als beider kunne
't Zoet gezelschap zamen deelt.
Jongens bij Meisjes, ja, Loeris bij Loerisje,
Jongens hij Meisjes, ja zóó moet het zijn.

11. In het kort, hoe men 't beschouwe,
Alles is maar vreugd in schijn,
Als geen Jongens bij de Meisjes,
Meisjes bij de Jongens zijn.
Jongens bij Meisjes, ja, Loeris bij Loerisje,
Jongens hij Meisjes, ja zóó moet het zijn.",Ach mijn zusje is gestorven,Amsterdam,../../data/dbnl/_zin006zing01_01.xml
129617,_thi001thir06_0067,1708,1708.0,1016156,4112224,mvvmmmm,AbbACCA,4A 1b 1b 2A 2C 2C 4A,.4A   .1b   .1b   .2A   .2C 2C 4A,"verhalend lied, wereldlijk
liefdeslied",10,7,"Als Boxvoetje speeld op sijn Pypje in ’t dal,
Zoo singen
En springen
De Satertjes al.
De Boompjes in ’t wilt,
’t Gansch bosjen dat drilt,
En schatert van ’t lieffelyk na-geschal.

Het riet daar wel eertyds Syringe   in zat,
Staat levend’
En bevend’
En schut als een blad,
Ja, zwiert heen en weer
Gelyken een Veer
Daar ’t ruysende windje maar even om-vat.

Dit wilden d’Arkadische Nimphjes eens zien
Wat wonder
Dat onder
Dit speelen kon schien,
Dat langs het geboomt
En Beeckjes gestroomt
Haar bruisende golfjens heenen vlien.

Dus zyn sy het Bosje ten einde gegaan
En liepen
En riepen
De Satertjes aan.
Maar ’t loose gebroed
Licht haastig de voet
En hebben de Harderinne gevaen.

Daar waren doen, laci, de Nimphies in noot.
Sy lilden
En trilden
En sagen als dood,
En riepen: ‘og, og!’
Maar ’t lose gedrog
Die hebben haar poesle leden ontbloot.

Terwyl dat Pan vast schaterd en lagt,
Zoo songen
En sprongen
Dit geyte geslagt,
Ja, deden in ’t veld
Daar ’t meeste geweld
En hebben d’onnosele Nimphjes verkragt.

Dit hebben de Harders door d’Echo gehoord,
Wiens harten,
Vol smarten,
So waren gestoort
Dat yder een eed
Aan Jupiter deed
Te wreken, of alle te worden vermoord.

Dus vielen sy op de Rovertjes aan.
Begonden
In ’t ronden
Met knuppels te slaan,
Met Schoppen en spa,
En riepen: ‘Sa, sa,
Hey Saters, wat hebtge ons Nimphjes gedaan!’

De splitte-koots   namen wel haastig de vlugt,
Maar lachten
En dagten
Om sulken klucht
De Harders verbaast.
Die vonden wel haast
Haar Nimphjes, maar waren   in groot gesugt,

Daar was het doen, laci, een droevige tyd.
Sy knarsten
En parsten
Haar tranen van spyt;
En hebben uit lust
Haar Nimphjes gekust.
Maar veele die waren haar maagdom quyt.",Boksvoetje,Amsterdam,../../data/dbnl/_thi001thir06_01.xml
130666,_thi001thir07_0092,1710,1710.0,1016157,23344434,vvmmmmvm,aaBBCCdE,2a 3a 3B 4B 4C 4C 3d 4E,".2a   ,3a   ,3B   ,4B   ,4C   ,4C   ,3d   ,4E","verhalend lied, wereldlijk
kluchtlied
liefdeslied",10,8,"Lest ging ons Jantje
's Avonds om een trantje
In de Uilevlugt
- Ik moet laggen om dees klugt -
Daar moeten ik   een meisje jent,
Grietje Snap-ops,   wel bekent,
Die hy aansprak uit minnen.
Vraagt waar dat hy  heen wou gaan.

‘Wel hede Jantje,
Wat benje een aardig quantje!
Soo deftig in de kleer,
Jan, je lijkent wel een Heer.
Je hoedje dat staat op een zey,
Een Vryster mag wel wesen bly,
In de stad - Hoorje Jantje -
Die soo 'n nobelen Vryer had.

‘Hebt gy behagen,
Grietje, ik moet vragen
- Hoord de reden myn -
Of gy wilt mijn Huisvrouw zijn:
Gy bent een meisje na de zwier,
In u praat heb ik pleizier,
Wilt in 't kort, Lieve Grietje,
U bedenken waar 't aan schort.’

‘Ik sie geen fouten,
Hoe kunje kouten!
't Is alles even net
Aan uw lyf heel toet afait.
Gy bent niet scheef, Niet mank, niet scheel:
Ik wou dat gy waart mijn deel.
Komt, wilt gaan Lieverde   Jantje,
Spreekt myn Vader daar op aan.’

‘U soete reden,
Grietje, doen mijn heden
Verblijden. Lief kom aan,
Wil mee by u Vader gaan.
Ik sal hem vragen, Liefste mijn,
Of gy meugt mijn Huisvrouw zijn.
Seer beleeft Sal ik spreken,
'k Wed dat hy mijn u wel geeft.’

Doen sy te samen
By haren Vader quamen,
Sprak Jan tryntjes bly:
‘Vader, hoord de reden my,
Geeft mijn u Dogter Grietje nou
Datse spoedig word mijn Vrouw.’
Siet, de Vader Was te vrede,
Daar mee was het Heilik klaar.

Jan, sonder dralen,
Gaat zijn moertje halen.
Die quam haastig voort
Om te sluiten het accoort.
Men dronk een glaasje wijn daar by,
Jan en Griet waren bly,
Moer en Vaar Maakten samen
Alles tot de bruiloft klaar.

Toen dese karen
Samen getroud waren,
Men hiel het bruilofs Feest
En men at en dronk om 't meest:
Huspot met pruymen, onbeschout,
Met een nugteren Kallefs bout.
Tot pleizier, over de tafel,
Speelden Tijsje op zijn Lier.

Daar mee aan 't zingen,
Danssen ende springen!
Doet 't eeten was gedaan,
Sijn sy samen opgestaan.
Sy riepen, Tijsje, speelt nu ras
Eens een braven Barkemas.
Keesje Klomp Met zijn Klaartje,
Dansten, maar maakten 't te plomp.

Grietje met haar Jantje,
Dansten een Courantje.
Desen Bruid en Bruidegom fijn
Waren meester van den trein.
Het worde laat - hier wel op let -
Bruid en Bruidegom trok na bed.
Hoord dit aan, Ik wil zwijgen
Hoe het vorders is gegaan.",Van Jantje,Amsterdam,../../data/dbnl/_thi001thir07_01.xml
