recordid,songid_DBNL,jaar_eind,jaar_begin,bronid,rijmaccent,rijmgeslacht,rijmschema,strofeschema,strofeschema_plus,trefw_genre,aantal_strofe,verstal,text,melodienorm,plaats,filepath_DBNL
176436,_han029hans01_0029,1805,1805.0,1015973,44334433,mmvvmmvv,AAbbCCbb,4A 4A 3b 3b 4C 4C 3b 3b,.4A   .4A   .3b=  .3b=  .4C   .4C   .3b/  .3b/,klaaglied,10,8,"Ik ben op gister eerst getrouwd,
Het geen my van daag al rouwd,
Myn vent weet van geen zorgen,
Myn vent weet van geen zorgen,
Ik dagt hy was zo wel gezind,
Hy was onnozel als een kind,
Maar ‘k vrees de dag van morgen.
Maar ‘k vrees de dag van morgen.

Ik zorg voor hem en ’t huisgezin,
Maar hy brengt my zo weinig in,
En weet niet als van zuipen,
En weet niet als van zuipen,
Des morgens vroeg en s’avonds laat,
Ja s’nagts krold hy nog langs de straat,
Hy kan zig zagt bedruipen.
Hy kan zig zagt bedruipen.

’t Is zeven gulde alle week,
Ik zag het toen hy ’t na hem streek,
En ik kryg net een daalder,
En ik kryg net een daalder,
En is myn eeten dan niet vet,
Dan rost y my nog s’nagts in bed,
Ik word hoe langs hoe kaalder.
Ik word hoe langs hoe kaalder.

Ik heb een Naaister op de vloer,
Een weelig meisjes van la tour,
Die krygt dan goede woorden,
Die krygt dan goede woorden,
En s’avonds stuurt hy my op straat,
Wie weet wat hy dan maaken gaat,
Daar zy hem tog bekoorden.
Daar zy hem tog bekoorden.

Spreek ik een woord dan is ’t verbruit,
Dan kryg ik slaagen op myn huid,
Hy slaat de boel aan stukken,
Hy slaat de boel aan stukken,
Het porcelyn moet van de wand,
De potten, keetels aan een kant,
Wie moet zulk kwaad niet drukken.
Wie moet zulk kwaad niet drukken.

En dat het meeste my verdroot,
Hy streeld een ander op zyn schoot,
Laat my in min verteeren,
Laat my in min verteeren,
Al schoon hy reeds myn beste goed,
Verzoopen heeft die dronke snoet,
Nu komt hy om myn kleeren.
Nu komt hy om myn kleeren.

Leef ik met zulk een vent voortaan,
Dan mag ik wel uit schooijen gaan,
Wat kan my ’t werken baaten,
Wat kan my ’t werken baaten,
Hy noemt my nog zyn lieven kind,
Geen ogenblik getrouw bemind,
Dan zou hy zulks wel laaten,
Dan zou hy zulks wel laaten,

Dan stuift hy weder op de vloer,
Nu is ’t makrol, jou slet, jou hoer,
Schaf op of ‘k zal jou leeren,
Schaf op of ‘k zal jou leeren,
Het vleesch is vast niet na zyn zin,
Al schoon hy brengt een daalder in,
En alles gaat verteeren.
En alles gaat verteeren.

Och jonge dochters neemt aan my,
Een spiegel in de vryery,
Hoort na geen jonkmans klagten,
Hoort na geen jonkmans klagten,
Verslyt liefst in de eenzaamheid,
Met naaijen uwe jongen tyd,
Dan ziet ge u nooit verachten. 
Dan ziet ge u nooit verachten. 

Wat heb ik nu van myne trouw,
In naam helaas, ben ik wel vrouw,
Maar kon ik wettig scheiden,
Maar kon ik wettig scheiden,
Daar was geen vent die ooit myn hart,
In zyne strikken kreeg verward,
Ik wil de min bestreiden.
Ik wil de min bestreiden.",De wereld is in rep en roer,Amsterdam,../../data/dbnl/_han029hans01_01.xml
178641,halm002davi01_0037,1707,1707.0,1015988,555555,vmvmvm,aBaBcB,5a 5B 5a 5B 5c 5B,.5a   .5B   .5a   .5B   .5c   .5B,,20,6,"ZYt over hen in afgunst niet ontsteeken,
Die boosheit doen, en onrecht slaan ter handt:
Benytze niet. wilt nimmer qualyk spreeken
Van 't hoog bestier; dewyl zy haast met schandt,
Gelyk het gras, hier worden afgesneden,
En vallen als grasscheutjes af op 't landt.

2 Betrout den Heer, doet goedt, en woont in vrede
Op d'aarde, en voedt u met getrouwigheit.
Godt zy uw lust, opdat uw voet betreede
Den weg der deugt, dan heeft hy u bereidt
Al wat uw hart hier immer kan begeeren,
En 't geen hy heeft den vroomen toegezeit.

3 Zooge uwen weg op 't albestier des Heeren
Zult wentelen, betrouwende op zyn magt,
Zal hy 't voor u wel maaken, 't zyner eeren:
Gelyk het licht komt na den vaalen nacht,
Zal hy uw recht ook doen te voorschyn komen;
Uw heil blinkt als de middagzon in kracht.

4 Zwygt, zwygt den Heer, verbeidt hem, zonder schroomen,
Ontsteekt u niet om hem, die vrolyk leeft
In voorspoedt, tot verdrukking van de vroomen,
En 't smeên van list, waarvan hy blyken geeft.
Laat af van toorn, dooft alle gramschapszaaden,
Opdat gy niet naar 't quaadt door afgunst streeft.

5 Want trotzen, die des hemels hoogheit smaaden,
Zal 's Heeren handt verdelgen met gewelt.
Maar hen die Godt verwachten in genaden,
Is d'aarde tot een erflyk goedt gestelt.
De booze zal in korten tyt verdwynen
Uit zyne plaats, gelyk het gras op 't veldt.

6 Maar 's Heeren glans zal op de vroomen schynen,
En d'aarde is den zagtmoedigen bereidt;
Men ziet hen door geen oorlogsplaag verquynen,
Maar dat hun hart in vrede zich vermeit.
De booze wil rechtvaardigen belaagen;
Zyn tantgeknars is op hen aangeleit.

7 Maar Godt, die zulk een' hoon niet kan verdraagen,
Belacht hem; want hy ziet zyn dag genaakt.
't Godtlooze rot rukt, om Godts volk te plaagen,
't Zwaardt uit de scheê, terwyl 't van woede blaakt.
Zyn boogen zyn gespannen om te vellen
D'oprechten, in elende en noodt geraakt.

8 Maar 't zwaardt, gewet om 's Heeren volk te knellen,
Door moordery en slagting, zal het hart
Der snooden zelf doorgrieven als zy 't quellen.
Godts handt verbreekt hun boogen, yzerhart.
Het kleen bezit der vroomen baart genoegen,
Maar d'overvloet der boozen enkel smart.

9 Want d'armen der godtloozen, die steedts zwoegen
In schennis, zal Godt breeken, maar hy draagt
Hen die zich naar zyn woordt en wetten voegen.
Van 't heilig volk, dat hem alleen behaagt,
Kent hy 't bedryf, den weg, en levensdagen;
Hunne erfenis blyft eeuwig, hoe belaagt.

10 Zy worden in den quaaden tyt van plaagen
Niet schaamroot; noch wanneer de honger woedt
Wordt hunne ziel niet angstig neêrgeslagen;
Maar door Godt gunst verzadigt en gevoedt.
Doch 't godtloos rot zal met den rook vervliegen,
Als 't offervee op 't outer in zyn bloedt.

11 De booze ontleent, om yder te bedriegen,
En geeft niet weêr, maar die rechtvaardig is
Geeft mildelyk, en zoekt nooit winst met liegen.
Want 's Heeren volk bezit, (dit is gewis)
D'aarde erfelyk: maar zyne vloekelingen,
Zienwe uitgerooit en schuil in duisternis.

12 Men ziet dien man met zegening omringen.
De Heer bestiert zyn' gang, en hy heeft lust
Aan zynen weg. als 't quaadt hem komt bespringen,
Of dat hy valt, zyn moedt wordt niet geblust,
Noch hy vertreên: omdat de Heer zyn handen
Steedts ondersteunt, en hem schenkt vrede en rust.

13 'k Ben jong geweest, en lette op 's wereldts standen,
En ben nu oudt, maar zag nooit in den noodt,
Rechtvaardigen verlaaten, zelfs in banden;
Noch dat hun zaadt vertwyfelt zogt om broodt.
Z'ontfermen zich den ganschen dag in 't leenen,
Terwyl hun zaadt in zegening vergroot.

14 Wykt af van 't quaade, en streeft langhs 't heilspoor heenen
Van 't goede, opdat gy liefde en deugt betracht.
Woont eeuwiglyk, van 's hemels licht bescheenen.
Want godt bemint het recht, en zal 't geslacht
Der vroomen niet verlaaten, maar bewaaren.
Doch 't godtloos zaadt vergaat met zyne kracht.

15 't Rechtvaardig volk zal vrede wedervaaren
Op d'aarde, die het erfelyk verkrygt
Tot zyn bezit, bepaalt door tyt noch jaaren.
Terwyl de tong des goddeloozen zwygt,
Komt ons de mondt des vroomen wysheit melden,
En spreekt voor 't recht wanneer het nederzygt.

16 Godts wet beslaat zyn harte als 't gras de velden,
Dies zullen nooit zyn gangen slibbren, schoon
Hy wordt beloert, van die hem booslijk schelden
En lasteren, met bitschen smaat en hoon.
De booze zoekt d'onschuldigen te dooden,
Maar krygt in 't endt zyn welverdienden loon.

17 Want Godt bewaart den vroomen in zyn nooden,
En laat hem niet in 's goddeloozen handt,
Noch doemt hem, als hy tot hem komt gevloden,
In 't oordeel, ja schut hem voor schade en schandt.
Wacht op den Heer, en wandelt op zyn wegen,
Dan zal hy u verhoogen in het landt.

18 Dan zult gy zien, in voorspoet opgestegen,
Hoe 't godtloos zaat zal worden uitgerooit.
'k Zag eenen man, daar elk voor scheen verlegen,
Geweldig, en met groote pracht getooit;
Hy scheen gelyk een groene boom te bloeien,
Maar hy ging door, en niemant zag hem ooit.

19 Ik zocht hem wel, maar vondt hem niet meer groeien.
Let op den man die vroom is van gemoedt,
Van wien men steedts gerechtigheit ziet vloeien;
Want zulk een man heeft vrede in 't endt en goedt.
Maar hen die stout Godts wetten overtreeden,
Zienwe eindelyk verdelgt in tegenspoedt.

20 Doch 't heil, dat van den hemel wordt gebeden,
Is eeuwig den rechtvaardigen bereidt
Door Godt, hun sterkte in tyt van tegenheden.
De Heer, die hun zyn hulp heeft toegezeit,
Zal hen ook van 's godtloozen magt bevryden,
Want zy zien op zyn trouwe in eeuwigheit.",Psalm 037 Datheen,Amsterdam,../../data/dbnl/halm002davi01_01.xml
178708,halm002davi01_0104,1707,1707.0,1015988,55555555,mmvvmmvv,AAbbCCdd,5A 5A 5b 5b 5C 5C 5d 5d,.5A   .5A   .5b   .5b   .5C   .5C   .5d   .5d,,17,8,"LOof, loof den Heer, myn ziel, met al uw kracht.
ô Heer, uw naam wordt eeuwiglyk gedacht.
Myn Godt, gy zyt bestuuwt met flonkerglanssen,
En Majesteit, in 's hemels hooge transsen.
Gy zyt zeer groot, bekleedt met heerlykheit.
't Licht heeft hy als een' voorhang uitgebreidt,
Daar hy zyn' glans meê dekt. de hemelboogen,
Als een gordyn, om d'aarde en zee getogen.

2 Hy is een Godt omringt met hemelpraal.
Hy zoldert in de watren d'opperzaal
Van zyn gebiedt op aard', en maakt zyn' wagen
Van 't driftig zwerk en wolken, die hem draagen.
Hy wandelt op de vleuglen van den windt,
Zyn Engelen, zoo dienstbaar, zoo gezwint,
Voor hem, maakt hy, de minsten met de meesten,
Tot vlammen viers en schitterende geesten.

3 Hy heeft den kloot der aarde vast gegrondt,
Als of hy op een' sterken grondvest stont,
Die nimmermeer zal wanklen noch beweegen,
Als door zyn zwaarte op 't middelpunt gezegen,
Daar hem de lucht rontom gelyk bevangt,
En even sterk in haare dryving prangt:
Gy quaamt dien met den afgrondt overtrekken,
En zyne vlakte als met een kleedt bedekken.

4 De wateren, gerezen op 't gebergt',
Dat met zyn' kruin de lucht en wolken tergt,
Zyn haastig voor uw schelden wechgevloden;
Uw donderstem heeft hun vertrek geboden
Naar hunnen kolk. de bergen rezen op,
En prykten met hun' hoogverheven top.
Gy vestigde ook den grondt der diepe dalen,
Die op de plaatze inzakten van hun paalen.

5 De wateren hebt gy een paal gestelt,
Voor hunnen vloet en woedende gewelt,
Waarover zy zich nimmer zullen strekken,
Zoodat ze nooit weêr d'aarde zullen dekken.
De heerlykheit des Heeren wordt bekent,
Doordien hy in de dalen bronnen zendt,
Die tusschen 't hoog gebergte heenen vlieten,
En 't water uit haar ruischende aadren schieten.

6 Zy drenken al 't gedierte van het woudt,
En 't vee dat zich in 't klavergroen onthoudt,
Ook d'ezelen, in bosschen diep versteeken,
Die hunnen dorst uit haare stroomen breeken.
By hen onthoudt zich 't vlugge pluimgediert,
Dat op 't gebergte en in de boomen zwiert,
En zyne stem laat uit de takken hooren,
Wiens zoete zang elks ooren kan bekooren.

7 De bergen, die hun kruinen als in praal
Verheffen, drenkt hy uit zyn opperzaal.
Het aardryk wordt verzadigt door de vruchten
Van uw bedryf, zoo grootelyks te duchten.
Hy doet het gras uitspruiten voor het vee,
En 't heilzaam kruidt voor 't menschdom, naar zyn beê.
Het koren teelt hy in den schoot der aarde,
Daar 't broodt van komt, zoo dierbaar en van waarde.

8 Ook schenkt hy ons den aangenaamen wyn,
Daar 's menschen hart zoo van verheugt kan zyn,
Wanneermen dien in vrolykheit mag drinken.
Het aangezicht doet hy van oli blinken.
Hy geeft ons 't broodt dat 's menschen harte sterkt.
De boomen, als met zyne handt gemerkt,
Verzadigt hy de hooge cederboomen
Des Libanons drenkt hy uit zyne stroomen.

9 Dit hoog geboomte, op vasten grondt gevest
Van Libanus, in 't Noordelyk gewest,
Krielt in zyn' kruin van vogelen die broeden
In nesten, en met aas hun jongen voeden.
De dennen zyn het huis des Oyevaars.
De bergen, nooit op hunne toppen schaars
Van voeder, zyn voor steen- en wilde bokken.
't Konyn vindt in de rotzen zyne hokken.

10 Hy heeft de Maan gemaakt door zyne kracht,
Opdat zy gaf haar schynsel in den nacht,
En strekte tot een onderscheit der tyden.
De Zonne, die men door den kring ziet ryden
Der hemelen, weet haaren ondergang.
De duisternis beschikt gy, kort en lang,
Waarin de nacht ons komt tot ruste wekken,
En 't woudtgedierte uit zyne holen trekken.

11 Dan wordmen van 't gebriesch der leeuwen doof,
Noch jong in kracht, verhongert op den roof,
Als zy rontom hun spyze in loof en hoeken
Der bosschen, als van Godt den Schepper, zoeken.
Maar als de zon aan d'Oosterkimme ryst,
Vertrekken zy, gespyst of ongespyst,
En leggen zich, vermoeit van om te doolen,
Te rusten in hun diepverborgen holen.

12 Dan gaat de mensch, naar zyn gewoone perk,
Aan zyn bedryf en dagelyksche werk,
Van landbou, of van steedsche bezigheden,
Totdat, de zon in 't Westen neêrgegleden,
Men weêr gevoelt den frisschen avondstont.
Hoe groot zyn, in dit ruime wereldront,
Uw werken, Heer, en vol van wysheitsstraalen !
Men ziet deeze aard' met uwe goedren praalen.

13 De zee, zoo groot, zoo wyd in haar begrip,
Daar 't wriemelend gedierte aan rotz en klip,
Of op den grondt in speelt, en met zyn vlerken
Het pekel klieft; door niemant te beperken
In soort en tal, het kleen gedierte en 't groot.
Daar wandelen de schepen, vloot by vloot.
De Zeedraak, in zyn hardgeschubde wapen,
Tot darteling in 't zout, van u geschapen.

14 Zy wachten alle op uwe milde handt,
Zoo 't zeegedierte, als dat van 't vaste landt,
Tot gy hun komt uit uwe volheit voeden
Ten rechten tyt, en voor 't bederf behoeden.
Geeft gy hun spyze in hunnen hongersnoodt,
Men ziet ze hen vergaadren kleen en groot,
Zoo uwe handt hun schut en begenadigt,
Dan worden zy met goederen verzadigt.

15 Verbergtge, ô Heer, voor hun uw aangezicht,
Strak derven zy uw levenwekkend licht,
Waardoorze onstelt in vreeze en angst verschrikken.
Ontneemt gy hun den adem, zy verstikken
En sterven, dat zy keeren tot hun' stof.
Zendtge uwen Geest van 't hooge hemelhof,
Zoo worden zy geschapen met elkandren:
Het aardryk komtge in zyn gelaat verandren.

16 De heerlykheit des Heeren, wyd verspreidt
In 't wereldruim, zy tot in eeuwigheyt:
Dat zich de Heer verblyde in zyne werken,
De Hemelheer, wiens gunst ons koome sterken.
Wanneer hy d'aarde in toornigheit beschouwt,
Zoo beeft zy datze als geene kracht behoudt:
't Gebergte rookt wanneer hy 't aan komt roeren,
En dreigt zyn vier tot aan 't gestarnt te voeren.

17 Dies zal ik in myn leven 's Hoogstens eer
Verheffen, als van 's wereldts Opperheer.
'k Zal mynen Godt zoo lang ik leeve zingen.
Myn psalmgezang zal door de wolken dringen,
Terwyl ik noch op aarde in wezen ben.
Opdat ik my door zoet gepeins gewen
Aan zynen lof. 'k zal my ten allen tyden,
Gerust van harte, in Godt den Heer verblyden.",Psalm 104 Datheen,Amsterdam,../../data/dbnl/halm002davi01_01.xml
179151,cort002zing01_0054,1866,1866.0,1010979,444,mmm,AAA,4A 4A 4A,.4A   .4A=  .4A=,,10,3,"Ze trokken gedrieën al
over den Rijn,
In gindsche taveerne daar wilden ze zijn.
In gindsche taveerne daar wilden ze zijn.

‘En hebt ge, waardinne, goed bier en wijn?
Waar is er uw liefelijk dochterlijn?’
Waar is er uw liefelijk dochterlijn?’

‘Mijn bier is frisch en mijn wijn is klaar...
Mijn dochterken ligt op de doodenbaar.’
Mijn dochterken ligt op de doodenbaar.’

En als zij traden in 't kamerkijn,
Daar lag zij in eenen zwarten schrijn.
Daar lag zij in eenen zwarten schrijn.

En de eerste die hief het laken omhoog,
En zag naar het lijk met tranen in 't oog.
En zag naar het lijk met tranen in 't oog.

‘Ach, leefdet gij nog, bevallig kind,
Ik hadde van heden u trow bemind!’
Ik hadde van heden u trow bemind!’

De tweede die schikte het laken weêr,
En wendde zich af, en weende zoo zeer.
En wendde zich af, en weende zoo zeer.

‘Ach, dat gij ligt op de doodenbaar...
Gij waart mijne liefste zoo menig jaar!’
Gij waart mijne liefste zoo menig jaar!’

De derde die hief het weder terstond,
En kuste der doode bleeken mond.
En kuste der doode bleeken mond.

‘Ik minde u en min u, o zoete meid,
En zal u beminnen in eeuwigheid!’
En zal u beminnen in eeuwigheid!’",Een drietal gezellen trok over de Rijn,Brussel,../../data/dbnl/cort002zing01_01.xml
180708,sorg003aanh01_0024,1688,1688.0,1015997,434344222244,vmvmmmmmmmmm,aBaBCCDDDDDD,4a 3B 4a 3B 4C 4C 2D 2D 2D 2D 4D 4D,.4a   .3B   .4a   .3B    4C    4C    2D=+  2D=   2D=+  2D=  4D/   4D/,,9,10,"1. Eeuwig, Heylig Hemels Koning,
Die door u groot beleyt,
Schiept den Hemel tot u woning,
En al u Scheps’len leyt.
Gy regeert in ‘t Aerdsche dal
Door u Wijsheyt over al:
Heyligheyt, Heyligheyt,
Heyligheyt, Heyligheyt,
Al ons sugt en wens gy zijt.
Al ons sugt en wens gy zijt.

2. Uw’ Wijsheyt voegt ons hier t’same
En ons u wijsheyt scheyt;
Soo dat wonder is u Name,
En wonder u beleyt.
Al wat uwe wijsheyt doet,
Zy dog in ons’ oogen goet:
Heyliogheyt, Heyligheyt,
Heyliogheyt, Heyligheyt,
Al ons sugt en wens gy zijt.
Al ons sugt en wens gy zijt.

3. Als wy met ons Lighaam scheyden,
Schept Heere nimmer op:
Wilt ons door u Geest geleyden,
Blijft ons dog altijt by.
Send u Engel voor ons heen,
Dat ons quaat aantreffe geen:
Heyligheyt, Heyligheyt,
Heyligheyt, Heyligheyt,
Al ons sugt en wens gy zijt.
Al ons sugt en wens gy zijt.

4. Of wy blijven, of wy scheyden,
Gy Iesu zijt ons heyl,
Hier in wy ons steeds verblijden,
Want wy zijn in u veyl:
Waar dat gy ons lighaam voert,
In u zijn wy onberoert,
Heyligheyt, Heyligheyt,
Heyligheyt, Heyligheyt,
Al ons sugt en wens gy zijt.
Al ons sugt en wens gy zijt.

5. Iesu, blijft met u genade
U Lievelingen by,
Laatse in u vroeg en spade
Dog altijt wesen bly:
Leert haar dat is Majesteyt
Al u doen en Heerlikheyt:
Heyligheyt, Heyligheyt,
Heyligheyt, Heyligheyt,
Al ons sugt en wens gy zijt,
Al ons sugt en wens gy zijt,

6. Iesu, wilt gy voor haar sorgen,
Woont altijt in haar hert,
Laatse in u zijn verborgen,
Dat haar geen vrees benert:
Iesu, grijpt haar Zielen aan,
Doets’ in brand van liefde staan,
Heyligheyt, Heyligheyt,
Heyligheyt, Heyligheyt,
Al ons sugt en wens gy zijt.
Al ons sugt en wens gy zijt.

7. Iesus soo de Hel haar kaken,
Tegens haar spede op,
Doet haer dog in iver blaken,
Veetreed den Slang den kop:
Iesus maakt (gelijk gy pleegt
Al u Kind’ren onbeweegt)
Heyligheyt, Heyligheyt,
Heyligheyt, Heyligheyt,
Al ons sugt en wens gy zijt.
Al ons sugt en wens gy zijt.

8. Brengt ons in die Stadt hier boven,
En in u Heyligdom,
Daar wy steeds u sullen loven,
Prijsen, en leven, om
Iuychende den lof en eer,
Toe te schrijven u, ô Heer,
Heyligheyt, Heyligheyt,
Heyligheyt, Heyligheyt,
Al ons sugt en wens gy zijt.
Al ons sugt en wens gy zijt.

10. Hier onnut, dog nauw aan Iesus,
En hier gantz veragt,
Hier verjaagt en dat om Iesus:
Hier na in eer gebragt,
Iesus is ons eer, ons kragt,
Iesus is ons stercke magt!
Heyligheyt, Heyligheyt,
Heyligheyt, Heyligheyt,
Al ons sugt en wens gy zijt.
Al ons sugt en wens gy zijt.",Amo te benigne Jesu,Utrecht,../../data/dbnl/sorg003aanh01_01.xml
184276,_gra006grap01_0031,1815,1815.0,1016648,33333333,mvmvmmmm,AbAbCCCC,3A 3b 3A 3b 3C 3C 3C 3C,.3A   .3b   .3A   .3b   .3C=  .3C/  .3C=  .3C/,,11,8,"'t Was Nacht, maer Maneschyn,
Toen myn de Vlooijen beeten,
Ik kon in 't Bed niet zyn;
De hitte deed my zweeten:
'k Stond op, en nam Tabak,
En rookte op myn gemak.
'k Stond op en nam Tabak,
En rookte op myn gemakt.

'k Zat voor myn Vensterraem,
In myn Japon gedoken;
De Tyd was juist bekwaem,
Gelyk men zegt voor Spooken,
Als zynde dan ter been,
De Klok was effen één.
Als zynde dan ter been,
De Klok was effen één.

'k Had 's avonds om de klugt,
By Lampioen gelezen,
Van Spooks en Spooksgerugt,
En dagt zou 't konnen wezen,
Dat zich by nacht misschien,
De Geesten laten zien.
Dat zich by nacht misschien,
De Geesten laten zien.

Daer ik dit overdacht,
Zag ik aen de overzyde,
By 't Maenlicht op de Gracht,
Een paer Verschynsels, blyde,
Zo 't scheen dat zy malkaer,
Ontmoeten 't is wel waer.
Zo 't scheen dat zy malkaer,
Ontmoeten 't is wel waer.

Aen beider wit gewaet,
Dacht ik het waren Spooken,
Of Geesten in dien staet,
Ten afgrond uitgebroken,
En zy verdwenen knap,
Juist in een Keldertrap.
En zy verdwenen knap,
Juist in een Keldertrap.

'k Dacht nu geloof ik meê,
Dat Geesten wel verschynen;
'k Merk duidelyk waer die twee,
Fluks voor myn oog verdwynen:
Zy daelden immers neêr,
En 'k zie hen thans niet meer.
Zy daelden immers neêr,
En 'k zie hen thans niet meer.

'k Hield op die plaets myn oog;
En toen 'k nog stond te kyken!
Rees 't Geestenpaer om hoog,
Wanneer 't my kwam te blyken,
Dat het ter zelver stond,
Zich vol genoegen vond.
Dat het ter zelver stond,
Zich vol genoegen vond.

Ik zag den eenen Geest,
Den andren haetlyk kusschen,
Maer dat my 't aldermeest,
Verwonderde ondertusschen,
Was dat 't Geestenpaer,
Juist huis hield naest elkaer.
Was dat 't Geestenpaer,
Juist huis hield naest elkaer.

'k Had echter nooit gehoort,
Van Spooken in die Huizen:
Myn vrees verdween toen voort,
En om 't niet uit te pluizen,
Wat Spookery het was,
Verklaerde 't zelf zich rasch,
Wat Spookery het was,
Verklaerde 't zelf zich rasch,

De Zoon van gierige Aegt,
Die niet vermogt te paren,
Had ryk buurs Kind behaegt,
Des zy by een vergaren,
In 't midden van den nacht,
Zo spookten zy met kracht.
In 't midden van den nacht,
Zo spookten zy met kracht.

't Gevolg dier Spookery,
Gaf hun een manlyk Geestje,
Van 't Spooken zyn zy vry,
Na 't blyde Huwelyks-Feestje:
En ik, voor Spreukjes doof,
Verban het Spooksgeloof.
En ik, voor Spreukjes doof,
Verban het Spooksgeloof.",Van de korporaal,Rotterdam,../../data/dbnl/_gra006grap01_01.xml
185052,_gee010gees01_0001,1631,1631.0,1016183,33333333,mmmmmvmv,ABABBcBc,3A 3B 3A 3B 3B 3c 3B 3c,.3A   .3B   .3A   .3B   .3B   .3c   .3B   .3c,,13,8,"1 Ghy Yveraers ghemeyn,
Die yvert om het goed,
Al is u hoopken kleyn,
Houd altijt goeden moet,
Wilt reyne liefde soet
Onder malkander dragen,
So sal u yvers gloed
God uwen Heer behagen.
* Met Broederlijcke aert,
En lieffelijck accoord,
Als ghy by een vergaert

2   En handelt van Gods woord;
Brengt geen propoosten voort
Van tydelijck geneeren:
Op dat hy, die daer hoordt,
Zijns zielen heyl mach leeren.

3 * Niet eyghen wijs en zijt
In ‘t ghene ghy verstaet,

4 Om woorden niet en strijt:
En so ghy u ontgaet,
En weest niet obstinaet,
Maer soeckt der zielen winste:
V onder rechten laet
Al waer ‘t oock van de minste.

5 * Wacht u van ydel eer,
Want sy heeft sulcke kracht;
Den vrede veldt sy neer,
Breeckt liefde en aendacht:
Haer naesten sy veracht
In schijn van heylighede,
Daerom u voor haer wacht
Wilt ghy behouden vrede.

6 * Die ghy gebrecklijck siet,
Met desen hebt medoogh,
Ergert u daerom niet,
Treckt uyt het schalcke oogh:
Want die daer somtijts hoogh
Boven al meynt te lichten:
‘t Is niet in zijn vermoogh
Een yegelijck te stichten.

7 * Dus u ootmoedigh draeght
Na ‘t Voorbeeld Iesu Christ,
V selven niet behaeght:

8 Is ‘t dat u naesten mist,
Moet willigh niet en is ‘t,
Het beste soeckt hy mede,
Waer ‘t dat hy beter wist,
Gewis hy beter dede.

9 * Houd stadigh in ‘t gebruyck
‘t Versamen, laet het niet
Om Mammon noch om buyck,
Gelijckmen daeghlijckx siet
Dat nu ter tijd geschiet
Van die de wereld minnen,
S’hebben in ‘t woord verdriet,
En onbereyde sinnen.

10 * Gods woord, dat edel Zaet,
Opwassen niet en kan ‘t
In herten, daer het quaet
Noch heeft de overhant,
Noch oock daer het verstant
Belemmert is met lusten,
‘t En kan niet wesen, want
‘t Moet in der stilheyd rusten.
* V herten wil bereyd
En vande sonde vrijdt,

11 Dat tot haer dienstbarheyd
Ghy niet verbonden zijt,
Hoe wel in desen tijt
Veel menschen daer in blyven:
Doet des te grooter vlijt
Om daer uyt u te dryven.

12 * So meught ghy onbelet
God dienen met gedult,
Consciency onbesmet,
En handen met onschult
Ghy voortaen hebben sult
Voor God in suyver klaerheydt,
Met liefde Gods vervult,
En vry gemaeckt in waerheyd.
* Aldus ghy Yveraers
Yvert van herten vry:
Vytwendigh veel gebaers
By u doch niet en zy:

13 Wacht u van huychely,
Want God siet alle dingen:
V wetenschap moet ghy
Oock in der daet volbringen.",Van Helena,De Rijp,../../data/dbnl/_gee010gees01_01.xml
