recordid,songid_DBNL,jaar_eind,jaar_begin,bronid,rijmaccent,rijmgeslacht,rijmschema,strofeschema,strofeschema_plus,trefw_genre,aantal_strofe,verstal,text,melodienorm,plaats,filepath_DBNL
35902,gavr001godd01_0055,1678,1678.0,1011338,43424442242224,vmmmmmvmmmvvmm,aBBBCCaDDDeeFF,4a 3B 4B 2B 4C 4C 4a 2D 2D 4D 2e 2e 2F 4F,4a    3B    4B   .2B    4C    4C   .4a    2D +  2D   .4D   2e +  2e + 2F 4F,"devoot lied
bespiegelend lied, geestelijk",5,11,"Och wat ruste valt daer te ghenieten,
Voor een Ziele bloodt,
Die haer leght in rustens schoot,
In rustens schoot,
Soo sy uyt haer selven ghinck,
En haeren Godt alleen aenhinck,
Waer sy haer gaet heel vernieten,
In den al, in den al,
Daer sy alleen in rusten sal,
Gheen ghenuchten,
Ofte suchten,
Haer beswaert,
Want sy is in Godt bewaert,
Want sy is in Godt bewaert.

Wie sou het gheluck konnen beschrijven,
Van dees Edel Ziel,
Als in dese ruste viel, dese ruste viel,
Want sy is gheheel ontdaen,
En haer selven uyt ghegaen,
K’sou wel willen benijden,
In dees rust, in dees rust,
Want sy heeft daer haeren vollen lust,
Sonder vreesen van te wesen onversaeyt,
Want sy is met Godt ghepaeyt.     bis.

In dees groote oversoete ruste,
Van dat eenigh een,
Waer dat sy haer vint ghemeen,
Haer vindt ghemeen,
Niet dat eenigh goedt ghebonden,
En vereenight aen den al,
Het schijnt sy en wilt niet begheeren,
Al dat is, al dat is,
Te vinden in ons duysternis,
Slaet wel gaede slaet wel gaede dese Ziel,
Als in dese ruste viel.     bis.

Daer wordt dese Ziel gheheel beschoncken,
Van den soeten Wijn,
Die haer dient voor medecijn, voor medecijn,
T’schijnt dat sy door desen keer,
Soo is verslonden in den Heer,
Want sy vindt al de creaturen,
Onder haer, onder haer,
Want s’en wilt niet met al voor haer,
Noch gheen lijden, noch verblijden,
S’is versaeyt,
Hoe dat Godt de winden waeyt.     bis.

Door het verlaeten van de creaturen,
Komt sy tot dat ent,
Dat niemandt en is bekent, en is bekent,
Dan de Ziel en haeren Godt,
Die daer is het beghin en’t slot,
Want t’gheschiet in eene stilte,
Dat dees ziel, dat dees ziel,
Dat Minne spel met Godt soo hiel,
Sy siet liefde in de liefde over al,
Al is sy noch in t’aertsche dal,
Al is sy noch in t’aertsche dal.",Corydon hoe slaapt gij nu zo vast,Antwerpen,../../data/dbnl/gavr001godd01_01.xml
35903,gavr001godd01_0056,1678,1678.0,1011338,3434452343344334,vmmmvmmmmvvmmmvm,aBBCdEEFGhhIFJkJ,3a 4B 3B 4C 4d 5E 2E 3F 4G 3h 3h 4I 4F 3J 3k 4J,.3a    4B   .3B    4C   .4d    5E +  2E   .3F   .4G   .3h   3h    4I   .4F   .3J   .3k   4J,"bespiegelend lied, geestelijk",3,15,"Ghelijck den Phenix Voghel,
Vlieght op eenen hooghen bergh,
En neemt sy ooghe merck,
Op het straelen van de Son,
Daer hy vergadert met der haesten,
Alder-hande cruyden ende hout daer by bout,
Eenen tas daer hy sterven wilt,
Dan slaet hy met sijn vleughelen,
Tot dat hy recht de stralen,
Die door het neder dalen,
Desen Voghel heel verslint,
En daer komt dan eenen anderen,
Voghel die dan in ste,
Komt vlighen door de wolcken,
Soo den anderen Voghel de.

Een Ziel die Godt bemindt,
Die gaet haer selven verheffen,
Om dat sy soude treffen,
Beter in dat eenigh een,
Waerom sy eerstmael gaet verlaeten,
Al de creaturen,
Swereldts pracht sy niet en acht,
Want sy naer dat eenigh tracht,
Soo vlieght sy als den Phenicx,
Seer snel boven haer selven,
Daer sy vailliant,
De wereldt heel gaet delven,
En behout de over handt,
En tot Godts min,
Treckt sy haer hert en sin,
Och och och och,
T’is wonder dat sy kan,
Behouden haer Ionck leven noch,

Daer die Godt Minnende Ziel,
In Godt dan wordt gheheel beschoncken,
Dat sy by naer wordt droncken,
Van den lievelijcken Wijn,
Dan thoont sy aen Godt haer liefde,
Die sy tot hem is draghen,
Sy verjaeght ende daeght,
Al het gheen dat Godt behaeght,
Sy en soeckt gheen creaturen,
Noch oock gheen eyghen deughden,
Maer wilt gheheel,
Den wil van Godt uyt vueren,
Die sy houdt voor het beste deel,
Hoe dat het waeyt,
Hoe Godt de winden draeyt,
T’is haer al een,
Gheen deinck kan haer ontstellen,
Want sy rust in Godt alleen.",Ballet du roi,Antwerpen,../../data/dbnl/gavr001godd01_01.xml
35994,beer014ghee01_0002,1653,1653.0,1011350,323233333232,vmvmvmvmvmvm,aBaBcDcDeFeF,3a 2B 3a 2B 3c 3D 3c 3D 3e 2F 3e 2F,.3a   .2B   .3a   .2B   .3c   .3D   .3c   .3D   .3e   .2F   3e   .2F,kerstlied,5,12,"Een Kindeken is ons gheboren: 
Godt lof en danck:
Verheught u uytvercoren 
Met spel en sanck.
Te Nazareth vvas besloten 
dees bloem in haeren bott,
Die nu is uyt-ghesproten 
seer schoon verciert van Godt:
Te Bethlehem vvordt ghevonden 
dit hemels Broodt,
Dat ons gheneest van sonden 
en doodt de Doodt.

Een kindeken is ons gheboren,
Godt lof en danck:
Verbeught u, uytverkoren,
Met spel en sanck.
TE Nazareth was besloten
Dees bloem in haeren bot.
Die nu is uytghesproten,
Seer schoon verciert van Gott.
Te Bethlehem wordt ghevonden
Dit Hemels-broodt,
Dat ons gheneest van sonden,
En doodt de doodt.

Een Kindeken is ons gheboren,
Godt lof en danck:
Verheught u, uytverkoren,
Met spel en sanck.
Den Schijn van 's Vaders glori',
Sijns wesens Even-Beelt,
Wt sijn vruchtbaer memori'
Eerst sonder vrouw gheteelt,
Is van een Maeght gheboren,
Oock sonder man:
Dit vat heeft hy verkoren,
Die wonder kan.

Een kindeken is ons gheboren,
Godt lof en danck:
Verheught u, uytverkoren,
Met spel en sanck.
Komt Branders nu beneden
Met al u minne-vier:
Komt Volle-wetentheden,
V Meester die is hier:
Komt Throonen hem ontfanghen,
Daer ghy in rust;
Des weirelts groot verlanghen,
Des Hemels lust.

Een Kindeken is ons gheboren,
Godt lof en danck:
Verheught u, uytverkoren,
Met spel en sanck.
Komt hooghe Heerschappijen;
Komt alle Cracht en Macht:
Komt Princen hem bevrijen
Van 't haetigh Ioods gheslacht:
Komt hier Arch-Enghels vlieghen,
Met soet gheschal:
Komt Enghelkens hem wieghen
In desen stal.",Een kindje is ons geboren,Antwerpen,../../data/dbnl/beer014ghee01_01.xml
36545,fore024refe01_0010,1735,1734.0,1011065,44444444,vvmmvvmm,aaBBccDD,4a 4a 4B 4B 4c 4c 4D 4D,4a 4a 4B 4B 4c 4c 4D 4D,"nieuwjaarslied
kerstlied",3,8,"2. Tot randzoen van uwe zonden,
Ben ik mensch tot u gezonden,
En om die diensten straf,
Kom' ik van den Hemel af,
t'Allen kanten t'allen hoeken
Kom' ik mensch uw' ziele zoeken,
En al ben ik naekt en bloot
U verlossen van de dood.

3. Waer dat kindeken noyt geboren,
En wy waeren al verloren,
En wy waeren al versmacht,
Door des vyands groote magt:
Maer dat kind was ons behoeder,
Door Maria zyne Moeder,
Die in dezen kouden nacht,
Hem ter weireld heeft gebragt.

4. Mogt ik doch eens ontmoeten,
En u o Jesus groeten,
En al na myns herten dorst
Hem ook leggen op myn' borst:
Nocht' om leven nocht' om sterven,
Zoud' ik Jesus willen derven,
Adieu 's weirelds ydelheyd
Jesus is myn' zaligheyd.",Och ik mag wel droevig schreien,Gent,../../data/dbnl/fore024refe01_01.xml
36916,minn002eere02_0020,1677,1677.0,1001870,3522411112225,mmmmmvvmmmmmm,AABBBccDDDEEE,3A 5A 2B 2B 4B 1c 1c 1D 1D 2D 2E 2E 5E,.3A   .5A   .2B   .2B   .4B   .1c + .1c   .1D + .1D   .2D   2E   .2E   .5E,liefdeslied,3,11,"O Blydtschap van myn hert',
O Enghel, die my vertroost in all' myn smert',
O myn Vriendin,
Die ick bemin,
En lief uyt heel myn hert' en sin,
O schoone’ Persoone
Die my’ maeckt bly,
Wanneer ick ly,
Die door het licht
Van uw ghesicht,
Myn hert' in alle swarigheydt verlicht.

2. O Beeldt vol aerdigheydt,
Mirakel, van Menschelycke schoonigheydt,
Uw' handen zyn,
Uw' tanden zyn
Ghelyck ivoor soo wit en reyn,
Uw' oogen’ die toogen,
Beset’ en net,
En swert als get,
Uw soet ghelaet.
En wesen staet,
Soo schoon ghelyck den gulden dagheraet.

3. Ghy zyt soet als een Druyf,
Eenvoudig, gelyck een lieve Tortel-Duyf,
Schoon als een Pauw,
Vers als den dauw,
Gy zyt een Perel van een Vrouw:
Uw' leden’ uw' seden,
Uw' deught’ verheught
Myn jonghe jeught,
Myn hert' dat brandt,
Schenckt my uw' handt
In echten bandt, tot eenen minne-pandt.",La Vignonne,Brussel,../../data/dbnl/minn002eere02_01.xml
36922,minn002eere02_0026,1677,1677.0,1001870,33554555,mmmmmmmm,AABBCCDD,3A 3A 5B 5B 4C 5C 5D 5D,.3A + .3A   .5B   .5B   .4C   .5C   .5D   .5D,liefdesklacht,3,7,"'k BEn een gheluckigh mensch’ Ick heb al dat ick wensch,
'k Heb landt en sandt, en goedt in overvloedt;
Nochtans ben ick onlustigh van ghemoedt,
'k En vinde nievers rust oft lust,
't En zy dat ick by myn Beminde rust,
Soo langh' als ick haer liefde derven moet,
Soo blyf ick arm in 't midden van myn goet.

2. Al hadd' ick een Palleys’ In het aerdts Paradys,
't Hof en den Hof sou wesen sonder roem,
Als ick daer in moest derven die schoon Bloem,
O soete Bloem, ô schoone Maeght,
O Bloem die my meer als den Hof behaeght,
'k En acht gheen huys hoe schoon dat is bereydt,
Soo langh als ghy myn Huys-vrouw niet en zyt.

3. Gheen gout en blinckt soo klaer, Ghelyck uw gout-geel hair,
Gheen Perle-snoer en is soo schoon en reyn,
Ghelyck uw haghel-witte tanden zyn.
'k En acht gheen Diamant soo hoogh,
Als ick de stralen acht van uw bruyn oogh,
Uw' lipkens maken 't root corael beschaemt,
Ghy en de Son zyn over-al befaemt.",Courante monsieur,Brussel,../../data/dbnl/minn002eere02_01.xml
36990,minn002eere02_0092,1677,1677.0,1001870,4343,mvmv,AbAb,4A 3b 4A 3b,.4A   .3b   .4A   .3b,"dialooglied, wereldlijk
kluchtlied
liefdeslied",13,4,"MYn Smodder-lodderlycke Pry,
Myn aerdighe Caroni',
Hoe lief-ghetal ghy zyt aen my
Siet ghy wel aen myn troni'.

'k En kan u, ô gy viesen haen
Myn liefde qualyck segghen,
Ick sou wel moeten kacken gaen
Om die wel uyt te legghen.

Als ghy noch waert ô liefste Lief
In Adams zyd' verholen,
Hebdy myn hert als eenen dief
Uyt mynen derm ghestolen.

En ghy schynt oock tot myn gherief
En tot myn vreught gheboren,
Ghy zyt myn alder-liefste lief
Van seven uyt-verkoren.

Ic sweer by suycker aen het hem,
En sotten Peerens Kack-huys,
My dunckt dat ick in welde swem
Als ick eens kus uw' back-huys.

Als ghy ô voetsel van myn jeught
My gingt uw trouw op-dragen
Toen red' myn blyde ziel van vreught
Op eenen Korde-waeghen.

'k En ben myn groote vreugt niet mans,
'k En kan my niet bedwinghen.
Ick sou van Blyschap wel by-cans
Uyt myn ouw schoenẽ springẽ.

Myn lief houwt my in groote weerdt
Want als sy my comt teghen.
Neyght sy dat 't hemde slypt op d'eerdt,
Is dat niet fray gheneghen?

Waer 't datter eenen bessem stack
Aen 't ey nd' van uwen degen,
Ghy sout de straten met ghemack
Wel keiren ende veghen.

En gy loopt als een mancke Kray
Gy springt gelyck een Veulen,
En gy draeyt uwen eers soo fray
Als eenen Mostaert-meulen.

Ons Liefden is soo vast gheset,
s'En schydt niet van ons beyen,
Den luyen eers met een werm bedd'
Hoe qualyck can dat scheyen.

De liefde van myn lieve Bruydt
Sal noch ghedurigh wassen;
Ick sal als Herman op syn Fluyt,
Op al haer diensten passen.

Ick maeck u in myn hert een plaets'
Om u daer in te planten,
Want wy zyn sulken goede maets
Ghelyck twee Olifanten.",Je sens pour vous la nuit et le jour,Brussel,../../data/dbnl/minn002eere02_01.xml
36994,minn002eere02_0096,1677,1677.0,1001870,3434444422,vmvmmmvvmm,aBaBCCddEE,3a 4B 3a 4B 4C 4C 4d 4d 2E 2E,"3a    4B    3a    4B    4C    4C   ,4d    4d    2E + .2E","kluchtlied
liefdeslied
vermaanlied, wereldlijk",4,9,"ONs Maert fiere Magrietjen
Droeg een roy tabie scheurs
En kreegh menigh visietjen
Van diversche Serviteurs,
Een Jongman die moy Hans hiet
Die vryden ons fiere Magriet,
En Hansken kreegh in Grietjen gadingh,
Hansken dacht, Griet heeft goey bladingh,
Want haer Kleedt, Staet ryck en breedt.

2 Hans huert fray en nieu kleeren
Op d'Ouw-merckt by Joncker Faes,
Hans draeght Kleeren van Heeren
Hans schynt eenen rycken Baes,
Hans komt daer soo trots aen-ghestapt,
Schoon Vaerken maer schoenen en lapt,
Hans komt met veel Cer'monien
Synen dienst aen Grietjen biën,
En syn hant’ voor minne-pant.

3. Griet kout lustig met Hansken,
Griet is vrolyck, Griet is bly.
Griet peyst hier is een kansken,
Sulck-een man gelyct aen my,
Want als ick syn Kleeren bekyck.
Soo schynt hy met duysenden ryck,
Enfin sy trouwen met malkander
Binden d'een hert aen het ander,
En d'een hant aen d'ander hant.

4. Nu heeft fiere Magrietjen
Eenen Man die niet en heeft,
Gheen ghelt oft gheen creditjen,
Peyst eens waer-van dat sy leeft,
Nu is onsen mageren Hans
Ghetrouwt met een maghere Gans,
Deês twee Postuerkens hebben 't gheckje
En daer by noch het ghebreckje,
En hun trouw is in den rouw.",Mall Peatly,Brussel,../../data/dbnl/minn002eere02_01.xml
38876,jong086kint01_0008,1723,1723.0,1015354,44444444,vmvmvvmm,aBaBccDD,4a 4B 4a 4B 4c 4c 4D 4D,4a 4B 4a 4B 4c 4c 4D 4D,"drinklied
loflied, wereldlijk",5,8,"DAer de vrienschap is gebroken,
Heeft den wyn dees wonder kracht
Dat hy weer kan liefde stoken,
Dat den peys wert inghebracht,
Met den wyn verstoorde menschen,
Dryncken peys naer hunne wenschen,
Want'er toch niet soeter is,
Als daer peys en vrientschap is.

Als der oude lieden krachten,
Hun begeven, kan den wyn,
Hun verquycken tot 't betrachten,
Van het geen kan nuttigh zyn,
't Welck en 't schoon der oude lieden,
Die als kinders henen vlieden,
Als me seght soo is den wyn.
Wyn wyn doet al vroyelyck syn.

Wyn heeft oock dees wonder kracht
Dat hy eenen geck maeckt wys,
Wyn doet hem syn selven achten,
Dat hy schyn niet eenen thys,
Ofte cloeten vol ghebreken,
Maer een Cicero in't spreecken,
Dit ghedacht geeft hem den wyn,
Wyn wyn doet al vroyelyck syn.

Den wyn die doet oock den vreckẽ
Veele geven mildelijck,
En hy maeckt wijse de gecken,
En de arme maeckt hy ryck,
Selden sietmen aerme schynen,
Vol gedroncken van den wyn,
Wyn verdryft de aermoe pyn,
Wyn wyn doet al vroyelyck syn.

Die 'thooft heeft vol muysenesten
Ende oock niet slaepen kan,
Is den wyn ten alderbesten,
Medecyn voor sulcken man,
Edel aerme ende rycken,
weerelijck ende geestelyck,
Voor die groot'lycks syn in pyn,
wyn wyn doet 't al vroyelyck syn.",In de eeuw van Adams tijden,Brugghe,../../data/dbnl/jong086kint01_01.xml
38879,jong086kint01_0011,1723,1723.0,1015354,233223323433332,mmmvmmmvvmmmmmv,AAAbAAAbbCCCCCb,2A 3A 3A 2b 2A 3A 3A 2b 3b 4C 3C 3C 3C 3C 2b,2A + .3A   .3A + .2b    2A + .3A   .3A + .2b   .3b   .4C   3C + .3C   .3C   .3C + .2b,"meilied
loflied",2,9,"SChoon diamant,, In't herteken geplant,
Door liefde abondant,, Den Mey idoone,
Groen plaisant,, Met loveren triumphant,
Daer aen elck kant,, bloeyt even schoone,
Om dat ghy spant de croone,
Gy croone der vreughden en't herte van myn
Gy blinckende Robin laet u ontfanghbaer zyn,
Den Lauwerier-boom syn,
Die ick op dit termyn, schenck u persoone.

Aensiet desen tydt, gy die de liefste zyt,
Hy brenght vreucht, en jolyt, in alle contrey
Want wy zyn quyt, den winter kout en
Den somer ons bevrijt, met armeynen,
Men hoort daer vreucht verbreyen,
In bosschen en velden in't generael,
Den fieren Nachtergael, met synder soete tael,
Hoort men daer principael,
Om alle druck en quael, van ons te leyen.",Schone diamant,Brugghe,../../data/dbnl/jong086kint01_01.xml
38951,vijf001vlae01_0025,1733,1710.0,1015358,33554555,mmmmmmmm,AABBCCDD,3A 3A 5B 5B 4C 5C 5D 5D,.3A   .3A   .5B   .5B   .4C   .5C   .5D   .5D,"bespiegelend lied, wereldlijk
dialooglied, wereldlijk
kluchtlied
verhalend lied",6,8,"De Vliegh quam by een Mier,
En sey: gy slechte dier,
Gy aerm floor, die als een esel muyl
Werckt heel den dagh, om wat graen in een kuyl,
Te garen, als de Boeren doen,
Soo slaet gy oock, en gy zijt oock soo coen,
En stout, dat gy de Boeren steelt hun graen,
Waer voor sy hebben vele moyt gedaen.

4. Dus bidt, gy slechte sloor,
Dat Godt Iupijn u hoor,
En u geef vleugels, oock een vliege maeckt.
Hier mede Vliegh heeft haer sermoen gestackt,
Dit hoord’ al aen de wijse Mier,
En gaf haer antwoord wel op dees manier:
Gy Monsieur Vliegh, gy eelman van mijn gat,
Gy stoeft wel seer hoveerdigh, ende prat.

5. Yder heeft u in haet,
Yder een u versmaet,
En gy zijt niemants vriendt, als vanden stront,
Daer gy alleen gerust op sitten kont
Aen yder zijt g’een vloeck, en spoock,
Gy quelt d’onnoosel peerden, kopen oock,
Gy suypt het bloedt van menigh peert en koe,
En die onnoosel beesten maeckt gy moe.

6. Gy zijt een lege pry
Somers zijt gy wat bly,
Maer ‘swinters zijt gy meer oock als half doodt,
En lijdt dan honger, ende grooten noot,
En yder oock, die slaet u doodt,
Als hy maer kan: want gy roost seer snoot,
En maer bederft goe spijsen, ende dranck,
En aen goe spijsen brenght gy vuylen franck.

7. Gy Vliegh, gy lieghter aen,
Dat ick maer roof het graen,
Ick neme maer, het geen verloren gaet,
En ’t geen gevallen yvers is op straet:
Des somers werck ick neerstigh seer,
En ‘swinters ben ick dan als eenen Heer;
Gy leefd’ op roof, en ‘swinters zijt g’als doot
En in gebreck, en aerremoede groot.

8. Leert dat hier jonge jeught,
Dat aerrebeyt verheught,
Als g’in den somer van u jonckheydt werckt,
Dat dit den winter van u oudtheydt werckt,
Dat dit gaet gy luyaert tot de Mier,
En leert van haer neerstigh te wercken hier;
Maer eerst, en meest naer ’t eeuwigh leven tracht,
En d’opgeblasen lege Vliegh veracht.",Courante monsieur,Brugge,../../data/dbnl/vijf001vlae01_01.xml
38960,vijf001vlae01_0034,1733,1710.0,1015358,44444444,mvvmvmvm,AbbAcDcD,4A 4b 4b 4A 4c 4D 4c 4D,4A 4b 4b 4A 4c 4D 4c 4D,kerstlied,5,8,"MYnen Godt, en mijnen al
Light hier in een krib gedoken
in een aerm hut gans open,
En in eenen beesten stal.
Sult gy ziel noch soo betrachten
U gemack, en u plaisier?
Sult gy ’t geldt noch soo groot achten,
Daer Godt light soo aerm hier?

2. Den Rijckdom, en gelt en goet
Bringen in d’hel vele menschen;
’t Zijn nochtans al ’s mensche wenschen,
Den mensch om ’t gelt alles doet:
Om ’t gelt sal den mensch verkoopen
Sijne ziel, en ’t Hemelrijck:
Duysent prijckels salme loopen
Om het geldt seer heftelijck.

4. Hy leert u hier te verstaen.
Van ’t gelt uwen Godt niet maecken,
En goetwilligh aen te raecken,
d’ Aerm menschen by te staen.
In sulck aermoed komt hy leven
Om dat gy sijn leven hier
d’ Aerm menschen soudt oock geven:
Die houdt u van ’t helsche vier.

5. Siet die hooghste Maiesteyt
d’ Alderhooghsten Godt der Goden
In een slechten stal gevloden
In een krib vernedert leydt.
Wilt den mensch nu sigh verheffen,
Daer Godt sigh verneder soo?
Wat wilt alles overtreffen
Mensch een slijck, en sondaer snoo.

7. Sal den vuyl onkuysschen lust
U mijn ziel noch overwinnen?
Ah wilt suyverheyt beminnen,
En dan hebdy waere rust.
Siet hoe Iesus, om de lusten,
Van al u onsuyverheydt
In een harte krib komt rusten,
En weent, en gedurigh lijdt.",Belle Iris,Brugge,../../data/dbnl/vijf001vlae01_01.xml
51429,_fra002fran01_0002,1819,1795.0,1003093,4444,vmvm,aBcB,4a 4B 4c 4B,4a 4B 4c 4B,drinklied,3,4,"Als ik een Vrouwtje mag verkiesen,
Moet zy myn geven Roode Wyn,
Moet zy myn geven Roode met Roode,
Moet zy myn geven Roode Wyn.

Wy zyn Knaapjes die het wyntje wel lusten
Geld in ons zak dat hebben wy niet,
Kom laat ons gaan, kom laat ons gaan,
Want wy moeten marscheeren, marscheeren
Kom laat ons gaan, kom laat ons gaan,
Want wy moeten marscheeren gaan.

Als ik dood ben zullen zy myn begraven,
Al in een vaatje met roode wyn,
Al in een vat, al in een vat.
Al in een vaatje met roode met roode,
Al in een vat, al in een vat,
Al in een vaatje met roode wyn.",,Amsterdam (Anjeliersgracht 148),../../data/dbnl/_fra002fran01_01.xml
51566,_nie035nieu01_0002,1819,1795.0,1003181,443443,mmvmmv,AAbCCb,4A 4A 3b 4C 4C 3b,4A 4A 3b 4C 4C 3b,ambachtslied,14,6,"Wat is de nacht verschriklyk guur,
Ik evenwel moet zonder vuur.
Geduldig hier staan wachten,
Geduldig! neen, dat ben ik niet,
'K byt op myn lippen van verdriet
Ja vloek zelfs by gedachten.

Maar 't één baat my zo min als 't aar,
'K moet wachten, schoon 't reeds ochtend waar,
Ol 'k zeg 't is Menschen plagen 
De klanten zitten warm en wé;
Zy vraagen niet hoe ik het stel,
Wat zouden ryken vragen,

Een Slepers Knecht, hoe goed en braaf,
Is in hun oogen maar een slaaf,
De vent moet maar wat wachten
En staken zy hun Neus eens uit,
En zagen 't bibbren van myn huid,
'K wed zy nog om my lachten,

En myn Perzoon, dat liet 'k nog gaan.
Maar dat myn Knol daar zo moet staan,
Dat zal ik eeuwig haten,
Het Beest is wis als Ys zo styf,
Ik lag het dek wel op zyn Lyf,
Maar, och! wat kan dat baten?

Dat ryke Volk weet nergens van;
Maar waar men nog toe komen kan,
Dat kan een Mensch niet weten,
Nebucadnezar was wat groot,
En echter kwam hy in den nood;
Moest met de Varkens eeten,

O! dat myn Knol my maar verstond,
'k Wed dat hy toch vertroosting vond,
Als hy my hoorde praten,
Want dikwyls troost 'k my zelv er meê,
Als 'k zit te wachten in de Sleê;
Maar nu wit 't toch niet baten,

'T is ook van Nacht zo yslyk guur,
En ik moet, zonder vonk of vuur.
Geduldig hier staan wachten,
Geduldig neen! dat ben ik niet.
'k byt op myn lippen van verdriet,
Ja vloek zelfs by gedachten.

Beklaaglyk is een Slepers maat,
Vooral als hy zo op de straat,
Van koude moet verstyven,
Zo 'k maar een ander Ambacht kon,
Waarmeê 'k maar half het Kostje won
Ja wél! 'k zou Sleper blyven.

Myn Wyfje (want ze is opperbest,)
Verzorgde ons wis wel voor de rest,
Doch dat kan 't nu niet velen,
Zy blyft nu by de Kindren t'huis,
Wel in myn vreugd, niet in myn kruis,
Mag 't lieve Vrouwtje delen,

Het ergste is maar, als 'k van myn post,
Nu eindlyk eens ben afgelost,
En 'k ga dan by haar leggen,
Zo yslyk koud, zo yslyk moê,
Dan vallen me reeds de oogen toe,
En 'k heb maar niets te zeggen.

Ik zeg, een al te zwaare last,
Is aan de Post van Sleper vast,
'T is maar niet uit te drukken,
Dan staan we om 't lieve stukje brood
Nog, boven dien, zo dikwils bloot,
Voor duizende ongelukken.

Hoe goed is 't evenwel toch niet,
Dat God ook naar de Slepers ziet,
En hun zo zwaar ziet dragen,
'K denk daarom ook, als 'k zo myn hart,
Eens heb ontlast van druk en smart,
Maar 't is Gods welbehagen.

En als de maagre Sleper komt;
Al hebt ge als Goude Tor gebromd,
Of dapper moeten pezen,
Hy neemt een ieder in zyn Sleê,
En ryd er zonder vragtloon meê,
Naar, daar geen goud zal wezen.

Daar zit ik met het Heerschap aan,
Voor wien 'k nu in de kou moet staan
En hy zal 't dulden moeten,
Ja Knol, gebeurde dat ons niet,
We stierven zeker van verdriet,
Maar 't end zal 'tal verzoeten.",De wereld is in rep en roer,Amsterdam (Anjeliersgracht),../../data/dbnl/_nie035nieu01_01.xml
100053,bon_001delf01_0036,1652,1652.0,1000695,23223252223113,vvmvvmmvvvmmmm,abCabCDeeeFFFF,2a 3b 2C 2a 3b 2C 5D 2e 2e 2e 3F 1F 1F 3F,2a   .3b + .2C    2a   .3b + .2C   .5D   .2e + .2e   .2e   3F=+ .1F=+ .1F=  .3F,,2,9,"WIlt noyt trouwen;
Ghy Maeghden die de vryheydt, noch steets bemind',
't Sal u rouwen,
Soo ghy de vrye Blyheydt, door Trou verslind',
Want d' Eghten Bant die maeckt u dapper vast,
U Maeghde leven, werd heen gedreven,
En wegh gegeven,
Ey Vrysters Trout doch niet, ey niet, ey niet,
Geen vreught de Trou ons bied'.

2. 'k Moet nu dragen,
Ten Offer al mijn leden, aen't sacht Altaer,
Droever vlagen,
Hebben noyt Mensch bestreden, O fel gevaer!
Waerom juyst My dit Noodt-lodt toe geschickt,
Dat ick moet huycken, en neder duycken,
En laet beruycken
Mijn Alderbeste Roos, o Roos, o Roos.
Adieu Adieu Altoos.",Ballet Bronkhorst,Delft,../../data/dbnl/bon_001delf01_01.xml
100217,_apo010apol01_0051,1760,1746.0,1001392,22322311333443,vmmvmmmmmmmmmm,aBCaBCDDEEEFFE,2a 2B 3C 2a 2B 3C 1D 1D 3E 3E 3E 4F 4F 3E,.2a   .2B   .3C   .2a   .2B   .3C   .1D   .1D   .3E   .3E   3E    4F   4F 3E,,5,14,"IK had voor dezen, 
Zo doen ik nog,
Genomen vast'lik voor, 
Cupidoos pezen,
En schalk bedrog, 
Te geven geen gehoor:
Ik zag,,, 
't Beklag 
Van zo veel Minnaars aan,
Dien hy bedrukt liet staan, 
En in de liefd' verbraan;
Doen heb ik wel vaak gezeid, 
Ik ben angstig voor de Meid,
Ik laatze veel liever gaan.

Zou ik voor deuren, 
Gelyk zy doen, 
De gantse nagt bykans,
Bedrukt staen treuren? 
Ey 't is te groen,
Voor deftige Jongmans; 
Of haer,,, 
Een jaar,
Nalopen, nagt en dag, 
Met bidden en geklag,
Als ik geen weerliefd' zag? 
Ik wou liever dat de Maagt
Was daar de Zon opdaagt,
Want ik niet treuren mag.

Men pryst'er leden, 
Haar ommegang,
Haar aanzigt blank en klaar, 
Men pryst'er zeden,
Syrenis gezang; 
Men zeid dat haar blond hayr
Bekans,,, 
In glans, 
Meer als de Zonne praalt,
Als zy op 't schoonste straalt, 
En waar toe dus gemaalt
Zynze mooy dat weten zy 
Zelver alzo wel als wy,
Of men 't schoon niet verhaalt

Dat doen zy blyken, 
Genoeg alle daag,
Met het verweent cieraat, 
Daar zy mee pryzen,
En pronken staag, 
In Kerk, in Huys, op straat:
Wat zyn,,, 
Ook fyn 
Haar Kapjes allegaar,
Veel Kantjes net en zwaar, 
Veel plooitjes op elkaar,
En dus wagtenz' in de deur
d'Een of d'ander Serviteur,
Hoe kanm' ontkomen haar.

De Juff'ren peyzen, 
Dunkt my voor gedaan,
Op 't schoonst' is half verkogt; 
En ofz' haar veynzen,
Hier merkt men aan, 
Zy willen zyn gezogt:
Dus dan,, 
Val an, 
Gy Jongmans schept een moet,
En wat gy laat of doet, 
Vryd, t'weten, dat met spoet,
Is de eene Juffrouw traag, 
Een ander is weer graag,
't Lang lopen is niet goed.",Engelse klokkedans,Dordrecht,../../data/dbnl/_apo010apol01_01.xml
