recordid,songid_DBNL,jaar_eind,jaar_begin,bronid,rijmaccent,rijmgeslacht,rijmschema,strofeschema,strofeschema_plus,trefw_genre,aantal_strofe,verstal,text,melodienorm,plaats,filepath_DBNL
20483,wits010stic02_0002,1649,1649.0,1016932,66333333333,vvmmmmmmmmm,aaBBCDDCDDC,6a 6a 3B 3B 3C 3D 3D 3C 3D 3D 3C,.6a   .6a   .3B=  .3B=+ .3C   .3D/  .3D/+ .3C*  .3D/  .3D/+ 3C*,geestelijk lied,24,8,"1. Ick gingh eens op een tijdt in 't groen my wat vermaecken
Daer ick tot leeringh sagh seer veelderhande saecken,
De Boomen stonden groen,
de Boomen stonden groen met vruchten schoon belaen,
Ick sagh 't ghemaeyde Hoy,
Ick sagh 't ghemaeyde Hoy, met groote hoopen staen,
Ick sagh 't ghemaeyde Hoy,
Ick sagh 't ghemaeyde Hoy, met groote hoopen staen.

2. Ick sagh de Roosjens aen, met veelderleye Bloemen,
Ick sagh veel Kruyden staen, my onbekent te noemen:
Dit gaf een soeten reuck,
Dit gaf een soeten reuck, dies werdt mijn hert verheucht,
Ick dacht den soeten Tijdt
Ick dacht den soeten Tijdt maeckt yeder een vol vreucht.
Ick dacht den soeten Tijdt
Ick dacht den soeten Tijdt maeckt yeder een vol vreucht.

3. De Beesten hadden tier in groen begraesde Weyden,
De Vog'len met gesangh haer Scheppers lof verbreyden,
En maeckten groote vreucht,
En maeckten groote vreucht, elck songh na sijnder aert,
Ick docht dit is het soet,
Ick docht dit is het soet, dat ons den Somer baert.
Ick docht dit is het soet,
Ick docht dit is het soet, dat ons den Somer baert.

4. Ick dacht den Winter na, die als doen was verleden,
Hoe ongelijck dien was als by den dagh van heden,
Doen dacht ick, alle dingh
Doen dacht ick, alle dingh verandert met den Tijt,
Den Tijdt die brengt het voort,
Den Tijdt die brengt het voort, den Tijt het weer verslijt,
Den Tijdt die brengt het voort,
Den Tijdt die brengt het voort, den Tijt het weer verslijt,

5. 't Komt alles op sijn tijdt, toe-nemen en vermeeren,
't Gaet alles met den Tijdt, vermind'ren en verkeeren:
Dus die wel neerstigh acht
Dus die wel neerstigh acht op al Gods Wercken slaet,
Die siet in alle dingh
Die siet in alle dingh oock mee sijn eyghen staet.
Die siet in alle dingh
Die siet in alle dingh oock mee sijn eyghen staet.

6. MY quam doen in mijn sin, oock mee mijn kindtse Jaren,
Hoe kleyn en ongeacht, hoe simpel dat dien waren:
Ick hield' my als ick was,
Ick hield' my als ick was, te weten eenen Kindt,
Dat kindtse leuren soeckt,
Dat kindtse leuren soeckt, en kindtse dinghen mint:
Dat kindtse leuren soeckt,
Dat kindtse leuren soeckt, en kindtse dinghen mint:

7. Je droech my als een Kint, en had ooc Kints gedachten,
Ick minde als een Kint, in kintsheyt ginck ick trachten,
Ick had' een Kindts verstandt,
Ick had' een Kindts verstandt, Kindts wesen en gelaet,
Vermakelijck en bly,
Vermakelijck en bly, door kinderlijcke praet.
Vermakelijck en bly,
Vermakelijck en bly, door kinderlijcke praet.

8. Dien Tijdt is nu voor-by, 't is nu een ander wesen,
't Verstandt is met den Tijdt nu hooger op-geresen,
Ick kies nu ander stof,
Ick kies nu ander stof, ick soeck nu ander goedt,
En 't is een hooger Geest
En 't is een hooger Geest die my dit schrijven doet.
En 't is een hooger Geest
En 't is een hooger Geest die my dit schrijven doet.

9. Wat dienter nu gedaen ? Wat paster nu gelaten ?
Geeft reden, mijn Gedicht, wat sal ick nu aenvaten ?
Sal aen mijn daech'lijcx werck,
Sal aen mijn daech'lijcx werck, daer ick ben meed' belast,
Mijn hert, gemoedt en sin,
Mijn hert, gemoedt en sin, nu stadigh blijven vast ?
Mijn hert, gemoedt en sin,
Mijn hert, gemoedt en sin, nu stadigh blijven vast ?

10. En wesen vorder nu belast met geenen saken
Als van het ruyge Hout, een Sweerdt of Schuyt te maken ?
En voort soo buytens tijdts
En voort soo buytens tijdts mijn Jeucht en vryen sin
Te slijten met ghevry,
Te slijten met ghevry, en wroeten in de Min ?
Te slijten met ghevry,
Te slijten met ghevry, en wroeten in de Min ?

11. O neen: Het e'el vernuft dient hooger opgetoghen,
En boven sijn beroep wat verder te beooghen.
Hier dient dan op-gelet,
Hier dient dan op-gelet, op 't geen den Tijdt ons leert,
Nadien al onsen doen
Nadien al onsen doen is met den Tijdt verkeert.
Nadien al onsen doen
Nadien al onsen doen is met den Tijdt verkeert.

12. DE kindtsheyt mach met recht bij Winter zyn gheleken,
Als dor en sonder vrucht, behoeftigh vol ghebreken:
Maer als rijper Tijdt
Maer als rijper Tijdt den Winter doet vergaen,
Soo neemt een teder Kindt
Soo neemt een teder Kindt oock meerder krachten aen.
Soo neemt een teder Kindt
Soo neemt een teder Kindt oock meerder krachten aen.

13. 't Vernuft rijst met den Son nu hooger uyt sijn kimmen,
En port soo 't Aerts-gewas schoon uyt het slijck te klimmen:
Dan wert het groen Geboomt,
Dan wert het groen Geboomt, geplant, gesnoeyt, ge-ent,
Dus zyn wy met den Tijdt
Dus zyn wy met den Tijdt ghekomen in de Lent.
Dus zyn wy met den Tijdt
Dus zyn wy met den Tijdt ghekomen in de Lent.

14. Een Tijt, een soeten Tijt, daer't alles komt te bloeyen,
't Is tijdt, o Christen Jeucht, qua rancken af te snoeyen.
Bouwt of het ruyge tuygh
Bouwt of het ruyge tuygh dat 't weel'ge Was verbrandt,
En Spruytjes goedt gewas
En Spruytjes goedt gewas we'er in haer plaetse plant:
En Spruytjes goedt gewas
En Spruytjes goedt gewas we'er in haer plaetse plant:

15. Op dat die soete vrucht mach lief'lijck van sich ruycken,
En groeyen voort, en voort,
En groeyen voort, en voort, altijdt tot hooger staet,
So spruyt dan Vreucht uyt Deucht
So spruyt dan Vreucht uyt Deucht die 't al te boven gaet.
So spruyt dan Vreucht uyt Deucht
So spruyt dan Vreucht uyt Deucht die 't al te boven gaet.

16. O suyv're witte Deucht ! wie kan te recht aenwijsen
Al 't aengename soet, dat uyt u vrucht komt rijsen ?
't Welck Ziel en lijf verquickt,
't Welck Ziel en lijf verquickt, en voor den val behoedt,
O Ed'le gave Godts !
O Ed'le gave Godts ! O ruste voor 't gemoedt !
O Ed'le gave Godts !
O Ed'le gave Godts ! O ruste voor 't gemoedt !

17. O over-groote schat ! O Heere, geeft den Zeghen,
Bevocht mijn dor gemoedt met u gaef-rijcke Regen !
Och roeyt in mijn het quaedt,
Och roeyt in mijn het quaedt, en vuyle rancken uyt,
Vermeerdert mijn Geloof,
Vermeerdert mijn Geloof, ey zeghent doch u Spruyt !
Vermeerdert mijn Geloof,
Vermeerdert mijn Geloof, ey zeghent doch u Spruyt !

18. Dat u begonnen werck dan altijdt mach vermeeren,
En brenghen vruchten voort die uwe Naem vereeren.
DVs moet een Christen Ziel
DVs moet een Christen Ziel in alles wat hy doet,
Gedencken op Gods eer,
Gedencken op Gods eer, en toonen rechte ootmoet:
Gedencken op Gods eer,
Gedencken op Gods eer, en toonen rechte ootmoet:

19. Op dat sijn hert bequaem, mach 's Heeren Tempel wesen,
Dat Godt daet in gedient, ghevreest werdt en gepresen.
Hy die de herten kent,
Hy die de herten kent, door alle nieren siet,
Kan een geveynsden schijn
Kan een geveynsden schijn in 't minst verdragen niet.
Kan een geveynsden schijn
Kan een geveynsden schijn in 't minst verdragen niet.

20. d'Oprechte Liefd' die moet altijt sijn Leydster wesen,
Godt moet in al sijn doen gedient zyn en ghepresen.
Wel hem die hier na soeckt,
Wel hem die hier na soeckt, geloovigh hier na tracht,
En schijnt gelijck een Licht
En schijnt gelijck een Licht in dit verkeert geslacht:
En schijnt gelijck een Licht
En schijnt gelijck een Licht in dit verkeert geslacht:

21. In Gode vindt hy rust, die troost hem in sijn lijden,
Als Werelt, Duyvel, Doodt, en 't Vleesch hem komt bestrijden,
Gods Geest maeckt hem gerust,
Gods Geest maeckt hem gerust, door God hy overwint,
Door Godt werdt hy bewaert,
Door Godt werdt hy bewaert, ghelieft gelijck sijn Kindt.
Door Godt werdt hy bewaert,
Door Godt werdt hy bewaert, ghelieft gelijck sijn Kindt.

22. Hierom bedroefde hert wilt tot den Heere naken,
Besteedt wel uwen Tijdt, met vasten, bidden, waken:
Want soo ghy u oprecht
Want soo ghy u oprecht nu naecket tot den Heer:
Daer is geen twijffel aen,
Daer is geen twijffel aen, Godt naecket tot u we'er.
Daer is geen twijffel aen,
Daer is geen twijffel aen, Godt naecket tot u we'er.

23. Hy noodt u als een Vriendt, en heeft na u verlangen,
Dus soeckt, klopt, waeckt en bidt, hy sal u wel ontfangen.
Weest vrolijck dan, mijn Ziel,
Weest vrolijck dan, mijn Ziel, en houdt nu goede moedt,
Neemt dit tot uwen troost
Neemt dit tot uwen troost in al u teghenspoedt.
Neemt dit tot uwen troost
Neemt dit tot uwen troost in al u teghenspoedt.

24. 't Goudt wert door 't vyer beproeft, een Christen door het lijden,
Tsa moedigh als een Heldt, wilt om de Kroone strijden,
Doet sullicks maer oprecht,
Doet sullicks maer oprecht, den Heer komt u te baet,
Want die op hem vertrouwt,
Want die op hem vertrouwt, hy nimmermeer verlaet.
Want die op hem vertrouwt,
Want die op hem vertrouwt, hy nimmermeer verlaet.",Eerste kusje,Enkhuizen,../../data/dbnl/wits010stic02_01.xml
40778,japi001frie02_0067,1681,1681.0,1010039,4444,mmmm,AABB,4A 4A 4B 4B,4A 4A 4B 4B,psalm,26,4,"LOf-sjongh de Heer, uwt herts-gruwns njoe,
Hy iz goe, ja 't heagste goe:
Want sijn goeheyt giet so fier,
Son on-eyn-brie, so goertier.

Lof-sjong God; dy, wa t'Goads neamm'
Preal-fiert, twang-stjoert, az ijnn' teamm':
Want sijn goeheyt giet so fier,
Son on-eyn-brie, so goertier.

Lof-sjong d'Heer dy 't heer oer-heer't
Dat, aerne' Heer, heersck in rejear't:
Want sijn goeheyt giet so fier,
Son on-eyn-brie, so goertier.

Dy allinne, boppa wet,
Tjin Natuwre, wond're det:
Want sijn goeheyt giet so fier,
Son on-eyn-brie, so goertier.

Dy, dy de' Hijmm'len mey forstân,
Macke', ô wirck fen socken hân!
Want sijn goeheyt giet so fier,
Son on-eyn-brie, so goertier.

Dy de' yerd', swier fen wichte', oer 't wiet
Fest, oer 't onfest weage', uwt-spried't:
Want sijn goeheyt giet so fier,
Son on-eyn-brie, so goertier.

Dy de' haed-Ljeachten, glanz'-gleaun' great,
Macke', al het eag bruwckt to steat':
Want sijn goeheyt giet so fier,
Son on-eyn-brie, so goertier.

Dy de Sinne blier in bly,
Oere Dey joe de' heerschappy':
Want sijn goeheyt giet so fier,
Son on-eyn-brie, so goertier.

Moanne' in Stiert' joe Hy de macht
Wad in fadschippe' oere Nacht:
Want sijn goeheyt giet so fier,
Son on-eyn-brie, so goertier.

Dy Egiptens aet in naet,
Heeg, leeg, minsch, djiers eer-bern' daet:
Want sijn goeheyt giet so fier,
Son on-eyn-brie, so goertier.

In kritse' Isr'el, az in buwt,
Spijt Nijls tosschen, dear midz uwt:
Want sijn goeheyt giet so fier,
Son on-eyn-brie, so goertier.

Mey' hanz kreft, dy 't mord-lee wreck't,
Mey' hiet fall'gjende' earme', uwt-streck't:
Want sijn goeheyt giet so fier,
Son on-eyn-brie, so goertier.

Dy 't Rea Mar oon twa'en trog smiet,
Midz trogh kleauwd', sney, schaet in spliet:
Want sijn goeheyt giet so fier,
Son on-eyn-brie, so goertier.

In fierde' Isr'el trog dy steeg',
Trog Marz midz-hôl, wetter Ieeg:
Want sijn goeheyt giet so fier,
Son on-eyn-brie, so goertier.

Dear ijn Phar'o, fen Him wirt,
Mey sijn Krijs-ljue, gjealp, oer-stirt:
Want sijn goeheyt giet so fier,
Son on-eyn-brie, so goertier.

Dy sijn Folck laet', sijcker, fry,
Trog dy wijlde wôsteny':
Want sijn goeheyt giet so fier,
Son on-eyn-brie, so goertier.

Dy kreft-greate Keen'gen sleyn,
In uwt-dijllge het, schien t'eyn':
Want sijn goeheyt giet so fier,
Son on-eyn-brie, so goertier.

Dy trog-loft'ge Kening-staef,
(Greatsch, ontsjoen', heag) hompe' yn 't graef:
Want sijn goeheyt giet so fier,
Son on-eyn-brie, so goertier.

Az Sihon, oerste' Amoriet,
Dy hy, az dol-tong're, smiet:
Want sijn goeheyt giet so fier,
Son on-eyn-brie, so goertier.

In de' oer-greate' Og, Basans haed
Blix'me hy, oon gruys to naet':
Want sijn goeheyt giet so fier,
Son on-eyn-brie, so goertier.

In hy joe, uwt mijlder han,
To erve'-eyndomm' herre Lan:
Want sijn goeheyt giet so fier,
Son on-eyn-brie, so goertier.

To erve'-eyn', in plante 'er del,
Sijn ljeav' Tjienner, Israël:
Want sijn goeheyt giet so fier,
Son on-eyn-brie, so goertier.

Dy mey-wirddigh uwz oon-seag,
Yn uwz dol-druwx jamm're pleag:
Want sijn goeheyt giet so fier,
Son on-eyn-brie, so goertier.

Dy (uwz mijld) krefts-hânz schoerde uwt,
Uwt dea-fijnn' kluwr', tosck in tuwt:
Want sijn goeheyt giet so fier,
Son on-eyn-brie, so goertier.

Ja dy Heer, dy alle flesch,
Jout, mijld, fiedsel-brea, ney esch:
Want sijn goeheyt giet so fier,
Son on-eyn-brie, so goertier.

Lof-sjong, al het iz, mey my
d'Hijmm'len God: ô lof-sjongh dy:
Want sijn goeheyt giet so fier,
So on-eyn-brie, so goertier.",Psalm 136 Datheen,Leeuwarden,../../data/dbnl/japi001frie02_01.xml
185262,_zin007zing01_0025,1805,1805.0,1004306,545422444,mmmmmmvvm,AAAABBccB,5A 4A 5A 4A 2B 2B 4c 4c 4B,5A=  .4A/   5A=   4A/   2B +  2B   .4c 4c 4B,,12,8,"Liefste Klaertje alderzoeste meid,
Ik heb u ruim een maend gevreid,
Liefste Klaertje alderzoetste meid,
Ik heb u zoo lang gevrijd.
Alle daeg, even graeg
Naer u gezondheid wezen kyken,
Maer gy liet nooit weermin blyken;
Maer ontvlugte my gestaeg.

Krelis waer toe dient dat mal gesnap,
En jou rammelen als een Lazarus klap;
Krelis waer toe dient dat mal gesnap,
Zeker broer 't lijkt wel een grap.
Heeft de min, in jou zin,
Zulk een puthaeks pijl geschooten;
Trektse uit en loop wat kooten,
Tot gy hair krijgt aen jou kin.

Ik heb altoos zoo'n zin in jou gehad,
Zedert datje by Kees in de gort-pan zat,
Ik heb altijd zoo'n zin in jou gehad,
Zedert datje by Krelis zat.
Ach mijn hart, wierd verwaet,
In uw krullende blonde lokjes,
Zwarte aep en roode rokjes,
Daer gy steenluy zelfs mee taet.

Brandje alzoo fel van 't minnevuur,
Krelis, en loop dog uit onze schuur;
Brandje alzo fel van 't minnevuur,
Krelis loop uit onze schuur.
Want jou vlam, so die kwam,
Eensjes in ons hoop te raken:
Sloeg de heele schuur aen 't blaken,
En dan wierd mijn Vaertje gram.

Ook jou oogjes vol van minnevier,
En jou zoet gelaet vol zwier,
Ook jou oogjes vol van minnevier,
En jou zoet gelaet vol zwier.
Ja jou hals, blank en als
Varsche room van Vaertjes koeijen,
Kan de minne vonkjes groeijen,
En ik wierd zoo kwips en mals.

Hebben jou mijn oogen als gy zegt,
Door min ontstoken lieve knegt?
Hebben jou mijn oogen als gy zegt,
Zoo gebrand? dat 's zeker slegt.
Ik zal jou, van die vou,
Met twee woorden slegts genezen,
Vryers my dog niet belezen;
Zy houde 't aepje in de mouw.

Jou gesigt stond altyd stuurs en straf,
Schikte ik na jou, jy schikte dwars,
Jou gesigt stond altyd stuurts en straf,
Schikte ik,  jy schikte dwars.
Ja in twist, vol van list,
Al myn vryen soo t' ontloopen,
Dat ik nooit jou schort kon knoopen,
Of ik wierd van jou betwist.

Of ik schoon tot trouwe waer gesint,
Kond gy my nog niet behagen vrind,
Of ik schoon tot trouwe was gesind,
Kond gy my  nog niet behagen vrind.
Want jou haer, door malkaer,
Heel verwart in een gewosse,
't Lykt een nest vol jonge mosse,
Niet gekamt in seven jaer.

Segt myn dog myn soete engelin,
Isser dan geen hoop van wedermin,
Segt myn dog myn soete engenlin,
Isser dan geen wedermin.
Zy denkt vry morsige pry,
Dat gy van myn droevige klagen,
Ons heele dorp nog sult sien wagen,
Tot gy my eens gunstig sy.

't Heele lyf dat is van top tot teen,
Als een ojevaer besneen
't Heele lyf dat is van top tot teen,
Als een ojevaer besneen.
Het lighaem lank, smal en rank
Met twee kuite loose biene,
Daer kan geen kind in 't dorp jou siene:
Of 't word voor u wesen bang.

Loop met almanakke op beter tyd;
Ligt krygt gy nog hier of daer een meyd.
Loop met almanakke op beter tyd
Ligt krijgt gy nog wel een meid.
Weetje hoe, dat ik doe,
Ik hou het met de spreuk van Otje,
daer is zelde zoo een scheef potje,
Of daer past een dekzel toe.

Loop jou spytig vorken als je bent,
die opregte vryers hoont en schent,
Loop jou spytig varken als je bent,
'k Hebje nooit zoo kwaed gekent.
Maer je zal, mede al,
U te laet hier van beklagen;
Want men ziet het alle dagen,
Hoogmoed die komt voor de val.",Liefste Klaartje allerzoetste meid,Amsterdam,../../data/dbnl/_zin007zing01_01.xml
190504,_ora003oran01_0066,1788,1788.0,1016540,4224344441112122,vmmvmvmvmmmmvmvv,aBBaBcDcDEEEfEff,4a 2B 2B 4a 3B 4c 4D 4c 4D 1E 1E 1E 2f 1E 2f 2f,.4a   .2B=+ .2B=  .4a   .3B    4c   .4D   .4c   .4D    1E/+ 1E/+  1E/+  2f#   1E/+  2f#+ 2f,,26,10,"A la Messieurs sa wilse kyken,
La Rareté, la Rareté,
Dingen jou siet nooit zyns kelyke,
La Curiosité;
Alle soorte van kekke sotten,
Die wil pronk met de skone naam
Van koede brave Patriotten,
Daar zy zyn vuilken al te zaam,
Oh! oh! oh! la merveille,
Oh la merveille sans pareille!

Hier zel jou ras en klaar ontdekken,
La Rareté,
Iets dat jou tot een les moet strekken,
La Curiosité,
Dat als de aap hoog klimmen willen,
Men, kelyk als de spreekwoord zek,
Straks ziet hun kaale naakte billen,
Hun toonen duvels kwaat of kek,
Oh! oh! oh! la merveille,
Oh la merveille sans pareille!

Daar zie jou eerst van Berkel koomen,
La Rareté,
't Krote Kopstuk van Hollands Rome,
La Curiosité,
Zie hum daar eed en plikt verzaken,
En stout, wat onkehoorde zaak,
Propria Auctoritate maken,
Een verdrak met d'Amerikaan.
Oh! oh! oh! la merveille,
Oh la merveille sans pareille!

Daar heb se Jonker van Capellen,
La Rareté,
Le Demagoge des Rebellen,
La Curiosité,
Hy ontfank van een troup Canaille,
Die voor hum mooy Soldaatje speel,
Een kroote skone gou Medailje,
Hankt met de lind die aan zyn keel,
Oh! oh! oh! la merveille,
Oh la merveille sans pareille!

Zie daar de Amsterdamsche Heeren,
La Rareté,
Hoe druk zy ben aan 't besoigneeren,
La Curiosité,
Zy weet niet hoe zy 't maken zullen,
Nu zy zien, hoe zy als de sot,
Zik van d'Amerikaan liet sullen,
En al den duvle heb verbrod,
Oh! oh! oh! la merveille,
Oh la merveille sans pareille!

Daar heb ze nou het Dortenaartje,
La Rareté.
't Kwaat en keffende Gyselaartje,
La Curiosité,
Uit zyn kezigt, men kan wel leezen,
Hy vrees voor duvle nok voor dood,
Zoo hum maar aankezien mag weezen,
Pour Jean de Wit, of Huig de Kroot,
Oh! oh! oh! la merveille,
Oh la merveille sans pareille!

Daar wil hum door de Hofpoort ryden,
La Rareté,
Dat wil Monsr. Morant niet lyden,
La Curiosité,
Hy pakt de Paart en hout se tegen,
Mais voyez vous, de man is sat;
Monsr. van Nispen trek de deegen,
Schoon men hier nix te vreezen had.
Oh! oh! oh! la merveille,
Oh la merveille sans pareille!

Ok! ok! daar word Morant kevangen,
La Rareté,
d'Armen drommel wil men hangen;
La Curiosité,
Daar ziet se de skavot al bouwen,
Wat zyn de Patriotten bly!
Maar ze bekryp dit zou hun rouwen,
Morant blyf van de kalge vry,
Oh! oh! oh! la merveille,
Oh la merveille sans pareille!

Daar heb se nou die krote baazen,
La Rareté,
Jean de Roye van Westmase,
La Curiosité,
Kent ze de Vent niet koeje vruitje.
ô Het is zo en keleerden Heer.
Die om de kleln onnosel pruitje,
De Staatsverkadring convoieer.
Oh! oh! oh! la merveille,
Oh la merveille sans pareille!

Daar hebt se Spaan met zyn twee Jongen,
La Rareté,
Wat doen die aapen kekke sprongen,
La Curiosité,
Zie hoe die dronke duvele zwayen,
Hoe hum staat als een Oojevaar,
Op de Stadhous, romtom te drayen,
ô Fraai curieus, ô dat is raar!
Oh! oh! oh! la merveille,
Oh la merveille sans pareille!

ô Le Prevôt, by volle flessen,
La Rareté,
Zie daar zyn Wyf die mal Princesse,
La Curiosité,
Zie hun daar zitten met hun beiden,
Zoo opkeblazen als de Pad,
Door de Stadhoudre Poort hem ryden,
Tot walkens toe van glory zat.
Oh! oh! oh! la merveille,
Oh la merveille sans pareille!

Daar zie jou veel kebeste knapen,
La Rareté,
Kunsjes doen net kelyk de aapen,
La Curiosité,
Snaphaan op schoer: Eerwaarde Heeren,
Die thans den brui heb te studeer,
Maar als Soldaat wil exerceeren,
Of leer behandlen het keweer.
Oh! oh! oh! la merveille,
Oh la merveille sans pareille!

Zie! zie! waar zag ze ooit huur kelyken,
La Rareté,
Zie! zie! hoe boos zy staan te kyken:
La Curiosité,
Elk pronkt, Hemel welk een wonder!
Met een postiche knevelbaart,
Ziet zoo brutaal als een Hans donder,
Of als Schoppe Boer in de Kaart.
Oh! oh! oh! la merveille,
Oh la merveille sans pareille!

Sa prenez garde op dees vertooning,
La Rareté,
Voila le plus grand Apekoning;
La Curiosité,
Monsr. van Salm, zie zie hum springen,
Hy stap of niemant hum kom deer,
't Is of hum zou den duvle dwingen,
Hun zie zoo bars kelyk een beer.
Oh! oh! oh! la merveille,
Oh la merveille sans pareille!

Zie! zie! hum daar in kroote sakken,
La Rareté,
Al zyn kestool ducaren pakken,
La Curiosité,
Zie! zie! wat maak hum kekke grappe,
Hy krap de kop, hum wou graag vort,
Uit Holland na Parys opstappen,
Eer hum hier opgehangen word.
Oh! oh! oh! la merveille,
Oh la merveille sans pareille!

Wie ziet ze daar zoo trots aankoomen?
La Rareté,
Le Dictateur van Amstels Roomen,
La Curiosité,
Monsr. Goudoure met zyn benden,
Qui les Elits du Magistraat,
Schop van 't Stadhous, en henen zenden,
ô! die verduvelde Democraat!
Oh! oh! oh! la merveille,
Oh la merveille sans pareille!

Ha! ha! nu zal ze moeten lakken,
La Rareté,
Dat ze schier in de broek zou kakken,
La Curiosité,
Ken jou daar niet die maagre Ritter,
Die Balnewis zoo hep keplaagt,
Die Pagattre, die van Sitter,
Die de Soldaat hep wekgejaagt.
Oh! oh! oh! la merveille,
Oh la merveille sans pareille!

Zie hum daar daar in zyn hemt staan pronke,
La Rareté,
Hum is parbleu half slape drenke,
La Curiosité,
Kyk! kyk! wat trekt hum viese bekke,
Nu hum Balnewis schoon badot,
En uit zyn slaapt hem op komt wekken,
Hum Conduiseer na het Casjot.
Oh! oh! oh! la merveille,
Oh la merveille sans pareille!

Schrikke non niet c'est detestable!
La Rareté,
Le pourtrait du plus laide Diable,
La Curiosité,
Quel visage de Contrabande!
Quel foutu nez! twee vuisten lang,
Kyk wat een bult, kyk wat voor handen,
Een figuur als een kromme tang;
Oh! oh! oh! la merveille,
Oh la merveille sans pareille!

Se kent hun wel dat 's vast en zekere,
La Rareté,
Suljart de grootste Eedverbrekere,
La Curiosité,
Zie, heb se van jou leeve daagen,
Wel kezien wat die beul bedryf?
Hy laat de braaf Sergeant wegjaagen,
Kort hem de tres, snyd de kleed van 't lyf.
Oh! oh! oh! la merveille,
Oh la merveille sans pareille!

Daar zied ze nou die kroote baazen,
La Rareté,
Die als verwoede duvle raasen,
La Curiosité,
Alles zy zal tot Huspot kappen,
Eer ze verlaat de Stat van Wyk,
Kyk ze daar nou de broek vol kakken,
A la Messieurs, sa kyk, sa kyk.
Oh! oh! oh! la merveille,
Oh la merveille sans pareille!

Ha! ziet ze daar den Oproer krayer,
La Rareté!
Van der Kempe die Twedragt zayer,
La Curiosité,
Een Dominé en Uniforme.
En dat nok wel een styf Menist,
Die de Hel zelf wel zou bestormen,
Zie hoe hum zik van angst bepist,
Oh! oh! oh! la merveille,
Oh la merveille sans pareille!

Non, non Monsieur, hier valt keen preeke,
La Rareté,
Nous connoissons jou duvle streeken,
La Curiosité,
Jy zelt ons hier niet ligt ontglippen,
Non, non parbleu kom spoedig voort,
Kyk hoe 2 hum pakken by de slippen,
Hum conduiseer naar Amersfoort.
Oh! oh! oh! la merveille,
Oh la merveille sans pareille!

Ha! nog een blyk hoe dat de Keesen,
La Rareté,
Voor spook, nok dood, nok duvele vreeze,
La Curiosité,
Daar gaan hum Soesdyk attaqueeren,
Tien tegen een. ha! dat is puik,
Maar zien hun schielyk retireeren,
Hals over kop, in heg, en struik.
Oh! oh! oh! la merveille,
Oh la merveille sans pareille!

Zie jou daar wel die Pruikebollen,
La Rareté,
Parbleu hum kop ze zyn op hollen,
La Curiosité,
Ventre saint gris, se kryg de stuipen,
Ze vrees, ze raken haast van kant,
Zy willen mensch en beest verzuipen,
Gaan Inundeer de gansche Land!
Oh! oh! oh! la merveille,
Oh la merveille sans pareille!

Mais quel bruit komt my verbaazen,
La Rareté,
Parbleu se hoor trompetten blaazen,
La Curiosité,
Hoor! hoor Messieurs de Paarden bruissche,
Se loop eens kyken gins en weêr.
Ventre saint gris, het zyn de Pruissen,
Sufficit dan, voor deeze keer.
Oh! oh! oh! la merveille,
Oh! la merveille sans pareille.",,,../../data/dbnl/_ora003oran01_01.xml
