recordid,songid_DBNL,jaar_eind,jaar_begin,bronid,rijmaccent,rijmgeslacht,rijmschema,strofeschema,strofeschema_plus,trefw_genre,aantal_strofe,verstal,text,melodienorm,plaats,filepath_DBNL
177713,_boe008boek01_0035,1774,1774.0,1016227,44444444,mmvvmmmm,AAbbCCDD,4A 4A 4b 4b 4C 4C 4D 4D,.4A   .4A   .4b   .4b   .4C   .4C   .4D   .4D,,13,8,"Twist met mijn twisters, Hemelheer;
Ga mijn' bestrijdren toch te keer;
Wil spies, rondas en schild gebruiken,
Om hun gevreesd geweld te fnuiken;
Belet hun d'optogt; treed vooruit,
Zoo wordenz' in hunn' loop gestuit;
Vertroost mijn ziel in haar geween,
En zeg haar: “'k Ben uw heil alleen.”

Beschaam z' in hunnen trotschen waan,
Die mij zoo wreed naar 't leven staan;
Zoo worden z' achterwaards gedreeven
En rood van schaamte; doe hen beeven,
Die kwaad verzinnen tegen mij;
Dat al hun list verijdeld zij;
Verstrooi hen, als de wind het kaf;
Gods Engel drijv' hen van mij af.

Doe hen altoos onzeker gaan,
In duisternis, op gladde paên;
En, daar Gij zijt op hen verbolgen,
Moet', HEER, uw Engel hen vervolgen.
Zij hebben, in hun listigheid,
Een' kuil, een net voor mij bereid;
En, schoon ik nimmer hun misdeed,
Steeds laagen voor mijn ziel gesmeed.

Mijn vijand word', eer hij 't ver-wacht,
Door ramp op ramp te niet gebragt;
Hij moog', in eigen net gevangen,
Het loon van zijn bedrijf erlangen;
Zoo vall' hij in den kuil, weleer
Door mij geschikt, verslagen neêr;
Dan zal mijn ziel, verheugd in God,
Steeds juichen in haar heilrijk lot.

Mijn beendren spreeken tot uw eer:
Wie, wie is U gelijk, o HEER?
U, die van d'overmagt der sterken
De zwakken redt door wondre werken?
Die, voor der roovren woed' en zwaard,
't Nooddruftig volk getrouw bewaart?
Gij weet, hoe valsch men mij belaagt,
En onverdiend ter vierschaar daagt.

Mijn vijand, dorstig naar mijn bloed,
Vergeldt mij wreevlig kwaad voor goed:
Maar ik, hem ziend' in krankheid zuchten,
Nam deel in al zijn ongenugten.
Ik vastte, met een' zak omgord;
'k Had mijn gebeden uitgestort;
Ik ging in 't zwart, met rouwmisbaar,
Als of 't mijn vriend, mijn broeder waar'.

'k Had om mijn haaters 't kleed gescheurd,
Als een, die om zijn moeder treurt:
Maar als ik moest met rampen strijden,
Verheugden zij zich in mijn lijden.
Zij kwamen schielijk op mij af,
Eer iets mij zulks te kennen gaf.
Elk spotte met mijn zielverdriet:
Hun valsche tong bedwong zich niet.

Bij dertle brassers aan den disch,
Wien 't huichlend spotten eigen is,
Wier lastertaal mij snood onteerde,
Was vreugd om 't onheil, dat mij deerde.
Hoe lang zult Gij zulks zien, o God!
Vergun mijn ziel een beter lot;
Verlos haar, door uw sterke hand,
Uit dezer leeuwen klaauw en tand.

Ik zal, in tegenwoordigheid
Van 't groote volk, uw Majesteit
D'erkentnis van mijn hart bewijzen:
'k Zal U voor aller oogen prijzen.
Dat zij dan, die mij zonder reên
Vervolgen, om mijn tegenheên
Niet juichen, noch, in hunnen waan,
Op mij hun schimpend' oogen slaan.

Zij spreeken nooit van vrede; neen!
Maar zij bedenken listigheên,
Ten val van hun, die, stil van zinnen,
Den vrede, 't dierbaarst pand, beminnen.
Zij bassen m' aan met open mond;
Hun schimptaal, die mijn ziel doorwondt,
Bespot mijn leed: zij zijn verheugd
Op 't zien van al mijn ongeneugt.

O HEER! Gij ziet het: zwijg niet stil;
Uw recht beslisse mijn geschil.
Ontwaak; treed toe tot mijn bescherming;
Mijn God, betoon mij uw ontferming;
Doe mij, o hoogste Majesteit!
Eens recht naar uw gerechtigheid,
En laat die wreeden, dag aan dag,
Niet juichen om mijn droef geklag.

Laat hen niet zeggen in het hart:
“Geluk, mijn ziel! hij is benard!”
Men hoore nimmer uit hun monden:
“Wij hebben hem in 't eind verslonden!”
Wil hen veeleer met schand' belaên,
Om al den smaad, mij aangedaan;
Opdat mijn trotsche weêrpartij
Zich niet verheffe tegen mij.

Laat vroomen, juichend t'allen tijd',
Om mijn gerechtigheid verblijd,
Dien lust, dien ijver nooit bedwingen;
Maar zeggen, onder 't vrolijk zingen:
“Verheerlijkt zij de hoogste God;
Hij schenkt zijn' knecht een vreedzaam lot.”
Dan meldt mijn tong, met diep ontzag,
Uw recht, uw' lof den ganschen dag.",Psalm 035 Datheen,Haarlem,../../data/dbnl/_boe008boek01_01.xml
177719,_boe008boek01_0041,1774,1774.0,1016227,53535353,mmmmmmmm,ABABCDCD,5A 3B 5A 3B 5C 3D 5C 3D,.5A   .3B   .5A   .3B   .5C   .3D   .5C   .3D,,6,8,"Welzalig hij, die zich verstandig draagt
Bij een ellendig mensch!
De HEER zal hem, wanneer hij treurt en klaagt,
Bevrijden naar zijn' wensch;
Behoeden, en doen leeven, hier op aard,
In vreê en zaligheid,
Nooit van zijn' God verlaaten, maar bewaard
Voor 's vijands boos beleid.

De HEER zal hem, op 't ziekbed neêrgestort,
Versterken door zijn kracht;
Gij maakt, dat zelfs zijn gansche leger word'
Verandert door uw magt.
Ik heb tot God geroepen om genaê;
'k Zei in mijn' angst en leed:
Genees mij, HEER, die bij U schuldig sta,
En tegen U misdeed.

In plaats van troost vervolgt mij 's vijands blaam;
Zij zeggen tot elkaêr:
“Waar blijft zijn dood? wanneer vergaat zijn naam?”
Komt iemand van die schaar
Om mij te zien; dan spreekt hij valsch, en smeedt
mij kwaad, zoo veel hij kan;
Als hij te rug van mij naar buiten treedt,
Spreekt hij er andren van.

Zij momplen saam, vervuld met bittren haat;
Van raadslaan nimmer moê,
Bedenken zij een goddeloos verraad;
Men zegt: “Gods Geesselroê
Treft hem gewis; een schendaad kleeft hem aan;
Hij ligt voor eeuwig neêr:
Nu zult gij hem niet weder op zien staan,
Hersteld gelijk weleer.”

Zelfs hij, op wien ik voormaals heb vertrouwd,
Mijn vreê- en dischgenoot,
Verhief zijn hiel, en sloeg mij fier en stout,
Terwijl hij at mijn brood.
Maar Gij, o HEER! schiet tot mijn hulpe toe;
Bewijs genaê, en red,
En richt mij op; dat ik vergelding doe,
En d'ontrouw paalen zett'.

Ik ken uw gunst, ik ken uw trouw hier aan,
Dat zich mijn vijand niet
Beroemen zal, noch ik te gronde gaan;
Wijl Gij mij bijstand biedt,
Mij onderhoudt in mijn oprechtigheid,
En, voor uw aangezicht,
Met teedre zorg en trouwe hulp, geleidt
Naar 't eeuwig zalig licht.",Psalm 041 Datheen,Haarlem,../../data/dbnl/_boe008boek01_01.xml
177724,_boe008boek01_0046,1774,1774.0,1016227,44444444,vvmmvvmm,aaBBccDD,4a 4a 4B 4B 4c 4c 4D 4D,.4a   .4a   .4B   .4B   .4c   .4c   .4D   .4D,,5,8,"God is een toevlugt voor de zijnen;
Hun sterkt', als zij door droefheid kwijnen;
Zij werden steeds zijn hulp gewaar
In zielbenaauwdheid, in gevaar:
Dies zal geen vrees ons doen bezwijken,
Schoon d'aard uit haare plaats mogt wijken;
Schoon 't hoogst gebergt uit zijne steê
Verzet wierd in het hart der zee.

Laat vrij het schuimend zeenat bruisschen;
D' ontroerde waatren hevig ruisschen;
De golven moogen, door haar woên,
Het berggevaarte daavren doen:
De stad, het heiligdom, de wooning
Van God, den allerhoogsten Koning,
Wordt in haar muuren, t'allen tijd',
Door beekjes der rivier verblijd.

Geen onheil zal de stad verstooren,
Daar God zijn wooning heeft verkooren:
God zal haar redden uit den nood,
Bij 't daagen van het morgenrood.
Men zag de heidnen kwaad beraamen;
De koningrijken spanden samen:
Maar God verhief zijn stem, en d' aard
Versmolt, voor 's Hoogsten toorn vervaard.

De HEER, de God der legerschaaren,
Is met ons; hoedt ons in gevaaren.
De Heer, de God van Iakobs zaad,
Is ons een burg, een toeverlaat.
Komt, wilt op 's HEEREN daaden merken;
Aanschouwt des Hoogsten groote werken.
Zijn magt, die nooit te stuiten is,
Maakt d'aarde tot een wildernis.

God stilt, alom, het ooreloogen:
Zijn arm verbreekt de taaie boogen;
Doet spies en speer aan stukken slaan,
En wagens door het vuur vergaan.
Laat af! dus spreekt de Heer der heeren:
Weet; Ik ben God; elk moet mij eeren:
Het heidendom, ja 't gansch heelal
Verhooge mij met lofgeschal.""",Psalm 046 Datheen,Haarlem,../../data/dbnl/_boe008boek01_01.xml
177726,_boe008boek01_0048,1774,1774.0,1016227,4444334444,mmvvvvmmmm,AAbbccDDEE,4A 4A 4b 4b 3c 3c 4D 4D 4E 4E,.4A   .4A   .4b   .4b   .3c   .3c   .4D   .4D   .4E   .4E,,5,10,"De HEER is groot; elk zing' zijn' lof
In Salems stad en tempelhof,
Daar onze God, bij zuivre toonen,
Op zijnen heilgen berg wil woonen.
Hoe schoon, hoe welgelegen,
Wat vreugd voor d'aard, wat zegen,
Is Sions berg! hoe grootsch, hoe blij,
Hoe heerlijk aan de noorder zij'!
Wie is 't, die niet de Godstad roemt,
De Stad des grooten Konings noemt?

In haar paleizen vestigt God
Zijn' troon, wordt daar erkend een slot
En hoog vertrek voor 't volk te weezen:
Geen vorsten heeft men daar te vreezen.
Pas hadden zij, verbonden,
Den togt zich onderwonden;
Pas hadden zij de Stad in 't oog,
Of hun verwondring steeg zoo hoog,
Dat Sion slechts van ver te zien
Hen straks van schrik te rug deed vliên.

Daar greep hen beeving aan, vervaard,
Vol smert, gelijk een vrouw, die baart.
Zoo doet G' een' oostenwind de kielen
Van Tharsis vloot in zee vernielen.
Wij zagen, 't geen onz' ooren
Voorheen slechts mogten hooren,
In deze stad, den troon der eer,
Van God der legerschaaren HEER;
Hij zal, door magt en kloeke daên,
In eeuwigheid haar vast doen staan.

Wij, o verheven Majesteit!
Gedenken uw weldaadigheid,
In 't midden van uw heilge wooning.
Gelijk uw naam is, groote Koning,
Bij ons te recht gepreezen,
Zoo is uw roem gereezen,
En bij de volken zeer vermaard,
Tot aan het uiterst eind der aard.
Uw rechtehand, die 't kwaad niet duldt,
Is met gerechtigheid vervuld.

Dat Sions berg weêrgalm' van vreugd;
Laat Iudaas dochters zijn verheugd;
Wijl Gij haar' vijand sloegt in 't strijden.
Gaat Sion rond aan alle zijden;
Telt al de vestingwerken
En torens, die 't versterken;
Ia ziet, met een oplettend oog,
Paleizen steigren hemelhoog,
En stout verduuren al 't geweld,
Opdat gij 't aan uw kroost vertelt.",Psalm 048 Datheen,Haarlem,../../data/dbnl/_boe008boek01_01.xml
177729,_boe008boek01_0051,1774,1774.0,1016227,55555555,mvvmmvmv,AbbACdCd,5A 5b 5b 5A 5C 5d 5C 5d,.5A   .5b   .5b   .5A   .5C   .5d   .5C   .5d,,9,8,"Genaê, o God, genaê, hoor mijn gebed;
Verschoon mij toch naar uw barmhartigheden;
Delg uit mijn schuld, vergeef mijn overtreeden;
Uw goedheid wordt noch paal noch perk gezet.
Ai! wasch mij wel van ongerechtigheid:
Mijn schuld is zwaar, ik heb uw wet geschonden;
Zie mijn berouw, hoor, hoe een boetling pleit,
En reinig mij van al mijn vuile zonden.

Want ik gevoel de grootheid van mijn kwaad;
Mijn zonde zie 'k mij steeds voor oogen zweeven:
'k Heb tegen U, ja U alleen, misdreeven;
Uw' wil en wet, hoe heilig, stout versmaad.
Ik heb gedaan, dat kwaad was in uw oog;
Dies ben ik, Heer, uw gramschap dubbel waardig:
'k Erken mijn schuld, die U tot straf bewoog;
Uw doen is rein, uw vonnis gansch rechtvaardig.

't Is niet alleen dit kwaad, dat roept om straf;
Neen, 'k ben in ongerechtigheid gebooren;
Mijn zonde maakt mij 't voorwerp van uw' tooren,
Reeds van het uur van mijn ontfangnis af.
Zie, Gij hebt lust tot waarheid in 't gemoed;
Gij, Heer, die weet al wat ik heb misdreeven;
Gij, die mijn' geest met wijsheid hadt gevoed,
En in mijn ziel uw godlijk licht gegeeven.

Ontzondig mij met yzop, en mijn ziel,
Nu gansch melaatsch, zal rein zijn en geneezen:
Wasch mij geheel, zoo zal ik witter weezen
Dan sneeuw, die versch op 't aardrijk nederviel.
Ai! geef mij weêr gewenschte zielevreugd;
Laat uit uw' mond mij stof tot blijdschap hooren;
Zoo wordt op nieuw 't verbrijzeld hart verheugd,
En in mijn' geest de waare rust herbooren.

Verberg uw oog van mijn bedreeven kwaad,
Waardoor mijn ziel gevoelt de diepste wonden:
Delg, delg toch uit mijn schuld en al mijn zonden,
En spreek mij vrij van mijne gruweldaad.
Herschep mijn hart, en reinig Gij, o Heer!
Die vuile bron van al mijn wanbedrijven;
Vernieuw in mij een' vasten geest, en leer
Mij aan uw' dienst oprecht verbonden blijven.

Verwerp mij van uw aangezicht toch niet:
Ai! laat van mij uw' heilgen Geest niet scheiden;
Die kan alleen op 't rechte spoor mij leiden.
Bestier mijn' gang, daar Gij mijn zwakheid ziet.
Geef mijn gemoed, dat nu angstvallig vreest,
De blijdschap weer; doe op uw heil mij hoopen;
Laat mij, gesterkt door eenen eedlen geest,
Volvaardig 't pad van uw geboden loopen.

Dan zal ik elk, die 't heilspoor bijster is,
Vrijmoedig al uw rechte wegen leeren;
De zondaar zal zich dan tot U bekeeren,
En scheppen moed uit mijn behoudenis.
O God! Gij God mijns heils, vergeef mijn schuld,
Mijn bloed-schuld toch, hoe billijk ook te doemen;
Dan zal mijn mond, met zangstof weêr vervuld,
Uw heilig recht, gepaard met goedheid, roemen.

Heer, open Gij mijn lippen door uw kracht,
Zoo zal mijn mond uw' lof gestaâg vermelden;
Geen offer kan voor mijne zonden gelden;
Behaagd' U dat, straks wierd het U geslagt.
Indien Gij lust in brandend' offren hadt,
Dan wierd het vuur door mij gewis ontstooken;
Ik spaarde dan noch zorg, noch vlijt, noch schat,
Maar zou 't altaar van offervee doen rooken.

Gods offers zijn een gansch verbrooken geest,
Door schuldbesef getroffen en verslagen:
Dit offer kan uw heilig oog behaagen;
't Is nooit, o God! van U veracht geweest.
Doe Sion wel, laat om mijn' zwaaren val
Uw goedheid niet van zijne burgren wijken;
Bouw Salem op, laat nooit zijn' muur en wal,
Door uwe straf, voor 's vijands magt bezwijken.",Psalm 051 Datheen,Haarlem,../../data/dbnl/_boe008boek01_01.xml
177749,_boe008boek01_0063,1774,1774.0,1016227,44444444,mvvmvmmv,AbbAcDDc,4A 4b 4b 4A 4c 4D 4D 4c,.4A   .4b   .4b   .4A   .4c   .4D   .4D   .4c,,6,8,"O God! Gij zijt mijn toeverlaat;
Mijn God, U zoek ik met verlangen,
Zoo ras wy 't morgenlicht ontvangen,
Bij 't krieken van den dageraad:
O Heer! mijn ziel en lichaam hijgen,
En dorsten naar U in een land,
Dat, dor en mat, van droogte brandt,
Daar niemand laafenis kan krijgen.

'k Heb U voorwaar in 't heiligdom
Voorheen beschouwd met vrolijk' oogen:
Hoe zag ik daar uw alvermogen;
Hoe blonk uw godlijk' eer alom!
Want beter dan dit tijdlijk leven
Is uwe goedertierenheid:
Och! wierd ik derwaards weêr geleid,
Dan zou mijn mond U d'eere geeven.

Dan zou ik, voor uw godlijk oog,
Uw deugden al mijn leven prijzen,
En in uw' naam mijn' zang doen rijzen;
Mijn handen heffen naar omhoog.
Mijn ziel zou nieuwe kracht ontvangen,
Verzadigd, als met vet en smeer;
Mijn mond zou U vol vreugd, o Heer!
Verheffen in zijn lofgezangen.

Wanneer ik, op mijn legersteê,
Aan U gedenk in stille nachten;
Dan peinst mijn ziel met al haar krachten,
Hoe Gij voorheen in angst en wee,
Als mij de vijand wild' omringen,
Mij vaardig zijt ter hulp geweest;
Dies zal ik nu ook, onbevreesd,
In schaduw van uw vleuglen, zingen.

Mijn ziel kleeft U standvastig aan;
Gij ondersteunt mijn zwakke schreden;
Uw rechtehant vol moogendheden
Doet mij getroost en veilig gaan:
Maar dezen, die mijn ziel begeeren,
Opdat ik tot verwoesting raak',
Staan bloot voor uw geduchte wraak;
Zij zullen haast ten afgrond keeren.

Men zal die boozen, door 't geweld
Van 't scherp gewette zwaard, doen sneeven,
En aan de vossen overgeeven,
Ter prooi alom in 't open veld.
Maar 's Konings hart zal zich verblijden
In God, die 't gansch heelal regeert;
En elk, die heilig bij Hem zweert,
Zal zijne trouw met roem belijden.",Psalm 017 Datheen,Haarlem,../../data/dbnl/_boe008boek01_01.xml
177755,_boe008boek01_0066,1774,1774.0,1016227,44444444,vmvmvmvm,aBaBcDcD,4a 4B 4a 4B 4c 4D 4c 4D,.4a   .4B   .4a   .4B   .4c   .4D   .4c   .4D,,9,8,"Juich, aarde, juich, met blijde galmen,
Den grooten Schepper van 't heelal:
Zing d' eer zijns naams, met dankbre psalmen;
Verhef zijn' roem met lofgeschal.
Zeg: “o! hoe vreeslijk zijn uw werken!
Gij doet uw wijdgeduchte kracht,
O God! aan al uw haaters merken,
Die veinzend buigen voor uw magt.”

Al 't aardrijk smeek' U, neêrgeboogen;
Het heff' de schoonste psalmen aan;
Gezangen, die uw' naam verhoogen,
De glorie van uw wonderdaên.
Komt, allen, ziet Gods wijze wegen;
Wat is zijn werking hoog geducht,
Het zij Hij 't menschdom met zijn' zegen
Bezoekt, of met zijn strenge tucht!

God baande, door de woeste baaren
En breede stroomen, ons een pad;
Daar rees zijn lof op stem en snaaren,
Nadat Hij ons beveiligd had.
Hij zal eeuw uit eeuw in regeeren:
Zijn oog bewaakt het heidendom.
Hij zal d' afvalligen verneêren:
Hij keert hun trotsch' ontwerpen om.

Looft, looft den Heer der leegerschaaren,
O volken! heft een' lofzang aan:
Hij wil ons in het leven spaaren,
Ons hoeden op de steilste paên,
Voor wanklen onzen voet bevrijden.
Gij hebt ons voor een' tijd bedroefd,
En ons gelouterd door het lijden,
Gelijk het zilver wordt beproefd.

Een net belemmerd' onze schreden;
Een enge band hield ons bekneld;
Gij liet door heerschzucht ons vertreeden;
Gij gaaft ons over aan 't geweld.
Hier scheen ons 't water t' overstroomen;
Daar werden wij gedreigd door 't vuur:
Maar Gij deedt ons 't gevaar ontkomen,
Verkwikkend' ons, ter goeder uur.

Door 's Hoogsten arm 't geweld onttoogen,
Zal ik, genoopt tot dankbaarheid,
Verschijnen voor zijn heilig' oogen,
Met offers, aan Hem toegezeid.
Ik zal, nu ik mag adem haalen,
Na zoo veel bangen tegenspoed,
Al mijn geloften U betalen,
U, die, in nood, mij hebt behoed.

Ik zal het brandaltaar doen rooken
Van 't edelst' vee uit kooi en stal;
Zoo worden vet en merg ontstooken,
Bij 't lieflijk rijzend lofgeschal.
Het rookwerk zal zijn geur verspreiden,
Daar ram bij ram wordt aangebragt:
'k Zal bok en rund ten offer leiden,
Opdat men z' U ter eere slagt'.

Komt, luistert toe, gij godgezinden,
Gij, die den Heer van harte vreest,
Hoort, wat mij God deed ondervinden;
Wat Hij gedaan heeft aan mijn' geest.
'k Sloeg, heilbegeerig, 't oog naar boven:
Ik riep den Heer ootmoedig aan;
Ik mogt met mond en hart Hem looven,
Hem, die alleen mij bij kon staan.

Waar' ik door ongerechtigheden
En haar aanlokselen bekoord;
Dan had de Heer naar mijn gebeden
En jammerklagten niet gehoord.
Maar nu, nu heeft, met gunstig' ooren,
Mijn God op mijnen wensch gelet.
Hij, die het al kan zien en hooren,
Merkt' op de stem van mijn gebed.",Psalm 118 Datheen,Haarlem,../../data/dbnl/_boe008boek01_01.xml
177773,_boe008boek01_0072,1774,1774.0,1016227,43434343,vmvmvmvm,aBaBcDcD,4a 3B 4a 3B 4c 3D 4c 3D,.4a   .3B   .4a   .3B   .4c   .3D   .4c   .3D,,10,8,"Geef, Heer, den Koning uwe rechten,
En uw gerechtigheid
Aan 's Konings zoon, om uwe knechten
Te richten met beleid:
Dan zal Hij al uw volk beheeren,
Rechtvaardig, wijs, en zacht;
En uw ellendigen regeeren;
Hun recht doen op hun klagt.

De bergen zullen vrede draagen,
De heuvels heilig recht;
Hij zal hun vrolijk op doen daagen
Het heil, hun toegezegd.
't Ellendig volk wordt dan uit lijden
Door zijnen arm gerukt;
Hij zal nooddruftigen bevrijden;
Verbrijzlen, wie verdrukt.

Zij zullen U eerbiedig vreezen,
Zoo lang er zon of maan
Bij 't nageslacht ten licht zal weezen,
En op en ondergaan.
Hij zal gelijk zijn aan den regen,
Die daalt op 't laate gras;
Aan droppels, die met milden zegen
Besproeien 't veldgewas.

't Rechtvaardig volk zal weelig groeien:
Daar twist en wrok verdwijnt,
Zal alles door den vrede bloeien,
Tot dat geen maan meer schijnt.
Van zee tot zee zal Hij regeeren;
Zoo ver men volkren kent;
Men zal hem van d'Eufraat vereeren,
Tot aan des aardrijks end.

Het woeste volk zal voor Hem knielen:
Zijn vijand lekt het stof;
En Tharsis voert, met rijke kielen,
Geschenken naar zijn hof:
Met giften zullen langs de stroomen
De Koningen der zee,
En Scheba nevens Seba komen,
Hem smeekend' om den vreê.

Ia elk der vorsten zal zich buigen,
En vallen voor Hem neêr;
Al 't heidendom zijn' lof getuigen,
Dienstvaardig tot zijn eer.
't Behoeftig volk, in hunne nooden,
In hun ellend' en pijn,
Gansch hulpeloos tot Hem gevlooden,
Zal Hij ten redder zijn.

Nooddruftigen zal Hij verschoonen;
Aan armen, uit genaê,
Zijn hulpe ter verlossing toonen:
Hij slaat hun zielen gaê,
Als hen geweld en list bestrijden,
Al gaat het nog zoo hoog:
Hun bloed, hun traanen, en hun lijden,
Zijn dierbaar in zijn oog.

“Zoo moet' de Koning eeuwig leeven!”
Bidt elk met diep ontzag:
Men zal Hem 't goud van Scheba geeven;
Hem zeegnen dag bij dag.
Is op het land een handvol koren,
Gekoesterd door de zon;
't Zal op 't gebergt geruisch doen hooren
Gelijk de Libanon.

De stedelingen zullen bloeien,
Gelijk het malsche kruid;
Zijn naam en roem zal eeuwig groeien.
Ook zal, eeuw in eeuw uit,
Het nageslacht zijn grootheid zingen,
Zoolang het zonlicht schijn':
Hun zal een schat van zegeningen,
In Hem, ten erfdeel zijn.

Dan zal, na zooveel gunstbewijzen,
't Gezegend heidendom
't Geluk van dezen Koning prijzen,
Die Davids troon beklom.
Geloofd zij God, dat eeuwig Wezen,
Bekleed met moogendheên;
De HEER, in Israël gepreezen,
Doet wondren, Hij alleen.",Psalm 065 Datheen,Haarlem,../../data/dbnl/_boe008boek01_01.xml
177774,_boe008boek01_0073,1774,1774.0,1016227,44444444,mmvvmmmm,AAbbCCDD,4A 4A 4b 4b 4C 4C 4D 4D,.4A   .4A   .4b   .4b   .4C   .4C   .4D   .4D,,14,8,"Ja waarlijk! God is Isrel goed,
Voor hun die rein zijn van gemoed:
Hoe donker ooit Gods weg moog' weezen;
Hij ziet in gunst op die Hem vreezen.
Maar, ach! hoe wel mijn ziel dit weet,
Mijn voeten waren, in mijn leed,
Schier uitgeweeken, en mijn treên
Van 't spoor der godvrucht afgegleên.

Ik zag met nijdig' oogen aan,
Hoe dwaazen hier op roozen gaan;
En hoe godloozen in hun gangen
Al veeltijds rust en vreê erlangen:
Zij weeten van geen traanenbrood;
Van geene banden, tot hunn' dood;
Hun kracht is frisch, zij zijn gezond,
Tot op hunn' laatsten avondstond.

Zij weeten doorgaans van verdriet
En moeit', als andre menschen, niet;
Men ziet hen bittre smert noch plaagen,
Als andre stervelingen, draagen:
Dies zijn ze trotsch, en doen den waan,
Gelijk een gouden keten, aan:
't Geweld, dat deugd en pligt versmaadt,
Bedekt hen, als een praalgewaad.

Indien men op hunn' voorspoed let,
Hun oogen puilen uit van vet;
Hun weelde, wat zij zich belooven,
Gaat hun verbeelding nog te boven.
Zij mergelen de menschen uit,
En spreeken, trotsch op roof en buit,
Steeds uit de hoogte van hun magt,
Terwijl hun hart de deugd belacht.

Hun mond tast zelfs den hemel aan,
Gods albestuur schijnt hun een waan;
Terwijl hun tong op aarde wandelt,
Geen mensch ontziet, maar elk mishandelt.
Daarom keert zich Gods volk hier toe,
En schrikt, wanneer hun, bang te moê,
Het water, daar hun niets gelukt,
Met bekers vol wordt uitgedrukt.

Dan peinst de ziel: is 't waar, zou God
Ook weeten van mijn droevig lot?
Zou d'Allerhoogste van mijn klaagen
En bittre rampen kennis draagen?
Ziet dezen, hoe godloos en wreed,
Zijn evenwel bevrijd van leed;
De rust volgt hen op al hun paên,
En hun vermogen groeit steeds aan.

Zoo heb ik dan vergeefs gestreên;
Mijn hart gezuiverd, en gebeên;
Vergeefs heb ik in reine plassen
Van onschuld mijne hand gewasschen:
Want al den dag ben ik geplaagd;
Mijn ziel verschrikt, mijn boezem jaagt;
En nooit verscheen er morgenstond,
Waarop ik geen kastijding vond.

Zoo ik dit zeggen staaven zou,
Gewis, dan waar' ik niet getrouw
Aan 't waard geslacht van uwe kindren,
En zou hun hoop en moed vermindren.
Nochtans heb ik, met al mijn kracht,
De Godsregeering overdacht;
Maar 't was een stuk, dat, in mijn oog,
Mij moeilijk viel en veel te hoog.

Dit duurde, tot ik uit dien drom
Van neevlen ging in 't heiligdom,
Om met de godspraak raad te pleegen:
Daar zag ik, op wat gladde wegen
De voorspoed zelfs de boozen leidt,
En, hoe G' in 't eind hunn' val bereidt.
Zij storten van den top van eer
In eeuwige verwoesting neêr.

Hoe worden zij, tot ieders schrik,
Vernield, als in een oogenblik!
Hoe moeten zij het leven enden,
Van angst verteerd in hun ellenden!
Hun weeld' is als een droom vergaan.
O Heer!, wanneer Gij op zult staan,
Zult Gij hun toonen, onverwacht,
Hoe Gij hun ijdel beeld veracht.

Toen 't zwellend hart met ongeduld
En wrevel' afgunst werd vervuld,
En ik geprikkeld in mijn nieren,
Om trotsch mijn drift den toom te vieren;
Was mijn verstand van licht beroofd:
Ik heb Gods waarheid niet geloofd;
Maar was, door mijn' verwaanden geest,
Bij U een onvernuftig beest.

'k Zal dan geduurig bij U zijn,
In al mijn nooden, angst en pijn;
U al mijn liefde waardig schatten,
Wijl Gij mijn rechtehand woudt vatten.
Gij zult mij leiden door uw' raad,
O God, mijn heil, mijn toeverlaat!
En mij, hiertoe door U bereid,
Opneemen in uw heerlijkheid.

Wien heb ik nevens U omhoog?
Wat zou mijn hart, wat zou mijn oog
Op aarde nevens U toch lusten?
Niets is er, daar ik in kan rusten:
Bezwijkt dan ooit, in bittre smart,
Of bangen nood, mijn vleesch en hart,
Zoo zult Gij zijn voor mijn gemoed
Mijn rots, mijn deel, mijn eeuwig goed.

Wie, ver van U, de weelde zoekt,
Vergaat eerlang, en wordt vervloekt:
Gij roeit hen uit, die afhoereeren,
En U den trotschen nek toekeeren;
Maar 't is mij goed, mijn zaligst lot,
Nabij te weezen bij mijn' God:
'k Vertrouw op Hem, geheel en al,
Den HEER, wiens werk ik roemen zal.",Psalm 073 Datheen,Haarlem,../../data/dbnl/_boe008boek01_01.xml
