recordid,songid_DBNL,jaar_eind,jaar_begin,bronid,rijmaccent,rijmgeslacht,rijmschema,strofeschema,strofeschema_plus,trefw_genre,aantal_strofe,verstal,text,melodienorm,plaats,filepath_DBNL
13903,_spa002spar02_0084,1646,1646.0,1000945,3333311133,mvmvmmmmmm,AbAbCDDDCC,3A 3b 3A 3b 3C 1D 1D 1D 3C 3C,.3A   .3b   .3A   .3b   .3C=  .1D/+ .1D/+ .1D/  .3C=  .3C,drinklied,3,8,"MUseaus en luminez,
Cher en fans de la traille,
Nous sommes destinez,
Pour faire ycy marveille,
Allons, le verre en Main.
Buvons, buvons, buvons,
Allons le verre en Main
Buvons jusq’á de main.

Sus Sus mes cher amis,
Qu’un chacun se resveille,
Faut il estre en dormis,
En voyant la boutaille,
Allons le verre, &c.

Si quelq’un ne boit point,
Il faut qu’il se retire,
Je veux que mon pourpoint,
Creue á force de rire,
Allons le verre, &c.",Museaux enluminés,Haarlem,../../data/dbnl/_spa002spar02_01.xml
13976,spey001syon02_0050,1670,1670.0,1000946,333333333,mmvvmmmmm,AAbbCCDDC,3A 3A 3b 3b 3C 3C 3D 3D 3C,.3A   .3A   .3b   .3b   .3C   .3C   .3D   .3D   .3C,geestelijk lied,3,9,"GOdt! die den dag en nacht.
In hare order bracht.
Ginck aen den Hemel stichten,
Soo veele suyvre lichten
De heldre Son, en Maen,
Die om de werelt gaen
De Sterren met haer glans,
Die door den Hemel, gans
Cierelijck verspreyt staen.

3.	Wat flickert meenig licht?
Soo klaer in ons gesicht,
Des nachts in duysternisse,
Als wy de Sonne missen.
Is 't Firmament soo schoon?
Hoe heerlijck is Gods Troon,
Daer 's Vaders aensicht straelt?
Daer onsen Koninck praelt?
Daer krijgt mijn ziel de kroon.

4.	O vrome! die hier leeft,
En onder boose sweeft,
Geeft uwen klaren luyster,
Als Sterren in het duyster,
Elck van uw geve licht
U tong, en wandel, sticht'
De blinde kromme schaer:
Dan sult ghy Zonne klaer
Blincken, voor Gods aensicht.",Psalm 097 Datheen,Middelburg,../../data/dbnl/spey001syon02_01.xml
19462,veen010zinn01_0059,1642,1642.0,1000974,444444,vvmvvm,aaBccB,4a 4a 4B 4c 4c 4B,4a 4a 4B 4c 4c 4B,bruiloftslied,26,6,"IK en vvil niet turelueren
Op een Rietjen nieuwe kueren,
Met een ongemeen gheluyt;
Noch veranderen van wesen,
Maar gelijk ik plach te vvesen,
Speelen op myn oude Fluyt.

Die geen beter Rijkdom rekent
Als te mogen zyn getekent,
In het groote Harder-boek,
O! waar ik daar in gheschreeven,
'k Ruylde myn een vuldigh leeven,
Niet voor 't alder-Cloekste cloek.

Noch voor al de Zuyder-Landen,
Die met Peru zyn in handen
Vanden Moorder den Maraan,
Noch voor d'Africaansche Mijnen,
Want dit moet en sal verdwijnen,
Maar het ander blyven staan.

O ghy Vrecken, oghy Slaeven,
Die u Zielen hebt begraven,
In 't vergankelijk Metaal,
Als u kloot is uyt-geloopen,
Kunt ghy gheen uyr leevens koopen,
Voor u schattenal al-te-maal.

Al u vroeten, al u ploeghen,
Doet verarmen ughenoeghen,
't Is ghelijk het spreek-woordt seydt,
Veel te hebben dat doet haken,
Om aan eens soo veel te raken,
Rijkdom stopt'gheen gierigheydt.

Dus myn Musa laat ons wijken
Vande Hooven vande Rijken,
Vande steedsche praal en pracht,
Laat ons met de Boere Knaapjes,
Looven 't hoeden vande Schaapjes,
En ons kleeden met de Vacht.

Laat ons climmen na de hooghte.
Dat wy moghen op de drooghte,
Brenghen ons sachtmoedigh Vee,
Daar de wel ghebooren zielen,
Die de Wolven over-vlieden,
Woonen t' saam in rust en vree.

Woonen t'samen met genuchten,
Vry van kommer, vry van suchten,
Vry van lyden en ghevaar,
Dees' haar alder-slimste daaghen,
Soude'een Koningh wel behaagen,
Javvel coopen kost hy maar.

Hierom Harders vander Heyden,
Di ebe mint de brede vveyden,
En de nacht Voor Sonne schijn,
Moet ik u gheselschap myen,
Soud' ik myne Cud' bevryen,
'k Most op hooger vveyden zyn.

'k Most ter rechter hant gaan dryven,
En op 't smalle paatjen blyven,
Soo verdooltmen niet soo licht,
Maar al eer ik tre vvat varder
Moet ik groeten eenen Harder
Die hier by vvoont in het Sticht.

Wel vvat sie ik ginder vvoelen?
Wel vvat isser te krioelen?
't Schijnt verbannen is de druk,
Wel hoe vrolijk zyn die menschen
Wel hoe gaat het op een vvenschen,
Arent Mari: veel geluk.

Soude vvel den Harder Arent,
Die int Wout noch vvoonde 't jarent,
Om te leeren kennen 't Kruyt,
Syn ghevanghen door de minne,
Sou de soete Harderinne
Maritje vvel zyn de Bruyt?

't Is gewis, 'k hoeft niet te vragen,
Want ik sie haar 't Kransje draghen,
Dat haar't opper-hooft begroent,
En bene'en naar wangen bloofen,
Even als twee roode Roosen,
Even ofse waar gesoent.

Dit baart my gheen quaat ghenoegen,
'k Mach my by 't geselschap voegen,
Ey! hoe net heb ik't gepast
Sulke Waters, sulke Vissen,
Op een Bruyloft moet me dissen,
Dapper moeter zyn ghebrast.

IK en sal gheen breef spel wesen,
Harders kom wilt u ghenesen,
Met Conserf van Hase- Vis,
Met Extract van Callekoenen,
En de Compost van Capoenen,
'k Wed dat dit Probatum is.

Marmelaad van Jonghe Duyven,
En lulep van Fransch druyven,
Met Candy ghedisteleert,
Gheconfijte Hoender-Bouten,
Met wat Cappers over-souten,
O myn Vrienden dat laxeert,

Mostert-Pillen van Sausyfen,
Inghenomen met Patrysen,
En het poeder van een Schaap,
Met twee stoopen Wijns ghedronken,
O dat zyn derechte vonken,
Om te raken tot den slaap.

't Pulvriseersel van Pasteyen,
En Composita van Vleyen,
Met den Labis Marse-seyn,
En Siroop van warme Taarten,
Bruykt dit niet, gantsch Ele-caarten,
Alle dinghen zyn niet reyn.

Maar de Maaghden ende Vrouwen,
Moghen dit op goeder trouwen
Vry ghebruyken wel gherust,
'k Sal de reden daar van schryven,
't heel goet voor jonghe Wyven,
En voor d'onghewoone lust.

Oly van ghebacken Vladen,
En de Gomma van Sucaden,
En het sap van Spaansche Pap,
En Podrigo van Banketten,
Dat kan vreemde lust beletten,
Dit is daar van d'ey ghenschap.

'k Wed u wondert al te samen,
Dat een Harder slecht van namen
Soo veel Tuyghs heeft voort ghebroch,
Van Recepten en secreeten,
'k Heb door 't menich vuldigh eeten,
Van myn leeven veel besocht.

'k Heb ook met verscheyden dranken,
Soo ghesonde Luy als kranken,
Menichmaal bescheyt ghedaan,
Daar van leerd' ik d'Operaci,
En de rechte Beurs Purgaci
Meesterlijk en wel verstaan.

Dan ghy Harders en Hand'rinnen.
Van verscheyden smaaken sinnen,
Van verscheyden Aart en Proef,
Wilt u selven toch niet pynen,
Gulsigh hier te medicijnen.
't Soud' u bind'ren aan de schroef.

Na het salven van de Nieren
Op de wijse en manieren,
Ende zeden van het Velt:
Laat ons onse harten keeren,
Tot den Opper-Heer der Heeren,
Die 't al bouwt en neder-velt.

Die ons heeft gheleent het leeven,
Niet als om hem eer te gheven,
Laat ons prijsen met ootmoet,
Laat ons danken ende loven,
Ende bidden daar en boven,
Dat hy dit Iongh' Paar behoet.

Dat hy door syn milde gaven,
Wil haar swacke zielen laven:
Groote Schepper weest haar stijl,
O ghy Heere der Heyrscharen
Wilt ghenadelijk bewaren,
ARENT en MARIA PYL.",Iets moet ik u Laura vragen,Amsterdam,../../data/dbnl/veen010zinn01_01.xml
19597,font031ario01_0063,1645,1645.0,1000980,33334353,mmmmmvmv,ABABCdEd,3A 3B 3A 3B 4C 3d 5E 3d,.3A   .3B   .3A   .3B   .4C   .3d   .5E   .3d,loflied,2,8,"EEn Arends flonkkeroog,
Boord door ‘et hooge zwerk,
Zo uitermaten hoog;
Maar tis een ander werk:
Wen Karileen ziet in mijn hart,
En schetterstraad van binnen,
Fa la la la la la la la la la.
In ‘t diep pit van mijn zinnen.
De waezem, die heur lipp
Zo zuiver schoon ontvloeid,
Ruikt als een Rooze klip
Met Hemeldauw besproeid.
Geen grager zuikker heeft een By,
Vol geuriger vermoogen,
Fa la la la la la la la la la.
Als hare Ademtogen.

GEen Amberwanten of fluweelen,
En konnen zo gevoelig streelen,
Als ene strooking aan ‘er wang’:
Heur hals, en blote Boezems tipjes,
En tgun ‘er speeld op oog en lipjes
Ist keurig zaft, tgun ik omvang.
Tvernougen tgun de Goden geven,
En kan in geen meer wellust zweeven,
Als, wen ik zuig die voedbre zugt,
Die zoete Nektarlijkke droppen,
Die my, wijl zy mijn harta’er proppen,
Vol Hemelvli’en, doen zo veel vrucht.
Geen Orgel klank, of zangk der Kooren,
En is zo angenaam te hooren
Als ‘t rinklen van ‘er lieve keel.
Geen Tijmbelspel geen Luit of znaren,
En konnen zulk een hoorlust baaren
Als Karileen, in’t minste deel.",Gelijk een roosje teer,Haarlem,../../data/dbnl/font031ario01_01.xml
19599,font031ario01_0065,1645,1645.0,1000980,212212222221221212,mmmmmmmmmmmmmmmmmm,AABAABBCBCCCDDDCCD,2A 1A 2B 2A 1A 2B 2B 2C 2B 2C 2C 1C 2D 2D 1D 2C 1C 2D,.2A + .1A   .2B   .2A + .1A   .2B   .2B + .2C   .2B + .2C   2C + .1C   .2D   .2D + .1D   .2C   .1C + .2D,"liefdeslied
klaaglied",2,11,"MYn lief, mijn hart// dat smart
Door ‘t geen ‘et lijd,
En blijft zoo hard// benart
Van tijd tot tijd;
Om datge zijt// een, die my haat,
En my benijt// zo groot een baat:
Ik bid u laat// dit quaad,
En word eens goed;
Blijft niet als
roet// onzoet,
Ga na mijn raad,
En zmaad, en straf gemoed.
Mijn liefde stond// gegrond,
Iuist, op dien dag
Toen ik u vond// gezond
Zo net op ‘t slag:
Dien blijden dag// die heugtme lang,
Dat ik u zag// zo trots, maar strang!
Nu word ik ang// en bang,
Wijl gy my dood!
En laatm’ in nood// zo groot:
Ai, schoone, vang,
(Dats gang) my in u schoot.

Zo liefde, liefde mist, en, moet ‘er Liefste derven,
Wat weg voor liefde dan te quinen, of te sterven?",Gaillarde Vlaanderland,Haarlem,../../data/dbnl/font031ario01_01.xml
19866,born006gees01_0028,1645,1645.0,1001024,33333333,vmvmmmmm,aBaBBCBC,3a 3B 3a 3B 3B 3C 3B 3C,.3a   .3B   .3a   .3B   .3B   .3C   .3B   .3C,"bruiloftslied, geestelijk",7,8,"GEluck moet u toekomen
Bruydegom en Bruyt eerbaer,
Gods vrese uytgenomen
Laet in u lichten klaer,
Op dat ghy soo hier naer
Als de Son blincken meught,
Met Gods verkooren schaer
In die eeuwighe vreught.

2 Als Godt Hemel en Aerde
Hadde geschapen wijs,
Adam een vat van waerde,
Na sijn beelde propijs,
Schiep Godt, en sprack 't abbijs,
Ten is niet goet certeyn
(Na Schrifturen bewijs)
Dat die Mensch blijft alleyn.

3 Ick wil hem hulpe maecken,
Die by hem wesen sal,
In slaep deed hy gereacken
Den mensch, een int getal,
En nam tot zijn geval
Een ribbe uyt zijn lijf,
Waer van in 't aertsche dal,
Hy schiep Eva zijn Wijf.

4 Hier uyt soo kond ghy weten
Dat die staet eerlijck zy,
Godt sal u ongemeeten
Geven weldaden bly,
Hy heeft oock selven vry
Dees Staet alsoo vereert,
Binnen Cana, daer hy 
Water in wijn verkeert.

5 Ghy die tweewaert verscheyden,
Een vleesch geworden zijt,
Door des Heeren beleyden,
Die 't alles in dit krijt
Soo regeert en vlijt,
Dat hy als Godt getrouw,
Noch oock op deser tijdt
Geeft yeder zijn Huysvrouw.

6 Malkanderen wilt niet haten,
Noch twist met gekijf.
Maer als heylige baten
Leven, dat by u blijf
Gods segen, end u Wijf
Sal hy maecken vruchtbaer,
Dat ghy sult sien te lijf
Kindts Kindren veel hier naer.

7 Prins Bruydegom verheven,
Als 't hooft 't lichaem regeert,
Soo met sachtmoedicheden
O Bruyt oock visiteert,
Vrou Bruyt is Man ge-eert
Van u laet wesen vry,
Soo sult ghy onverseert
Altijt leven seer bly.",Fortuin helaas,Amsterdam,../../data/dbnl/born006gees01_01.xml
20000,_ams013amst03_0045,1655,1655.0,1001025,43434343,mmmmmmmm,ABABCDCD,4A 3B 4A 3B 4C 3D 4C 3D,.4A   .3B   .4A   .3B   .4C   .3D   .4C   .3D,bruiloftslied,2,8,"DIt is dien dach, dien vreughde Feest,
Waer naer ons Ziele tracht:
Dit is de blijdtschap die ons Geest
Verweckt tot nieuwe kracht
De Lent is niet soo aengenaem.
Naer guere Winter-weer;
Als te verkrijgen Bruyd’goms naem
Met sulcke vreucht en eer.

3   De Bruyt sal ’t u verklaren wel,
Als ghy komt morgen weer,
‘k Wed dat ghy haest sult volgen snel
Ons Bruytjes les, mijn leer:
Ey wilt, o Nimphjes! nae dit pas
Noch trots, noch stuyrigh zijn,
Maer maken dat de Ionghmans ras
Ontbonden zijn van pijn.",Prins Robberts mars,Amsterdam,../../data/dbnl/_ams013amst03_01.xml
20058,_ams013amst02_0003,1654,1654.0,1001026,33633112112112,mmmmmvvmvvmvvm,AAABBccBddBeeB,3A 3A 6A 3B 3B 1c 1c 2B 1d 1d 2B 1e 1e 2B,.3A   .3A   .6A   .3B   .3B   .1c + .1c + .2B   .1d + .1d + 2B   .1e + .1e + .2B,politiek lied,9,8,"O Gy die ‘t werelts-recht
Verheft, en weder slecht!
Verschoon ’t oprecht versoek van uw geboge Knecht;
Gy stiet uyt Eng’lands Throon
Den Vader, en den Soon.
O Karel! o Parel van Engelands kroon!
Wy missen den Vader, en hebben den Soon,
En knielen voor Stuarts gemartelde Throon.

2   ’t Huys, dat mijn Scepter schent,
Verwoed, moort sonder endt,
De Slijpsteen schen-schut is, de byl het Parlement.
O dier-vergote bloed,
Hoe knaegtge mijn gemoed!
Wy t’uwaert, O Stuart! ons wenden, heb moed,
Dien stoorders, en moorders, hoe hevig verwoed,
Den honing van Konings bloed wisselt in roet.

3   O God-vergete eeu!
Gy saegt de laetste geeu
Van Vader, my ten hoon, en schricking voor den Leeu;
Wie yst niet voor ’t verhaal?
O block! o duyvels staal!
Gerechtigheydt vecht, en pleyt, ‘t laaghste verhaal,
Uw’ degen, door segen, doet swaren de schaal,
Ey! smacht niet in klachten, maar wacht op uw’ staal.

4   Uw’ Vader die, om hoog,
Op ’s Heeren Hemel-boog,
Den Scepter swaait, roept wraak: Help appel van sijn oog:
Wie ken u wederstaen?
Ick gesp het Harnas aan.
De Galgen ree walgen, Schavotten, en Raân,
En micken versticken; de Ravens haar laân,
En proppen ‘er kroppen, nae ’t koppen afslaan.

5   Doch sie de wraak alree
Haar kling van dubb’le snee,
Om gordden… Hemel druck de trotzheydt onder Zee.
Schaf uytkomst, goede Godt,
En keert ’t Rampspoedigh lot.
Al kneusen de Reusen den edelen strot
Uw’s Vaders; verraders geprangt en geknot,
Steets klampen haar rampen aan ’t schamper schavot,

6   ’t Onwinbaar Hollands Beest
Voor beesten nooit bevreest,
Vecht voor haar vrye tuyn, en ick ben self geweest
D’invoerder van uw’ kroon.
D’invoerder van mijn hoon.
‘t Voorleden is, heden, gegleden ter zy;
Wy brachten ’t Geslacht van ons Harder in ly,
Maar gisten geen listen van Aarts dwinglandy.

7   Mijn moeder werdt verschopt,
Den burger naeu verkropt
Sijn tranen; moortsucht onderwijl haar ooren stopt.
Ach Broeders! Susters, ach!
Hoe knackt men ons gesach!
De vrancken haar Rancken besproien met gal:
En steenen, en weenen met het Leeuwen-dal,
En sweeren te weeren der Karolen val.

8   Geef krachten aan mijn hand,
Geef, Heer, dat ick de schand,
En scha, versette van mijn kroonloos Engeland;
Toon datge wettig schent
’t Onwettig Parlement.
Wilt smoren uw toren, en horen mijn beê,
En stuuren mijn Buuren verwinning, en vreê,
En schenden de benden der schenders op Zee.

9   O gy, die ‘tHemels-recht
Wel buygt, maar nimmer slecht!
Verhoor ‘t oprecht versoeck van uw’ geslechte knecht,
Her-recht sijn slechte staat,
En vecht voor Stuaarts zaat.
So leven wy, even als eertijdts, in rust,
En geven het leven, vrywillig, met lust,
Voor Karel, de parel van Engelandts kust.",O Cromwell,Amsterdam,../../data/dbnl/_ams013amst02_01.xml
20100,_ams013amst02_0045,1654,1654.0,1001026,33633112112112,mmmmmvvmvvmvvm,AAABBccDeeDffD,3A 3A 6A 3B 3B 1c 1c 2D 1e 1e 2D 1f 1f 2D,.3A   .3A   .6A   .3B   .3B   .1c + .1c    2D   .1e + .1e + 2D   .1f + .1f + .2D,"dialooglied, wereldlijk",3,9,"NEen dat sal niet geschien,
Die boosheyt sal ik vlien,
‘k Had liever datje vloogt voor hondert en voor tien,
Dat ik mijn maeghdom zou
V geven op een Trouw.
Wat schaet het, wel laet het 
dan, binje niet groen,
Ick vraeghtje, behaeghtje niet, spreeck met fatsoen,
Ick weter, een beter, die sal het wel doen.

2   Och! Liefste benje quaet?
Ia omje malle praet,
Dat jy mijn kleen versoeck, soo op een botz afslaat.
Kom an, ick bent te vreen,
Gane wy samen heen,
Nae ’t bedtje, ick wedje, 
nu niet en sel gaan.
O! ja ick, nu gae ick, ick heb my beraen.
Ay! Gaet niet, soo quaet niet, ick bidtje blijft staen.

3   Wel kom dan kliedje uyt,
Soo benje voort de Bruydt.
Dat men dan op het Bed oock voort het Houlijk sluyt.
Wel nou kom treet maer in,
Soo doeje van mijn zin,
Laet rusten, met lusten, 
my in uwen schoot,
Kom hartje, ick tartje, gantsch sackereloot,
Ist moorden, dit boorden, soo steeckt my vry doot.",O Cromwell,Amsterdam,../../data/dbnl/_ams013amst02_01.xml
20114,_ams013amst02_0059,1654,1654.0,1001026,43434343,mmmmmmmm,ABABCDCD,4A 3B 4A 3B 4C 3D 4C 3D,.4A   .3B   .4A   .3B   .4C   .3D   .4C   .3D,loflied,5,8,"2   Gy vraagt me Minnaar na het beeld,
Het welck my so behaagt,
Sy is het, dien ick heb gestreelt,
En in haar hart my draagt.
Sy? wie? een beeld so overschoon,
So herelijck van spraack,
So glory-rijck, ja self die Goon
Verstrecktse tot vermaak;

3   Twe putjes nevens hare mond
Inwijcken, als sy lacht,
Sy bloost gelijck de morgenstond
Der lenten na de nacht.
Haar hals, met hemels-dau genet,
Dat ’s uchtends nedervalt,
Gelijckt het alderwitst’ Himet,
’t Welck met den hagel bralt.

4   Den ommering van ’t aangesicht
Is op sijn pas geront,
Ia self de Son met al haar licht
Nooit vlammen-volder stont,
Twee heuvels sonder wederga,
So blanck als swanen-prael,
Die volgh ick, sonder veerder, na,
En knopjes van coraal.

5   Dies ick my na geen rijckdom wen,
Nooit Vorst was so gerust,
Noch so geluckich, als ick ben,
Wen sy haar Minnaar kust;
De trou-Godin wijckt in gestel,
De rechting van aar leen,
Geneester van mijn minnewel,
Ick vier uw’ Godd’lijckheen.",Prins Robberts mars,Amsterdam,../../data/dbnl/_ams013amst02_01.xml
20352,targ004haer01_0005,1647,1647.0,1001034,45222252222422224,mmmmmmmmmmmmmmmmm,AABCBDDEEEFFGGGHH,4A 5A 2B 2C 2B 2D 5D 2E 2E 2E 2F 4F 2G 2G 2G 2H 4H,4A    5A    2B +  2C    2B +  2D    5D   .2E +  2E    2E + 2F    4F    2G +  2G    2G +  2H   .4H,,3,11,"WAerde Kuysheyt, Hemels Kint,
Van den Heer en yder een bemint:
Wiens gepronck // wiens gegluer //
En ghelonck, En gelaet
Is der Deughden Allerhooghsten graedt:
Het is een Deugt,, 't Is een vreugt //
Die de Jeught Meer bepraeldt,
Als het Goudt, Hoe seer 'et straeldt:
't Is een schat // Die het padt //
Nae de Stadt henen leydt,
Daer men noyt ween-ooght, snickt, of schreyt.

2 Ioseph, Spiegel van de Ieught,
Deftigh beeldt van eerbaerheydt en Deught;
Sedigh hert // Die de schimp
En de smert // Van de Vrouw'
Vaeck wou lijden // En noch blijven trouw;
Die Liever vloodt // In de noodt,
Totte doodt // Dan u Heer
Gantsch te brenghen // Tot on-eer:
Die u zinn'// Op 'er Minn'
En ghewinn'// Niet en hecht',
Maer u droegh // Trouw, ghelijck een Knecht.

3 Lof eerwaerde Kuyscheydts glans,
Ghy verdient een versse Rose-krans,
En een Croon // Op u hooft,
Tot een loon // Voor u strijt:
Om dat ghy ons // Soo een Voorbeeldt zijt,
Op Kuyscheyts baen // Die wy gaen
Nu voortaen // Stadigh voort
Moeten treden // Alst behoort:
Lof ô! Helt,, Die in 't velt
Hebt ghestelt // Al u macht,
En de lust,, Heel hebt t'onderbracht.",Tweede Carileen,Haarlem,../../data/dbnl/targ004haer01_01.xml
20362,targ004haer01_0015,1647,1647.0,1001034,345553344,mmmmmmmmm,AABBCCDEE,3A 4A 5B 5B 5C 3C 3D 4E 4E,".3A    4A   ,5B    5B   ,5C   .3C 3D 4E 4E",,5,9,"WEl hoe komt dat men jou
Soo siet rennen nae de Trou?
Wel wat heeft u toch hier toe aengheport,
Datje soo u soete tijdt verkort?
Wel wat is het toch, heeft de dronckenschap,
Of heeft de malle klap
V hier in verstrickt?
Soete Man, wat gingh jou aen,
Dat jy 't Trouwen dorst bestaen?

2 Daerje oock selver weet,
Datter lichtlijck is ghereet
Binnen 's Jaers yet Jonghs, dat beneemt u rust,
Als 't u alderbest te slapen lust.
Als ghy zijt vermoeyt van u arrebeydt,
Dan leydt dat goedt en schreyt;
Dan moet gaen de Wieg: 
Soete Man, wat ging jou aen
Dat jy 't Trouwen dorst bestaen?

3 Waer 't hier mee al ghedaen,
Maer daer schort noch vry meer aen;
Daer moet de Pap-pot, Wiegh, en Kack-stoel zijn,
En de Lueren voor het Kindekijn,
En de Luere-mandt, met de Baecker-mat,
En noch ick weet niet wat
Dat daer toe behoort:
Soete Man, wat gingh jou aen,
Dat jy't Trouwen dorst bestaen?

4 't Waer recht bilck datmen 't leed',
Soo 't noch eenigh voordeel deed':
Maer dit ist profijt 't geen het u dan doet,
Dat u Vrouw de Lueren spoelen moet:
Dat is wel een saeck om op voort te gaen,
Hier op niet langh beraen,
Maer gedaen in 't kort: 
Soete man, wat gingh jou aen,
Dat jy 't Trouwen dorst bestaen.

5 Seght eens recht, ofje nou
Niet wel licht onttrouwen sou:
Soo het kon gheschien, 'k twijfel niet daer an,
Of je denckt wel vaeck, waer ick 'er van:
Maer 't is nu gheschiedt, 't moeter nu mee voort;
Had ick nae raedt ghehoort,
Soo waer ick noch vry:
Och, och, och, wat gingh my aen,
Dat ick 't Trouwen gingh bestaen.",Rozemond waar gij vliedt,Haarlem,../../data/dbnl/targ004haer01_01.xml
20364,targ004haer01_0017,1647,1647.0,1001034,43434343,mmmmmmmm,ABABCDCD,4A 3B 4A 3B 4C 3D 4C 3D,.4A   .3B   .4A   .3B   .4C   .3D   .4C   .3D,,5,8,"HOe suyv're Reynheyt God behaegt,
Dat kan men klaerlijck sien:
Want als SUSANNA wierdt belaeght,
Van Goddeloose Spien,
Wees haer de Heer en groote Godt,
Een wegh en open baen,
Dat sy tot aller Boeven spot,
Mocht suyver henen gaen.

2 Maer laes! de Vrome lijden noch,
Schoon heur gheen sond' en quelt:
Susanna wierdt door valsch bedrogh,
Voor 't hooghe Recht ghestelt.
Maer siet: door Daniels wijsen raedt,
En sijn voorsichtigheydt,
Wordt heel en al de slimme daedt,
Ontdaen, en bloot gheleydt.

3 De onschuldt leydt de vrome staegh,
En rechtse altijdt op:
In voeghen dat deselfde plaegh,
Haer vaeck noch treft den kop.
Susanna heeft 'er eere weer,
En yder gheeft 'er lof:
Maer dese Guyten zijn omveer
Ghestooten, in 'et stof.

4 Susannes lof en luyster blinckt,
Om datse suyver was.
Maer Fielten! uwen name stinckt,
En leydt in vuyle asch:
V snoo vervloeckte geyle lust,
Is door 'et vinnigh zwaert,
(Dat u vermoorde) uytgheblust,
Ghy waert niet anders waert.

5 Dit is een onghelijcken loon,
Die Godt den menschen gheeft:
Den desen krijght een goude Kroon,
Die hier Godtvruchtigh leeft.
Den genen krijght een sware straf,
Die Goddeloosheydt doet:
Om dat hy noyt ghehoor en gaf,
Aen 't eenigh Opper-goedt.",Hoe zuivere reinheid God behaagt,Haarlem,../../data/dbnl/targ004haer01_01.xml
20366,targ004haer01_0019,1647,1647.0,1001034,242424247224,vmvmvmvmmvvm,aBaBcDcDEffE,2a 4B 2a 4B 2c 4D 2c 4D 7E 2f 2f 4E,2a 4B 2a 4B 2c 4D 2c 4D 7E 2f 2f 4E,,5,12,"ACh wat plagen!
Ontrouw wort nu hoogh ghekroont.
'k Moet beklagen,
Dat men goedt met quaedt beloont:
Want de loosheydt
Van het wispeltuerigh breyn,
En haer boosheydt
Is nu leyder seer ghemeyn.
Meest der Vrouwen sinnen Voor ons ongebrijp'lijck zijn:
Dees sal smeken,
Die haer spreken;
Elck koockt ons een boos fenijn.

2 Dees seydt Hartje,
Daer mijn lust en sin nae tracht;
Agh men smartje,
'k Heb soo langh op jou ghewacht:
Mijn beminde,
Saeghje my eens in de grondt,
Jy soud' vinden,
Datje al gheschreven stondt
In mijn Hart en Nieren: soume niet wel meenen recht,
Maer haer wercken
Doen bemercken
Datse spotten met de Knecht.

3 Die sal toonen
Wrevel-moedt, en stuersheydt quaedt,
En beloonen
Reyne Liefd' met bitt're haet:
Voor wel spreecken
Groeten met een nors ghekijf,
Voor soet smeecken
V schier vallen op het lijf:
't Waer noch al te lyen nam't in 't eynde maer een keer,
Maer met klappen,
En besnappen
Nemensy dan noch u eer.

4 'k Sou wel wenschen,
Dit vermomde onghediert,
Dat als Menschen
Soo in onse ooghen swierdt,
Hare mommen
Van haer aensicht wierdt ghedaen,
Soo sou kommen
Dat men eerst mocht veylligh gaen,
Sonder eenigh vresen van bedrogh of klapperny,
Daer och armen
Droevich karmen,
Die nu legghen in de ly.

5 'k Wil noch rommen
Eerbaer Maeghden, schoons' haer sin
Wat verblommen,
Want dat voeght wel by de Min,
En het vryen
Wordt door Jae en Neen ghevoedt:
't Is te lyen
In een toe-gheneyght ghemoedt.
Dus verliefde Minnaers, houdt dit voor een regel-maet;
Wilje Vryen
En bedyen,
Aght gheen Dochters eerste praet.",Quam Mariam dulcibus,Haarlem,../../data/dbnl/targ004haer01_01.xml
20374,targ004haer01_0027,1647,1647.0,1001034,43433333,mmmmvmvm,ABABcDcD,4A 3B 4A 3B 3c 3D 3c 3D,.4A   .3B   .4A   .3B   .3c   .3D   .3c   .3D,,3,8,"NOu heb ick vastelick e docht //
Te vryen dat'et klinckt:
En 't sel oock wesen haest volbrocht,
Jae eerder dan je dinckt.
Nou mijmeren staeg mijn sinnen,
alleenich op jou, men Trijn;
Ick wilder, en selder je minnen,
Al sou 'et me schadelijck zijn.

2 Wel Trijntje, soete bolle Mayt,
Heb ick (mit eer in Trouw)
Niet sommes teuge jou e sayt:
Get Maysje wordt men vrouw?
Maer jy en wouwet niet willen
Maer say gheduerigh, jou Vaynt,
Laet blijven, laet loopen jou grillen,
Ick siene wel datjet niet maynt.

3 Maer datj'et qualijck hebt e raen,
Is klaer, ghelijck den dagh:
Wanght noch en wil ick niet af staen,
Maer doe noch as ick plach;
Jae en ick souw'et schier sweeren
By Groote-moers  kouw-gerief,
Dat ickke niet aers en begheere
As jou, men Trijntje, men Lief.",Wanneer de zon zijn paarden ment,Haarlem,../../data/dbnl/targ004haer01_01.xml
20381,targ004haer01_0034,1647,1647.0,1001034,44441134,vmvmmmmm,aBaBCCDD,4a 4B 4a 4B 1C 1C 3D 4D,4a    4B    4a    4B   .1C + .1C    3D    4D,,6,7,"WIs ghy hadd'et spel verloren,
Hippomenus aerdigh gast,
Maer ghy kond' de Maeght bekoren,
Daerse wel me was ghepast:
Met Goudt, 't gheen bouwt
Liefd' en soete Min;
't Goudt heeft groote krachten in;

2 Konsten, wijsheydt, goede Zeden,
Deught, gheleertheydt, kloeck verstant,
Tucht en welghekamde Reden
Raecken in een hoeck en kant;
Maer Goudt,, dat houdt
Ende plant de Min:
't Goudt heeft groote krachten in.

3 Die een Vrijster thans wil vrij'en,
Soo hy niet veel Goudt en heeft,
Wis soo sal hy niet bedy'en,
Schoon sijn doen nae deughde streeft:
Maer Goudt,, dat trouwt,
En dat bouwt de Min:
't Goudt heeft groote krachten in.

4 Is een Meysje scheef, of scheeltjes;
Isse bruyn ghelijck een kaeuw:
Isse swart, of isse geeltjes,
Isse grijs, of isse graeuw:
Soo 't Goudt,, bedouwt
Heure slimme le'en,
't Knechjen isser me te vre'en.

5 Gheen soo groven, botten Lompert:
Gheen soo overdommen Loer:
Gheen soo dobbel slechten Plompert,
Tart de Kinckel of sen Moer:
Soo 't Goudt,, maer smout
Sijne bottigheydt,
Soo ist knoopjen haest gheleydt.

6 'k Weet niet of ick nu wil suchten,
Met den droeven Heraclijt,
Of dat ick met veel ghenuchten,
Lacchen wil met Democrijt,
Om 't Goudt,, 't gunt stout
Ider maeckt in Min:
't Goudt heeft groote krachten in.",Hei hoe helder schijnt het maantje,Haarlem,../../data/dbnl/targ004haer01_01.xml
