recordid,songid_DBNL,jaar_eind,jaar_begin,bronid,rijmaccent,rijmgeslacht,rijmschema,strofeschema,strofeschema_plus,trefw_genre,aantal_strofe,verstal,text,melodienorm,plaats,filepath_DBNL
178642,halm002davi01_0038,1707,1707.0,1015988,424424,vvmvvm,aaBccB,4a 2a 4B 4c 2c 4B,4a 2a 4B 4c 2c 4B,,22,6,"LAat uw straffe op my niet blaaken,
Noch my naaken,
Heer, in uw verbolgentheit.
Matig toch myn smarte in 't lyden,
En 't kastyden,
Datge in grimmigheit bereidt.

2 Want uw scherpe pylen klieven,
En doorgrieven
Myn gebeente en ingewandt.
'k Ben benaaut en zeer beneepen,
Aangegreepen
Van uw wraak en slaande handt.

3 Daar wordt niet geheels gevonden,
(Door myn zonden)
In myn vleesch. uw gramschap gloeit.
'k Vind geen ruste in myne beenen,
D'oogen weenen,
Omdat steedts myn lyden groeit.

4 Want myne ongerechtigheden,
Booze zeden,
Gaan my verre boven 't hoofdt;
Ik kan haren last niet draagen,
Door uw slagen,
En 't gewigt van kracht berooft.

5 'k Ben vol stinkende etterbuilen,
Die vervuilen.
En verzweeren door 't gezwel.
Wegens myne dwaaze daaden,
Quaade zaaden,
Strydende met uw bevel.

6 'k Ben gekromt en neêrgebogen,
Als onttogen
Van myn lyfsgestalte en kracht.
'k Moet van droefheit gansche dagen
't Roukleedt draagen,
Zoodat myne ziel versmagt.

7 Want de brandt verteert myn dermen;
Door myn kermen
Slyt myn ooge en 't zwakke lyf.
In myn vleesch is ziel noch leven
Meer gebleven,
Al myn leên staan dootsch en styf.

8 'k Ben verzwakt en als gebroken,
'k Zit gedoken,
Gansch verbryzelt, in elendt.
'k Brulle van 't geruisch myns harten,
En myn smarten;
Opdat gy u tot my wendt.

9 Heer, die kent myn wensch en klagten,
Koom verzagten
't Bitter lyden dat ik draag.
Gy kent myn gebeên en zugten,
En de vruchten
Van myn quaale en zwaare plaag.

10 't Hart keert in my om van binnen,
Kracht en zinnen.
Hebben my verlaaten; ook
Is het licht zelf van myne oogen
My ontvloden:
'k Ben verdroogt als door den rook.

11 'k Wordt van ydereen verlaaten,
Op de straaten
Staan myn vrienden van myn huis.
Myn bestaanden zyn verlegen,
Neêrgezegen
Door myn leet en bitter kruis.

12 Zy, die op myn ziele mikken,
Leggen strikken
Opdat ik geraake in 't leet.
'k Zie hen die myn lyden zoeken,
Zich verkloeken
In 't bederf, voor my gesmeedt.

13 Zy bedenken looze streeken,
Om te steeken:
Maar ik houde my als doof.
'k Ben als stom en wil niet hooren,
Alsze in tooren,
My beloeren tot hun' roof.

14 'k Houde mynen mondt gesloten,
By 't vergrooten
Van hun smaalen op myn quaadt.
'k Hebbe als geene tegenreden,
Alsze ontleeden
Hoe uw handt my drukt en slaat.

15 Want myn hoope en zielsbetrouwen
Zal ik bouwen
Op uw goedheit, magtig Heer:
Gy verhoort my naar myn beeden;
Dekt myn leden
Voor des vyandts moordgeweer.

16 Dat zy zich toch in myn lyden
Niet verblyden,
Zeide ik; want wanneer myn voet
Zoude wanklen, rees hun grootheit,
En hun snoodheit
Tegen my, door 't boos gemoedt.

17 Want ik ben gereedt tot hinken:
'k Moet verzinken
In den grondeloozen put
Van dees' rampen. ja myn harte
Breekt door smarte,
Zoo gy my niet onderstut.

18 Want myne ongerechtigheden,
U beleden,
Maake ik u nu weêr bekent.
'k Ben bekommert en verlegen,
In het weegen
Van myn zonde en zwaare elendt.

19 Maar myn haters groeien krachtig,
Worden magtig,
'k Voel myns vyandts fellen haat,
Zonder oorzaak opgenoomen,
Niet te toomen:
Hy vergroot in eere en staat.

20 Die my quaadt voor goedt beloonen,
En my hoonen,
Staan my tegen; omdat ik
Dagelyks naar 't goede jaage,
En my draage
Dat geen onrecht my verstrik'.

21 Laat uw hulp my niet begeeven,
Doet my leeven,
Och ! verlaat my nooit, ô Heer !
Wees, myn Godt, van my niet verre.
Als een sterre
Straale uw aanschyn op my neêr.

22 Haast u, Heer, om my te vryden,
Uit dit lyden;
Toon my uwe hulpe en kracht.
Heer, myn heil, myn troost, myn leven,
Koom my geeven
't Geen myn ziel van u verwacht.",Psalm 038 Datheen,Amsterdam,../../data/dbnl/halm002davi01_01.xml
178648,halm002davi01_0044,1707,1707.0,1015988,44444444,vvmmmvmv,aaBBCdCd,4a 4a 4B 4B 4C 4d 4C 4d,.4a   .4a   .4B   .4B   .4C   .4d   .4C   .4d,,13,8,"O Godt, wy hebben 't met onze ooren
Gehoort, 't is ons vertelt te vooren
Van onze vadren: gy hebt, Heer,
Een werk gewrocht, tot uwer eer,
In hunne dagen. door uw handt
Hebt gy de Heidenen verdreven
Uit hun bezit, en hen geplant:
De volken plaagde gy daar neven.

2 Doch gy quaamt hunnen staat verhoogen,
Wantz' erfden 't landt niet door hun boogen,
Noch zwaardt; door hunne strydbre vuist
Is 's vyandts krygsmagt niet vergruist,
Noch rees hun heil: maar door uw handt,
En rechterarm is zy verslagen,
't Licht uwes aangezichts; als 't pandt
Dat Isrel was uw welbehagen.

3 Gy zelf, ô Godt, zyt onze Koning;
Wil Jakobs heil uit uwe woning
Gebieden; door u sullen wy
Hen, die niet houden onze zy,
Met hoornen stooten: in uw' naam
Zal Israël met voeten treeden
Die tegen hem gekant zyn. blaam
En schande zal hun' naam bekleeden.

4 Want ik betrouw niet op myn boogen;
Myn zwaardt, schoon blinkende uitgetogen,
Zal my niet redden; gy alleen
Zyt onze hulp en anders geen
Gy vrydt ons van des vyandts magt,
En maakt beschaamt al die ons haaten:
Den weêrpartijders toont ge uw kracht
Ter wraake, en al die u verlaaten.

5 Men hoort den ganschen dag ons roemen
In Godt, en zynen naame noemen
Met lof; wy zullen eeuwiglyk
Dien pryzen in zyn koningkryk.
Maar nu hebtge ons verstooten, Heer,
En onze magt gemaakt te schanden;
Dewyl gy met ons, als weleer,
Niet uittrekt naar des vyandt landen.

6 Men ziet ons heir te rugge trekken,
't Kan zich voor 's vyandts magt niet dekken;
Wy worden jammerlyk berooft,
Door onze haters, hoofdt voor hoofdt.
Gy geeft ons over als het vee,
Als schaapen die men slagt ter spyze;
Wy zyn verstrooit tot aan de zee
By 't Heidendom, naar ballingswyze.

7 Uw volk verkooptze om geen waardye,
Opdat men 't aan de wraake als wye,
't Wordt van u niet verhoogt in prys;
De vyandt eet het op als spys.
Gy stelt ons tot des nabuurs smaadt,
Ten spot en schimp; hy komt ons hoonen;
Wy zyn een spreekwoordt, gansch verhaat,
Van die om onze grenzen woonen.

8 De volken schudden hunne koppen
Thans over ons, dat wy verkroppen,
Met nedrigheit. den ganschen dag
Zit ik in schande en droef geklag.
De schaamte van myn aangezicht
Bedekt my; om de stem des boozen
En lasteraars, die my beticht,
En 't smaadtgeroep der goddeloozen:

9 Van wegen 's vyandts looze streeken,
En hen die eere en trouwe breeken,
Wier hart met wraaklust is vervult.
Dit alles heeft, om onze schuldt,
Ons zwaar getroffen; evenwel
Zoo hebben wy u nooit vergeeten,
Noch tegen uw verbondts bevel
Gehandelt, met een valsch geweten.

10 Ons harte is niet van uwe wetten
Geweeken, om den voet te zetten,
In onze gang, van 't heilig padt,
Dat gy ons aangewezen hadt.
Hoewel wy zyn door uwe magt
Verplettert in een plaats van draaken,
En in 's doodts schaduwe gebragt;
Daar wy naar licht en leven haaken.

11 Zoo wy Godts naam, zyn woordt en reden,
Vergeeten hadden, en beleden
Een' afgodt; ja, met onbescheidt
De handen hadden uitgebreidt
Tot eenen vreemden God; zou Godt
Zulks niet ten naausten onderzoeken;
Daar hy de hartsgeheimen tot
Den grondt kent, in de diepste hoeken?

12 Maar, och ! wy zien ons dooden, keelen,
Als schaapen, om uw woordts bevelen,
Den ganschen dag, en zyn geacht
Als slagtvee, voor de byl gebragt.
Waak op; waarom zoudt gy, ô Heer,
Als slaapen? wil ons niet verstooten
In eeuwigheit, ontwaak; en keer
Het lyden uwer gunstgenooten.

13 Hoe ! zoudtge uw aangezicht verbergen,
Daar heidens stout uw wraakzwaardt tergen?
Zoudtge onze quaalen, zonder end',
Verdrukking, jammer en elend',
Vergeeten? want door 't week gemoedt
Is onze ziel in 't stof gebogen;
Ja onze buik, gansch ongevoedt,
Kleeft zelf aan d'aarde, in onvermogen.",Psalm 044 Datheen,Amsterdam,../../data/dbnl/halm002davi01_01.xml
178661,halm002davi01_0057,1707,1707.0,1015988,55555,mmvmv,AAbAb,5A 5A 5b 5A 5b,.5A   .5A   .5b   .5A   .5b,,7,5,"Zyt my, ô Godt, genadig, want in noodt
Betrout myn ziel op u, zelf in den doodt,
Terwyl ik my stelle onder uwe vleuglen,
Totdat het quaadt, 't geen dagelyksch vergroot,
Voorby zal zyn; dat gy ook wilt beteuglen.

2 'k Zal roepen tot den Allerhoogsten Godt,
Tot Godt, die eens voleinden zal myn lot.
Van 's hemels boog zal hy my hulpe zenden,
Tot myn behoudt, en schenden 's vyandts rot.
Godt zal zyn gunste en waarheit naar my wenden.

3 Myn ziel is in het midden van 't gewelt
Der leeuwen; zy legt onder hen gevelt
Dien yder kent voor felle stookebranden;
Wier tanden men als spiesse en pylen telt;
Hun tong is als een slagzwaardt in hun handen.

4 Verhef, ô Godt, u boven 's hemels trans.
Het aardryk zy vol van uwe eere en glans.
Zy hebben loos een net voor my gehangen.
Myn ziele was gebukt door 's vyandts kans;
Zy poogden my in eenen kuil te vangen:

5 Maar in den kuil, voor my gegraven, zyn
Zy zelfs gestort, met groote schande en pyn.
Dies is myn hart, ô Godt, bereidt te zingen.
Dat uwe liefde en gunst my dan beschyn',
Zoo zal myn zang door lucht en wolken dringen.

6 Waak op, myne eer, waak op gy harpe en luit,
Vermengt u met de keelen en de fluit;
'k Zal opstaan als het daglicht aan zal breeken.
Uw' lof, ô Heer, zal door my zyn geuit,
En 'k zal van dien by vreemde volken spreeken.

7 'k Zal met gezang u loven, magtig Heer.
Want uwe gunst, uw waarheit en uwe eer
Zyn groot in kracht, ja ryzen tot de wolken.
Verhef, ô Godt, uw hoogheit meer en meer:
Uw eere blink' rontom by alle volken.",Psalm 057 Datheen,Amsterdam,../../data/dbnl/halm002davi01_01.xml
178675,halm002davi01_0071,1707,1707.0,1015988,433433,vmmvvv,aBBacc,4a 3B 3B 4a 3c 3c,.4a   .3B   .3B   .4a   .3c   .3c,,18,6,"'k BEtrouwe op u, Heer, met myn harte,
Dat my in eeuwigheit
Geen schaamte zy bereidt;
Maar redtme uit alle leet en smarte,
Door uw gerechtigheden:
Bevry my, naar myn beeden.

2 Neig, Heer, uwe ooren tot myn klagten.
Slaak my van 's vyandts trots.
Wees my een vaste rotz,
Waarin ik altoos kan vernachten.
Gy hebt bevel gegeeven
Tot redding van myn leven.

3 Want gy zy myne rotze en sterkte.
Myn Godt, bevry myn' stant
Van des godtloozen handt,
Van dien, die steedts verkeerdheit werkte,
Heel wrevelig in handel,
En trots in zynen wandel.

4 Want gy zyt, Heer, al myn betrouwen.
'k Steunde op u van der jeugt,
Als Godt van heil en vreugdt;
Van dat ik mogt het licht beschouwen:
Van 's moeders ingewanden
Trokt gy my uit de banden.

5 Ik ben by veelen als een wonder;
Maar gy zyt myne kracht,
Myn toevlucht, hoede en wacht.
Vervul myn' mondt, Heer, in 't byzonder
Met uwen lof en eere;
Dat hy die steedts vermeêre.

6 Laat my uw heerlykheit verbreiden.
Verwerp my niet ten tyt
Dat ik door zwakheit slyt,
Laat, Heer, uw gunst nooit van my scheiden,
Terwyl, door hooge jaaren,
Myn krachten heene vaaren.

7 Want 'k hoore myne haters spreeken,
Van my, en mynen staat,
Zy houden t'zamen raat,
Om listig zich op my te wreeken.
Men loert op myne ziele,
Opdatmen haar verniele.

8 Zy zeggen, Godt heeft hem verlaaten;
Jaagt hem dan na op 't landt,
En grypt hem niet de handt,
Want geen verlosser zal hem baaten.
Uw hulpe, ô Godt, verschyne,
Opdat myn leet verdwyne.

9 Laat hen dan schande en schaamte treffen;
Verteerze die myn quaat
Bevorderen door haat,
En zich stoutmoediglyk verheffen
Om tweespalt te verwekken:
Laat smaadt hen overdekken.

10 Doch ik zal, Heer, gedurig hoopen,
Opdat ik uwen lof
Verhooge aan 't starrenhof.
Myn mondt, ontsloten, blyft steedts open
Om van uw recht te spreeken,
En 't heil aan my gebleken.

11 Ik zal 't den ganschen dag vertellen,
Schoon ik 't getal niet weet.
'k Zal heene gaan, gereedt
In 's Heeren mogentheit, en spellen
Alle uw gerechtigheden
Den volke in alle steden.

12 O Godt, qy quaamt my onderwyzen,
Zelf in myne eerste jeugt,
En leerde my de deugt:
En noch mag ik uw goedheit pryzen,
En melden uwe wondren;
Die door de wereldt dondren.

12 Wil daarom my ook niet begeeven
In gryzen ouderdom;
Totdat myn mondt uitbrom'
De magt van uwen arm den neeven,
Van dit en 't nageslachte,
Ver boven men ooit dachte.

14 Ook is uw recht zeer hoog verheven,
En uw gerechtigheit
Tot 's hemels boog verspreidt;
O Godt, die wondren hebt bedreven;
Wie is gelyk gy t'achten
In groot bedryf en krachten ?

15 Gy die my niet veel angst en quaalen
Bezogt hebt, zult my weêr
Verlevendigen, Heer,
En my uit 's aardryks afgrondt haalen,
Om myne ziel te troosten
Door 't heillicht uit het Oosten.

16 Gy zult myn grootheit ook vermeêren.
Dan zal ik op de luit,
Met harpgezang en fluit,
Uw trouwe roemen en u eeren.
Ik zal u Psalmen zingen
Die door de wolken dringen.

17 O Heilige Israëls, myn lippen
Zal ik tot feestgezang
Besteên myn leven lang:
Het heilgejuich zweeve op haar tippen.
Myn ziele zal u pryzen,
En altoos eer bewyzen.

18 Want gy hebt haar verlost uit banden;
Dat uw gerechtigheit
Den ganschen dag verbreidt
Word' door myn tong. want schaamte en schanden
Zyn 't loon van die my zoeken
Door boosheit te verkloeken.",Psalm 031 Datheen,Amsterdam,../../data/dbnl/halm002davi01_01.xml
178683,halm002davi01_0079,1707,1707.0,1015988,5555333333,vvvvmmvmmv,aabbCCdEEd,5a 5a 5b 5b 3C 3C 3d 3E 3E 3d,.5a   .5a   .5b   .5b   .3C   .3C   .3d   .3E   .3E   .3d,,7,10,"DE heidens zyn, ô Godt, met magt gekomen,
En hebben stout uwe erfnis ingenomen,
Den Tempel van uw heiligheit geschonden,
En uwe stadt, Jerusalem, verslonden
Door 't vier, en haar gestelt
Ten steenhoop; ja op 't veldt
Gestrooit de bleeke lyken
Van uwe knechten, laas !
't Gevogelte tot aas,
Opdat hun wrok zou blyken.

2 Zy gaven 't vleesch van uwe gunstgenooten
't Gedierte. 't bloet, door moordery vergoten,
Vloeide om de stadt Jerusalem als stroomen;
Hun woede, door geen smeeken in te toomen,
Vergunde hun geen graf,
Elk deinsde van hun af.
Dus zyn wy onze buuren
Tot smaadheyt, schimp, en spot;
Dit is het bitter lot
Dat wy rontom bezuuren.

3 Hoe lange, ô Heer ? zult gy in eeuwigheden
Vergramt zyn, en uwe erfenis vertreeden ?
Zal dan uw toorn in yvervlam steedts branden
Gelyk een vier, dat weidt door steên en landen ?
Stort uwen gramschapsgloet
Op 't heidendom, verwoedt
En vreemt van uwe kennis:
De koningkryken, daar
Men u in 't openbaar
Niet aanroept, vol van schennis.

4 Want Jakob heeft men woedende opgegeeten,
Zyn woningen ten gronde neêrgesmeeten,
En gansch verwoest, tot puin, en gruis, en steenen.
Gedenk ons, Heer, die deze breuk beweenen,
Toch niet het voorig quaadt,
En misbedryf: maar laat
Ons uw barmhartigheden
Voorkomen, want wy zyn
Verdunt naar oogenschyn,
Door 't quaadt by ons geleden.

5 Help ons, ô Godt des heils, en waak voor d'eere
Van uwen naam, opdat uw gramschap keere.
Verzoen uw volk, vergeef zyn schuldt en zonden,
Waardoor uw' naam onteert is en geschonden.
Waarom zou 't heidens rot
Stout vraagen: waar is Godt
Hun heilandt ? dat de wraake
Van al 't vergoten bloet
Eens uitspatte als een vloedt,
En zyne koppen blaake !

6 Geef dat wy zulks beschouwen met onze oogen.
Het naar gekerm, dat klinkt aan 's hemels boogen,
Van hen die in de kerkers zyn gevangen,
Koome eens voor u, opdat ze hulpe ontfangen.
Behoudt, in dezen noodt,
De kindren, die ter doodt
Alrede zyn verwezen;
Door uwen arm en kracht,
Opdat het nageslacht
Uw mogentheit mag vreezen.

7 Vergeldt, ô Godt, het nagebuuren smaalen,
Om in hun' schoot, naar rechten, te betaalen,
Zelf zevenvoud', hun bits en schamper spreeken,
Waardoor zy naar uw kroon en hoogheit steeken.
Dan looven wy, uw volk,
Bevrydt van 's vyandts dolk,
De schapen uwer weide,
Uw hoogheit eeuwiglyk,
Verheerlykt in het ryk,
Dat gy voor ons bereidde.",Psalm 079 Datheen,Amsterdam,../../data/dbnl/halm002davi01_01.xml
178685,halm002davi01_0081,1707,1707.0,1015988,333333,mvmmmv,AbACCb,3A 3b 3A 3C 3C 3b,3A 3b 3A 3C 3C 3b,,18,6,"ZIngt bly onzen Godt,
Hy is onze sterkte,
Als die Jakobs lot
Neemt in zyn hoede,
Juigt hem, die 't goede
Steeds voor hem bewerkte.

2 Zingt hem eenen Psalm,
En slaat op den trommel
Heldren toon en galm.
Op harpe en luiten,
En zoete fluiten
Klink' muzykgedommel.

3 In de niewe Maan
Laat bazuinen hooren,
Datmen 't feest voortaan,
Vrolyk ten tyde,
Als 't Godt inwyde,
Viere zonder stooren.

4 Want dat is een wet
Van Godt zelf gegeeven,
Door hem ingezet;
't Recht en de leere
Van Jakobs Heere,
Josef voorgeschreven.

5 Hy heeft dit gestelt
Tot genade-blyken,
Als hy 't boos gewelt
Brak van Egipten,
Dat zy ontslipten,
Toen hy 't deedt bezwyken.

6 Daar heeft het gehoort
Onverstaanbre taalen.
'k Heb zyn' schouder voort
Den last ontheven,
En hem gegeeven
Dat hy aêm kon haalen.

7 Ik ontrok zyn handt
Van den ticheloven.
Als gy, overmant,
Riept in het lyden,
Quam ik u vryden
Door myn hulp van boven.

8 Ik antwoordde uit
's Donders donkerheden,
Met een zwaar geluidt.
'k Proefde u aan 't water,
Dat met geschater
Stroomde naar beneden:

9 Dat te Meriba
Uit de rotz quam vloeien.
Toen zeide ik daar na:
Myn volk wil hooren,
En leen uw ooren,
Dat uw heil mag groeien.

10 Ik zal, Israël,
Onder u betuigen;
Dient, naar myn bevel,
Nooit vreemde Goden;
Wil in uw nooden,
U voor hen niet buigen.

11 Want ik ben de Heer,
Uwe Godt, ik leidde
U, tot myn naams eer,
Uit 's vyandts banden,
En Memfis landen,
In een ruimer weide.

12 Open uwen mondt,
Laat uw hart ontvonken
Naar myn heilverbondt.
Dat myn genade
Uw ziel verzaade,
U van my geschonken.

13 Maar myn volk, verhardt
In zyn booze wegen,
Heeft my steeds gesart;
't Hart op myn wetten
Niet willen zetten,
Als my ongenegen.

14 Dies gaf ik 't, in wraak,
Over aan zyn harte,
Dat het naar zyn' smaak
Leefde en zyn zinnen;
Om 't quaadt te minnen,
Dat myn Godtheit tarte.

15 Och, hadt Israël
My toch willen hooren,
En, naar myn bevel,
Den weg bewandelt,
En trou gehandelt,
Als myn uitverkoren !

16 'k Hadde in korten tijdt
's Vyandts magt verslagen,
Schoon vol woede en spyt;
En zyne benden
Gedempt, in 't wenden
Van myn handt, door plaagen.

17 Zy, die in 't gemoedt
Zelfs den Heere haaten,
Hadden hem te voet,
Geveinst, gevallen;
En geen van allen
Immer hem verlaaten.

18 Maar hun levensstaat
Hadmen lang zien bloeien.
Hy had hun verzaadt
Met tarwe in goedheit,
En honigs zoetheit,
Die de rotz liet vloeien.",Psalm 081 Datheen,Amsterdam,../../data/dbnl/halm002davi01_01.xml
178694,halm002davi01_0090,1707,1707.0,1015988,555555,vvvvmm,abbaCC,5a 5b 5b 5a 5C 5C,.5a   .5b   .5b   .5a   .5C   .5C,,9,6,"GY waart ons van geslachte tot geslachte
Een toevlucht, Heer, van wien men hulp verwachtte,
Een hoog vertrek, in allerlei gevaaren.
Want eerder dan hier immer bergen waren,
Ja voor gy d'aarde en wereldt hadt bereidt,
Beslaatge als Godt, ja van alle eeuwigheit.

2 Gy doet den mensch, hoe hoog in staat en eeren,
Door uw bevel, weêr tot verbrysling keeren:
En zegt met kracht: Keert weder, menschen kindren.
Want gy, ô Heer, wiens jaaren nooit vermindren,
Ziet 's wereldts loop van duizent jaaren aan,
Gelyk een dag of nachtwaake, al vergaan.

3 Gy overstroomt de menschen, en zy derven
Het licht; zy zyn gelyk een' slaap in 't sterven.
Men ziet hen in den morgenstondt hier bloeien,
Gelyk het gras en waterriet in 't groeien;
Doch dat, wanneer het afgesneeden wordt,
Des avondts haast verandert en verdort.

4 Want wy, die in elenden zyn gezonken,
Vergaan in leet, door uwe gramschapsvonken;
Uw grimmigheit verschrikt alle onze leden,
Gy stelt voor u onze ongerechtigheden,
Ons heimlyk quaadt en misbedryf in 't licht
Van uwen troon, en Goddlyk aangezicht.

5 Want onze tydt en dagen vliegen heenen
Door uwen toorn; en zyn zeer haast verdweenen,
Als een gedachte, in 't luchtig ruim gevaaren.
Want wat belangt de dagen onzer jaaren,
Die teltmen wel tot zeventig, of sterk,
Tot tachtig voor des menschen levensperk.

6 Dan zyn ook noch d'uitnemenste van allen
Verdriet, en zorg die ons komt overvallen.
Want onze tydt wordt snellyk afgesneeden.
Wy vliegen heen, door ramp op ramp bestreeden.
Wie kent uw' toorn, dienge over ons verspreidt,
Naar zyne sterkte, of uw verbolgentheit ?

7 Leer ons bedacht zoo onze dagen tellen,
Dat wy ons hart tot uwe vreeze stellen,
En wy, gesterkt, een wys gemoet bekoomen.
Keer weder, Heer, hoe lange doetge ons schroomen ?
't Berouwe u van uw knechten in den noodt,
Geraakt tot aan de poorten van de doodt.

8 Verzadig ons met blydschap in den morgen.
Kom met uw liefde en goedheit ons bezorgen.
Zoo zullen wy verheugt zyn t’allen dagen,
En juichen. Heer verblydt ons na de slagen,
Waarmeê gy ons gedrukt hebt jaar op jaar,
Zoodat het quaadt ons trof in 't openbaar.

9 Laat zoo uw werk aan uwe knechten blyken,
Hun kinderen met hunnen luister pryken,
De lieflykheit en heerlykheit des Heeren
Bestraalen ons, opdat wy hem vereeren.
Bevestig gy dan onzer handen werk,
O onze Godt, ja maak het vast en sterk.",Psalm 078 Datheen,Amsterdam,../../data/dbnl/halm002davi01_01.xml
178707,halm002davi01_0103,1707,1707.0,1015988,555555,vvmvvm,aaBccB,5a 5a 5B 5c 5c 5B,.5a   .5a   .5B   .5c   .5c   .5B,,11,6,"LOof, loof den Heer, myn ziel, en wil hem pryzen,
Laat zynen lof ter lucht en wolken ryzen;
't Geen in my is vermelde zynen naam,
Zoo hoog geacht, zoo groot, zoo ongemeeten:
Loof Godt, myn ziel, om nimmer te vergeeten
Zyn goedheit, die u vrydt van straffe en blaam.

2 Die u vergeeft alle ongerechtigheden,
En 't zondig quaadt, uw krankheit, door de leden
Van 't lichaam zelf verspreidt, in u geneest:
Hy redt u van 't bederf, en spaart uw leven,
Hy kroont u met barmhartigheit daar neven;
Zyn liefde en gunst is u tot heil geweest.

3 Die uwen mondt verzadigt met het goede,
En u altoos een schildt is tot uw hoede;
Die u verjeugt gelyk een' adelaar.
De Heer doet recht en oefent zyn gerichten,
Om hen, die hier verdrukt zyn, te verlichten,
En slaaken uit het uiterste gevaar.

4 Aan Mozes heeft hy zyne wet en wegen
Bekent gemaakt, aan Israël den zegen
Ontsloten van zyn daaden, kloek verricht.
De Heer is goedt, barmhartig en genadig,
Lankmoedig, trou, menschlievend en weldadig,
Die op ons straalt zyn vriendlyk aangezicht.

5 Hy zal altoos niet twisten noch den toren
Behouden, voor het volk by hem verkoren;
Zyn gramschapsvier blaakt niet in eeuwigheit.
Hy doet ons niet naar onze schuldt en zonden,
Noch straft ons, schoon wy strafbaar zyn bevonden,
Maar heeft voor ons het eeuwig heil bereidt.

6 Want zelf zoo hoog de hemel staat van d'aarde,
Is zyne gunst geweldig en van waarde,
Voor allen die hem vreezen met ontzagh.
Als 't Oosten is gelegen van het Westen,
Zoo ver doet hy het misdryf, t'onzen besten,
Van ons, en al ons zondelyk gedrag.

7 Naar 's vaders liefde en zucht is tot zyn kindren,
Ontfermt de Heer, wiens heilstroom nooit zal mindren,
Zich over hen, in wien zyn vreeze woont.
Hem is bewust wat maakzel zyner handen
Wy zyn, slechts aard' en stof, bedekt met schanden;
Hoewel hy ons zyn gunste en liefde toont.

8 Als gras zyn hier de dagen aller menschen,
Gelyk een bloem des veldts, die, voor 't verslenssen,
Staat in haar bloei; bloeit hy in zyne kracht:
Maar als de windt komt over haar gedreven,
Verliest zy strak haar verwe, kracht, en leven,
Zoo dat haar plaats gekent wordt noch gedacht.

9 Maar 's Heeren gunst duurt in all' eeuwigheden,
Zyn goedheit wordt van dien nooit afgesneeden,
Die hem betrouwt; zyn heilsgerechtigheit
Zal altoos aan kindts kinderen beklyven,
Van hen die trou in zyne wegen blyven,
En in 't verbondt, tot afval nooit verleidt.

10 Godt heeft zyn' troon ver boven 's hemels wolken
Gevestigt, hy regeert al 's wereldts volken,
Zyn koningkryk gaat over alles heen.
Looft onzen Godt, gy Engelen, zoo magtig,
Gy Helden, die zyn woordt verricht eendrachtig,
Vol yvergloet, omhoog en hier beneên.

11 Looft Godt den Heer al zyne heirenschaaren,
Zyn dienaars, die getrou zyt in 't bewaaren
Van zyn gebodt, en zynen wille doet.
Looft onzen Heer, ô alle zyne werken,
Wilt zynen lof met eergezangen sterken:
Loof hem, myn ziel, die u met blyschap voedt.",Psalm 103 Datheen,Amsterdam,../../data/dbnl/halm002davi01_01.xml
