recordid,songid_DBNL,jaar_eind,jaar_begin,bronid,rijmaccent,rijmgeslacht,rijmschema,strofeschema,strofeschema_plus,trefw_genre,aantal_strofe,verstal,text,melodienorm,plaats,filepath_DBNL
21727,marn001boec01_0009,1580,1580.0,1000194,4444,mmvv,AAbb,4A 4A 4b 4b,.4A   .4A   .4b   .4b,psalm,20,4,"2. UAn ganscher herten ende cracht
Wil ick hooch prysen dyne macht,
O Heer ick wil tot  allen stonden
Dijn wonder wercken vry verconden.

3. * All' myne vreucht met herten bly
Stell' ick alleen o Heer op dy:
End' dynen naem voor alle dinghen
O hoogste Godt wil ick lofsinghen.

4. * Midts dat mijn vyanden seer fel
Sijn nu te rug' ghekeert wel snel,
So haest dijn aensicht was verschenen
So vielens' omm' ia sy verdwenen:

5. * Want mijn saeck hebstu gae' geslaen
End' mijn recht trouw'lijck voorghestaen,
Du bist op dynen richtstoel weerdich
Gheseten rechter seer rechtveerdich.

6. * Du hebst ghestraft der heydens pracht
End' goddeloosen omm' ghebracht,
Du hebst in eewicheyt te samen
Verdelgt end' uytgheroeyt haer namen.

7. * Is het verwoesten nu voldaen?
Sijn onse steden gants vergaen?
Seggh' vyandt: Sijns' al ne'er ghesmeten,
Is haer' gheheugniss' heel vergheten?

8. * Neen, Neen: de HEER sal eewelijck
Vry sitten in zijn coninckrijck,
End' sal daer synen stoel oprichten
Om alle saecken recht te slichten:

9. * Hy sal de gantsche wereldt breedt
Oordeelen met recht en' bescheet
End' ouer volcken t'alle weghen
Seer billijcke regering' pleghen.

10. * De Heer God sal een toevlucht sijn
Den armen die lijdt druck end' pijn
Een toevlucht in bequame tyden
Wanneer hy steeckt in zware lyden.

11. * Dies die dy kennen, sullen vry
Haer hope gronden vast op dy:
Want wie dy soeckt, Heer, met volherden
Sal van dy niet verlaten werden.

12. * Lof singhet God die eewich leeft
End' in Syon sijn wooningh' heeft.
Gaet onder volcken ende scharen
Sijn wonderdaden openbaren.

13. * Want hy der armen bloet hoog' acht
End' houdt het diep in sijn ghedacht,
Ja kan het schreyen niet vergheten,
Der menschen onder t'cruys gheseten.

14. * Ontferm dy mijns Heer end' behert'
Mijn lyden ende zware smert',
Daer med' mijn haters my verdrucken
End' wil my uyt der doots poort rucken.

15. * Op dat ick dijn lof allemael
In Syons poorten vry verhael',
End' juychen mach end' my verblyden
Om dijn verlossing' in mijn lyden.

16. * De heydens sijn in hare gracht
Die sy my groeuen self versmacht,
Haer voeten sijn int net verwerret
Dat sy my hadden uyt ghesperret.

17. * Daerom wordt God de Heer bekendt
Dat hy dit oordeel heeft volendt
Als dat de boose (wilt het merken)
Verstrickt blijft in sijn eyghen wercken.

18. * De goddeloosen sullen snel
Te rugghe keeren inde hel,
Met al dit volck stout end' vermeten
Die Gods des Heeren gantz vergeten.

19. * Maer God en kan des armen mans
Doch niet vergeten gaer end' gants:
Noch der bedruckten hop' lanckmoedich
En sal niet eewich sijn wanspoedich.

20. * Stae op dan Heer thoon dijn ghewelt,
Dat een swack mensch' niet houd' het velt:
Maer laet de volcken haer vertooghen
In het ghericht voor dynen ooghen.

21. * Jaeg' hun een schroom end' schricken aen,
Op dat sy leeren recht verstaen,
Dat sy niets sijn, hoe sy't oock wenden,
Dan swacke menschen vol ellenden.",Psalm 009 Datheen,Antwerpen,../../data/dbnl/marn001boec01_01.xml
21783,marn001boec01_0038,1580,1580.0,1000194,424424,vvmvvm,aaBccB,4a 2a 4B 4c 2c 4B,4a 2a 4B 4c 2c 4B,psalm,22,6,"2. STraff' doch niet in onghenaden
Mijn misdaden,
Heer, maer hebb' met my ghedult:
Ende zijnd' in toorn' ontsteken,
Wilt niet wreken,
Ouer my mijn swaere schult.

3. * Want dijn pylen afgheschoten
Staen ghesloten
In mijns herten diepsten grondt.
Dijn hant swaer end' onghenadich
Druckt my stadich
End' heeft my gheheel doorwondt.

4. * In mijn vleesch' en is o Vader
Lidt noch ader
D'welck voor dijn toorn' is ghesondt:
Mijn ghebeenten mits mijn sonden
Gantz gheschonden,
Sijn vol onrust t'aller stondt.

5. * Want mijn sonden end' boosdaden
Die my schaden
Rysen bouen mynen kop.
Ende doen my nedersacken
Gh'lijck als packen,
Die men niet kan beuren op.

6. * Dies mijn seeren ende buylen
Seer vervuylen
Werpend' etterende dracht.
D'welck mijn dwaesheyt veroorsaecket
Ende maecket
Dat ick schier van stanck versmacht'

7. * Ick verkrimp' heel end' verkromme
Ja vall' omme
Van last end' van hertenleedt.
Ick moet heele daghen sluypen
End' gaen druypen,
Treurich zijnd' in rouw' ghekleedt.

8. * Want mijn heupen vol ghebreken
Sijn ontsteken,
Met vyer end' vol heeten brants
End' t'vleesch is my gantz met allen
Inghevallen:
Aen my is niet gaef noch gantz.

9. * Dies ben ick swack al te seere
O Godt Heere:
End' verbroken schier van smert'.
Daerom brull' ick met gheruchte
Ende suchte,
Van pijn die ick voel int hert'.

10. * Doch mijn lust end' hert' van binnen
Ende sinnen,
Staen, Heer, voor dy openbaer,
All' mijn suchten ende sorghen,
Onverborghen,
Is dy wel bekent end' claer.

11. * T'herte sweeft my gintz end' weder
Op end' neder,
Soo dat mijn cracht my begheeft.
D'ooghen zijn my inder waerheyt
Sonder claerheyt,
Als een die gheen ooghen heeft.

12. * All' mijn vrienden ende maghen
Sien mijn plaghen,
Van besyden ende dwers.
Myne naeste naghebeuren
Sien my treuren,
End' aenschouwen my van vers.

13. * Maer die my nae't leuen jaghen
Legghen laghen:
End' die my beraden quaet,
Gaen en dichten alle malen
Leughentalen,
Met bedroch end' valschen raet.

14. * Doch het valt m'al in mijn ooren
Sonder hooren,
Want ick houd' m'als doof end' dom.
End' op all' haer valsch aentyghen
Met stil swyghen,
Houd' ick toe den mont als stom.

15. * Als off ick van all' haer woorden
Niet en hoorden:
Houd' ick my gheheelijck stil.
Oft als een die wordt bestreden
End' met reden,
Sijn saeck niet verweiren wil.

16. * Want ick vast in mijn ghedachte
Op dy wachte:
O Heer, mijn troost staet op dy,
Du mijn Godt end' Heer goetdadich,
Salt ghenadich:
Gunstigh' antwoort gheuen my.

17. * Want ick sprack in mijn ghebeden
Dese reden:
Maeck mijn vyanden niet bly:
Want sy sullen met behaghen
Hoomoet draghen,
Soo mijn voet ghestruyckelt sy.

18. * Want soo dijn handt my wilt mincken
Ick moet hincken,
Smadelyck mijn leefdaegh' lanck.
End' steed's sonder op te houwen,
Droeviggh schouwen
Mijn smert end' mijn onderganck.

19. * Heer du sietst dat ick mijn sonde
Dy verconde:
End' verlaghe mynen row'.
Ende dat ick swaerlijck suchte,
Ende duchte,
Voor mijn misdaet seer ontrow'.

20. * Myne vyanden die bloeyen
Ende groeyen,
Hierentusschen in haer cracht.
Ende die my bouen maten,
Nydich haten,
Nemen toe in hare macht.

21. * Die my quaet voor goet verghelden,
End' my schelden,
Vallen teghens my met haet.
Alleen om dat ick in deugden,
Stell' mijn vreugden
End' volgh' een goet opsaet.

22. * Maer du wil my niet begheuen
All' mijn leuen,
Mijn Godt end' ghenadich Heer,
Keer niet van my dyne vrede,
Noch en trede,
Verde van my nimmermeer.

23. * Dyne hulp' wil my toestellen,
End' versnellen,
Dijn ontset in desen strijdt:
Want ick doch van dyner crachte
Troost verwachte,
Du bist mijn hulp alle tijdt.",Psalm 038 Datheen,Antwerpen,../../data/dbnl/marn001boec01_01.xml
26314,marn001boec02_0038,1591,1591.0,1000195,424424,vvmvvm,aaBccB,4a 2a 4B 4c 2c 4B,4a 2a 4B 4c 2c 4B,psalm,22,6,"STraf doch niet in ongenaden
Mijn misdaden,
Heer, maer heb met my gedult:
Wil niet sijnd' in toirn' ontsteken,
Aen my wreken,
Mijne sond' end sware schult.

Want dijn pijlen afgeschoten,
Staen gesloten,
In mijns herten diepsten grondt.
Dijn handt swaer end ongenadich,
Druckt my stadich,
Ende heeft my heel doirwont.

In mijn vleesch en is te gader
Spier noch ader,
(Mits dijn gramschap) wel gesont.
Al mijn beenen sijn geschonden
Mits mijn sonden,
End vol onrust talle stondt.

Want mijn sonden end misdaden,
Die my schaden,
Rijsen boven mijnen kop:
Ende doen my nedersacken,
Als de packen,
Die men niet kan bueren op.

Dies mijn seeren ende buylen,
Seer vervuylen,
Werpend' etter ende dracht,
Dwelck myn dwaesheyt veroorsaket,
Die daer maket,
Dat ick schier van stanck versmacht.

Ick vercrimp heel, end vercromme,
Iae val omme,
So is my het herte flouw,
Ende gae heel dagen sluypen,
Ende kruypen,
Siende swert van swaren rouw.

Want mijn heupen vol gebreken,
Sijn ontsteken,
Iae vol viers end herten brants:
Mijn vleesch is my heel end allen,
Ingevallen,
Aen my is niet gaef noch gants.

Ick gevoel dat ick slabacke,
End verswacke:
Iae ick berste schier van smert:
Dies ick oock op sulcke wijse
Grimm' end grijse,
Iae ick brulle binnen thert.

Doch mijn wenschen, vreesen, duchten,
Ende suchten,
Stel ick Heer, in dijnen schoot:
Dy en is mijn daeglijcx sorgen,
Niet verborgen:
Want du kennest mijnen noot.

Mijn hert sweeft my gins end weder,
Op end neder,
So dat mijn cracht my begeeft:
D'oogen sijn my inder waerheyt,
Sonder claerheyt,
Als die gantz geen oogen heeft.

Mijne vrienden ende magen,
Sien mijn plagen
Van besijden ende dweirs:
Mijne naeste naegebueren,
Sien my treuren,
End aenschouwen my van veirs.

Maer die my nae tleven jagen,
Leggen lagen:
Ende die my berocken quaet,
Spreken ergheyt alle reysen,
End bepeysen
Boosen list end valschen raet.

Maer het valt my in mijn ooren
Sonder hooren:
Ick gelaet my doof end dom:
End op haer versiert aentijgen
Met stilswijgen,
Houd' ick toe den mont als stom.

Als of ick van al haer woorden
Geen en hoorden,
Houd ick my geheelijck stil:
Oft als een die wort bestreden,
End met reden
Sijn recht niet verweiren wil.

Want ick vast in mijn gedachte
Op dy wachte,
Iae verlate my op dy.
Du mijn God en Heer goetdadig,
Salst genadig
Goed' antwoirde geven my.

Want ick sprack: wil om dijn eere
Sulcx doen, Heere,
Dat sy niet en sijn verblijt:
Nademael sy met behagen
hoomoet dragen,
So wanneer den voet my glijt.

Doch ick sie, dat ick gae hincken,
End versincken,
In dees pijn, helpstu my niet:
End moet, sonder op te houwen,
Steets aenschouwen,
Mijne smert end swaer verdriet.

Want dewijl ick mijne sonde,
Dy verconde,
End merck, wat ick heb misdaen,
So wort my mijn hert benouwet,
End my rouwet,
Dat ick my dus heb ontgaen.

Ondertusschen, sietmen bloeyen,
Ende groeyen
Mijnen vyant in sijn macht,
Ende die my boven maten
Vinnich haten,
Nemen toe in hare cracht.

Die my quaet voor goet vergelden,
End my schelden,
Vallen tegens my met haet,
Om dat ick my voir tquaet hoede,
End na tgoede
Trachte, sonder onderlaet.

Maer wil du my in mijn leven
Niet begeven,
Mijn God end genadig Heer:
Keer niet van my dijnen vrede,
Noch en trede,
Verde van my nemmermeer.

Dijne hulp wil my toestellen,
End versnellen
Dijn ontset, in desen strijt.
Want ick, Heer, van dijner crachte,
Troost verwachte:
Du bist mijn hulp alle tijt.",Psalm 038 Datheen,Middelburg,../../data/dbnl/marn001boec02_01.xml
30040,marn001boec02_0081,1591,1591.0,1000195,333333,mvmmmv,AbACCb,3A 3b 3A 3C 3C 3b,3A 3b 3A 3C 3C 3b,psalm,18,6,"SIngt met hertzen vreugt,
Tlof Gods onses Heeren,
Onse sterckt end deught.
Lofsingt claer end hel,
God van Israel
juycht tot sijner eeren.

Koimt aen met gesanck
End met soete snaren:
Datmen hoor tgeclanck,
Van harp end van luyt,
Trommel ende fluyt,
Om God te verclaren.

Op de nieuwe Maen
Steeckt vry de trompetten,
Laet tvolck comen aen,
End met blijden geest,
Vieren onse feest,
Volgens onse wetten.

Want in Israel
Is dit onse wijse:
Ia tis een bevel,
End een recht geset
In Gods Iacobs wet,
Tsijnen lof end prijse.

Die dit oorcondt claer
Steld' in Iosephs palen:
Voerende sijn schaer
Uyt Egypten landt
Daer wy geen verstandt,
Hadden vander talen.

Ick heb hem den last
Vanden hals geschoven
(Sprack hy) ende vast
Trowlijck bygestaen,
End sijn handt ontslaen,
Van sPotbackers oven.

Daer du schier versmoort
Van druck laegst heel t'onder:
Heb ick stracx verhoort
Dijn stem end gekrijt,
End heb dy bevrijt,
Schuylend' in den donder.

Ick heb dy beproeft
Aen den vloet der twisten,
Ende my bedroeft,
Doe ick dy bevondt
Dobbel inden grondt,
End vol arge listen.

Ick sprack, mijn volck hoirt
Ick wil dy getuygen
Mijnen wech end woirt:
Woudstu slechs dijn oor
Bieden tot gehoor,
End thert tot my buygen.

Du salst neven my
Geenen God aenveirden,
Hy sy wie hy sy:
Noch oock jmmermeer
Bieden dienst oft eer
Andren God op eirden.

Want ick ben de Heer
End dijn God genadich,
Groot end machtich seer:
Ick heb dy gebracht
Doir mijn stercke macht
Uyt Egypten smadich.

Doe wijt op, den mont,
Neem aen, mijn weldaden.
End ter selver stont,
Sal ick dy met goet
In all' overvloet,
Vullen end versaden.

Maer mijn volck seer steeg
Keert van my sijn ooren,
So het altijts pleeg:
End Israel blijft
Evenseer verstijft,
End wilt my niet hooren.

Dies geef icks' oock op,
In haer crijgel sinnen
Dat sy haeren kop,
Volgen met der daet:
End naer eygen raet,
Alle dinck beginnen.

Hadde mijn volck doch
My, gehoor gegeven,
Sonder valsch bedroch:
End dat Israel,
Waer nae mijn bevel,
Op mijn baen gebleven.

Ick hadd' also saen,
Al die hen sijn tegen
Doen te gronde gaen:
Ende mijne handt
Haddes' al met schandt,
Plat ter neer geslegen.

Die God wederstaen,
Souden hem al truerich
Hebben dienst gedaen.
Ende sijne jeugt
Had gegroeyt in vreugt,
End vreed eewich duerich.

Ick soud hem kort om
Hebben laten spijsen
Met fijn terwen blom,
End in overvloet,
Hebben honich soet
Doen wt steenen rijsen.",Psalm 081 Datheen,Middelburg,../../data/dbnl/marn001boec02_01.xml
32707,_bli007blij01_0022,1645,1645.0,1001567,44444444,mvmvmvmv,AbAbCdCd,4A 4b 4A 4b 4C 4d 4C 4d,.4A   .4b   .4A   .4b   .4C   .4d   .4C   .4d,"kerstlied
bijbels historielied",3,8,"VVAt gaet u weerde Priester aen,
Dat ghy alree sijn bloet gaet storten?
Oft waer heeft Iesus iet misdaen.
Dat ghy sijn leven wilt verkorten?
Wat Sijn Vader en was Adam niet,
Sijn' Moeder leefde sonder sonden,
'tKindt is onnoosel soo ghy siet,
Waerom dan het soo vroegh gaen wonden?

Dies daghen inde felle kouw
Soo beefden all' sijn teere leden,
De kribb' en stroy viel hem soo rouw,
En nu soo wordt hy noch besneden.
O spaert het doch, 'ten is gheen noodt,
O laet het Kindt sijn bloedt ghenieten,
Het sal't aen't Cruys, en in sijn doodt
Tot een druppel toe vergieten.

Hy neemt eens sondaers teecken aen,
Daer hy niet tot en was verbonden:
Op dat den sondaer sou ontgaen
De slavernije van de sonden,
Hy stort voor alle-gaer sijn bloedt,
Vooralt' die zijn van goede wenschen.
Siet wat den brandt der liefde doet
Godt schenck sijn hert aen alle menschen.
Hy stort.",,Antwerpen,../../data/dbnl/_bli007blij01_01.xml
33169,droo008lang01_0002,1698,1698.0,1010124,2332223224,mmvmmmvmmm,AAbCCDbDEE,2A 3A 3b 2C 2C 2D 3b 2D 2E 4E,2A   .3A   .3b    2C   .2C    2D   .3b   .2D   .2E   .4E,"vreugdelied
danslied",3,10,"",,Brugge,../../data/dbnl/droo008lang01_01.xml
33170,droo008lang01_0003,1698,1698.0,1010124,24234552,mmmmmmmm,AABBCCDD,2A 4A 2B 3B 4C 5C 5D 2D,.2A   .4A   .2B   .3B   .4C   .5C   .5D   .2D,"vreugdelied
kermislied
danslied",3,8,"",,Brugge,../../data/dbnl/droo008lang01_01.xml
33175,droo008lang01_0008,1698,1698.0,1010124,33333333,mmmmmmmm,AABBCCDD,3A 3A 3B 3B 3C 3C 3D 3D,.3A   .3A   .3B   .3B   .3C   .3C   .3D   .3D,loflied,3,8,"",,Brugge,../../data/dbnl/droo008lang01_01.xml
33177,droo008lang01_0010,1698,1698.0,1010124,444444,mmmmmm,AABBCC,4A 4A 4B 4B 4C 4C,.4A   .4A   .4B   .4B   .4C   .4C,verhalend lied,3,6,"",,Brugge,../../data/dbnl/droo008lang01_01.xml
33946,rosa002evan01_0191,1654,1654.0,1011046,555577777,vvvvvvvmm,aabbcccDD,5a 5a 5b 5b 7c 7c 7c 7D 7D,.5a   .5a   .5b   .5b   .7c   .7c=  .7c=  .7D   .7D,"bijbels historielied
loflied, geestelijk",5,9,"LAet ons de liefde van Iesus naerstigh merken,
Die hy betoont heeft in alle sijne werken,
Sonderlingh als hy gingh om voor ons te lijde,
Met vryen wille, met harten wonder blijde,
Gaet hy na Jerusalem met sijn Discipels t'samen,
Sy te met ontrent den Bergh van Oliveten quamen,
Sy te met ontrent den Bergh van Oliveten quamen.
Amor, amor, amor, amor, amor, quam dulcis est amor.
Amor, amor, amor, amor, amor, quam fortis est amor.

2. Sijnde t'Bethphage, sijn Jongers heeft gesonden
Na een Kasteelken, alwaer dat stond' gebonden
Een Ezelinne, en daer by haer jongh meede,
Waer op nogh niemant sijn leeven had gereede,
Bindtse los, en brenght se mijn; wil ymandt u verbieden,
Seght, den Heer heeft haer van doen, hy sal 't laten betieden,
Seght, den Heer heeft haer van doen, hy sal 't laten betieden.
Amor, amor, amor, amor, amor, quam dulcis est amor.
Amor, amor, amor, amor, amor, quam fortis est amor.

3. Dus sijn verhult al de oude Prophetyen,
Boodtschapt aen Sion, uw Koningh komt aen rijen
Tot u saghtmoedigh, op eene jok-gewende
Eselin, en 't jongh dat geene jok en kende.
Sijn Discipels doen alsoo, sy deckens' met haer kleeden,
Daer op setten sy den Heer, dus komt hy aengereeden,
Daer op setten sy den Heer, dus komt hy aengereeden.
Amor, amor, amor, amor, amor, quam dulcis est amor.
Amor, amor, amor, amor, amor, quam fortis est amor.

4. Als d'Joodsche Scharen sijn komst hebben vernomen,
Sijn s' hem t'gemoete met menighte gekomen,
Veel palmen-tacken sy van de boomen sneeden,
Veel op de weegen neerspreyden hare kleeden,
En dus gaen se voor en na, en looven Godt met vreughden,
Want s' in hem hadden gesien veel Goddelijke deughden,
Want s' in hem hadden gesien veel Goddelijke deughden.
Amor, amor, amor, amor, amor, quam dulcis est amor.
Amor, amor, amor, amor, amor, quam fortis est amor.

5. Sy riepen luyde, Hosanna, Davids Soone,
Gebenedijt sy die ons hem komt vertoone,
Israëls Koningh komt in den naem des Heeren,
't Rijke van David komt nu weer in sijn eeren,
Vreede in den Hemel sy, en Glori sy der boven,
En Hosanna, Davids Soon, men Godt moet altijdt loven,
En Hosanna, Davids Soon, men Godt moet altijdt loven.
Amor, amor, amor, amor, amor, quam dulcis est amor,
Amor, amor, amor, amor, amor, quam fortis est amor.",Nooit zulke liefde,Antwerpen,../../data/dbnl/rosa002evan01_01.xml
34159,suet001brus01_0052,1659,1659.0,1011052,3434224,vmvmmmm,aBaBCCC,3a 4B 3a 4B 2C 2C 4C,.3a   .4B   .3a   .4B   .2C   .2C   .4C,drinklied,4,7,"Al die met eere wilt stryden,
Nemet een Hespe voor gheweer,
'tGheschut dat sulde ghy myden,
Vecht met ghelaesen 'tis meerder eer,
Sa, sa, drinckt op,
Giet nat door den krop,
Men danst, en men springht, door de kracht van dit sop.

2. Een teugh met vreughde ghedroncken,
Maeckt ons bly-geestigh ende verstout,
En laet 'tghelasken niet proncken,
Soo ghy van de ghesontheyt hout.
Sa, sa, drinckt op,
Giet nat door den krop,
Men danst, en men springht, door de kracht van dit sop.

3.      Suypt uyt de snel, en, ghelasen,
Brenghet aen my ick sal doen bescheet,
Als ghy't hebt uyt-gheblasen,
Ghy de kracht, ende deucht maer eerst weet,
Sa, sa, drinckt op,
Giet nat door den krop,
Men danst, en men springht, door de kracht van dit sop.

4. Wilt vry u buyckxkens dan vollen,
Suysselt ghy worden u beenen swack,
Valt vry, ghy sult konnen rollen,
Beter als gaen met meerder ghemack,
Sa, sa, drinckt op,
Giet nat door den krop,
Men danst, en men sprinckt, door de kracht van dit sop.",,Brussel,../../data/dbnl/suet001brus01_01.xml
34166,suet001brus01_0059,1659,1659.0,1011052,444433112222,vmmvmmmmvmmv,aBBaCCDDeFFe,4a 4B 4B 4a 3C 3C 1D 1D 2e 2F 2F 2e,.4a   .4B   .4B   .4a   .3C   .3C   .1D + .1D + .2e   .2F   2F   .2e,drinklied,4,10,"Laet ons niet twisten, ofte keyven,
Noch procederen nimmermeer
Laet Hofsche pracht, en eydel eer,
En laet het sotte vryen blyven,
Laet herssens, noch verstant,
Aen gheen sorghe zyn verpant.
Maer schinckt, en drinckt, spoelt de ghelaesen,
Veracht de min,
En 'tHofs ghesin,
Laet 'tkryghs-volck raesen.

2. Waerom? moet-men door sotte grillen,
Syn vrint, oft vyant, van syn lief,
'tWelck elck behaeght is syn gherief,
Elck leeft in vreughden naer syn willen,
Die lust heeft in den dranck,
En acht gheen liefdens dwanck,
Maer lacht, en schacht, by Bacchus baesen,
Veracht de min,
En 'tHofs ghesin,
Laet 'tkryghs-volck raesen.

3. Al die dan vreucht soeckt sonder sorghen,
Preyst, rust, en vré, en vryigheyt,
Die hem van 'tHof, en liefde meydt,
En vindt gheen druck in hem verborghen,
Weest lustigh, en verbleydt,
Soo leeft ghy langhen tydt,
Dus singht, en klinckt, wilt glas uyt-blaesen,
Veracht de min,
En 'tHofs ghesin,
Laet 'tkryghs-volck raesen.

4. Drinckt vrinden dan een teught in't ronde,
Ghetapt uyt d'edel Bacchus vat,
'tIs beter als d'Aptekers nat,
Daer wordt ghesontheydt in bevonden,
Drinckt elck eens rommendom,
Singht lustigh blyft niet stom,
Verheught, in vreught, met Bacchus Baesen,
Veracht de min,
En 'tHofs ghesin,
Laet 'tkryghs-volck raesen.",N'ayons ni procès ni querelles,Brussel,../../data/dbnl/suet001brus01_01.xml
34179,suet001brus01_0072,1659,1659.0,1011052,4444443444,mvmmvmmmmm,AbACbCDDEE,4A 4b 4A 4C 4b 4C 3D 4D 4E 4E,4A    4b    4A    4C    4b    4C   .3D 4D 4E 4E,liefdesklacht,3,10,"Hoort een Minnaer weder klaghen,
Dat het lastigh is om draghen,
Soo te minne soo hy mint,
Hy roept Cupied om ghenade,
Wilt die Maeght ten beste rade,
Heb ick sulcken aen u verdint.
Cupido wat droef ghesucht,
Klemt daer uyt den gront myns ziele,
Ach! myn Dafne neemt de vlucht,
Van my die haer soo bemint,
Wilt ghy my dan heel vernielen,
Heb ick sulckx aen u verdient.
Dat ghy met uwen schicht,
Myn Vrindin niet eens verlicht,
Ghy siet hoe sy van my vliet,
Sy en acht myn suchten niet.

2. Heb ick u dan soo mis-daen,
Dat ghy my doet liefde draghen,
Tot een die my wilt versmaen,
Ach! ick bid 'u om ghenaet,
Soo myn klacht u kan behaghen,
Comt te hulp die ghy verlaet,
En wilt myn stuer Vrindin,
Wat versoeten door u min,
Soo ghy sulcken gonst my gheeft,
Roep ick dat Cupido leeft.

3. Soo myn ziel maer over-denckt.
'tSoet ghelaet van myn Beminde,
Soo wordt ick door min ghekrenckt,
In haer Maeghdelyck ghesicht,
Laet ghy daghelyckx u vinde,
En door-wont my met u schicht,
Met dat ghy zyt soo naer,
Maeckt die Maeght my gonst ghewaer,
Op dat ick naer al myn peyn,
Eens magh haer Beminde zyn.
Die vliedt, van die oprecht bemint,
Die acht de minne-klacht maer wint.",La princesse,Brussel,../../data/dbnl/suet001brus01_01.xml
34187,suet001brus01_0080,1659,1659.0,1011052,5454334334,mmmmmmmmmm,ABABCCDEED,5A 4B 5A 4B 3C 3C 4D 3E 3E 4D,5A    4B    5A    4B    3C    3C    4D    3E    3E   4D,liefdesklacht,3,10,"Hoe veel suchten, hoe veel klachten,
Eer een Maeght dickwils wilt achten,
Hem die haer oprecht bemint,
Sy veracht al syn ghebeden,
Het is morghe lyck als heden,
Tot dat haer de gonst verwint.
Alder-liefste laet u wreetheyt af,
Het valt my jongh hert soo swaer,
Thoont hem liefde, die u liefde gaf,
Met dit soete nieuwe jaer,
Beloont uwen vrient,
Soo hy 't heeft verdient,
Die hier voor u deur nu staet,
En met hert en sin,
Soeckt u weder-min,
Ach! beminde gheeft ghenaet,
2. Ey, denckt eens wat ick heb onder-staen,
In het suer verlede jaer,
Maer ick hoop dat ghy my sult ont-slaen,
Want den soeten tydt is daer,
Wilt toch metter daet,
My thoone ghenaet,
Door u vrindelyck ghesicht,
Dat ick segghen magh,
Ach! beminde, ach!
Hoe is myn hert verlicht.
3. Ick wensch u een saligh soet nieuw jaer,
En aen my daer ick naer tracht,
Dat wy 'tsaemen vrolyck met malkaer,
Moghen leven, hoort myn klacht,
'kBid' u door dat kint,
Dat daer in den wint,
Leydt in eenen slechten Stal,
Dat ghy myne klacht,
Doch niet en veracht,
Maer helpt myn on-gheval.

Die troost verwerft van die hy mint,
Die acht de wanhoop, enckel wint.",Bourrée royale,Brussel,../../data/dbnl/suet001brus01_01.xml
34188,suet001brus01_0081,1659,1659.0,1011052,5555233235,vmvmmmmmmm,aBaBCDDCEE,5a 5B 5a 5B 2C 3D 3D 2C 3E 5E,.5a   .5B   .5a   .5B   .2C   .3D   .3D   .2C   .3E   .5E,"klaaglied, wereldlijk
verhalend lied, wereldlijk",4,10,"Waer heen, waer heen, blyft staen, waer wilt ghy ryden,
Waer heen, waer heen, segh ick met dese Maeght,
O helschen Godt, komt ghy u netten spryden,
Hier op de aert, en vist 'tgheen u behaeght,
Laet af, laet af,
Den roof en dient u niet,
Gaet rooft daer ghy ghebiet,
En pleeght u straf,
Aen die verdint de pyn,
Ghy sult den Soon soo niet van Ceres zyn.

2. Toeft Pluto toeft, dat en magh niet gheschieden,
O dubbel smaet voor my en dese strom,
Soo ick d'belette wil, sien ick u vlieden,
En Proserpina die siet droevigh om,
Naer blom, en kruyt,
d'Welck sy acht voor een pyn,
Die haer ont-vallen zyn,
O. slecht besluyt,
Van u, ô kintsche Maeght,
Dat u 'tgheblomte boven d'eer behaeght.

4. Waer't ghy by my Goddin, ick hulp u klaghen,
Want uwe droefheyt; dat is myn verdriet,
Aen Bergh, en Bosch, aen boomen sult gy't vraghen,
En niemant weet van Proserpina niet,
En gheeft oock vry,
De vruchte d'oorsaeck niet,
Waer van ghy hebt ghebiet,
Waert ghy by my,
U soecken waer gedaen,
En ick helaes, die smilt in my ghetraen.

5. Helaes, myn stem beghint my te begheven,
Myn borst, en schouders, die siet-men vergaen,
Ick voel myn beenen onder 'tlichaem beven,
Niet machtigh om daer op te blyven staen,
Daer ick Goddin,
Eerst was van de Fonteyn,
Moet ick den vloet nu zyn,
Myn hert, en sin,
Verkeert my om, en dom,
Ick vloey helaes, ick vloey met dese strom.",A quoi sert-il de vous dire ma peine,Brussel,../../data/dbnl/suet001brus01_01.xml
