recordid,songid_DBNL,jaar_eind,jaar_begin,bronid,rijmaccent,rijmgeslacht,rijmschema,strofeschema,strofeschema_plus,trefw_genre,aantal_strofe,verstal,text,melodienorm,plaats,filepath_DBNL
1702,_ant001antw01_0106,1544,1544.0,1000000,32532532323333,mvmmvmmmmmvvvv,AbCAbCCDCDeeee,3A 2b 5C 3A 2b 5C 3C 2D 3C 2D 3e 3e 3e 3e,.3A + .2b   .5C   .3A + .2b   .5C   .3C + .2D   .3C + .2D   3e + .3e   .3e + .3e,"liefdeslied
verhalend lied, wereldlijk",5,8,"Ic quam mer gister auont  also mi dochte
Daer moete mi een meysken  een	meysken dat was fier
Ick boot haer goeden auont  met woordekens sochte
Oft ic een vreken met haer mocht maken chier
Si seyde lief coemt schier / en beyt niet lanck
Ic sal gaen boeten tvier  coemt door die ganc
Op dat wt ons verblijen  en laten alle fantasien.
Ende melancolijen  nv ende tot allen tijen

Ic quam met haesten spoede  si sach al omme
Om ende om  al na die nijders quaet
Si sprac met snelle woorden  ic heet v willecome
si toonde mi daer een also fieren gelaet
Si seyde liefken gaet ende weest bedect
Mijn herteken verfraeyt bi dit bancket
Op dat wt ons verblijen  en laten alle fantasien.
Ende melancolijen  nv ende tot allen tijen

Si hief op en si sanck  met also soeten tale
Alsulcken voeysken en had ic nije ghehoort.
Haer stemmeken dat clanck  ghelijcken dye nachtegale.
Met minne so worde mijn hertken so doorboort
Si seyde gaet ongestoort  ick blijf v by
Ten worter niet gehoort  doet v willeken. met mi
Op dat wt ons verblijen  en laten alle fantasien.
Ende melancolijen  nv ende tot allen tijen

Ick lach te nacht bi haer  wi waren alleyne
Gebruyckende daer ons beider sherten lust
Hi seyde lief weest gedachtich die woorde|kens reyne
Die wi te samen in minnen hebben gheblust
Si seyde liefken rust  in die armkens van mijn
Op dattet si ghesust  voor die nijders fenijn
Op dat wt ons verblijen  en laten alle fantasien.
Ende melancolijen  nv ende tot allen tijen

Daer laghen wi twee  wi twee wi mosten scheyden
Het scheyden dat dede ons beyder herte verdriet
Haer oochskens op hem loeghen  haer handekens die si spreyde
Ic bid v mijn alderliefste en segtet immers niet
Wi willen noch te samen  al in dat riet
Wi willen iolijt bedrijuen  spijt al dees nijders diet
Op dat wi ons verblijen  ende laten alle fantasien
Ende melancolijen  nv ende tot allen tijden",Ik kwam maar gisteravond alzo mij dacht,Antwerpen,../../data/dbnl/_ant001antw01_01.xml
1740,_ant001antw01_0144,1544,1544.0,1000000,444444444444,vmvmmvmmvmmm,aBaBCdCCeCCC,4a 4B 4a 4B 4C 4d 4C 4C 4e 4C 4C 4C,"4a   ,4B   ,4a   ,4B   ,4C   ,4d   .4C    4C   .4e   .4C   4C   .4C","verhalend lied, wereldlijk
kluchtlied",4,12,"SYmonet stont voor die poorte
Sinen meester die hi comen sach
Die groote necker met met zijnder soorte
die geue v also quaden dach
Wat segt ghi Lieue knape fijn
Meester ic hiete v wellecome
Moet ic niet een goet bode zijn
Meester ic ben Symonetkijn.
Die van uwer vrouwen camere
draecht het slodt ende het sluetelkijn
En ben ic niet een mannekijn. |
Ende altoos ben ic smoorpot fijn

Symonet ouer tafel was gheseten
Sijn vrouwe brochte spijs ende dranc
Symonet ic laet v weten
Altijt staet ghy in mijn bedanc
Knaep ende meester suldy zijn
Och vrouwe dat sal ic betalen
Moet ic niet een goet bode zijn
Meester ic ben Symonetkijn
Die van uwer vrouwen camere
draecht het slodt ende het sluetelkijn
En ben ic niet een mannekijn. |
Ende altoos ben ic smoorpot fijn

Symonet maecte goede chiere
daer hi op die bedsponde sadt
Die meester maecte die maniere
door een cleyn spleetken dat hi sach
O wat maect ghi lieue knape mijn
Meester ic doe dat ghi behoort te doene.
Moet ic niet een goet bode zijn
Meester ic ben Symonetkijn
Die van uwer vrouwen camere
draecht het slodt ende het sluetelkijn
En ben ic niet een mannekijn. |
Ende altoos ben ic smoorpot fijn

Symonet sinen meester diende
Seuen maenden meer noch min
Al hadde hi zijnder vrouwen te vriende
Sijn meester gaf hem zijn ghewin
Ghi en moecht niet meer goet bode zijn
die van mijnder vrouwen camere
Draecht het slot ende sluetelkijn
Meester ic ben Symonetkijn
Die van uwer vrouwen camere
draecht het slodt ende het sluetelkijn
En ben ic niet een mannekijn. |
Ende altoos ben ic smoorpot fijn",,Antwerpen,../../data/dbnl/_ant001antw01_01.xml
1769,_ant001antw01_0173,1544,1544.0,1000000,23234343333323,mvmmmvmmvmvmmm,AbCDEbFDgDhIII,2A 3b 2C 3D 4E 3b 4F 3D 3g 3D 3h 3I 2I 3I,.2A   .3b   .2C   .3D   .4E   .3b    4F    3D    3g   .3D   3h   .3I   .2I   .3I,liefdesklacht,4,14,"TRibulatie ende verdriet
Wat moet mijn herte al lijden
Eylacen schoon lieueken
Is dat niet een groote pijn
Confortatie gheeft mi soete lief
Ic soudet so wel ghelijden
Mer eylacen schoon lieueken
Ten mach anders niet zijn
Ic wijts quade tongen
Veel erger dan fenijn.
Want zijt al beniden
waer datter vruecht gesciet
Troost ghi mi niet
so blijf ic int verdriet

O troost confoort
Na v staet alle mijn verlanghen
O wreede fortuyne
Hoe valdy mi dus fel.
Van die liefste die ic vercoos
En can ic gheenen troost verweruen
Mer eylacen schoon lieueken
Is dat niet groot gequel
Ic wijts quade tongen
Veel erger dan fenijn.
Want zijt al beniden
waer datter vruecht gesciet
Troost ghi mi niet
so blijf ic int verdriet

Onghetroost te sine
Waer vintmen meerder pijne
Want rooc ende smaec
Die doet al vergaen
Wel rieckende roosemarijne |
Gheeft mijn herteken een medecijne
Sal ick soete lieueken
Van v gheenen troost ontfaen.
Ic wijts quade tongen
Veel erger dan fenijn.
Want zijt al beniden
waer datter vruecht gesciet
Troost ghi mi niet
so blijf ic int verdriet

Oorlof schoon lieueken
Alst anders niet en mach wesen
Ick bedancke mi seere
Van uwer goeder duecht
Ic hope aen god den heere
Ic salt noch also wel ghelijden
Mer doet schoon lieueken
Van alle dat ghi moecht
Want ghi zijt die ghene
die mijn ionc herte verhuecht
Ende ghi weet schoon lieueken
Wat tusschen ons beyden is geschiet
Troost ghi mi niet 
so blijf ic int verdriet.",De tijd is hier,Antwerpen,../../data/dbnl/_ant001antw01_01.xml
2069,bell009denl02_0034,1674,1674.0,1015621,3333113333,vvmmvvvmvm,aaBBccdEdE,3a 3a 3B 3B 1c 1c 3d 3E 3d 3E,3a    3a    3B    3B   .1c   .1c 3d 3E 3d 3E,geestelijk lied,3,10,"DAt van 's Hemels Salen
U vier neêr komt dalen,
Dat 't myn ziel verwint
En myn ziel verslint,
O Jesu’ 
O Jesu,
Myn hert en myn sinnen
Die verlanghen seer
Naer uw' lieve minne
Minnelycken Heer.

Heer dat 't u beliefde
Een strael van uw' liefde
Op myn hert te slaen,
't Soud' haest branden gaen,
Uw' vieren’ 
Vercieren,
En die lieve schichten
Van uw' soete Handt,
Schieten myn ghevrichten
En myn hert in brandt.

In liefden verdwynen
Zyn de soetste pynen,
Liefden in het hert
Is een lieve smert,
Myn sinnen’ 
Beminnen,
Sulcken lieve Wonden,
Soo vol van playsier
Myn ziel is verslonden
In uw minne-vier.",Echo wil ik tergen,Brussel,../../data/dbnl/bell009denl02_01.xml
2072,bell009denl02_0037,1674,1674.0,1015621,442224322222222222,mmvvmmmvvmvvvvmmmm,AAbbCCDeeDffggHIIH,4A 4A 2b 2b 2C 4C 3D 2e 2e 2D 2f 2f 2g 2g 2H 2I 2I 2H,.4A    4A    2b    2b    2C    4C   .3D   .2e    2e    2D   2f    2f    2g    2g    2H    2I +  2I   .2H,geestelijk lied,3,17,"IS 't dat ghy naer een herte snaeckt
Dat in uwe Liefde blaeckt,
Soeten Heere
Wat een eere
Sou 't my zyn,
Dat ick u moght schencken 't myn?
Myn hert' dat is bereydt,
Ick wil 't u gheven
O verheven
Majesteyt,
Zyn 't uw' wenschen
By de Menschen
Te verkeeren
Soeten Heere,
Willekom
Zyt ghy in’ hert' en sin
O Bruydegom.

Onsteckt myn sinnen Soeten Heer'
In uw' Minne meer en meer,
Steckt in brande
D'Offerhande
Van myn hert',
Dat u op-ghedraghen wert,
Woont in myn hert' en sin,
Wilt my vercieren
Met de vieren
Van uw' Min,
Dat uw' schichten
Myn ghevrichten
Vierigh maken,
En doen blaken
Myn ghemoedt:
Dat myn hert' Brandigh wert
En liefde voedt.

Dat uyt den Hemel daelt het Vier,
En verslindt myn hert' en nier,
Die verlanghen
Om t'ontfanghen
Langhs hoe meer
Naer u alder-liefsten Heer',
Ick vlam naer uwe vlam
Die my soo krachtigh,
En soo machtigh
't Hert' in nam,
Dat ick haeckte,
Dat ick snaeckte,
Dat ick wenschste,
En verslenschste
Door den brandt,
Die soo soet’ Myn ghemoet
Hadd' over-mant,",Bedroefde harten zij verblijd,Brussel,../../data/dbnl/bell009denl02_01.xml
2102,bell009denl02_0067,1674,1674.0,1015621,233344424,mvvmmmvmm,AbbACCdEE,2A 3b 3b 3A 4C 4C 4d 2E 4E,.2A   .3b   .3b   .3A   .4C   .4C   .4d    2E   .4E,geestelijk lied,3,9,"HEt thiende deel
Der Vruchten van-der eerden
Wildy ô Heer' aen-veerden,
Maer ghy wilt ons hert geheel;
De liefd' is 't Rocksken Sonder naet,
Het scheyden komt voordts Uyt den haet:
Heel myn hert' en al myn sinnen
Zyn alleen
Voor u, Heer', en anders geen.

Kost wat het kost
Hebdy, ô Heer' uw' Schapen
Die ghy eerst hadd' gheschapen
Met uw dierbaer Bloedt verlost,
Op datter niet Een Schacpken niet
De helft van syne Liefd' en biet
Aen den Schepper, en Verlosser
Als alleen
Aen u Heer' en anders gheen.

Is 't moghelyck
O Heer' dat die u kennen,
Hun-selven noch ghewennen
Tot de min van d'Aerde-Ryck,
O Heer' doet uw Schoon Hemel-Ryck
Te niet met heel het Aerde-ryck,
Soo en sal den mensch niet minnen
Als alleen
U, ô Heer', en anders gheen.",Phyllis gij vlucht,Brussel,../../data/dbnl/bell009denl02_01.xml
2154,blas001fida01_0057,1663,1663.0,1000642,444444444,vmvmvmvmm,aBaBcDcDD,4a 4B 4a 4B 4c 4D 4c 4D 4D,4a    4B    4a    4B    4c    4D    4c    4D=   4D=,"liefdeslied
abclied",3,9,"AFgodinne van mijn leeven,
Boven-aardsche Maagde-siel,
Cierlijk Nymfje, hoog verheeven,
Deugde-bag, die my beviel,
Eerbaar weesen na behooren,
Fraeye schoon- en aardig-heyd,
Goede, vroome uytverkooren,
Heemelrijk my toe-bereyd,
Heemelrijk my toe-bereyd,

Ionge bloem vol seedigheeden,
Kroone-draagster van mijn hart,
Luyster onser Eew en Steeden,
Meesteresse van mijn smart,
Noord-star van verliefde sinnen,
Oogen-troost voor my gesond,
Parel waardig om te minnen,
Quetster van gewenste wond,
Quetster van gewenste wond,

Reyne, wijse, soeten Engel,
Schoone, lieve, waarde Bout,
Toon uw Min, daar ik na hengel.
U, so lang men 't leeven houd,
Wil ik kuys en vast beminnen.
Xal, dat sweer ik siel en lijf,
Yslijk in de Hel verslinnen,
Zo ik u niet trow en blijf.
Zo ik u niet trow en blijf.",Petit Bordeaux,Amsterdam,../../data/dbnl/blas001fida01_01.xml
2181,blas001fida01_0084,1663,1663.0,1000642,444444332224,vmmvmmvvmmmm,aBBaBBccDDEE,4a 4B 4B 4a 4B 4B 3c 3c 2D 2D 2E 4E,4a=   4B/   4B*   4a=   4B/   4B* 3c 3c 2D 2D 2E 4E,liefdeslied,3,12,"MAg ik u dan niet genieten
Daar mijn Liefd' om heeft geleen
Soo veel angst en wrevelheen?
MAg ik u dan niet genieten
Daar mijn Liefd' om heeft geleen
Soo veel angst en wrevelheen?
Quaamt gy dan van Leewen
In Saturnus eewen,
Sonder min
Engelin
Dat gy haat,
Daar elk schepsel so na staat?

Ik versoek maar om te kussen
Uw twee lichten, daar het licht
Van het Sonne-licht voor swicht.
Ik versoek maar om te kussen
Uw twee lichten, daar het licht
Van het Sonne-licht voor swicht.
Na uw gulde kronkklen
By Sapphiers karbonkklen
Stuurt de min
Mijne sin
Om gedood
Weg te treen in Charons boot.

Soud gy my dat weygren kunnen,
Die uw Slaaf en Minnaar heet
En sijn dienst aan u besteed?
Soud gy my dat weygren kunnen,
Die uw Slaaf en Minnaar heet
En sijn dienst aan u besteed?
Ey so sal ik waagen
't Kussen sonder vraagen,
Of je my
Stoot ter zy
Dat 's maar spel:
Soo'n gestoole beet smaakt wel.",Gavotte d'Anjou,Amsterdam,../../data/dbnl/blas001fida01_01.xml
2203,blas001fida01_0106,1663,1663.0,1000642,3344112115,mmmmvvmvvm,AABBccDeeD,3A 3A 4B 4B 1c 1c 2D 1e 1e 5D,.3A   .3A   .4B   .4B   .1c + .1c + .2D   .3D   .1e + .1e   .5D,liefdeslied,3,8,"TOen ik op 't bedje lag,
Niet als ik eertijds plag,
In kriele wellust van de min,
En spiegelde mijn weesen in
Het weese van deese mijn Celestyn,
Maar toen ik in de pijn
En toortsen der koortsen
Ellendig heel begraven scheen te sijn.

Mijn Fluytje daar ik mee
Verdreef mijn Minne-wee.
Hong leeg toen aan de leege muur.
Mijn schelle Cyter viel my duur.
Noyt song ik, noyt sprong ik, noyt socht ik lust,
Ik was alleen belust
Mijn leeven te geeven
Aan d'Opper-Heemel-Voogd in eewge rust.

Mijn Engel over my
Ontfonkt in meedely
Eer ik sou daalen in het graf
Drie kusjes aan mijn kaakjes gaf.
Sy kusde en blusde. Mijn koorts terstond
Van my raakt in de grond.
Haar Liefde my griefde
Haar min my maakte krank en weer gesond.",L'Orangère,Amsterdam,../../data/dbnl/blas001fida01_01.xml
2588,bred001groo01_0137,1622,1622.0,1000653,6666,vmvm,aBaB,6a 6B 6a 6B,.6a   .6B   .6a   .6B,liefdeslied,4,4,"Ay hooch verheven Ziel, en overschoone Vrouwe
Godinne vande Goon, ghebiester van mijn hoop,
Waerom vliet ghy van mijn, is dit oprechte trouwe
Soo smelt mijn bradent hert, dat ick met traenen droop.

Mijn Vrou mijn teer gemoet, vermeestert met gepeynsen
Jaecht my nu nae de deur, van u gheluckich Huys,
Ick coom hier raesent heen, ick kan niet langer veynsen,
Maer laes de deur is toe, dat is mijn t'meeste cruys.

Ach deur, ach wreede deur, is dit dan u vermaecken
Behaecht u mijn verdriet, en onghemeene smart,
Laet my ten minsten toe, dat ick eens mach ghenaecken,
Het straalen van haer ooch, dat mijn ghemoet verwart.

Gheluckich zyt ghy huys, die in u hebt beslooten
Des werelts hooghe roem, en sijn ghecierde pracht,
Al dees ghewenste lust, hebt ghy alleen ghenooten,
Gheluckich sijt ghy wel, maer meerder niet gheacht.",Esprits qui soupirez,Amsterdam,../../data/dbnl/bred001groo01_01.xml
2684,brug061chri01_0003,1657,1657.0,1000659,4444333333,vmvmvvmvvm,aBaBccDeeD,4a 4B 4a 4B 3c 3c 3D 3e 3e 3D,.4a   .4B   .4a   .4B 3c 3c 3D 3e 3e 3D,psalm,3,10,"ONse Godt sy ons nu genadich, 
End' segen ons met Overvloet: 
Hy verlicht' ons alle gestadich, 
Met syn aenschyn lieflick en soet. 
Op dat ons syn wegen 
Bekent recht van degen
Werden; en met een. 
De Heydenen leeren
Hen tot den wegh keeren 
Onses heyls alleen.

Dat doch, Heer, de Volcken met singen, 
U seer dancken Vry openbaer: 
En met vreughd' uwen lof voortbringen,
Hen in u verheugend' eenpaer. 
ghy hebt alle lieden
Alsins te gebieden, 
Naer u goetheyt reyn, 
Jae 't gheheel Aertrycke, 
Ghy in der ghelycke 
Regeert Heer alleyn.

De Volckeren met soeten toone, 
Dancken daerom uwen naem goet, 
Om dat 't Aerdt-Ryck draecht vruchten Schoone, 
Segent ons Heer, tot ons behoet, 
De Heere seer goedich, 
Geeft ons overvloedich, 
Den segen ghewis:
Dat Hem dies elck vruchte, 
En onsen Godt duchte 
Die Almachtich is.",Psalm 033 Datheen,Harderwijk,../../data/dbnl/brug061chri01_01.xml
2717,smee012bruy01_0032,1655,1645.0,1000660,44444444,vmvmmmmm,aBaBCCDD,4a 4B 4a 4B 4C 4C 4D 4D,",4a   .4B   .4a   .4B   .4C   .4C   .4D   .4D",liefdeslied,3,8,"IK socht mijn vreugde nu laetst by de boomen;
Vermits mijn gedachten heel waren verwart.
Ik ley my in 't groen. en 'k raakte aan 't droomen.
Ik voelde iet soets, och! 't ging my aan 't hart:
My docht dat men Cloris, al zingende, quam,
En niet dan roosjes en bloempjes nam,
Des vlocht sy een kransje en sey: eel gewas
Hier voegje veel beter dan by het gras.
Mit quamse, soo my docht, noch wat nader,
En boog heure knietjes beneeven mijn kin.
Ik hieldmen als doot: sy riep: o verrader!
Hoe benje soo koel? ik brant ree van min,
Ai zie wat Cloris uit liefde bestaat,
Ik kus uw konen, ik streelje. wat raat!
Ik kroon uw hairen met een roosen hoet:
Maar laas! wat ik begin 't smaakt u niet soet.
Toen reesse weer op en teeg voort aan 't vluchten.
En dadelik was ook mijn slapen gedaan.
Mijn Cloris was weg; des riep ik, met suchten:
Hoe ben ik, door droomen, soo schandig verraen?
Mit vloog ik naar stee: maar eer ik 'er quam.
Ontmoetme mijn Cloris; eerst scheense vry gram:
Maar toense 't klagen van my had gehoort,
Wiert sy, deur 't lyen dat ik lee, bekoort.

Is dit mijn Leever? wel ik wil wel als ik moet.
Is 't geen goe hen die twee kuikens uit een ey broedt?

Die van geen rijmen weet moet van de Leever swijgen.
Wie weet wat nuwe jaar de bruit te nacht sal krijgen.",Sarabande Pinel,Amsterdam,../../data/dbnl/smee012bruy01_01.xml
3160,stri015chao01_0073,1643,1643.0,1000670,3133133131223,vmmvmmvmvmmmm,aBCaBCdEdEFFE,3a 1B 3C 3a 1B 3C 3d 1E 3d 1E 2F 2F 3E,.3a +  1B   .3C   .3a +  1B   .3C   .3d +  1E   .3d +  1E   2F + .2F   .3E,bruiloftslied,4,8,"DE werelt heeft haer bly en / tijt,
En oock haer noodigh suer,
Ghy die nu noch te vryen / zijt,
Wenst niet dat 't eeuwigh // duer,
Al schijnt het schier verlooren // dan
Het soet begint van vooren // an:
Dies kiest (o Maeght) de u behaeght,
Tot een verkoren Man.

2 De werelt heeft haer droeve / staet
En oock haer noodigh soet,
Of u uw' vryster toeven / laet,
Hout echter goeden moet:
Wijck daerom niet te verder // van
Maer vryt haer des te herder // dan
Ghy sult niet zijn // in staeghe pijn:
Dat is wel verr' daer van.

3 De weerelt heeft haer soeten // vreught,
Dat speurt ghy aen dees twee,
Maeckt dat ghy soo oock boeten // meught,
Met vreught u herten wee,
Ghy Vryers vryt de Vrysters / sterck,
Ghy Vrysters prijst des Vryers / werck,
Segh haestigh Jae / elck wachter nae:
Want Jae is 't Vryers merck.

4 De wereldt heeft haer staghen // smert,
Maer alles neemt sijn keer,
Al vallen u de dagen // hert
De nacht versae. het weer
Een lieve laegh versoet het / al,
Wat u by daegh ontmoeten / sal,
Dies gaet gerust // daer min u lust
Met vreughde boeten sal.",Ik peins om een persoon,Dordrecht,../../data/dbnl/stri015chao01_01.xml
3184,jans004chri01_0023,1645,1645.0,1000671,5555235555,vmvmmmmmmm,aBaBCCDEDE,5a 5B 5a 5B 2C 3C 5D 5E 5D 5E,.5a   .5B   .5a   .5B   .2C + .3C   .5D   .5E   .5D   .5E,geestelijk lied,3,9,"GEen goetheyt kan volmaecktheyts naem genieten,
Tenzy die self in alles is volmaeckt:
Gheen goedt en is volkomen goedt te hieten,
Indien sijn werck nae onvolmaecktheyt smaeckt,
En so is't al, Hier in 'et aertsche dal;
Daer is geen-goedt waer op men vast mach staen,
Daer is gheen goedt daer yets op dient gebouwt:
Al wat hier is, hoe goet, het moet vergaen:
Al wat hier is, en mach niet zijn betrouwt.

2 Maer 't eenigh Een, in goetheydt onbegrepen,
Die is en blijft in goedtheydt even goedt.
Is yemandt door de Duyvel fel ghenepen,
Hy koom tot Godt, en kniel hem neer te voet,
En smeeck, en vley, En sucht, en bidt, en schrey,
Dat hy hem help, wijl hy't soo seer begheert,
Oyt puer ghenae hy is terstondt ghereet,
En recht hem op, wijl hy gheheel verneert,
Maer wensten om te raecken aen sijn kleedt.

3 O! goetheyt Gods! van geenderhande tonge
De hier bene'en op dese aerden zijn,
Nae rechten eysch en waerdde uytghesonghen,
Wijl ons de gheest alleen verbeeldt de schijn
Om dese daet Te roemen op sen maet,
En die verswackt, en is als t'enden a'em,
Wanneerse meent te galmen overluydt
V goedtheydt, en den lof van uwen Naem,
't Voornemen valt, en moet'er scheyden uyt.",Meer aarde als goud,Haarlem,../../data/dbnl/jans004chri01_01.xml
3274,cloe001edes01_0036,1677,1677.0,1015966,444444,vmvmmm,aBaBCC,4a 4B 4a 4B 4C 4C,4a 4B 4a 4B 4C 4C,geestelijk lied,33,6,"Heylig! heylig! heylig Wesen!
Wezentlijcke Heyligheid!
Die van Seraphims geprezen
Roem-ruchtig word uytgebreid;
Heyligt, heyligt, heyligt my,
Dat ick wesen mag als gy.

Wie is Heer als gy verheerlijckt?
Schoon in heyligheids cieraat?
Hoe uw’  heyligheid my meer blijckt
Hoe gy my oock schoonder laat:
Heyligt, heyligt, heyligt my,
Dat ick wezen mag als gy.

Uwen glans en gloor was duyster
Deed’ het niet uw’ heyligheid,
Heyligheid die geeft den luyster
Aan all’ uwe heerlickheid:
Heyligt, heyligt, heyligt my,
Dat ick wezen mag als gy.

Zuyver licht dat niet besmet is
Met de minste duysternis,
Wiens oog’ noyt ten gôe gezet is
Op het geen dat zondig is:
Heyligt, heyligt, heyligt my,
Dat ick wezen mag als gy.

Gy zijt d’ heyligheids Sprinck-ader,
d' Onuytputtelijcke Bron,
Schepselen heyligheid te gader
Is een straal van uwe Zon:
Heyligt, heyligt, heyligt my,
Dat ick wezen mag als gy.

Heylig zijt gy niet alleen Heer
In u zelven, maar wilt dat
U oock heyl’gen zal die geen Heer
Die oyt nadrend tot u trat:
Heyligt, heyligt, heyligt my,
Dat ick wezen mag als gy.

Wanneer voormaals zonder schroomen
Imand reuckeloos bestond
Onheylig tot u te koomen,
d' Aard hem levendig verslond:
Heyligt, heyligt, heyligt my,
Dat ick wezen mag als gy.

Zoo gy Saal’mons gunst my toezeyd,
Geven woud wat ick verzocht,
‘k Zouw verzoecken dat g’ my toeleyd
Dat ick heylig wezen mocht:
Heyligt, heyligt, heyligt my,
Dat ick wezen mag als gy.

’k Bid u om geen aardsche schatten,
Neen, maar dat ick heylig zy,
Die het vat die mag het vatten,
Zy zijn veel te slecht daar by:
Heyligt, heyligt, heyligt my,
Dat ick wezen mag als gy.

’k Min een schat van meerder waarde,
Die geen dief nog roover rooft,
Waar voor allen schat der aarde
Haren luyster gansch verdooft:
Heyligt, heyligt, heyligt my,
Dat ick wezen mag als gy.

Dien schat die voor wereldlingen
Veel te kost’lijck is en t’ eel,
‘t Eygen lot der Hemelingen,
Heer laat dat dog zijn mijn deel!
Heyligt, heyligt, heyligt my,
Dat ick wezen mag als gy.

’k Min een schat die na dit leven
Ons nog nuttig is en baat
Die als ‘t aardsch ons moet begeven
Ons dan niet alleenig laat:
Heyligt, heyligt, heyligt my,
Dat ick wezen mag als gy.

’k Bid u om geen ampt of staaten,
Om geen aardsche heerschappy,
‘k Wil die geern aan and’ren laaten,
Houd maar heyligheid voor my:
Heyligt, heyligt, heyligt my,
Dat ick wezen mag als gy.

’k Weet dat daar niet veel aan vast is
Als men die wil wel bekle’en,
Dat een ampt dan maar een last is,
En veel onrust baart met een:
Heyligt, heyligt, heyligt my,
Dat ick wezen mag als gy.

Ick acht dat die vry wat meer is
Als een Koning, zulck een man,
Die van zich zelven een Heer is,
En zijn lusten temmen kan:
Heyligt, heyligt, heyligt my,
Dat ick wezen mag als gy.

’k Hoef geen landen te regeeren,
Met a’er wercken my te mo’en,
Kan dat rustelijck ontbeeren,
‘k Heb genoeg met my te doen,
Heyligt, heyligt, heyligt my,
Dat ick wezen mag als gy.

‘k Bid u om geen aarsche hoogheid,
Werelds eer of heerlickheid,
Die den aard’ling steeds in ‘t oog leyd,
Heer geeft my maar heyligheid.
Heyligt, heyligt, heyligt my,
Dat ick wezen mag als gy.

’t Aartsche hoog dat lijckt my hel-laag
By het Hemels hoog, gewis
Mag ick dat genieten! zoo vraag
Ick niet wat ‘k voor hoogheit mis.
Heyligt, heyligt, heyligt my,
Dat ick wezen mag als gy.

Laat my vry op aarden kleyn zijn,
Een uytvaagsel zijn geacht,
Als het hert mag blanck en rein zijn,
En de heyligheid betracht:
Heyligt, heyligt, heyligt my,
Dat ick wezen mag als gy.

d’Heyligheid die lijckt my heerlijck,
Haren glans en schoonen schijn
Die is voor mijn ziel begeerlijck,
Ach mocht ick maar heylig zijn!
Heyligt, heyligt, heyligt my,
Dat ick wezen mag als gy.

’k Schep geen vreugt in schoon’ gewaden
‘t Groot gesleep van lang en breet,
‘k Laat de wereld die cieraden,
Geeft my maar het deugden-kleet:
Heyligt, heyligt, heyligt my,
Dat ick wezen mag als gy.

Ach! wat is ‘t een ydel praalen
Op wat wols, of worm-gespin!
Wat eer zal men daar door haalen?
Daar steeckt wel een deug-niet in!
Heyligt, heyligt, heyligt my,
Dat ick wezen mag als gy.

Zoo de Heer ‘t onzigb’re moye
Aan de wereld te zien gaf,
Al dat ciersel, al dat toye
Viel dan wel van zelver af:
Heyligt, heyligt, heyligt my,
Dat ick wezen mag als gy.

Heer geeft my d’ inwend’ge schoonheid,
Daar toe streckt dog al mijn zin,
Die voor d’ oogen niet ten toon leyd,
Dat ‘s een moyheid die ick min:
Heyligt, heyligt, heyligt my,
Dat ick wezen mag als gy.

‘k Bid u om geen kost’le wooning
Onwaardeerlijck toebereid,
Opgesmuckt met all’ verschooning,
Al mijn zucht is heyligheid:
Heyligt, heyligt, heyligt my,
Dat ick wezen mag als gy.

’k Weet dat Jesus in een stalle
Is geboren in een kluys,
‘k Acht dat toysel niet met alle,
Heb ick Jesum maar in huys!
Heyligt, heyligt, heyligt my,
Dat ick wezen mag als gy.

’t Huys zal licht voor schoon verstrecken
Voor een vreemd’ling op zijn reys,
Die maar denckt daar door te trecken
Naa een konincklijck paleys:
Heyligt, heyligt, heyligt my,
Dat ick wezen mag als gy.

’k Bid u om geen leckernyen,
Om geen kostelijcke dis,
‘k Kan my zonder die wel lyen,
Als ick ‘t heyl’ge maar niet mis:
Heyligt, heyligt, heyligt my,
Dat ick wezen mag als gy.

Wie die spijse eens gesmaackt heeft
Die de wereld niet en kend,
Met zijn tong maar aangeraackt heeft,
Is dat leck’re haast ontwend:
Heyligt, heyligt, heyligt my,
Dat ick wezen mag als gy.

Wat zijn Feesten, kost’le maalen
Delicate brassery,
By dat Goddelijck onthaalen?
‘k Acht haar zoet maar roet daar by:
Heyligt, heyligt, heyligt my,
Dat ick wezen mag als gy.

Zoo de wereld die eens smaacken
En haar zoetheid proeven kost,
‘k Weet zy zoud’ de aardsche laacken,
Houden voor een lichte kost:
Heyligt, heyligt, heyligt my,
Dat ick wezen mag als gy.

Ach doet my dat zoet dog smaacken!
Voert my in u wijn-huys Heer,
‘k Zal zoo gratig dan niet haacken
Naa dat aardsche leck’re meer:
Heyligt, heyligt, heyligt my,
Dat ick wezen mag als gy.

Laat my dickwils zijn beschoncken
In een heyl’ge brassery,
En des Heyl’gen Geestes droncken,
Dat is ‘t zoetste zoet voor my!
Heyligt, heyligt, heyligt my,
Dat ick wezen mag als gy.",Rozemond die lag gedoken,Utrecht,../../data/dbnl/cloe001edes01_01.xml
4322,dubb003heli01_0002,1645,1645.0,1000703,444444,vvmvvm,aaBccB,4a 4a 4B 4c 4c 4B,.4a   .4a   .4B   .4c   .4c   .4B,,3,6,"AMintas dreef zijn klavergasjes, 
Langs Amstels glaze waterplasjes,
Daar hij Korinne slapen vont, 
Die wijl haar beesjens klaver snoeiden, 
De gronttogt van haar hertje sproeiden,
Op d'oever van haar lieve mont.

O kusjes! 'k voel mijn lusjes gragen:
Amintas! voel mijn Hartje jagen:
O Min! ô Min! ô Min! hoe prikt,
Hoe prikkelt gij mijn jonge zinnen?
Amint! ik sweere u trouw te minnen,
Tot Atrop' d'Egte strik ontstrikt.

Amint liet zijn getergde lippen
In haar ontregen boezem glippen,
Het jagen van haar slinkker borst,
Het trillen van haar teere schonkjes,
Getuygden d'innerlijke vonkjes,
Goon! (riep Amintas,) die nu dorst.",O kerstnacht schoner dan de dagen,Amsterdam,../../data/dbnl/dubb003heli01_01.xml
