recordid,songid_DBNL,jaar_eind,jaar_begin,bronid,rijmaccent,rijmgeslacht,rijmschema,strofeschema,strofeschema_plus,trefw_genre,aantal_strofe,verstal,text,melodienorm,plaats,filepath_DBNL
20702,swae006sing01_0048,1664,1664.0,1001047,4244244222,vvmvvmvvvv,aaBccBdddd,4a 2a 4B 4c 2c 4B 4d 2d 2d 2d,4a    2a    4B    4c    2c    4B    4d    2d    2d   2d,"loflied, geestelijk",5,10,"TRouw' Bewaerder, trouwen Engel!
Siet! ick hengel
Om uw' hulp, en bystand we'er;
Ey! gelieft toch mijne saecken,
Goet te maecken
By den alder-hooghsten Heer,
Die eertijds ons vleysch aenvaerden,
En ons naerden // 
op dees aerde //
O wat waerde!

2. Trouwen Engel, trouw' Bewaerder,
Deughd-vergaerder
Van dien geen die heyligh leeft.
Ey! gewaerdight mijn gebreken
Af te spreken,
Ghy, die my vertroostingh geeft;
Ghy, die my komt trouw verblijden
In mijn lijden // 
in mijn strijden //
't Meesten tijden.

3. Trouwen Engel, trouw' Beschermer,
En Erbermer
Van mijn smert, en ongeneughd!
Laet my troost van U ontfangen,
Wacht niet lange;
Ey! besorght my rust, en vreugd.
Krijght my rust, en rechte vrede,
Waer ick mede // 
's Hemels stede //
In mach treden.

4. Dan sal ick U eeuwigh loven,
Als daer boven
Ick by U sal zijn verblijdt.
Hoort Ghy 't Trooster? hoort Ghy 't Vrecker,
Deughd-Verwecker,
Die van sonden my bevrijdt?
'k Sal dan singen Alleluja,
Alleluja ,, 
Alleluja’
Alleluja.

5. Maer wanneer sal aengekomen,
En vernomen
Wesen desen blijden dagh!
Als ick hebben sal verslonden
All' mijn sonden:
Och of ick dien tijd eens sagh!
Dan sal 'k singen, Alleluja.
Alleluja ,, 
Alleluja’
Alleluja.",Enfant prodigue,Antwerpen,../../data/dbnl/swae006sing01_01.xml
20990,zoet001parn01_0006,1663,1663.0,1001048,23432332343233232311323,mvmmmvmmvmmmvmvmvmmmmmm,AbCDDeFAbCGGeFhIhIJJKKI,2A 3b 4C 3D 2D 3e 3F 2A 3b 4C 3G 2G 3e 3F 2h 3I 2h 3I 1J 1J 3K 2K 3I,2A   .3b    4C   .3D   .2D   .3e    3F    2A   .3b    4C   3G   .2G   .3e    3F   .2h    3I    2h    3I   .1J   .1J    3K   .2K    3I,"moralistisch lied
antwoordlied",5,23,"DOor de Vrouw,
Liet Adam sich verleyden,
In het aardsche Paradijs:
Daar hy (in overvloed)
Genoot het goed,
De Hemelsche soetheyt:
Als Gods eygen beeld:
Sonder bouw,
Of planting, van haar beyden,
Of een eerst betaalde prijs,
Ja sonder werk, of konst:
Alleen uyt gonst
Van d'opperste goedheyt;
An hem meê gedeeld:
Al wat de aarde,
Uyt haar milde schoot,
Teelde, en baarde:
So volmaakt, so groot,
So schoon, 
Ten toon,
Hem, voor het oogh gesteld.
Op dit veld,
Wierd hy verleyd ter doodt.

Door een Hoer
Liet Simson sich berooven
En ver-rukken, van 't verstand:
Schoon hy haar valscheyt sach,
Van dach, tot dach,
Tot dat hy besweek, en
Sich vermeesterd vond.
Siet: so voer
Hy (in het licht gelooven)
Door een teere Vrouwen-hand;
Die hem, met list verwon
Mits sy, niet kon
Als vleyen, en smeeken:
't Geen se best verstond.
Die so veel sterkte,
In sijn lichaem droech:
Die so veel werkte:
Die sijn vyand joech
Als 't wild: 
verspild
(Al speelende) 't geluk:
Tot sijn druk.
Dit is bewijs genoech.

Door een Stoet
Van af-gerechte Vrouwen
Wierd de alder wijste Vorst,
Die van de Hooste-God,
Het hoogste-lot,
Hier, hadde verkreegen,
(Met een Koning-staf.)
In 't gemoed,
Een bitt're-dronk gebrouwen:
Die hem walghde, boven dorst:
Als hy d'afgodery,
So veyl, so vry,
Den loop (in haar weegen)
Ja sijn offer gaf.
Hy, die door wijsheyt,
Tot den hemel klom:
Hy, die door grijsheyt,
Van sijn ouderdom,
In eer, 
veel meer
Als al-de weereld blonk:
Die versonk,
In dese modder-kom.

Hier uyt blijkt
Dat d'alder wijste Mannen,
Door de Vrouwen zijn verleyd:
Als haar geslepen Tong,
't Gemoet besprong:
Die 't hart (door 't begeeren)
En de ziele wond.
Voor haar wijkt
De wijsheyt, als gebannen,
Met de Reedens billijkheyt;
't Verstand, en sterkt, en macht,
Schijnt, sonder kracht,
En laat sich verheeren
Van een Vrouwen mond.
Zeeden, en wetten,
Worden krachteloos,
Als zy, haar netten
Spannen, voor een poos:
Het swaard, 
veraart:
En 't harde-staal, word week:
Want het bleek,
In 't voor-beeld, dat ik koos.

Daarom acht
Ik, (na mijn beste oordeel)
Dat de Wijste-man, die leefd,
Het lichste, word beroerd,
Verleyd, ver-voerd,
Van 't pad, dat ten leeven
Hem geleyden sal:
Door 't geslacht
Der Vrouwen; dat veel voordeel
Booven hem, in 't weesen heeft:
Bevalligheydt: en list:
En schoonheyt, ist:
't Geen haar is gegeeven:
Dikwijls tot een val
Van, die sijn ooren,
Leend an dees' Sireen
Om haar te hooren
Door begeert alleen:
Begeert, 
die deerdt,
Die leyd hem uyt het spoor,
Als sy voor
Gaat; met bedekte schreên.",Eerste Carileen,Amsterdam,../../data/dbnl/zoet001parn01_01.xml
21160,soet007kley01_0109,1649,1649.0,1001049,4441143,mmmvvmv,AAAbbCb,4A 4A 4A 1b 1b 4C 3b,4A=   4A=   4A   .1b/  .1b/   4C   .3b,bruiloftslied,5,7,"KNoddige Pan speeld' op zijn Fluyt,
Knoddige Pan speeld' op zijn Fluyt,
Dat men hoor het soet geluyt,
Dryaden, 
Dryaden,
Springht en singht, en tot dees Feest
De and're Nimfen raden.

2. Wijl 't nu seecker is een dagh,
Wijl 't nu seecker is een dagh,
Dat men vrolijck wesen magh,
Want heden, 
want heden,
Komt ons Jager met zijn Hert
Verheught na huys getreden.

3. Wack're Meysjes wilt oock mee,
Wack're Meysjes wilt oock mee
(Die vergaert zijn hier ter stee)
V voegen, 
u voegen
By der soete Nimfem-rey,
En toonen u vernoegen.

4. Haest lijck wilt dan handt aen handt,
Haest'lijck wilt dan handt aen handt,
En gestooft door liefdens-brandt,
Met hoopen, 
met hoopen,
(Elck op 't schoonste toe-gemaeckt)
Den Jager tegen loopen.

5. Roept: geluckigh is die Man,
Roept: geluckigh is die Man
Die soo seecker jagen kan,
Godt geve, 
Godt geve
Dat de Jager met zijn Hert,
Veel duysend' nachten leve.",La Dauphine,Zaandam,../../data/dbnl/soet007kley01_01.xml
21167,ooij001haer01_0005,1646,1646.0,1001050,211444431144,vvvmmvmvvvmm,aaaBBaCdddCC,2a 1a 1a 4B 4B 4a 4C 3d 1d 1d 4C 4C,.2a=+ .1a=+ .1a=  .4B   .4B   .4a   .4C/  .3d*+ .1d*+ .1d*  4C/  .4C,spotlied,7,8,"Wat valt het vryen, vryen, vryen,
Wat valt het vryen wreedt en suer!
Ach! die ghequeldt is met dat vuur,
Steeckt tot de Keel in bitter lijen:
Die 't garen doet, is wel geck,
En so veel houdt van Minne, Minne, Minne,
Die 't garen doet die is wel geck,
En so veel houd vande minnetreck.

2 Want als ghy uwe lusjes, lusjes
Al hebt ghekreghen nae u sin,
Seght meens, wat heyl steeckt daer dan in?
Anders niet dan ghevley, en Kusjes:
Die 't garen doet, is wel geck,
En so veel houdt van Minne, Minne, Minne,
Die 't garen doet die is wel geck,
En so veel houd vande minnetreck.

3 Maer als ghy weder spijtigh, spijtigh
Wordet bejeghent van de Meyt,
Lacy! dan sitmen staegh en schreyt:
Want al haer doen valt nors en bijtigh;
Die 't garen doet, is wel geck,
En so veel houdt van Minne, Minne, Minne,
Die 't garen doet die is wel geck,
En so veel houd vande minnetreck.

4 Ey, laet het vryen varen, varen,
En voeghje by de brave Maets
Daer en ontmoet een Mensch niet quaets,
Anders niet dan ghezangh en Snaren;
Die 't garen doet, is wel geck,
En so veel houdt van Minne, Minne, Minne,
Die 't garen doet die is wel geck,
En so veel houd vande minnetreck.

5 Laet dan het vryen steecken, steecken,
Waer toe u schoone tijdt verquist?
Ach! die een reys ter deghen wist
Wat het is, van de Min te spreecken:
Die 't garen doet, is wel geck,
En so veel houdt van Minne, Minne, Minne,
Die 't garen doet die is wel geck,
En so veel houd vande minnetreck.

6 Ick hebt wel ondervonden, vonden
Wat dat het vryen al vermach:
Dus schep 'k er uyt van desen dagh,
'k Hou niet van soo te zijn verbonden,
Die 't garen doet, is wel geck,
En so veel houdt van Minne, Minne, Minne,
Die 't garen doet die is wel geck,
En so veel houd vande minnetreck.

7 Laet ons het vryen staecken, staecken,
En houw 'et liever met de Kan:
Want aen het Bier is voedtsel an;
Wat soud' men met een Wijf togh maecken,
Die'r sin in heeft, die is wel geck,
En so veel houdt van 't Minne, Minne, Minne,
Die'r sin in heeft die is wel geck,
En soo veel houdt van de Minne-treck.",Likkepotje,Haarlem,../../data/dbnl/ooij001haer01_01.xml
24505,_han028hand01_0005,1500,1476.0,1006807,4444444223,vmvmmmmmmm,aBaBCCBDDD,4a 4B 4a 4B 4C 4C 4B 2D 2D 3D,.4a   .4B   .4a   .4B   .4C   .4C   .4B   .2D=+ .2D=  .3D,"gebedslied
loflied, geestelijk
Marialied",8,9,"1   Ic heb die schoenste wtuercaren
oer liefte is vast in stadicheit
hadde sy gedaen ic waer verlaren
Verlaren oec inder ewicheit
Maria du bist al die ic meyn
bauen alle vrouwen schoen alleyn
och    laet my syn dyn troest bereyt
Ick bidde di ic bidde di
och staet my trouwelic by

2   God gruet v weerde maghet reyne
ende moeder der barmherticheit
ende der genaeden een ewige fonteyne
bewyset den sunders myldicheit
din macht is groet by god den heren
seer gheerne volbrenget hi dine begeerte
syn moeder en mach hy weygeren niet
Ick bidde di ic bidde di
och staet my trouwelic by

3   Der werlde vroude en mach niet dueren
oer arch heeft mennich mensche bedragen
dat eynde der vrouden en is niet dan trueren
oer dienres heeft sy mannych gelage
Maria gy syt die stedich blyft
Daer om keer ic toe di myn liefte
din dienre wyl ic geerne syn
Ick bidde di ic bidde di
och staet my trouwelic by

4   Dyn doegden en konde ic niet wtspreken
al had ic alle tongen ghewalt
an mynre macht solt my ontbreken
seer guetlic is dyn wesen gestalt
du biste des hemels een conynginne
ende der werlde keysarynne
in dinen handen staetet al
ic bidde di ic bidde di
och staet my trouwelic bi

5   Myn ziele is dicke in swaren noden
bange is dat jonge herte myn
Ick sorge die duuel wil my doden
oec vreese ic seer die helsche pyn
Ick bidde dat gy altyt wilt syn
tegen alle quellynge een medecyne
ende my verblyden in allen liden
Ick bidde di ic bidde di
och staet my trouwelic by

6   Maket my van allen sunden vry
behuedet myn herte ende alle myne synnen
mit allen doechden vercieret my
dat bid ic doer dine reyne mynne
gy syt den sunders een troesterynne
Ick lye dat ic een sunder byn
daer om soeke ic genaede aen di
Ick bidde di ic bidde di
och staet my trouwelic by

7   Och weerde vrouwe myns hertsen lost
genaede begeer ic van di te ontfaen
gy syt myn hape ende alle myn troest
dede gi dat waer mit my alle gedaen
ontfermt v mynre al coem ic spade
ic hebbe my dickewile quellic verraden
och moeder mylde ic geer genade
Ick bidde di ic bidde di
och staet my trouwelic by

8   Teghen dat wy van hier nv scheyden
als wy dit leuen moeten laten
soe wilt ons hemelscher vrouden bereyden
Daer vroude is altyt sonder mate
in des hemels throen daer gy syt schoen
verheuen by dinen ewigen soen
daer di die enghelen choren lauen
ic bidde di ic bidde di
och staet my trouwelic by",Het gepeins ligt mij zeer vast en kwelt,"IJsselstreek (Deventer, later Zutphen)",../../data/dbnl/_han028hand01_01.xml
24507,_han028hand01_0007,1500,1476.0,1006807,333333333,vmvmvvvvv,aBaBcdcdc,3a 3B 3a 3B 3c 3d 3c 3d 3c,.3a   .3B   .3a   .3B   .3c   .3d=  .3c/  .3d=  .3c/,"Marialied
loflied, geestelijk",7,9,"1   Myt vrouden laet ons begynnen
toe lauen een joncfrouwe fyn
god lae  ons dat volbrengen
Maria is die ic meyne
van gade is sy wtuercaren
in hoer soe wolde hy rusten
hi wart van hoer gebaren
in hoer soe wolde hi rusten
hi wart van oer gebaren

2   Ick en kan sy niet volprysen
noch lauen in geenre tyt
sy gaet alle joncfrouwen bauen
in hemel ende in eertryke
Ick gruete di O edel joncfrouwe fyn
bauen alle die gene die leuen
sydi inder herten myn
bauen al die gene die leuen
sydi inder herten myn

3   Myt recht mach ic di lauen
du edelle peerle fyn
voel blenckender dan die sternen
claere dander sonnen schyn
sy is die lichte dageraet
mit hoeren claren aenschyn
voer allen joncfrouwen wil ic se lauen
Want sy hem allen bauen gaet
voer allen joncfrouwen wil ic se lauen

4   Onder allen creatueren
en vyndic hoers gelic en geen
hoer ogekyns lichten claere
dan die carbunkel steen
sy is dat clare mergenroet
altoes wil ic sy eren
gestedelick totter doet
altoes wil ic sy eren
gestedelick totter doet

5   Tot hoer wil ic my keren
ende nvmmermeer aflaen
sy licht mi inder herten
maria walgedaen
al myn hape set ic in hoer
Och mocht ic se scouwen
geen dynck en coer ic daer voer
Och mocht ic se scouwen
geen dynck en coer ic daer voer

6   Maria schone joncfrouwe
du edelle peerle fyn
wilt my genaede verueruen
van al die sunden myn
gy syt daer alle myn troest aen steet
tot uwen steden dienst
wil ic altyt syn bereyt
tot uwen steden dienst
wil ic altyt syn bereyt

7   Och wtuercaren bloeme
du edel roesken roet
wilt mi toe troes  coemen
totten lesten in mynre doet
gyf my een salich steruen
wilt my genade verweruen
als ic scheyden sal van eertryke
wilt my genade verweruen
als ic scheyden sal van eertryke",Solaas wil ik hanteren,"IJsselstreek (Deventer, later Zutphen)",../../data/dbnl/_han028hand01_01.xml
24580,_han028hand01_0081,1500,1476.0,1006807,333322224,vvvmmmmmm,aaaBCCCCB,3a 3a 3a 3B 2C 2C 2C 2C 4B,.3a   .3a   .3a   .3B   .2C + .2C   .2C + .2C   .4B,"nieuwjaarslied
kerstlied",6,7,"1   Myt desen nyen jaere
soe wort ons apenbaren
hoe dat een maget vruchtbaere
die werlt al verblyt
Ghelauet moet syn dat suete kyndekyn
gheert moet syn dat maegdelyn
nv ende ewelic tot alre tyt

2   Die enghelen syngen schoene
hier bauen inden throne
marien der maget toe lauen
daer dryuen sy jolyt
Ghelauet moet syn dat suete kyndekyn
gheert moet syn dat maegdelyn
nv ende ewelic tot alre tyt

3   Doe achte dage waren gheleden
soe waert dat kynt besneden
al naeder joedscher seden
des sulle wy syn verblyt
Ghelauet moet syn dat suete kyndekyn
gheert moet syn dat maegdelyn
nv ende ewelic tot alre tyt

4   Drie Conynge wt veren lande
die quamen mit offerhande
tot alder werlde heylande
in eenre corter tyt
Ghelauet moet syn dat suete kyndekyn
gheert moet syn dat maegdelyn
nv ende ewelic tot alre tyt

5   Sy gauen ore gauen
een yegelic van hoere hauen
den kyndekyn toe lauen
ende oec der moeder syn
Ghelauet moet syn dat suete kyndekyn
gheert moet syn dat maegdelyn
nv ende ewelic tot alre tyt

6   Daer jhesus inder crybben lach
toe betlahem dat dat gheschach
golt wieroec merre nae hoere manyeren
dat gauen sy den kynde te eren
Ghelauet moet syn
dat suete kyndekyn
geert moet syn dat maegdelyn
Nv ende ewelic tot alre tyt",Met deze nieuwe jaar,"IJsselstreek (Deventer, later Zutphen)",../../data/dbnl/_han028hand01_01.xml
24588,_han028hand01_0089,1500,1476.0,1006807,333333333,vmvmvmvvm,aBcBdEffE,3a 3B 3c 3B 3d 3E 3f 3f 3E,.3a   .3B   .3c   .3B   .3d   .3E   .3f=  .3f=  .3E,"devoot lied
mystiek lied",5,9,"1   Pelgermasi heb ick ghewandert
wel xxxiij jaer
wanner dye tyt sal comen
ic en weet oeck nyet wanner
weer ick toe iherusalem bynnen
al in myns vaderslant
wanner soe sal hi comen
wanner soe wyl hi comen
dye my heeft wt gesant

2   Dye crachten mynre begherte
sy synt ghewont seer groet
Dyt wech hy is seer enghe
tys mynre syelen doet
Der moerdenars isser vele
in allen hoeken omtrynt
Wanner soe sal hie comen
wanner soe wil hye comen
dye my heeft wt gesant

3   Myti suchten ende myt carmen
soe vaer wy ouer dye see
Den wynt den heb wy teghen
die mast is al en twee
Dye ancker is weech ghedreuen
tschyp en heeft gheen profant
wanner soe wil hy comen och
wanner soe wil hy comen
die my heeft wt ghesant

4   Myn trouue heb ick gebroken
verloren is dye rynck
Myn mantelken is versleten
dat ick vp der doop ontfinck
Nu wil ick my haestelick wenden
ende cryghen een suuerlyck cleet
Toe vallen in myn brughum
Toe vallen in myn brughum
tys my van herten leet

5   Condt ick een herberch crygen
daer ick worde ihs bruyt
dat gelt der rechter doechden
des gheue ick weynich wt
Onder dye quade gesellen
soe voede ick my omtrent
wanner soe sal hy comen
wanner soe sal hy comen
dye my heeft wt gesant",,"IJsselstreek (Deventer, later Zutphen)",../../data/dbnl/_han028hand01_01.xml
33856,rosa002evan01_0101,1654,1654.0,1011046,53253244443,mvvmvvmmvvv,AbbAbbCCddd,5A 3b 2b 5A 3b 2b 4C 4C 4d 4d 3d,.5A   .3b=+  2b=  .5A   .3b/+  2b/  .4C   .4C   .4d   .4d*  3d*,"bijbels historielied
verhalend lied, geestelijk",5,9,"Wanneer Herodes dagh gekoomen was,
Op welk hy was gebooren, was gebooren,
Deed' hy een Avondmael bereyden ras,
Voor al sijn uytverkooren, uytverkooren,
Voor Vorsten, en de Princen valjant
Van 't heele Galileësche Lant.
En daer quam ook by dese Hanssen,
Herodias Dochter te danssen,
Hare Dochter te danssen.

2. Sy heeft Herodes soo wel aengestaen,
Dat hy haer looft te schenken, looft te schenken,
Al wat dat sy begeert soud' sy ontfaen,
Al wat sy konde denken, konde denken,
Daer op hy onvoorsightelijk deed',
Een al te onverstandigen eed',
Woudt gy 't halve Rijke begeere,
Ik u dat sal geeven, ik sweere,
Dat sal geeven, ik sweere.

3. Daer op is uyt-gegaen die Doghter loos,
Gaet met haer Moêr te raden, Moêr te raden,
Wat of sy eyschen sal, die Vrouwe boos,
Denkt om haer haet te saden, haet te saden,
't Hooft van Iohan den Dooper begeert,
Dat Herodes u daer mee' vereert;
Sy seydt met ongodlijke monde,
Geeft 't Hooft van Joannes terstonde,
Van Joannes terstonde.

4. Herodes was bedroeft, maer om sijn eed',
En die daer t'samen saten, t'samen saten,
Haer niet bedroeven wouw, dit feyt seer wreed'
En dorste hy niet laten, hy niet laten,
Daerom hy na den Kerker terstondt
Den Beul met sijn Rappier heenen sondt,
Die welke daer moordadigh 't hoofde
Van Joan den Dooper af kloofde,
Jan den Dooper af kloofde.

5. In eenen schootel heeft men haer gebroght
Het Hooft van den Propheete, den Propheete,
Gelijk het felle Wijf dat had' versoght,
O boosheydt ongemeen, ongemeete!
Men gaf dat hooft die danstersche loos,
En sy brenght dat haer Moeder seer boos,
't Lijf hebben sijn Jongers begraven,
Die haer tot Heer Jesum begaven,
Tot Heer Jesum begaven.",De lustelijke mei is nu in de tijd,Antwerpen,../../data/dbnl/rosa002evan01_01.xml
34088,vlee002ryme01_0039,1660,1660.0,1011050,33333444,mmvmvmmm,AAbCbCCC,3A 3A 3b 3C 3b 4C 4C 4C,.3A   .3A   .3b   .3C   .3b   .4C=  .4C=  .4C,"heiligenlied
loflied, geestelijk",6,8,"LOoft Barbara ver-blydt,
Die hier ver-gaedert zyt,
Een Maeghd soet, hoogh ver-heven;
Al is den naem barbaer,
Haer daed ons all' doet leven;
Die honigh-soeter is voor-waer.
Die honigh-soeter is voor-waer,
Door hare deughd, dat 's open-baer.

Haer groote jonst ver-toont,
Waer med' sy al-tyd loont
Haer dienaers uyt-ver-koren,
Die tot haer zyn ghesint:
Want niemand gingh ver-loren,
Die dese Maeghed heeft ghedint,
Die dese Maeghed heeft ghedint,
Haer dienaers Barbara bemint.

Vlucht al barbaersch gheslacht,
En wreede Koninghs macht
Van Roomen en Afriecken;
Als wy de soete deughdt
Van Barbara tot slecken
Met eenen Sangh, die 't hert ver-heught,
Met eenen Sangh, die 't hert ver-heught,
Ver-klaeren tot een ieders vreughdt.

Want sy ghenoemt moet zyn
De soete medecyn,
(Ghelyck het klaer magh blycken)
In allen teghen-spoedt,
Op zee, op 't land, in rycken
De doode sy her-leven doet, 
De doode sy her-leven doet, 
Haer dienaers troost, en hulpe goedt.

Dit is oock Aelst be-kent,
Dat Barbara ghewent
Haer dienaers troost te wesen,
En by-stand in den noodt,
Als sy stracx heeft ghenesen,
Die daer nu scheen te wesen doodt, 
Die daer nu scheen te wesen doodt, 
Ver-resen door haer vvel-daed groot.

Dus singhen wy met vreughd,
En loven uwe deughd,
O Barbara ghepresen!
Die niet en zyt Barbaer;
Maer een Maeghd saeght van wesen,
Den Roos-maryn houd staen vruchtbaer, 
Den Roos-maryn houd staen vruchtbaer, 
Tot uwer eer' gheplant voor-waer.",Si je suis travaillé,Brussel,../../data/dbnl/vlee002ryme01_01.xml
34164,suet001brus01_0057,1659,1659.0,1011052,33333333333,mmvmmvmmmmm,ABcABcDEDEE,3A 3B 3c 3A 3B 3c 3D 3E 3D 3E 3E,.3A   .3B   .3c   .3A   .3B   .3c   .3D   .3E   .3D   .3E=  3E=,drinklied,5,11,"'kHeb menigh pint en kan,
Ghelost met eenen teugh,
En weder vol-gheschoncken,
In't nat ben ick een man,
k'En drinck toch maer myn meugh,
Tot dat ick word' half droncken,
'kVind' lust, en smaeck daer in,
Draeyt my daer naer den kop,
Soo word' ick bly van sin,
Door krachten van dit sop,
Door krachten van dit sop,

2. Den dranck toch maer en wast,
Om dat m'hem drincken sou,
Waer-om dan niet ghesopen,
Voor-waer ick ben een gast,
Die van het suypen hou,
Laet swalghen met heel stoopen,
Drinckt een ghesontheyt om,
En smeert u drooghe borst,
Suypt wacker aen den brom,
Soo sterft-men noyt van dorst,
Soo sterft-men noyt van dorst,

3. Elck ooghen-blick een dronck,
Laet ons niet ledig zyn,
Want ledigheydt is sonde,
Die ons den wyn eerst schonck,
Die heeft het vreudigh zyn,
In't edel nat bevonden,
'tWelck deughdigh is doet deucht,
Soo moet altyt den wyn,
Tot voetsel van de vreucht,
Van ons ghedroncken zyn,
Van ons ghedroncken zyn,

4. Doen ick een teugh bescheet,
Ick slaen 'tghesicht om hoogh,
Ghedurigh naer den hemel,
'kBeween dan al myn leet,
Met traenen in myn oogh,
Waer door ick krygh gheschemel,
My dunckt dat d'aerde beeft,
Elck voet-stap die ick gaen,
Eer my den gangh begheeft,
Brenght noch een teughskens aen,
Brenght noch een teughskens aen,

5. O goddelycke nat,
Hoe wonder is u kracht,
Ghy dryft van ons het suchten,
Naer dat m'u lost uyt 'tvat,
Laeyt m'in den buyck u vracht,
Dan jaeght ghy 'thooft vol kluchten,
Lof dan die al-tydt drinckt,
En leeft met bly ghemoet,
Want ieder singht, en klinckt,
Als hy is vol, en soet.
Als hy is vol, en soet.",Ik heb menig pint en kan,Brussel,../../data/dbnl/suet001brus01_01.xml
34176,suet001brus01_0069,1659,1659.0,1011052,33333333333,mmvmmvmmmmm,ABcABcDEDEE,3A 3B 3c 3A 3B 3c 3D 3E 3D 3E 3E,.3A   .3B   .3c   .3A   .3B   .3c   .3D   .3E   .3D   .3E=  3E=,liefdesklacht,5,11,"
U vrindelyck ghesicht,
O over-schoone Maeght,
Dat doet my dickwils suchten,
Ick ben aen u verplicht,
U schoonheyt my behaeght,
Waer-om wilt ghy my vluchten,
Behaeght u dan myn smert,
Soo mis-preys ick den dagh,
Dat ick verwonnen wert,
Als ick u eerst-mael sagh.
Als ick u eerst-mael sagh.

2. Twyffelt ghy aen myn min,
Oft wat bedwinght u hert,
Dat ghy my wilt verachten,
En denckt dat niet Vrindin,
U veynsen doet my smert,
Versaet u met myn klachten,
Thoont ghy u liefste wreet,
Voor-waer 'ten voegh u niet,
Ghy doet u schoonheyt leet,
Als ghy my stuer aen-siet.
Als ghy my stuer aen-siet.

3. Gheeft vry u ooghskens last,
Dat sy een soet ghelonck,
Op uwen dienaer schieten,
Hebt ghy myn min verrast,
Ververscht de minne vonck,
My sal gheen smert verdrieten,
Als ick naer al myn pyn,
Ghenieten magh u belt,
Gheen peyn, kan peyn my zyn.
Als ghy u liefde melt.
Als ghy u liefde melt.

4. Bedwinght u lieven mont,
Dat hy gheen stuerigheyt,
Comt uwen dienaer gheven,
Laet ons in't soet verbont,
Eynden den korten tydt,
Die hier noch is te leven,
Belast vry aen u hert,
Dat achter laet den streyt,
Waer uyt dat spruyt myn smert.
Soo zyn wy 'tsaem verbleyt.
Soo zyn wy 'tsaem verbleyt.

5. Ghy sult dan soete rust,
Bevinden in de vreucht,
Die ick aen u sal thoonen,
En ick myns herten lust,
Ververscht door liefdens deucht,
Als ghy myn min sult kroonen,
Met uwe weder-min,
Laet af u stuerigheyt,
O over-schoon Vrindin,
Soo ghy ghenaedigh zyt.
Soo ghy ghenaedigh zyt.",Ik heb menig pint en kan,Brussel,../../data/dbnl/suet001brus01_01.xml
34186,suet001brus01_0079,1659,1659.0,1011052,444344,mmmvvv,AAAbbb,4A 4A 4A 3b 4b 4b,.4A=  .4A=  .4A   .3b   .4b/  .4b/,liefdesklacht,6,6,"O hemel, sal myn droeve pyn,
Noyt in een vreught verandert zyn,
'kDucht neen, want die Vrindinne,
Die ick bemin, wilt my niet minne.
Die ick bemin, wilt my niet minne.

2. Behaeght u Cupido die smert.
2. Behaeght u Cupido die smert.
Die my ghedurigh woelt in't hert,
Waer zyn u oude krachte,
Die ghy my eerst uyt gonst toe-lachte.
Die ghy my eerst uyt gonst toe-lachte.

3. Als ghy bedwonght haer wreet ghelaet,
3. Als ghy bedwonght haer wreet ghelaet,
Dat sy my thoone sou ghenaet,
Prees ick u groote daeden,
Die vreught is nu met druck gheladen.
Die vreught is nu met druck gheladen.

4. Herschept u kracht, ô Venus kint,
4. Herschept u kracht, ô Venus kint,
Bindt die Vrindinne die my bint,
Met den bandt van u schichten,
Soo kunt ghy haer, en my verlichten,
Soo kunt ghy haer, en my verlichten,

5. 'kWeet dat sy self niet kent die pyn,
5. 'kWeet dat sy self niet kent die pyn,
Die haer van my doet vlietigh zyn,
Want 'ksien haer soete wangen,
Zyn met een schors van druck bevangen.
Zyn met een schors van druck bevangen.

6. Stelt dan die Maeghet in haer rust,
6. Stelt dan die Maeghet in haer rust,
Haer vreught dat is myns herten lust,
Dan sal ick t'uwer eere,
Met grooten lof u deuchden vermeere.
Met grooten lof u deuchden vermeere.",Amour tu me fais trop souffrir,Brussel,../../data/dbnl/suet001brus01_01.xml
34226,momm004brab02_0019,1650,1650.0,1011053,33333224,mmvmvmmm,AAbAbCCC,3A 3A 3b 3A 3b 2C 2C 4C,.3A   .3A   .3b   .3A   .3b   .2C=   .2C/   .2C=   .2C/    .4C,liefdesklacht,5,10,"VLucht niet, vlucht Laura niet:
Hoe langh sal mijn verdriet
V nortsheydt noch behagen?
’t Schijnt dat ghy niet en siet
Hoe door ’t geduerigh klagen
Mijn stemm’ begeeft,
Mijn tongh die kleeft,
Mijn stemm’ begeeft/
Mijn tongh die kleeft
Aen ‘t gehemelt dat gheen nat meer heeft.

2. Siet ghy niet hoe ick hijgh,
En schier ter aerden zijgh
Van u steedts na te sweven,
Soo ick geen troost en krijgh,
Verlooren is mijn leven;
Och keert Goddin
Den stueren sin,
Och keert Goddin
Den stueren sin
Eens naer de langh-ghewenschte min.

3. Hoe kan doch wesen dat
Soo Goddelijcken schat,
Gepronckt met ’s Hemels zegen,
Een Marmer ziel’ om-vat,
Die niemandt kan bewegen,
Noch door de straf,
Die sy hem gaf,
Noch door de straf,
Die sy hem gaf,
Noch selve door het droevigh graf.

4. Och hoe kan het ghesicht
Dat in mijn ziele sticht
Onblusschelijcke qualen,
Hoe kan soo brandigh licht
Sijn voedsel doch ghehalen
Van ’t ysigh hert,
Dat noyt en werdt,
Van ’t ysigh hert,
Dat noyt en werdt
Ontvrosen door mijn heete smert?

5. Is ’t soo dan dat de pijn,
Waer door ick steedts verdwijn,
V sinnen kan verblijden,
‘k Wil u gheen droefheydt zijn,
Maer sal ghewilligh lijden,
Soo langh als ghy
Met vreught tot my,
Soo langh als ghy
Met vreught tot my
Ghebruyckt u soete tyranny.",Si je suis travaillé,Brussel,../../data/dbnl/momm004brab02_01.xml
