recordid,songid_DBNL,jaar_eind,jaar_begin,bronid,rijmaccent,rijmgeslacht,rijmschema,strofeschema,strofeschema_plus,trefw_genre,aantal_strofe,verstal,text,melodienorm,plaats,filepath_DBNL
177936,_boe008boek01_0105,1774,1774.0,1016227,444444,vvmmmm,aaBBCC,4a 4a 4B 4B 4C 4C,.4a   .4a   .4B   .4B   .4C   .4C,,24,6,"Looft, looft, verheugd, den HEER der heeren!
Aanbidt zijn' naam, en wilt Hem eeren;
Doet zijne glorierijke daên
Alom de volkeren verstaan,
En spreekt, met aandacht en ontzag,
Van zijne wondren, dag aan dag.

Iuicht, elk om strijd, met blijde galmen;
Zingt, zingt den Hoogsten vreug-de psalmen;
Beroemt u in zijn' heilgen naam:
Dat die Hem zoeken nu te saam
Hun hart vereenen tot zijn eer,
En zich verblijden in den HEER.

Vraagt naar den HEER en zijne sterkte;
Naar Hem, die al uw heil bewerkte;
Zoekt dagelijks zijn aangezicht:
Gedenkt aan 't geen Hij heeft verricht,
Aan zijn doorluchte wonderdaên;
En wilt zijn straffen gadeslaan.

Gij volk, uit Abraham gesprooten,
Dat zooveel gunsten hebt genooten;
Gij Iakobs kindren, die de HEER
Heeft uitverkooren, meldt zijn eer.
De HEER is onze God, die d'aard
Alom door zijn gericht vervaart.

God zal zijn waarheid nimmer krenken,
Maar eeuwig zijn verbond gedenken.
Zijn woord wordt altoos trouw volbragt
Tot in het duizendste geslacht.
't Verbond met Abraham, zijn' vrind,
Bevestigt Hij van kind tot kind.

Al wat Hij Izak heeft gezwooren
Heeft Hij ook aan zijn uitverkooren',
Aan Iakob tot een wet gesteld,
Van al 't beloofde heil verzeld;
En aan gansch Isrel toegezeid
Tot zijn verbond in eeuwigheid.

Hij sprak: “Ik zal de schoonste landen,
'k Zal Kanan leevren in uw handen,
't Welk 't snoer uws erfdeels weezen zal.”
Het volk was weinig in getal,
't Verkeerde daar als vreemdeling,
Toen 't zulk een gunstrijk woord ontving.

Geleid door 's Heeren alvermogen,
Zijn zij van volk tot volk getoogen,
Van 't een naar 't ander rijksgebied.
Hij dulde hun verdrukking niet;
Maar heeft zelfs vorsten, op dien togt,
Om hunnentwil, met straf bezocht.

God sprak, en deed den vorsten weeten:
“Tast mijn gezalfden, mijn profeeten
Niet aan door eenig leed of schand'.”
Hij riep een' honger in het land:
Hij brak vergramd den staf des broods,
En 't volk kwam in gevaar des doods.

Wie kan Gods wijs beleid doorgronden?
Een man werd voor hen heen gezonden;
De vroome Iosef, rijk in deugd,
Tot slaaf verkocht in zijne jeugd,
In ijzren boeien wreed gekneld,
Werd, hun tot heil, in eer gesteld.

Toen hij door 't godlijk alvermogen
Beproefd was; toen voor aller oogen
Zijn woord in 't helder daglicht scheen,
Toen bood de Koning, om zijn reên
Verbaasd, hem straks de vrijheid aan:
Der volken Heer deed hem ontslaan.

Hij kreeg van Farao in handen
't Bestier van huis en goed en landen;
Dies bond hij vorsten naar zijn' lust.
Van zijn verstand en deugd bewust
Deed gansch Egyptens Opperheer
Al d'oudsten luistren naar zijn leer.

Daarna toog Israël, gedreeven
Door nooddruft, tot behoud van 't leven,
Naar 't rijk Egypten: Iakob kwam
Als vreemdeling in 't land van Cham.
Daar groeid' en bloeide zijn geslacht,
En overtrof zijns vijands magt.

De harten der Egyptenaaren,
Die eertijds Isrel gunstig waren,
Verkeerden toen in bittren haat;
Des Heeren volk werd bits versmaad.
Men smeedde laagen tot hunn' val:
Verdrukking trof hen overal.

Maar God zond Mozes, die te vooren
Door Hem met Aron was verkooren.
Zij beide voerden Gods besluit
Door teekenen en wondren uit,
En toonden in Egyptenland
De plaagen van zijn strenge hand.

't Werd alles door zijn groot vermogen
Met duisternissen overtoogen.
Niets wederstreefde 't hoog bevel
Van God, den God van Israël,
Die beek en bron verkeerd' in bloed;
Den visch deed sterven in dien vloed.

Ook deed God uit de waterstroomen
Een magtig heir van vorschen komen,
Dat doordrong tot in 's Konings hof.
De luizen kwamen voort uit stof;
God sprak, en een ontelbre drom
Van ongedierte zweefd' alom.

Hij zond, in plaats van vruchtbren regen,
Zijn' hagel neêr, die, allerwegen,
Met een verslindend vuur gepaard,
Den frisschen wijnstok sloeg ter aard;
Den vijgeboom, met kruin en tak,
En al het vruchtgeboomte brak.

De springhaan en de kever kwamen,
Gelijk een talloos leger, samen;
Verslonden, wat het aardrijk gaf;
Toen heeft God, als de zwaarste straf,
Al d'eerstelingen hunner kracht,
Hun eerstgeboornen omgebragt.

God deed zijn volk met wisse treden,
Daar niemand struikeld' in zijn schreden,
Met zilver en met goud belaên,
Blijmoedig uit Egypten gaan.
Toen juicht' om hun vertrek al 't land,
Daar 't al door schrik was overmand.

God breidd' een wolk uit, om zijn schaaren
Bij dag te hoeden voor gevaaren:
Hij gaf hun door zijn hoog bestuur
Des nachts ten licht' een wondervuur;
Zij baden, en hun Opperheer
Zond straks een heir van kwakklen neêr.

Zij werden daaglijks begenadigd;
Met manna, hemelsch brood, verzadigd.
Gods hand bragt, in dien dorren oord,
Rivieren uit een steenrots voort:
Hij dacht om 't geen Hij aan zijn' knecht,
Aan Abraham had toegezegd.

Dus toog 't verkooren volk des Heeren
Al juichend uit, op Gods begeeren:
Het land der heidnen van rondom
Schonk Hij hun tot een eigendom:
Der volken arbeid werd geheel
Aan Israël ten erflijk deel.

Die gunst heeft God zijn volk bewezen,
Opdat het altoos Hem zou vreezen;
Zijn wet betrachten, en voortaan
Volstandig op zijn wegen gaan.
Men roem' dan d'Oppermajesteit,
Om zooveel gunst, in eeuwigheid.",Psalm 105 Datheen,Haarlem,../../data/dbnl/_boe008boek01_01.xml
178617,halm002davi01_0013,1707,1707.0,1015988,44444,mmvvm,AAbbA,4A 4A 4b 4b 4A,.4A   .4A   .4b   .4b   .4A,,5,5,"HOe lange zult gy myner, Heer,
Vergeeten; dat men zonder eer
My smaadt?
Hoe lange zal ik derven
't Licht van uw aanschijn; om te sterven
Door 's vyands hand en moordgeweer?
2 Hoe lange zal ik in myn hart
Raadslagen neemen, steeds benart?
Hoe lange zal my droefheit treffen
By daag?
Hoe lange zich verheffen
Myn vyand, die my hoont en sart?
3 Aanschouw, verhoor my, Heer, mijn Godt:
Dat ik niet valle in schande en spot;
Verlicht myn ooge, om niet t'ontslaapen
Zoo dat de dood my wech komt raapen
Van d'aarde, en 't graf my zy ten lot.

4 Opdat myn vyand, trots van moed
Niet zegge, als hy in gramschap woedt;
Ik mogt hem over in het stryden:
Noch myne haters zich verblyden,
Als ik zou wanklen, met den voet.
5 Maar op uw goedertierenheit
Betrouwe ik, my steeds toegezeit:
Mijn hart zal in uw heil opspringen
Van vreugde: ik zal den Heere zingen,
Omdat hy my heeft hulp bereidt.

DE dwaas zeit stout in 't hart: daar is geen Godt:
Zy hebben zich bedorven in hun wegen;
Daar zy met hart en monde gruwels pleegen,
Niemant doet goed; maar elk, vol schimp en spot,
Hoont Godts gebodt.
2 De Heer heeft uit den hemel neêrgezien,
Op 's werelds staat, en alle menschen kindren;
Of iemant, als ver-

standig, zou vermindren
Zyn misdryf en de goddeloosheit vliên,
Godt eere biên.
3 Al t'zamen zyn zy van het deugdenpadt
Geweken, en gansch stinkende verbastert:
Daar is 'er geen die Godt in 't hart niet lastert.
Te zamen zijn ze in boosheit uitgespat,
En vuil bekladt.
4 Hoe ! hebben dan de werckers van het quaad
En onrecht, geen verstant, die, fel gebeeten
Op 's Heeren volk, dat graag als brood opeeten?
Zy roepen Godt niet aan.
Hun hart versmaadt
Des Heeren raadt.
5 Aldaar zyn zy met schrik en angst vervaart;
Want Godt is by 't geslacht met zynen zegen
Dat onvermoeit betracht zyn wet en wegen,
En overal rechtvaardigheit bewaart,
Met trou gepaart.
6 Gy, die zoo trots, vermetel zyt, en stout,

Beschaamt den raad van hem die in elenden
Zit; omdat hy zich tot den Heer komt wenden
In zynen nood, hem voor zyn' toevlucht houdt,
En hem betrout.
7 Och quam het heil van Israël eens voort
Uit Sion !
Als de Heer hen die gevangen
Zijn wederbrengt, zal Jacob met gezangen
Verblijdt zijn: en de vreugd in Isrels poort,
Nooit zyn gestoort.",Psalm 013 Datheen,Amsterdam,../../data/dbnl/halm002davi01_01.xml
178626,halm002davi01_0022,1707,1707.0,1015988,55525552,mmmvvvvm,AAAbbbbC,5A 5A 5A 2b 5b 5b 5b 2C,.5A   .5A   .5A   .2b   .5b   .5b   .5b   .2C,,16,8,"MYn Godt, myn Godt, waarom verlaat gy my?
Zeer verre van te kiezen myne zy,
Toont gy u als myn vyand en party,
Versmaadt de klagten
Myns brullens. 'k roep, myn Godt, geheele nachten,
En dagen, doch gy schynt zulks te verachten,
'k Heb geene stilte en moet van druk versmagten,
Sta op, ô Heer !

2 Gy zyt de Godt dien Israël toont eer,
De heilige, wiens woord en waarheits leer
Men dagelyks verheerlykt meer en meer,
Met lofgezangen.
Gy waart altoos der vaderen verlangen,
Zy hebben u betrouwt, om hulp t'ontfangen,
Wanneer 's doods schrik hun harten had bevangen,
Gy holptze ook uit.

3 Z'aanriepen u, met naar en bang geluit,
En zyn geredt door uw genâ-besluit,
Hun hoope op u, (die dood noch lyden stuit,)
Hielt hen uit schanden.
Maar ik, gesmaadt, veracht, geknelt in banden,
Ik ben een worm, geen man meer, die de handen
Niet kan ontgaan der menschen, noch hun tanden,
Door wraak verwoedt.

4 Zy dorsten, Heer, naar myn oschuldig bloedt,
En schudden 't hoofd. de wrok van 't boos gemoet
Barst los. De lippe, in mynen tegenspoet,
Geeft blyk van smaalen.
Zy zeggen: laat hy zyne hulp nu haalen
By zynen Godt; dat die hem uit dees' quaalen
Nu redde; opdat wy zien zyn liefdestraalen,
Is hy zyn lust.

5 Gy immers hebt, toen ik was onbewust,
In 's moeders buik, van smerten en onrust,
My voortgebragt, en in uw gunst gekust,
Als myn vertrouwen.
Van 's moeders borst ging ik my op u bouwen,
Van dat ik mogt het levenslicht beschouwen
Zyt gy myn Godt, om my uw heil t'ontvouwen,
Zelf in den dood.

6 Nadien ik dan die vroege gunst genoot,
Zoo wees van my niet verre, nu ontbloot
Van alle hulp, terwyl myn smart vergroot,
Schraag myne lenden.
Daar varren en verwoede Bazansbenden
Van stieren, zich vol gramschap naar my wenden,
In eenen kring, om my te mogen schenden,
En dooden, Heer.

7 Hun mondt gaapt wydt tot demping van myne eer,
Gelijk een leeuw brult op een oilam, teer
En rein van vacht; scherpt elk het moordgeweer,
Om my te vellen.
'k Ben uitgestort als water dat uit wellen Stroomt.
myn gebeente is, door 't gedurig quellen
Gescheiden: 't hart versmelt door al 't ontstellen,
En naar geween.

8 Myn krachten zyn verdroogt gelyk een steen,
En aarde scherf. myn tonge, als uitgesneên,
Is sprakeloos: ik moet naar 't doodstof heen
Door uwe slagen:
Want honden my omringen, die my plaagen,
Veel boozen my omsinglen en belaagen,
Die nagels door myn hand en voeten jaagen,
Met groot gewelt.

9 Al myn gebeente in 't lyf kan zyn getelt;
Zy schouwen 't aen, hoe dat myn leven smelt,
En zien op my. hun boezem jaagt en zwelt
Door 't schamper spreeken.
Terwyl zy my de zyde en 't hart doorsteeken,
Verdeelt men stout myn kleedren, (tot een teken
Van smaad) door 't lot. men kan zich nauwlijks wreeken
Door myne doodt.

10 Maar gy, ô Heer, myn sterkte in dezen noodt,
Wees nu niet verre, om niet te zyn ontbloot
Van uwe hulp; haast u; men hoont my snood,
In 't bange lyden:
Om myne ziel te redden en te vryden
Van 't zwaard. help my, die eenzaam ben, bestryden
't Gewelt des honds; dat hy aan alle zyden
My niet bespring.

11 Verlos my uit des leeuwen muil. bedwing
D'eenhorens, dat hun kracht my niet omring',
Noch 't woeden van hun hoornen op my dring:
Wil my verhooren.
Zoo zal ick, Heer, mijn' broederen, verkoren
Tot uwe kerk, het heil door u beschoren,
En uwen naam vertellen, ja hunne ooren
Hier meê verzaân.

12 Gy die Godt vreest, prijst hem, en roept hem aan,
Gy Jacobs zaad vereer hem door uw daân,
Al Isrels zaad ontzie hem, om te staan
Op zyne wegen.
Want hy heeft niet veracht hem die verlegen
Was, noch verfoeit den smaat, in top gestegen,
Van zynen knecht, verdrukt en neêrgezegen
In diepe elend:

13 Maar hy heeft zich naar zyne klagt gewendt.
Van my zal uw genade zyn erkent
In uw gemeinte, aan 's werelds grenze en end
In top verheven.
'k Zal by hen die u vreezen willig geeven
Al wat ik u belooft hebbe in mijn leven.
't Zachtmoedig volk zal eeten, en daar neven
Ook zyn verzaadt.

14 Al die Gods weg en vreeze niet verlaat,
Pryst zynen naam: uw hart leeft in dien staat
In eeuwigheit, zoo ge in zyn paden gaat,
Gevaagt van smetten.
Alle einden van het aardryk zullen letten
Op dat zy 't hart tot ware boete zetten,
En tot den Heer zich wenden naar zyn wetten,
In 't zalig licht.

15 Het heidendom zal voor uw aangezicht
Aanbidden. want Godt heeft zyn ryk gesticht
By 't heidens volk, en 't aan zyn dienst verplicht,
Om 't heil te weeten.
De vetten op der aarde zullen eeten,
En juichen. alle in 't stof om laag gezeten,
Zal elk zien voor zyn aanschyn neêrgesmeeten;
Ook dien 't ontbreekt.

16 Dat zyne ziel zich voor den dood versteekt.
't Zaad dient hem, dat, tot zynen dienst gequeekt,
Als zyn geslacht, van zyne daaden spreekt,
Hier toe verkoren.
Zy zullen 't volk, dat noch niet is geboren,
Godts waarheit en gerechtigheit doen hooren,
Omdat hy doet al 't geen hy 't heeft beschoren;
En 't quade wreekt.",Psalm 022 Datheen,Amsterdam,../../data/dbnl/halm002davi01_01.xml
178653,halm002davi01_0049,1707,1707.0,1015988,55555555,mmmmmmvv,AABBCCdd,5A 5A 5B 5B 5C 5C 5d 5d,.5A   .5A   .5B   .5B   .5C   .5C   .5d   .5d,,8,8,"Hoort, volken, hoort, neemt myne leering aan,
Ontsluit uw hart en ooren, wilt verstaan
Gy alle die den wereldtkloot bewoont,
Zoowel die u gering als groot vertoont,
Te zamen ryk en arm. 'k zal mynen mondt
Nu openen, en wysheit uit den grondt
Myns harten, vol verstandts aan u verhaalen,
Om door een spreuk iets leerzaams af te maalen.

2 'k Zal op de harp myn diepverborge reên
Ontsluiten; komt al t'zamen dan byeen.
Waarom zoude ik, ten dage van het quaadt,
Als 't booze volk my op de hielen gaat,
En my omringt, iet vreezen? want die 't goedt
Hier stellen ten betrouwen van 't gemoedt,
En trotzelyk op hunnen rykdom roemen,
Zyn niets voor Godt te tellen noch te noemen.

3 Niet een van hen kan zynen broeder ooit
Verlossen, als hy hier wordt uitgerooit.
Hy kan 't rantzoen aan Godt niet geeven, (want
De ziel is al te kostelyken pandt,
Haar lossing houdt in eeuwigheden op)
Dat hy hier, zelf ver boven 's levens top,
Geduriglyk zou leeven, en 't verderven
Niet zien; daar hy de wyzen ook ziet sterven:

4 Dat onvernuft hier omkomt met den dwaas,
Die 't goedt, (een niet, en enkel windtgeblaas)
Aan anderen moet laaten met verdriet.
Hun binnenste beseft toch anders niet
Dan dat hun pracht zal eeuwiglyk bestaan,
Hun huizen en paleizen nooit vergaan,
Maar duurzaam zyn tot alle nageslachten:
Zy doen hun' naam door dien der landen achten.

5 De mensch nochtans, hoe hoog in waarde, blyft
Hier niet: zyn glans en heerlykheit beklyft
Zoo weinig als de beesten, die vergaan.
Hun dwaaze weg is ydelheit en waan:
Nochtans behaagt dat woordt hun nageslacht.
Men zetze in 't graf als schaapen, ongeacht,
Wanneer de doodt hen t'zamen af komt weiden:
Dus moeten zy van 't goedt en alles scheiden.

6 D'oprechten wordt dan in dien morgenstondt
De heerschappy ook over hen gegont:
En 't graf zal hun gedaante, sterkte en rotz
Verslyten, uit zyn woning, hoog en trotz.
Maar Godt verlost myn ziele van 't gewelt
Des grafs, schoon hier voor eenen tyt gevelt:
Want hy zal my in heerlykheit verheffen;
Zoodat 's doodts schicht en vloek my nimmer treffen.

7 Vreest dan niet als een man tot rijkdom komt,
Zoodat zyn huis op eere en grootheit bromt;
Want hy neemt in zyn sterven gansch niet meê.
Schoon hy zyn ziel in 't leven stille vreê
Belooft, zyn eer daalt hem niet na in 't graf.
En of zy schoon, met woorden valsch en laf,
U, omdat gy u zelven goedtdoet, looven,
Zult ge echter u van alles zien berooven.

8 Want, wat gy ook op aarde hebt gedacht,
Uw ziel komt by haar vaderen geslacht;
Zy zullen 't licht in eeuwigheit niet zien.
De mensch zal nooit 't bederf zyns naams ontvliên,
Hoe zeer verwaant, hoe waardt, hoe hoog geërt,
Als hy verstandt en redenslicht ontbeert;
Maar wordt gelyk de redenlooze beesten,
Die gansch vergaan, de minsten met de meesten.",Psalm 049 Datheen,Amsterdam,../../data/dbnl/halm002davi01_01.xml
178654,halm002davi01_0050,1707,1707.0,1015988,555555,mmmmvv,AABBcc,5A 5A 5B 5B 5c 5c,.5A   .5A   .5B   .5B   .5c   .5c,,10,6,"GOdt, d'Opperheer, de Godt der Goden spreekt,
Dat zyne stem door lucht en wolken breekt,
Van daar de zon aan d'Oosterkimme blaakt,
Tot daar ze daalt en in het Westen raakt:
Uit Sion, daar geen schoonheit by kan haalen,
Verschynt de Heer, vol glans en flonkerstraalen.

2 Godt komt, en zal niet zwygen; ja een vier
Brandt voor hem heen met ysselyk getier;
't Zal rontom hem zeer stormen met geruisch;
Zyn stem klinkt tot den hemel met gedruisch,
En roept tot d'aarde om 't volk zyns naams te richten;
Verzamelt hen die zich aan my verplichten:

3 Die, als myn gunstgenooten, myn verbondt
Met offerhand' bevestigen, ten grondt
Van eeuwig heil. het hemelsch hoog gewelf
Vermeldt zyn recht: want Godt, als rechter zelf,
Roept: hoor myn volk, en ik zal tot u spreeken;
Myn Israël, myn heil is u gebleken.

4 'k Betuig voor u: ik Godt, ben uwe Godt.
Om d'offerdienst, gepleegt naar myn gebodt,
Zult gy geen straffe ooit lyden van myn handt,
Dewyl uw vee steedts op myn outer brandt.
'k Neeme uit uw huis geen rund, noch varre, of doffer,
Noch bokken uit uw kooien tot myn offer.

5 Want myne is al 't gedierte van het woudt,
En 't vee dat zich op duizent bergen houdt.
't Gevogelte dat op 't gebergte zweeft
Kenne ik: ook 't wildt dat op de velden leeft.
Indien ik dan met honger wierdt bevangen,
Hoe ! zoude ik naar uw offervee verlangen ?

6 Want my behoort de wereldt met haar goedt.
Behoeve ik dan tot drank ooit bokkenbloedt ?
Zal stierenvleesch my strekken tot myn spys ?
Neen: Godt wordt niet gedient op deze wys;
Maar offert hem uw' dankpligt zonder draalen,
En wilt hem uw geloften trou betaalen.

7 Roept my dan aan in 's doodtbenaauden dag,
Ik zal 'er u uithelpen, met gezagh,
Dan zult gy my ook eeren, naar myn woordt.
Maar Godt zeit tot den goddeloozen; hoort:
Wat hebt gy myne rechten te vertellen,
En myn verbondt in uwen mondt te spellen ?

8 Dewyl gy stout de tucht en leering haat,
Myn woorden ook onwaardiglyk versmaadt.
Zietge eenen dief, gy treedt meê in zyn lot.
Uw deel is met het overspeelers rot.
Gedurig slaat gy uwen mondt in 't quaade,
Uw tonge smeedt bedrog, tot 's naastens schade.

9 Gy zit, gy spreekt tot uwes broeders leet,
De lastering hebt gy altoos gereedt
Tot nadeel zelf van uwe moeders zoon.
Gy meent, omdat ik zwyge en u verschoon,
Dat ik ben een van uwe medtgezellen:
Ik zal u slaan, en 't u voor oogen stellen.

10 Verstaat dit, gy die 's Heeren hoogheit schendt,
En Godt vergeet; omdat gy hem niet kent,
Opdat ik niet verscheure, en niemant redt.
Hy die met lust dankoffert naar de wet,
Eert my; en wie op 't deugdenpadt zal treeden,
Die zal Godts heil zien in alle eeuwigheden.",Psalm 050 Datheen,Amsterdam,../../data/dbnl/halm002davi01_01.xml
178672,halm002davi01_0068,1707,1707.0,1015988,443443443443,mmvmmvmmvmmv,AAbCCbDDeFFe,4A 4A 3b 4C 4C 3b 4D 4D 3e 4F 4F 3e,.4A   .4A   .3b   .4C   .4C   .3b   .4D   .4D   .3e   .4F   4F   .3e,,16,12,"GOdt sta nu op met Majesteit,
Dan zal hy in rechtvaardigheit
Zyn vyandts magt verstrooien:
Zyn haters zullen voor het licht
Verstuiven van Godts aangezicht,
Wanneer hyze uit komt rooien.
Gy zult ze dryven als de rook
Verdreven wordt; zy zullen ook
Als wasch voor 't vier verteeren.
De goddelooze zal vergaan
In zynen weg, en niet bestaan
Voor 't aangezicht des Heeren.

2 Maar 't vroom geslachte zal, verblydt,
Van vreugde opspringen, hun ten spyt
Die u rontom bestryden:
Het zal voor 's Heeren aangezicht
Verschynen in het zalig licht,
En zynen naam belyden.
Zingt Gode, psalmzingt zynen naam,
En hoogt voor hem den weg bequaam,
Die in de vlakke velden
Snel heene rydt; verheft zyne eer,
Omdat zyn naam is Opperheer,
En wilt zyn grootheit melden.

3 Springt voor zyn aanschyn op, verheugt
Van harte, en juicht in volle vreugdt,
Hy is der weezen Vader;
Een rechter, die de weduwvrou
Beschermen zal met zyne trou,
Haar Godt, en levensader;
In 't huis van zyne heiligheit.
Een Godt die 't eenzaam hart bereidt
Een huisgezin: de boeien
Van zyn gevangenen verbreekt,
Daar hy d'afvalligen versteekt
In 't dorre, zonder bloeien.

4 O Godt, toen gy voor 't aangezicht
Toogt van uw volk, in 't vierig licht
Bedekt, tot zyne hoede:
Toen gy daar heene tradt als Heer,
In Sinaas woesteny, vol eer,
Scheen 't aardryk als in woede;
Het daverde, de hemel droop,
Voor 's Heeren aanschyn, in zyn' loop,
Zelf Sinaï, verheven
Ten wolken, beefde op zynen grondt,
Voor Isrels Godt, wanneer 't verbondt
Werdt van den top gegeeven.

5. Gy stortte, ô Godt, den regen neêr,
En sterkte uwe erfnis, tot uwe eer,
Gansch mat en buiten krachten.
Toen woonde uw dierenhoop daar in,
Dien gy bereidde voor 't gezin
Van hen die gansch versmachtten,
Behoeftig en in diepe elendt.
De Heer heeft zich tot ons gewendt,
En gaf van 't heil te spreeken:
Men zag een groote heireschaar,
Die 't goede meldde in 't openbaar,
Het heil uw volk gebleken.

6 De Koningen, van groote magt,
Der legerschaaren, hoog geacht,
Zyn haastig wechgevloden:
Zy vloden wech met groot gedruis,
Terwyl de zorgsters van het huis,
Gelyk het was geboden,
Den roof uitdeelden van de schaar
Des vyandts. al laagt gy heel naar
Besloten tusschen steenen
Der haarden, door het vier verdooft
In uwen glans, en zwart om 't hoofdt,
Als van geen licht bescheenen:

7. Zultge echter worden als een duif,
Met goude veedren, wit van kuif,
En als met zilvre vleuglen,
Die schitteren in 't zonnelicht,
Versiert, voor 's vyandts aangezicht,
Om zynen trots te teuglen.
Wanneer d'Almagtige, de Godt
Van Israël, des vyandts rot
En Koningen verstrooide;
Werdt zy, verrezen uit het puin
En stof, sneeuwit als Tzalmons kruin:
Daar 's vyandts magt verschooide.

8 De berg van Bazan is 't gebergt'
Dat met zyn kruin de wolken tergt,
Godts berg, ter lucht gerezen,
Vol bulten, op- en nederwaart
Gekronkelt, vruchtbaar in zyn' aart;
Een landtstreek hoog geprezen.
Waarom springt gy, ô bergen ! op,
Gebult gebergte ? want den top
Heeft Godt zelf uitgekoren
Van dit gebergte, daar hy woont,
En eeuwiglyk zyn' glans vertoont;
Ja 't eeuwig heil laat hooren.

9 Godts wagens zyn tien duizentmaal
Tien duizenden, vol hemelpraal,
En milioenen schaaren
Van Engelsdommen, steedts bereidt;
Een Sinaï in heiligheit,
Daar hy zich quam verklaaren.
Gy zyt, bestuuwt met hemelglans,
Gevaaren naar den hoogsten trans,
En hebt, in 't zegepraalen,
Den kerker in triomf gevoert,
Waardoor de helsche magt, beroert,
Het hoofdt most onderhaalen.

10 Gy hebt, naar uw miltdadigheit,
Veel gaven voor uw volk bereidt;
Ja hun die u niet hoorden,
Opdat ze by u woonden, Heer.
Gelooft zy Godt, die, t'zyner eer,
Ons geeft, tot volle boorden,
Zyn zegenstroomen, dag by dag.
Wy eeren hem met diep ontzag,
Als Godt van heil en leven,
Een Godt van volle zaligheit,
Den Heer die in den doodt ons leidt,
Om ons zyn heil te geeven.

11 Gewis zal Godt den kop verslaan,
Van zynen vyandt, opgestaan
Ter wraake, en dien verbreeken:
Den haairtop, daar elks hart voor beeft,
Die in zyn woede en schulden leeft,
Zal 's Heeren handt doorsteeken.
De Heer, die ons zyn gunst bereidt,
Heeft ons dit troostwoordt toegezeit;
Ik zal u wederbrengen
Uit Bazan, en den diepen kolk
Der zee, en, als myn erve en volk,
Voor u geen leet gehengen.

12 Opdatge in zege zet den voet
Op 's vyandts nek, en in zyn bloet
De tongen zelfs moogt steeken
Van uwe honden, tot zyn smaadt,
Alsge over zynen hoon en haat
U moediglyk zult wreeken.
O Godt, toen werdt gezien uw gang,
Godts gangen, onder 't feestgezang;
Myns Konings, in de reien
In optocht naar het heiligdom,
Met groot gejuich en heilgebrom,
Van fluiten en schalmeien.

13 De zangers trokken voor den rei,
De speelliên achter, tusschen bei
De trommelende maagden.
Looft Godt in zyn gemeenten, al
Die Isrels zaat zyt, groot van tal,
Wiens Vaders Godt behaagden.
Daar is de kleene Benjamin,
Die over hen heeft in 't begin
Geheerscht; met Judaas Vorsten,
En hun vergadering; ook die,
Van Zebalon en Naphtali,
Die hunnen staat steedts torsten.

14 Uw Godt heeft uwe sterkte en kracht
Geboden, en aan u gedacht;
Sterk, Heer, ons uit den hoogen !
O Godt, 't geenge aan ons hebt gewrocht,
Wanneerge ons in uw gunst bezocht,
Sterk dat door uw vermogen.
Uit uwen tempel, die gesticht
Wordt in Jerusalem, zal 't licht
Den volkeren bestraalen:
Dat u de koningen geschenk
Toebrengen, op uw woordt en wenk
Gereedt, in zegepraalen.

15 Sla 't wilt gedierte van het riet,
En scheldt het in zyn hoog gebiedt,
Met alle wreede stieren,
En kalvers van de volken, die,
Opdat al d'aarde hen ontzie,
Godt noch zyn wetten vieren:
Ook dien, die onderworpen is
Met stukken zilvers. Godt heeft wis
Verstrooit de krygsgezinden.
Egipten zendt gezanten heen,
Gansch Moorenlandt is op de been,
Om 's Heeren heil te vinden.

16 Gy Koningkryken, van 't gebiedt
Der aarde, zingt een zegeliedt,
Zingt Gode vreugdepsalmen;
Den Heer, die in den hemel rydt
Der hemelen, van ouden tyt:
Pryst hem met zegegalmen.
Ziet, hy zendt zyne stemme omlaag,
Zyn donderstem, by onweêrsvlaag.
Geeft Gode sterkte en eere.
Zyn hoogheit schut en dekt zyn volk,
Zyn sterkte is boven lucht en wolk,
Daar hy verschynt als Heere.",Psalm 036 Datheen,Amsterdam,../../data/dbnl/halm002davi01_01.xml
